date,author,text
2016-11-06 12:34:01,PolitiK33,"Kepel est le seul à prendre l'ensemble de ces éléments en compte. Contrairement à ce que je lis en ce moment il il parle aussi beaucoup de la question sociale. J'ai lu les ouvrages des trois analystes que tu évoques, Kepel est le plus pertinent à mon sens, voici en résumé et en simplifiant, le contenu de sa pensée :

Au XIXe siècle s'opère un basculement dans l'échiquier de la domination mondiale.

L'Empire Ottoman, héritier de la civilisation islamique, est en plein déclin. Ses crises socio-économiques internes entament sa dislocation et réduisent considérablement sa puissance passée.

A l'inverse, l'Europe alors composée d'une multitude d'empires, est en plein essor. La révolution industrielle et le progrès technique qu'elle induit lui assure un développement économique et technologique très important. Le tel delta de progrès offert par l'industrialisation vis à vis de l'étranger lui assure une différence de puissance vis-à-vis des autres civilisations sans commune mesure avec ce qui fut le cas dans le monde par le passé. La technologie industrielle lui permet non seulement d'écraser économiquement et militairement les civilisations concurrentes, mais aussi pour la première fois dans l'histoire d'exercer une influence jusqu'à l'autre bout de la planète, chose impossible par le passé même pour les empires les plus influents. La colonisation, qui fut le fait de tous les empires, est ainsi portée à une mesure sans comparaison avec les colonisations passées.

Côté civilisation islamique, on s'interroge ainsi sur les raisons de ce renversement : Comment la civilisation islamique, autrefois si brillante, peut-elle être réduite à une telle faiblesse vis-à-vis d'un occident qu'elle avait pourtant dominé par le passé ? Des penseurs vont ainsi théoriser deux doctrines différentes : les uns estiment que le monde islamique n'a pas su s'adapter à ce que l'Occident avait entamer dès la fin du XVIIIe, à savoir la modernité. Les autres estiment à l'inverse que la tradition islamique et ses différents représentants se sont trop éloignés de l'Islam des origines à travers les siècles, et que c'est en revenant à cet Islam du VIIe siècle, l'Islam de Mahomet et de ses conquêtes, que la civilisation islamique retrouvera sa grandeur. Ce dernier état d'esprit est notamment théoriser par Al Wahhab, théologien vivant dans la péninsule arabique épargnée par la colonisation. Il noue une alliance avec un chef de tribu locale nommé Al Saoud. Al Saoud voit dans l'idéologie d'Al Wahhab le moyen de rassembler les tribus arabes de la péninsule derrière lui et d'accéder au pouvoir, Al Wahhab voit dans Al Saoud le leader capable de porter son idéologie à la tête d'un pays et dans l'ensemble du monde islamique. Ainsi naît le wahhabisme, que l'on appèlera bientôt Salafisme. Salaf voulant dire ""les pieux ancêtres"" soit Mahomet et ses compagnons, le terme salafisme ayant pour vocation d'illustrer la pensée de Al Wahhab plutôt que son nom. 

Au XIXe siècle, avec la quête de l'or noir occidentale, le régime salafiste saoudien va gagner considérablement en puissance et en influence en nouant d'étroits liens commerciaux avec l'Occident. Sa nouvelle puissance lui permet d'exporter ses théories ailleurs dans le monde musulman et assure une révolution moderne de l'islam par le rigorisme. C'est ainsi que l'on retrouve l'islamisme post-colonial un peu partout dans le monde musulman, qui finit par l'emporter sur les doctrines panarabistes, nationalistes, socialistes (exemple : GIA et FIS en Algérie)

En parallèle, en Egypte, va naître une autre forme de ""retour à l'Islam"" par le biais des frères musulmans fondés en Egypte par Hassan-El-Banna en 1928. La principale différence entre les salafistes et les frères musulmans est que les premiers estiment que c'est en changeant les mentalités ""par le bas vers les élites"" que l'on assurera l'avenir d'un islam rigoriste, tandis que les seconds estiment que c'est ""des élites vers le bas"", c'est à dire en prenant directement le pouvoir par le biais de révolutions pour ensuite instaurer la Charia.

A la fin du XXe siècle, le salafisme commence à échapper aux Saoudiens. Des Salafistes, se faisant plus rigoristes que les rigoristes, estiment que la famille royale Saoudienne est ""apostate"" car contraire à l'Islam (la monarchie étant proscrite, tout comme le fait de verser du Champagne et des petro-dollars sur des prostituees) et qu'il faut les combattre. Ils estiment également que les textes fondateurs de l'Islam appellent à la résistance armée voire au meurtre d'apostats. Ainsi naît le salafisme djihadiste. Les Saoudiens sont alors bien embêtés. Leur bébé rigoriste s'est retourné en partie contre eux. Ils font donc en sorte d'évacuer la menace et le territoire de la ""guerre sainte"" hors de la péninsule arabique : En Afghanistan, alors en proie à l'invasion russe. Les américains, bien content de voir des alliés de circonstance émerger, vont ainsi fournir à ces djihadistes, en l'occurrence les Talibans, de quoi expulser les russes d'Afghanistan en espérant reprendre la domination au Moyen-Orient dans un contexte de guerre froide ( il faut alors regarder les articles de presse occidentale de l'époque qui voient dans ces combattants des ""défenseurs de la liberté""). Sauf que de la même manière que les djihadistes s'étaient retournés contre le pouvoir saoudien, ils retournent ensuite contre la volonté hégémonique américaine au Moyen-Orient, dont les attentats du 11 Septembre sont l'illustration. Nous sommes au tournant des années 2000, et le djihâd se globalise.

Dans le même temps, salafistes comme frères musulmans vont identifier que la naissance d'une population musulmane dans les territoires européens du fait de l'immigration est une grande opportunité pour reprendre à travers eux une revanche vis à vis de la domination occidentale (colonialiste ou non) en influençant ces communautés particulièrement réceptives à leur doctrine du fait de leur sentiment de marginalisation socio-économique. Ils vont ainsi investir les mosquées pour les salafistes (changement du bas vers le haut) et les mondes associatif et politiques  nationaux pour les frères musulmans (à travers les instances de représentation et le champ politique genre CFCM CCIF,changement du haut vers le bas). Les djihadistes vont quant à eux identifier la même chose en 2005 : appel d'Al Souri à la résistance islamique incitant les jeunes musulmans occidentaux à commettre des actes terroristes contre leur société, doctrine reprise par l'Etat Islamique aujourd'hui et qui passe surtout par les réseaux sociaux. 

Voilà comment nous en sommes arrivés là. Les frères musulmans, le salafisme et le salafisme djihadiste sont autant de doctrines violentes qui, par porosité idéologique, peuvent aboutir au terrorisme. Alors du coup, quoi qu'on fait ? Eh bien comme le dit Kepel le problème est multiple :

- il faut lutter sur le plan socio-économique pour que les jeunes musulmans soient intégrés et moins réceptifs à cette doctrine. Mais l'étude de David Thomson, seule à ce jour qui fait témoigner des djihadistes français partis pour la Syrie, montre que le profil du jeune rebeu de banlieue marginalisé est bien loin d'être le seul dans les candidats (exit Roy). Il semblerait qu'il y ait surtout une crise existentielle en Occident qui fait que même l'intégration à la société de consommation ne rend plus forcément heureux, que le citoyen moderne a besoin d'un autre ""espoir"" et que l'espoir clé en main du djihadisme qui offre une vision simpliste des gentils et des méchants n'est qu'un espoir parmi d'autres, ce n'est pas une fatalité. 

- Il faut lutter sur le plan religieux pour que ceux qui se battent aujourd'hui pour un Islam pleinement démocratique puisse exister. Cela passe par le fait de leur donner la parole et de developer un islam de France mais aussi et SURTOUT par le fait de faire comprendre à ces nouveaux collaborateurs d'islamo-gauchistes que dans leur bienveillance vis à vis des pratiques rigoristes (voile, halal, burkini, charia etc...) ils se font les idiots utiles des extrêmes et empêchent les réformateurs d'exister, adoubant l'idée que la vision salafiste de l'islam est représentative de ce qu'est l'islam. Qui plus est, ils rajoutent de l'huile sur le feu en faisant croire aux musulmans que la dénonciation du port du voile et autres Burkini serait une forme de haine à leur égard, alimentant le discours des islamistes. Mais dans tout cela il ne faut pas oublier qu'un Islam libéral n'apporterait peut-être plus la réponse ""espoir"" que constitue le salafisme (djihadiste ou non) par rupture vis à vis de la société...

- Enfin il faut que sur le plan international cesse le partenariat avec les régimes extrêmes qui nous pénètrent en retour tel un virus, ainsi que les guerres occidentales aléatoires qui fournissent aux extrêmes les raisons de nous haïr."
2016-08-30 17:40:41,so_Kyra,"Et les 5 millions de français maghrébins, ils sont où? Je ne te considère pas plus ou moins chez toi qu'eux chez eux.

Et si tu me fais chier avec tes croyances, tes croyances ridicules comme quoi t'es plus chez toi que les autres. 

Quel âge as-tu? 

En quoi t'es plus ""français"" que mon père, britannique arrivé en france à 25 ans et qui en a aujourd'hui 66 et qui a été naturalisé y a 3 ans.
Ce que tu cites alors n'a RIEN à voir avec les maghrébins, c'est de certains rites de la religion musulmane dont tu parles. (sauf l'excision) Sais-tu qu'on peut être blond aux yeux bleu, français depuis 1000 ans et être musulman?

Pour moi et d'autres, c'est toi qui n'est pas français. Ta façon de juger des gens, de les mettre tous dans le même panier, de vouloir les expulser pour aucune autre raison que le fait qu'ils te dérangent. Le seul problème avec les gens comme toi, c'est qu'on peut même pas imaginer les expulser ailleurs que dans l'espace."
2016-07-21 12:09:08,scylk2,"WTF la carte sur les musulmans ???  
&gt; Outre les gros problèmes juridiques et moraux que soulèverait une telle décision  

Qu'on va pas s'amuser à détailler hein, quand même...  

&gt; elle pourrait se heurter à deux obstacles plus pratiques :  
&gt;Où les expulser ? Quel pays accepterait de recevoir autant de personnes d'un coup sur son territoire ?  
&gt;Comment définir qui est musulman ? En fonction de la culture, de l'assiduité de la prière ?   

 
Surréaliste. Quand l'idée est juste inacceptable dans la théorie tu ne poses pas la question de la praticité. Je sais pas si c'est volontaire ou juste extrêmement maladroit mais j'hallucine de voir ça sur le monde.

"
2016-03-08 13:17:17,supterfuge,"&gt;Quel procès débile? Israel, en tant que terre des juifs, a le droit d'exister. Point.

Pourquoi cet endroit ? Par ce qu'ils y vivaient y'a 2 000 ans ? Du coup ça justifie aujourd'hui d'expulser des gens ? De l'avoir fait y'a 70 ans ? Tu peux admettre qu'un peuple ai le droit d'exister, et refuser qu'il le fasse d'une manière aussi violente et oppressive ?

Le problème ce n'est pas que c'est un ""État juif"". Le problème c'est que oui, un État qui se fonde sur cette violence, qui a intégré des logiques de répressions de populations extérieures, et qui s'enrichit sur la conquête illégale d 'un autre territoire, ça me semble assez logique de s'y opposer, au final. C'est même pas la question qu'il soit juif cet état. Il pourrait être hindou, chrétien, musulman ou laïque que ça serait la même chose.

Et pourquoi l'État  ""en tant que terre des juifs, a le droit d'exister"" ? Tu parles en tant que peuple ou en tant que religion ? Par ce que sinon, il faut aussi qu'on crée une terre des musulmans du coup, non ? On peut choisir la Mecque, sur le territoire de l'Arabie Saoudite. L'AS est wahabbite, il faut bien un État pour les autres courants de l'islam ?  Un État pour les chrétiens aussi ? Les catholiques ont le Vatican comme siège de leur Église, mais les protestants ? Par ce que je suis sûr qu'a peu près tous apprécieraient d'intégrer Jérusalem comme cœur symbolique de leur État.

Mais du coup, si on parle de peuples, tu es probablement pour l'indépendance de la Corse ? Du pays Basque ? De la Tchétchénie ? De la Cisjordanie ?"
2015-12-13 17:21:17,FleurDuPays,"Ils font [près de 4%](http://www.lemonde.fr/languedoc-roussillon-midi-pyrenees/elections/) en Midi-Pyrénées/Languedoc-Roussilon. Plus leur potentiel réserve chez les abstentionnistes, dont le vote éventuel ne changerait rien d'après les sondages.

C'est la droite qui n'a pas vraiment de réserve, puisqu'ils étaient alliés dès le premier tour avec les centristes. Ce qui relativise quand même beaucoup leur  score de dimanche dernier. Et en cas de vote PS/FN, je suis pas certains que les électeurs de l'UMP choisissent en majorité le PS...

&gt; &gt; Valls en tête...ils reprennent largement les thèses et les discours du FN

&gt; Ok...

[l'Ennemie intérieur](http://tempsreel.nouvelobs.com/societe/20121012.FAP0401/terrorisme-valls-met-en-garde-contre-l-ennemi-interieur.html) est musulman forcément , [la sécurité est la première des libertés](http://www.politis.fr/La-securite-premiere-des-libertes,33105.html) disent Le Pen et Valls, [Le FN pose de bonnes questions](http://www.lemonde.fr/politique/article/2013/07/11/le-front-national-centre-de-gravite-de-la-vie-politique_3446242_823448.html) disait Fabius , [les Rroms ont des modes de vie extrêmement différents des nôtres et qui sont évidemment en confrontation](http://www.lepoint.fr/politique/manuel-valls-attaque-pour-ses-propos-sur-les-roms-10-10-2013-1741544_20.php) alors faut les expulser en masse... Plus le discours permanent sur la fermeté, l'ordre, L’État fort, le soutient sans faille à la police...

Ok?"
2015-12-04 03:32:29,djcoin,"Le mouvement le-message etc. met l'accent sur un processus qui garantirait en principe une société plus démocratique, par le vote direct des lois et leur préparation par des gens au mandat court, formés par et recueillant les idées, affaiblis par le tirage au sort et les préservant tant que possible des conflits d'interets, de la corruption et de l'ivresse du pouvoir.

L'idéologie qui en déboucherait n'a pas à être défini à priori tant qu'il respecte la volonté du peuple, avec comme garde fous des principes fondamentaux comme la liberté d'expression etc.

Honnetement je ne comprends pas, vraiment, cette décrédibilisation, association/insulte, que tu donnes à ces gens qui essayent d'eveiller les consciences.
Et je ne comprends pas non plus comment autant de gens peuvent up-voter pour ta critique quand la situation de notre démocratie, déjà très fatigué, se prend un tour de vis sécuritaire énorme. Il devrait au contraire y avoir une panique de sauvegarde de notre démocratie et ces gens proposent certainement des idées intéressantes.
Le fait que l'inverse se passe me plonge dans l'effroi.

Tous nos parlementaires (pouvoir legislatif) censés etre independant ont tous voté ce que l'executif a décidé a priori et sans debat. Ils ont créé de fait un parti unique et ont donné durablement à l'executif la possibilite de se defaire du pouvoir judiciaire et de mener leurs actions. C'est une derive tres grave et disproportionnée.

L'alternative n'existe en effet pas et c'est eventuellement toute la scene politique qu'il faudrait gicler. Mais il ne faut aussi pas combattre des personnes mais un ""systeme"". Et ce systeme, c'est celui que denonce les gens de ""le-message"" etc. On pourrait au moins, reflechir par ailleurs à une democratie representative mais avec bcp plus de contre-pouvoirs, etc.

Pour moi un des problemes majeurs est que tout le monde est aussi aligné sur des choses comme l'Union Européenne et l'Euro qui sont une des causes des causes qui nous condamnent. Et en ce sens oui, il n'y a clairement pas d'alternative (dette, privatisation, ""manque de competitivite"" du à nos acquis sociaux et à l'impossibilité de se proteger, donc leur suppression).
Sous couvert de progrès, l""UE et l'Euro (on le voit parfaitement actuellement dans les pays du Sud et notamment en Grece) sont des constructions neoliberales qui entrainent les pays dans une concurrence feroce, nous defont de notre souveraineté politique, economique et monetaire ; de nos acquis sociaux et qui finalement ne correspondent pas au projet qu'avait la France à l'issu de la Seconde Guerre Mondiale et qui a continué tant que l'URSS et donc les partis communistes permettait de galvanisé des luttes sociales.

Tout le monde a ete bouffé par cette idée de soi-disant progrès (d'union forcée face à la guerre - et on voit ou on en est rendu) et nombre de sujet de toute facon ne viennent mm plus de notre propre gouvernement depuis Maastricht (et l'Euro). Donc oui, il n'y a pas d'alternative pour ceux qui réfléchisse dans un cadre contraint et refuse de remettre en cause par exemple l'UE/l'Euro - notamment à cause de son association au FN, on ne peut pas en parler sous peine d'etre traité de fasciste - c'est fou, ce dogme.

Il y a bien l'UPR qui est un parti gaulliste (un vrai, pas ceux qui s'en reclame en nous faisant entré dans l'OTAN, le dévoiement le plus total, ou s'aligne sur les EtatsUnis en permanence) qui monte très fort.
Il represente à mes yeux une forme de compromis acceptable pour la population en cela qu'il garde une democratie representative (introduisant le referendum d'initiative populaire), sont economiquement assez ""neutres"", mais on va dire ""patriotique"" (essaye de faire en sorte d'ameliorer l'economie nationale reellement).
C'est un des rares partis, pas mouillé encore dans ce naufrage absolu, que je vois comme une solution qui pourrait nous sortir de cette impasse qui nous dirige vers la répression, la degradation economique, et finalement le FN (car la situation va continuer de se degrader structurellement tant qu'on ne posera pas la question de la cause des causes à savoir l'UE/l'Euro).

Et mon opinion c'est qu'il s'agit pour moi du capitalisme neoliberal auquel est converti la plupart de nos elites et qui est, de toute façon le cadre de l'UE/Euro que personne ne veut remettre en cause, qui affaiblit les Etats, accroit les inegalités mais qui a aussi saturé les marchés.

Et les gens qui pensent que le FN, invité des medias partout, derniere roue du systeme d'oppression economique, de division raciste/religieuse, va change ce système et les protéger ou va faire réflechir d'autres se trompent et prennent un risque énorme. Le FN est un parti de l'ordre, est cooptée et protège la classe dominante ; une belle illustration est le revirement idéologique ou le bouc emissaire est le musulman et non plus le juif - elle est totalement alignée desormais avec les interets israeliens (http://www.europe-israel.org/2015/07/marine-le-pen-a-denonce-lantisemitisme-ainsi-que-le-mouvement-raciste-bds-elle-est-prete-a-expulser-les-frontistes-qui-soutiendraient-bds/), comme l'est il me semble Valls du parti socialiste. La religion et le debat identitaire sont des outils utilisés pour desunir et le peuple, afin qu'il ne puisse plus lutter pour leurs acquis sociaux et leurs veritables oppresseurs (qu'ils soient la classe politique ou le systeme capitaliste qui benefice a peu -&gt; le modele de la secu, inventé par les francais est un magnifique exemple d'economie en dehors de la Religion capitaliste, qu'il faut etendre - ni etat ; ni capitaliste  - à la presse comme le suggerait le Monde Diplomatique, ou aux arts etc.).


Il me semble qu'il faille en tout cas absolument arreter la diabolisation et l'etiquettage des gens comme fascistes etc. dans une periode de crise et se concentrer sur le contenu, sur l'analyse des vraies problemes et la resolution de leur cause, de la cause des causes etc. Et parler ensemble, entre tous les gens, allez voir ses voisins, ses collegues, les comprendre - au delà de leurs inclinaisons politiques - , reinstaurer le debat calme, le dialogue, est une nécessité car ce n'est ni dans le déni, ni dans le rejet que l'on va s'en sortir. Et si on ne le fait pas, le pire nous attend.
"
2015-11-23 12:48:25,suppreme,"Ce mec est un prédicateur doué qui a remplacé l'exploration du monde par des tabous religieux so medieval. 

Il est l'équivalent musulman de https://www.reddit.com/r/france/comments/3txmor/les_victimes_du_bataclan_qualifiées_de_frères/ 

Pourquoi l'interdire lui, et pas l'autre? Pourquoi le renvoyer lui, et pas les autres?

Personnellement je n'ai aucun doute sur le fait que cet imam condamne totalement le terrorisme, ne participe à rien qui favoriserait le terrorisme, ou à tuer etc.

Mais il gave des gamins avec de la pure merde, parle des femmes comme de putes dangereuses à tenir en laisse, avec un style angélique et percutant qui marche bien sur youtube.

Comme les catholiques à une époque, j'espère qu'il sera mis en lumière, écouté, et que la société comprendra pourquoi ce mec est une fausse idole - sans l'expulser ni le bâillonner."
2015-11-16 19:02:24,OracleJDBC,"Osef de ton appartenance politique.       
Il faut pas être un génie de la politique pour se rendre compte de plusieurs trucs:        

* quasiment tous les terroristes étaient nés Français. On aurait pu les mettre en prison, mais en aucun cas les renvoyer dans ""leurs pays"".

* même si c'était le cas, le risque est surtout d'expulser un peu tout le monde de musulman, en tapant large. L'exemple récent c'est l'état britannique qui veut bannir les sites pro-terroristes et pédo-porno, bonne idée de base (enfin j'espère). D'amalgames en amalgames, ils bannissent les sites d'Hentai qui ne sont **pas** pédophiles. Puis les sites de BDSM, puis les sites d'éducation sexuelle, etc. [\(liste de surblocages\)](https://en.wikipedia.org/wiki/Internet_censorship_in_the_United_Kingdom#Overblocking).            
* prendre une décision sous le coup de la colère, c'est quasi-systématiquement une mauvaise idée. La prendre pour rassurer ces électeurs, c'est une **énorme** bêtise. Malheureusement, c'est ce qui est en train de se passer, au-vue des réponses de ce thread.

"
