date,author,text
2020-09-28 21:02:40,literally_a_hedgehog,"&gt;  avoue que tu veut déporter les musulman.es. 

C'est littéralement ce qu'il vient de faire. Le condamné est citoyen français, la seule raison de l'expulser est le racisme."
2020-07-31 14:28:04,[deleted],"À titre personnel, je ne comprends pas qu'on puisse être croyant. Dieu ? Qu'est-ce que vous entendez par là exactement ? Tous des simulateurs, des tartuffes. Je suis résolument anticlérical, quelle que soit la religion. Tous les intégristes se ressemblent : le même genre de tarés. Ceci dit, quelqu'un qui fait le bien et me dit que sa foi l'y conduit, je respecterais.

Pour l'islam, bien noter que tout citoyen marocain ou algérien DOIT être musulman. C'est pas une option. Donc les immigrés et leurs enfants, ils sont formatés comme on a pu l'être en France par le catholicisme jadis. Ça leur fait une cause commune malgré des origines différentes et une identité à revendiquer CONTRE la France. 

La gauche est molle sur l'islamisme parce que les musulmans ont acquis un poids significatif lors des élections et que les cailleras constituent une menace physique au quotidien. Je connais une ville de banlieue où le vote FN/RN est très important lors des présidentielles, mais impossible à un candidat FN/RN de se présenter aux élections municipales : il  risquerait sa peau, ses enfants se feraient lyncher au collège, ce genre de chose. Par contre, un candidat musulman s'est présenté et a fait environ 13%. Très modéré dans son discours, Taqiya oblige, sauf qu'il contrôle une librairie musulmane qui vend des ouvrages ""fréristes"".

Dire que la société française est minée par l'islamisme n'est pas faux, avec des pays derrière les activistes qu'ils financent : Turquie, Qatar, Arabie Saoudite et pays du Maghreb, moins riches. Premier point COUPER le financement étranger et EXPULSER les imams étrangers. On a déjà une Cinquième Colonne islamiste en France, faut le savoir.

Sinon, les filles musulmanes d'origine savent très bien ce que la société française laïque leur apporte. Pareil pour les immigrés qui réussissent. Les autres, les jeunes éclopés de la société, ils peuvent se la jouer victimes et revanchards, basculer terroristes et entreprendre de mourir les armes à la main. Il suffit d'une mauvaise rencontre."
2020-02-18 23:32:49,livinginahologram,Je propose qu'on commence par expulser ce mec Abdallah Zekri délégué du Conseil Français du Culte Musulman (CFCM) qu'a dit pendant l'affaire *Mila* **&lt;&lt;Qui sème le vent récolte la tempête&gt;&gt;** .
2019-12-02 23:40:49,whateverdude3858,"&gt;C'est le pays dont l'existence est peut-être la plus justifiée au regard du droit international.

Le droit international d'envahir une nation, s'approprier ses terres et d'expulser les basanés qui y vivaient ? Cette phrase n'a pas vraiment de sens. Je préfère l'autodétermination des peuples.

&gt;Pour moi il suffit de voir la violence de la guerre Iran-Irak pour comprendre qu'Israël n'est pas l'élément moteur des conflits du Moyen-Orient.

Ça n'a jamais été mon propos. Bien sûr qu'il y a des causes et des acteurs multiples. Seulement, rajouter de l'huile sur le feu n'est jamais une bonne idée. La fondation d'Israël et l'échec du panarabisme ont contribué à cette rhétorique du ""choc des civilisations"" qui ligue en partie les habitants du monde musulman contre l'Occident."
2019-10-09 07:56:32,Guy_Yottine,"&gt;légiférer pour que chaque musulman, dés lors qu'il refuse d'adopter nos lois et nos usages, soit expulsé sans délai. Peut être qu'ils finiraient par comprendre cette chose très simple : quand on choisit d'émigrer dans un pays, on se plie à ses règles.

Expulser les musulmans français vers... la musulmanie (?), nécessiterait le même fichage religieux qu'avec les juifs dans les années 30, la fin de la liberté de culte, et la fin de la vie privée, et cela a tout d'un programme nazi.

&gt;Pourquoi ce pays est capable de faire respecter ses propres lois aux étrangers, et pas nous ?

Parce que contrairement aux croyances nazies,""musulman"" n'est pas une nationalité."
2019-04-02 14:30:30,KvitDod,"Alors que les fichés S musulman, la ce serait indigne de les expulser. Belle mentalité"
2018-07-24 23:52:52,ValeursActuelles,"L'article complet :  
  
**Portrait. Le prêcheur australien Mohammad Tawhidi est une star sur Twitter, où il accuse les islamistes, les djihadistes et les gauchistes de vouloir détruire l'Occident et ses valeurs.**  
  
« Okay, je suis dans l'avion, le WiFi est lent, mais nous sommes dans le ciel et je peux confirmer qu'il n'y a pas 72 vierges ici. Arrêtez le djihad. » Même à 10 000 mètres d'altitude, le plus célèbre imam de Twitter ne se départ pas de son humour pour moquer les extrémistes musulmans qui déshonorent sa religion. Mohammad Tawhidi parcourt depuis des années le monde pour mener son combat courageux contre le danger islamiste lors de conférences, dans les médias et sur les réseaux sociaux. Avec sa robe et son turban, celui qui dit « passer pour le frère de Ben Laden » ne laisse jamais indifférent. À un agent de sécurité suspicieux dans un aéroport qui voulait le contrôler, il a récemment répondu : « Je ne me fais pas confiance non plus, fouillez-moi immédiatement, s'il vous plaît. » Ils ont éclaté de rire en se serrant la main.  
  
L'imam de l'Association islamique d'Australie du Sud, nommé en 2010, a quitté l'anonymat pour devenir à 35 ans le prêcheur le plus controversé du continent et le plus révolutionnaire du monde musulman. À l'origine de sa popularité, un discours héroïque prononcé au Rotary Club d'Adélaïde, en mars 2017. « Mon père a choisi de venir en Australie parce que c'était un pays non musulman. Si nous avions su que, trente ans plus tard, nous aurions des burqas un peu partout, des mosquées à chaque coin de rue et des personnes pour défendre la charia contre la démocratie, nous ne serions pas venus », proclamait alors Mohammad Tawhidi, né dans la ville sainte de Qom, en Iran, et descendant d'un compagnon du prophète Mahomet. « Si vous ne l'aimez pas [l'Australie], nous vous donnerons un de nos kangourous pour vous raccompagner là d'où vous venez. »    
   
Depuis, l'autoproclamé « imam de la paix » veut bannir les ouvrages intégristes, interdire les nouvelles mosquées et expulser les militants radicaux. « Les membres de ma famille ont été exécutés, brûlés vivants et bannis par les gouvernements islamistes et Dae'ch », rappelle Tawhidi, qui a fui l'Irak à 12 ans, après que son père imam eut été condamné à mort par Saddam Hussein. « Voilà pourquoi j'ai des convictions fermes sur l'immigration et l'extrémisme islamiste. » Des paroles d'autant plus audacieuses qu'il a été « un fondamentaliste islamiste qui prêchait la violence », avant de changer en assistant à une explosion au cours de ses études à Karbala, en Irak, en 2014. Désormais, « je construis des ponts entre communautés et groupes religieux et je répands la paix lors de mes voyages », confie-t-il. « Il est une raison d'espérer que l'islam modéré l'emporte sur l'islam radical », renchérit l'islamologue américain Daniel Pipes.  
   
Preuve de son engagement sincère et périlleux, les critiques dont le prédicateur, rebaptisé « faux cheikh d'Australie », est la cible de la part du Conseil national australien des imams, de la chaîne publique ABC et d'activistes de gauche, qui remettent en cause sa crédibilité malgré les documents officiels, raillent un « extrémiste chiite » en guerre contre la communauté sunnite et soupçonnent de double jeu cet ancien élève du grand ayatollah Shirazi, réputé pour ses idées rigoristes. Sur Internet, des opposants complotistes l'accusent même d'être une « marionnette sioniste », voire un agent israélien. « C'est faux. Je travaille pour le MI6 parce que le Mossad n'avait pas les moyens de me payer », leur a ri au nez Tawhidi.  
  
Plus inquiétant encore, l'imam iconoclaste reçoit des menaces de mort par centaines. « La règle islamique pour cet infidèle est la décapitation, lui a promis un ennemi. Je paierai 5 000 dollars à qui me dira où il se trouve. J'organiserai le reste. » Le fils d'un imam a appelé à son assassinat, se demandant « pourquoi personne n'a pas massacré ce porc ». Le leader religieux a aussi été insulté, s'est fait cracher dessus et a été frappé au visage. Sa voiture a été caillassée et taguée du symbole de Dae'ch, tandis que des radicaux ont tenté de pénétrer dans sa propriété. « Il est toujours prêt à risquer sa vie pour défendre la vérité, souligne l'activiste pro-israélien Avi Yemini. Il a cet esprit australien et je suis fier de l'appeler mon frère. »  
    
Déclaré apostat par un mufti saoudien, Mohammad Tawhidi a même dû rester caché pendant plusieurs mois pour éviter les attaques. « Avant, j'avais peur. Maintenant, j'ai accepté la possibilité d'être tué à tout instant, confesse-t-il. Des centaines de personnes font des dons pour financer ma sécurité parce qu'ils croient dans la valeur de mon activisme. » L'imam, escorté par des gardes du corps, avait déjà récolté 11 000 dollars en ligne pour installer... des détecteurs de métaux. Pas de quoi dissuader ses détracteurs, qui lui reprochent aussi son soutien à Pauline Hanson, fondatrice de One Nation, parti populiste opposé au multiculturalisme. Tawhidi avait osé souhaiter à la sénatrice du Queensland et « pire cauchemar des djihadistes » un « joyeux anniversaire » et défendu son appel à « stopper l'immigration islamique » après les attentats de Londres, dans un pays où la population musulmane a augmenté de 77 % en dix ans !  
  
« Le terrorisme au Royaume-Uni croît semaine après semaine. Avoir des extrémistes dans nos sociétés n'a rien à voir avec le multiculturalisme, c'est du suicide », remarquait Mohammad Tawhidi à l'époque sur Twitter. « La gauche anglaise est en train de transformer Londres en nouveau Bagdad. » Une opinion partagée par son « ami » et « frère en humanité » Tommy Robinson, cofondateur de l'English Defence League, avec qui il participait, en février, à « une discussion honnête, intellectuelle et respectueuse » diffusée sur YouTube, trois mois avant que le journaliste nationaliste soit condamné à treize mois de prison ferme alors qu'il couvrait le procès d'un gang de violeurs indo-pakistanais. « Tommy aurait été mieux traité par n'importe quel tribunal islamique britannique... », ironisera l'""imam de la paix"".  
  
Au Royaume-Uni comme en France, des millions de gens redoutent l'avancée de cet islam conquérant. Niqab, burkini, prière de rue... « Ces signes visibles sont des symboles de pouvoir, reconnaît Mohammad Tawhidi. Je comprends la peur de la majorité des Français. Je travaille à chasser les extrémistes de la communauté musulmane, mais je ne peux pas les chasser du pays. C'est au gouvernement de le faire. » En février, en séjour dans la capitale, il avait aussi été effaré par les camps de migrants installés dans le nord de ce « Paristan ». À défaut, il s'est félicité de la décision « excellente » du chancelier autrichien, Sebastian Kurz, d'expulser 60 imams liés à la Turquie, dirigée par le « calife en costume » Erdogan.  
  
Idéologiquement, « la vie m'a fait conservateur », assume Tawhidi. « Les gauchistes vous disent que les djihadistes vont se réformer et réintégrer la société. » Ses opinions, délivrées à ses 217 000 abonnés sur Twitter, lui valent d'ailleurs le plébiscite des sympathisants de droite, las du politiquement correct. Obama et Hillary Clinton ? « Ils ont créé Dae'ch. » Trump ? « Il a raison sur les frontières et l'extrémisme islamique. » Trudeau ? « Le héros des exdjihadistes. » Le terrorisme ? « Une part de l'islam. » L'Iran et l'Arabie saoudite ? « Des régimes corrompus. » La taqiya, l'art de la dissimulation ? « Un cancer. » L'immigration massive ? « Elle détruit l'Occident. » La Palestine ? « Une nation de terroristes » et « une terre juive ». L'islamophobie ? « Ça n'existe pas. »  
  
Toutefois, l'imam dément être un provocateur. « L'humour est une arme pacifique mais létale », dit-il. Mieux, « être sarcastique est 100 % halal ». Comme lorsqu'il s'est filmé en train de manger une barre chocolatée... non halal. « Le goût est meilleur quand il n'y a pas de tampon halal. C'est délicieux », a-t-il savouré. Mohammad Tawhidi entend surtout incarner un islam ouvert et moderne. Ce végétarien, qui cite Ayn Rand, a même divorcé parce que ses opinions religieuses étaient « offensantes » pour son épouse et sa famille. Et puis, il entretient « une relation très forte » avec les chrétiens, s'agenouille devant la statue de Jésus, admire la Vierge Marie, loue le père Hamel en « noble martyr » et brûle des cierges. « Je vis à côté d'une église et je laisse les fidèles utiliser mon allée pour garer leurs voitures le dimanche, raconte-t-il. L'archevêque m'embrasse quand il me voit, il m'appelle ""mon fils"" et je l'appelle ""mon père"". »  
  
Il faut dire que son combat a des airs de croisade. « Si seulement nous pouvions créer des prêcheurs musulmans pacifiques aussi vite que les gauchistes créent de nouveaux genres », plaisante-t-il. « Depuis mille quatre cents ans, nous avons une religion de guerre », répète Mohammad Tawhidi, mais « la réforme islamique est une illusion. La seule réforme possible se fera au niveau individuel ». En attendant, l'""imam de la paix"" jure de poursuivre sa mission antiextrémiste auprès des gouvernements, des élus et des religieux. En plus de son testament, il a rédigé un livre explosif, mais peine à trouver un éditeur téméraire, alors que son compte Facebook a déjà été fermé huit fois en un an ! « L'Australie doit mettre en avant Tawhidi pour envoyer un message aux islamistes », a exhorté l'activiste néerlando-américaine d'origine somalienne Ayaan Hirsi Ali. Inch'Allah.  "
2018-05-14 19:14:36,pepsman," &gt;« La chasse aux musulman.e.s (présumé.e.s) qui ont l’outrecuidance de se rendre visibles, orchestrée par le@printempsrepub se poursuit. Le but : nous expulser de la sphère publique. Mais on est là, chez nous.


Frissons..."
2017-04-18 14:04:21,yoshi570,"&gt; Que ce soit un de la situation irrégulière ou un débouté du droit d'asile qui reste sur le territoire, les deux rentrent dans la catégorie des immigrés illégaux.

Les situations sont clairement différentes, même si tu tiens à les regrouper à tout prix.

&gt;D'après le Parisien, en 2015, il y a eu 10'500 expulsions alors qu'on estime le nombre des illégaux en France entre 200'000 et 400'000. Au delà de savoir s'il faut les expulser ou les régulariser, le fait est qu'on ne peut pas dire qu'actuellement tout les illégaux sont expulsés systématiquement.

C'est vrai. Mais elles existent; de plus, il coûterait très certainement plus de faire une chasse et expulsion systématique etc que de ne rien faire.

&gt;Ensuite même si tu prétend qu'on peut en parler et nie mon accusation, tu dis que ce n'est pas un sujet digne d'être discuté car il est 'absolument mineur' et que donc celui qui en parle est un 'démagogue jouant sur la peur de l'autre' En gros: il faut mettre ça sous le tapis et celui qui le ressortira sera un xénophobe -&gt; sujet tabou

Faudra que t'arrêtes avec ce mot parce que de toute évidence tu ne comprends pas ce qu'il veut dire. Un sujet tabou, tu n'as pas le droit d'en parler. Tu as le droit de dire des choses xénophobes; et j'ai le droit de dire que c'est xénophobe. Ca te plait pas d'être xénophobe ? Alors arrête de l'être.

&gt;Et bien sur que je sais que les politiques peuvent manipuler les masses mais les politiques sont aussi des idéologues et croient parfois fermement aux idées qu'ils défendent: je ne pense pas que Phillipot pense que l'immigration c'est super et qu'il dit le contraire uniquement pour gagner des voix et j'estime que si tu n'as aucun remord à traiter tout les électeur du FN de raciste sans nuance, il est bizarre de donner le bénéfice du doute aux leaders en pensant qu'ils ne sont qu'opportunistes.

Je ne pense pas que Philliot soit idiot, donc il doit savoir que l'immigration est une force économique pour la France, fait clairement établi. Socialement, il est difficile de prétendre que c'est un vrai problème, à part à vraiment aller chercher l'anecdote de tel musulman ou telle mosquée. L'immigration existe depuis des siècles en France, c'est un pays qui comme beaucoup d'autres a été bâti sur plein de peuples différents. L'immigration d'aujourd'hui n'est ni différente ni plus gênante que celle d'hier; du moins il n'existe aucun facteur rationnel le montrant.

&gt;si tu n'as aucun remord à traiter tout les électeur du FN de raciste sans nuance, il est bizarre de donner le bénéfice du doute aux leaders en pensant qu'ils ne sont qu'opportunistes.

C'est simplifier ce que je dis à l'extrême. Si tu simplifies ce que je dis pour le déformer, forcément, ça n'a plus grand sens."
2017-03-07 14:32:15,Ergotisme,"Je trouve le muslim ban très con pour plusieurs raisons. Le ""musulman moyen"" de syrie ou d'Iran n'avaient déjà aucune chance d'obtenir un visa américain, au final c'est juste de la com qui a mal tourné parce que les ingénieurs, médecins ou autres personnes talentueuses qui avaient été recruté par les US se sont retrouvé bloqués comme des.


&gt; Les frontières ne sont pas ""ouvertes"", donc il n'est pas nécessaire de les fermer pour pouvoir les ""rouvrir"" après. Après quoi, d'ailleurs ? C'est comme ceux qui pensent qu'il faut partager les richesses ""après"" les avoir créées, ce ""après"" n'existe pas. Le travail de compréhension et de résolution des problèmes doit être fait en permanence, et je ne vois pas comment réduire l'immigration actuelle va aider le problème de rejet par certains français issus de l'immigration, très franchement.  

Pour moi le ""après"" serait dans 5 ou 10 ans, le temps que la jeunesse des banlieues soient réintégrée et se sentent bien en France. Que l'école refonctionne correctement en intégrant les gosses (et en lui donnant des moyens). Ca me frustre d'être plutot a gauche  sur pas mal de sujets mais qu'aucune personnalité de gauche n'est pour ralentir l'immigration (selon moi pour des raisons davantage idéologiques que pragmatiques)

Que le futur des gens qui viennent en France ne soit pas ""vos enfants auront la nationalité française mais détesteront probablement la France alors qu'être français fait parti de leur identité"".

&gt; Et oui, empêcher les familles de se regrouper et de vivre ensemble, empêcher des réfugiés de venir vivre en France, expulser des gens qui vivent en France pour des délits mêmes triviaux, empêcher des enfants d'aller à l'école, dans certains cas, c'est inhumain.

Bah renseigne toi sur les politiques de Visa des autres pays du monde. Les US d'Obama étaient déjà inhumain, l'allemagne, l'australie et la nouvelle-zélande aussi selon tes critères"
2017-01-18 18:11:07,Tidregon,"&gt;Ben non on s'en tape pas. Le but c'est de gagner donc il faut être sûr de pas être contreproductif. Une fois de plus tu parles d'expulser des gens comme si c'était une liste de personnes identifiées et forcément reconnaissables. 

On a des listes de fichés S, on a des listes de djihadistes revenus de Syrie, on a des listes d'imams radicaux. Qu'on commence par ça. Je ne vois pas ce qu'il y a de contre-productif à les virer. Par contre je vois bien ce qu'il y a de contre-productif à les laisser ici tout en faisant mine d'être des gros durs. 

&gt;&gt; Et il faut également les combattre là-bas. Ce sont nos ennemis. On combat ses ennemis sinon on perd.

&gt;Tu veux faire quoi ? Envoyer les armées occidentales partout dans le monde musulman ? 

Je l'ai déjà dit : sanctions sur le Qatar et l'Arabie Saoudite qui financent tout ça. Et évidemment tuer les djihadistes à l'étranger mais ça on le fait déjà. 

&gt;T'as le souvenir des conséquences de la guerre d'Irak ?

Je n'ai pas parlé d'invasion.

&gt; L'islamisme c'est pas une armée que l'on détruit comme dans le cadre d'une guerre conventionnelle. C'est une matrice, une mouvance qui se nourrit des instabilités du monde musulman. Alors oui, des questions se posent sur la façon dont on doit gérer nos relations diplomatiques avec des pays extrémistes mais c'est une questions complexes qui demandent des réponses bien plus élaborées qu'une vulgaire déclaration de guerre générale.

Deja commencer par dire qu'on est de racine chrétienne et que la charia n'est pas tolérée, que l'islam n'est pas une religion de paix et que le gouvernement expulse ou tue les extrémistes ça me paraît être un bon commencement. 

Au lieu de ça on les libère et on refuse de les expulser parce que ces pauvres petits ils risquent d'être torturés. 


&gt;Alors expulser les imams prêcheurs de haine étranger ok, mais en l'occurence c'est déjà en bonne partie le cas. Ensuite les imams français tu les expulsent comment ? 

Tu les déchoie de leur nationalité française et tu les expulses. Ceux n'ayant qu'une seule nationalité française sont minoritaires c'est démontré on a les chiffres. 

&gt;Tu les mets à la frontière allemande ? Tu rouvres Cayenne ? 

C'est une possibilité oui pour les Français. 

&gt;Et tous les islamistes de quartier sans autorité officielle, tu les identifies comment ? 

On avait des rg qui faisaient ça plutôt bien à l'époque. 

&gt;Tu mets la France entière sur écoute ? Tu places l'armée dans les banlieues à la recherche du moindre barbu ? Tu crois que ça va arranger quoi que ce soit ?

Pas besoin de faire tout ça mais évidemment que  conjointement à une politique de restriction de l'immigration et une politique de grandeur de la France qui va un peu plus loin que le matérialisme déplorable qu'on a actuellement, ça serait pas trop mal de contrôler les territoires perdus de la République. 



&gt;Ptin heureusement que t'as pas le bouton rouge toi. Faut ouvrir des livres d'histoire et s'intéresser au phénomène dans sa globalité plutôt que de balancer des grosses banalités guerrières plus fruits de ton ressenti que d'une quelconque réflexion.
 

Lol. Ça me fait bien marrer ce genre d'attaques. On ne se connaît pas et tu n'as aucune idée des centaines d'ouvrages que j'ai lus. "
2017-01-18 17:41:18,UnPoulpe,"&gt;On se tape complètement de ""faire le jeu des islamistes"". On doit les expulser et tuer ceux qui nous combattent.
Ce qui est contre productif c'est de les laisser s'installer ici. Ce qui est contre productif c'est de montrer nos faiblesses. Les manifestations ridicules contre les attentats c'est vraiment faire preuve de faiblesse.
On peut et on doit montrer de la force et de la gloire. Pas faire des débats interminables sur la manière de s'habiller.

Ben non on s'en tape pas. Le but c'est de gagner donc il faut être sûr de pas être contreproductif. Une fois de plus tu parles d'expulser des gens comme si c'était une liste de personnes identifiées et forcément reconnaissables. 

&gt; Et il faut également les combattre là-bas. Ce sont nos ennemis. On combat ses ennemis sinon on perd.

Tu veux faire quoi ? Envoyer les armées occidentales partout dans le monde musulman ? T'as le souvenir des conséquences de la guerre d'Irak ? L'islamisme c'est pas une armée que l'on détruit comme dans le cadre d'une guerre conventionnelle. C'est une matrice, une mouvance qui se nourrit des instabilités du monde musulman. Alors oui, des questions se posent sur la façon dont on doit gérer nos relations diplomatiques avec des pays extrémistes mais c'est une questions complexes qui demandent des réponses bien plus élaborées qu'une vulgaire déclaration de guerre générale.


&gt; Je n'ai pas parlé de supprimer le port du voile dans les rues, comme je l'ai dit l'état a autre chose à faire que de regarder comment les gens s'habillent.
Par contre, les guignols qui prêchent n'importe quoi ici, les intégristes musulmans et les imams qui imposent leurs règles sur notre territoire, on doit les expulser. Et évidemment inverser les flux migratoires pour diminuer le nombre de musulmans en France.

Alors expulser les imams prêcheurs de haine étranger ok, mais en l'occurence c'est déjà en bonne partie le cas. Ensuite les imams français tu les expulsent comment ? Tu les mets à la frontière allemande ? Tu rouvres Cayenne ? Et tous les islamistes de quartier sans autorité officielle, tu les identifies comment ? Tu mets la France entière sur écoute ? Tu places l'armée dans les banlieues à la recherche du moindre barbu ? Tu crois que ça va arranger quoi que ce soit ?


Ptin heureusement que t'as pas le bouton rouge toi. Faut ouvrir des livres d'histoire et s'intéresser au phénomène dans sa globalité plutôt que de balancer des grosses banalités guerrières plus fruits de ton ressenti que d'une quelconque réflexion.
"
