date,author,text
2021-08-13 13:56:12,PapaZoulou,"En 1564 toutefois, le chevalier de l'ordre de Saint Jean Mathurin Romegas parvient à capturer le chef eunuque du sérail de Soliman, humilie celui-ci, ce qui le met dans une colère noire.

La même année, les chrétiens parviennent à prendre une base corsaire fortifiée à Penon de Vélez (toujours sous contrôle espagnol à ce jour et revendiqué par le Maroc).Les deux camps (Espagnols et Ottomans surtout) prennent de plus en plus conscience du problème Maltais.

Si les Espagnols tiennent Malte, ils peuvent sécuriser la côte nord de l'Afrique et expulser les Ottomans.

Si les Ottomans prennent l'île, la Sicile, la côte ouest de l'Italie, de l'Espagne et Rome seraient vulnérables à des assauts Ottomans de grande ampleur (en dehors des razzias classique). Il ne faut pas oublier que l'Espagne conserve à l'époque une population musulmane importante et que les Ottomans ont pillé Otrante en Italie en 1480. La peur d'une cinquième colonne (haha) musulmane en Espagne et d'une invasion de grande ampleur en Italie est bien présente.En 1565 commence ainsi le Grande siège de Malte. On y retrouve les grands commandants Ottomans, Turgut Reis, Mustapha et Piyale Pacha, Barberousse fils (gouverneur d'Alger) et Uluç Ali, gouverneur d'Alexandrie et futur Grand amiral Ottoman.

&amp;#x200B;

Côté chrétien, on retrouve sur place La Valette, âgé maintenant de 70 ans. Il avait passé un an esclave des galères ottomanes, servi comme capitaine des galères de l'ordre et comme gouverneur de Tripoli.Le problème à Malte c'est que les chevaliers comptaient l'utiliser comme base temporaire avant de retourner à Rhodes et n'avaient pas aussi bien fortifié Birgu (la capitale) comme on pourrait le penser. Le petit fort de Saint Elme, clé de l'entrée vers le port, ne pourrait pas tenir longtemps face à une attaque ottomane directe.De plus, ils prenaient de haut les locaux, proches du monde musulman (ils parlaient un dialecte arabe) et ne les traitaient pas bien, ce qui générait des tensions. La chance des chevaliers était que les Ottomans, notamment Turgut, terrorisaient les locaux. En 1551, le bonhomme avait réduit en esclavage 5000 habitants de l'île. Les locaux étaient aussi de fervents chrétiens, ce qui n'aidait pas leur opinion des Ottomans.En tout pour la garnison de la place de Birgu, on a 500 chevaliers de l'ordre, la milice maltaise (qui formerait la majorité des défenseurs) ainsi que des mercenaires et des volontaires étrangers. Un peu plus de 5000 hommes en tout.Face à ça, 30 à 40 000 Ottomans, une armée énorme pour l'époque pour une opération contre une île pratiquement déserte. On compte notamment un fort contingent de Janissaires et de sipahis, les corps d'élite de l'armée ottomane.Au moment de l'arrivée des Ottomans, l'Europe prend peur et Philippe II d'Espagne, le fils de Charles Quint, ordonne de préparer une armée de renfort. 

Le hic, c'est que Philippe est un maniaque ridiculement prudent et que rassembler une force capable de prendre la mer (surtout après les branlées des années passées) est un effort financier et militaire conséquent. Les Espagnols n'ont pas les ressources administratives ottomanes et sa capacité à coordonner l'approvisionnement de ces forces. De plus, la flotte n'est espagnole que de nom, les principaux contingents provenant de Gênes, Naples et de Sicile (sous contrôle espagnol mais ne parlant pas la même langue).Un mois après le début du siège, ils arrivent à peine à réunir 25 galères. Le Ottomans en ont déjà 165 sur place.Les Ottomans, qui disposent de l'armée la mieux organisée et disciplinée d'Europe, mettent le siège devant Birgu et ravagent le reste de l'île pour trouver des ressources.

Les deux camps se rendent compte que prendre le fort de Saint Elme serait clé. La Valette envoya 750 hommes à Saint Elme pour le défendre, des Espagnols en majorité. Le 28 mai 1565, les Ottomans commencèrent à bombarder le fort. Les Ottomans prévoyaient comme les défenseurs que le fort tiendra une semaine, pas beaucoup plus. Il allait tenir près d'un mois.Au cours du siège, Turgut est tué par un éclat de canon, les janissaire repoussés par les défenseurs qui se mettent un moment en grève car demandant des ressources en plus à La Valette. 

Pendant les assauts, les défenseurs utilisent des cercles de feu à jeter sur les Ottomans qui attaquent.Le 23 juin, veille de la Saint-Jean, les Ottomans prennent le fort et massacrent les défenseurs.Les chevaliers auront gagné 3 semaines, ce qui leur sauve la vie. Trois assauts ottomans sont lancés entre juillet et septembre. Les turcs tentent un débarquement qui est repoussée, tentent de couper la chaîne qui bloque le port (ce qui amène les chrétiens à envoyer des troupes et on se retrouve avec des soldats qui se tapent dessus tout en barbottant dans l'eau de la rade). Le deuxième assaut passe très près de réussir, mais les Ottomans paniquent après l'arrivée d'une centaine de cavaliers venus de l'intérieur des terres (Mdina, la capitale de l'île).Le siège se termine avec l'arrivée de l'armée de secours des chrétiens en septembre. 

Les Ottomans, affaiblis par la dysenterie et démoralisés par les échecs, commencent la retraite. Entre temps, ils apprennent que les chrétiens sont moins nombreux que prévu (au début, ils pensaient qu'ils étaient 16000 alors qu'ils sont 8000). Histoire de ne pas finir sur une défaite et se faire exécuter par le sultan (surtout que Soliman n'a pas arrêté de lui envoyer des lettres pour se tenir au courant de l'avancée du siège), Mustapha Pacha déploie son armée pour les battre. Le hic, c'est qu'ils pensaient que les chrétiens n'étaient que 6000 plutôt que 8000. De plus, les chrétiens sont frais là où les Ottomans sont démoralisés. 

C'est la déroute et ils parviennent à s'échapper in extremis.Militairement, la défaite ottomane n'a pas de conséquences importantes, l'impact est d'abord psychologique. Le siège montre que les Ottomans peuvent être battus dans un combat de grande ampleur. L'île est dévastée, La Valette a perdu plus de la moitié de ses hommes (ce qui est un taux de perte ridiculement élevé). 

Cependant, la population et les chevaliers sont désormais bien plus soudés qu'auparavant. Les forts de Birgu seront réparés, améliorés et reconstruits et la ville deviendra la capitale de Malte, La Valette, mort trois ans après le siège.Soliman épargne ses commandants, reconnaissant qu'ils ont pris sacrément chers eux-aussi.Pour lui, ce n'est que partie remise. En attendant, il mène une nouvelle campagne en Hongrie et mène le siège devant Szigetvár. 

Ce siège aussi mériterait un film. Soliman meurt d'épuisement et de vieillesse la veille de la chute du fort, qui explose le lendemain (en manquant d'emmener le vizir avec). Sa mort est cachée jusqu'au retour à Constantinople pour faciliter la succession à son fils Selim II le blond/l'ivrogne.

C'est sous Selim II qu'aura lieu la grande bataille du siècle en Méditerranée, la bataille de Lépante (qui elle aussi mérite un film vu que niveau retournement de situation engueulades et autre c'est le siège de Malte puissance 10).

&amp;#x200B;

Voilà pour le pitch du film, et encore j'ai raté plein de détails qui iraient bien.L'aspect psychologique avec la population, les rivalités entre les combattants issus de différents pays, les scènes de fraternisation entre combattants chrétiens et chrétiens combattant dans le camp ottoman, les trahisons des deux camps qui sauvent la partie aux défenseurs (ou mènent très près de la défaite), les mensonges éhontés de plusieurs commandants pour tenir le coup, l'ombre de Soliman derrière, la peur de l'Europe chrétienne (moins la France, on est avec les Ottomans), les rivalités entre les différents commandants...

On a aussi du tragicomique (des défenseurs de Saint Elme qui tentent de s'enfuir en se planquant dans une caisse et qui passent pas loin de s'en sortir)..."
2021-07-08 12:33:10,CulteDeLaRaison,"&gt;Cette tendance s'est estompée, ne serait-ce que par la force des choses.

Mouais.

Quand en 1880 Jules Ferry faisait expulser avec l'aide de l'armée les chrétiens qui voulaient pas jouer le jeu de la République, on faisait quand même moins les petites chattes niveau ambition laïque et application du dit concept.

La liberté de conscience c'est fondamentale, mais c'est jamais contre l’intérêt commun ou la chose publique, *la res publica -* la République.

Et toutes les religions sont fondamentalement des projets politiques dogmatiques et fascisants en veille qui n'attendent qu'un moment de faiblesse ou une majorité politique pour se réveiller.

À force de se comporter comme des héritiers d'héritiers qui pensent que la relative harmonie du pays est tombée du ciel et qu'elle est éternelle, la laissant de fait s'estomper puisque l'harmonie dans un monde émanant du chaos nécessite une lutte perpétuelle, on va immanquablement retourner vers des périodes style 3ième République d'unification culturelle.

Je rappelle quelques chiffres utiles :

La République Française elle a 200 ans, la loi de 1905 elle en a 100.

Le Christianisme et l'Islam ont respectivement 2000 et 1300 ans.

Il faut savoir faire preuve d'humilité face à des projets de société avec autant d'inertie, et par soucis de préservation il faut savoir être dur mais juste quand le moment le nécessite.

Personnellement le projet politique que j'ai de la France c'est une nation souveraine de citoyens rationnels sachant être critiques de tous les dogmes - y compris religieux, sûrement pas une nouvelle frontière floue du monde musulman ou une terre de conquête pour l'évangélisme renaissant."
2021-05-12 05:41:08,Noirceuil,"A la fin de la seconde guerre mondiale ressurgit le projet sioniste, un projet qui na jamais été abandonné mais qui reprend force après les événements de la 2eGM. 

Ce projet est porté par de nombreuses communautés juives en palestine/judée, et ailleurs dans le monde depuis de nombreuses décennies, vienne se joindre à ce projet et le précipiter, tout les juifs fuyant l'Europe et ce qui s'est passé.

L'angleterre qui a la Palestine/judée en protectorat, se lave les mains et refuse de trancher avant de devoir abandonner me territoire. Le problème monte au niveau international et un vote a lieu à l'ONU. Ce vote reconnaît l'existence d'Israël, la partition en deux états avec un partage des frontiere, il me semble que c'est en 1947.

Sur place la guerre éclate, les palestiniens refuse de se voir expulser d'une partie de leur pays, les nouveaux israéliens se défendent. Tres vites les pays arabes soutiennent la Palestine et les usa soutiennent Israël (je ne connais pas la position de tout les occidentaux). Israel gagne, l'état israélien nait et les palestiniens doivent céder une partie de leur pays. 

Depuis succession de conflit ou Israël à toujours gagné, ce qui fait qu'Israël a maintenant un ascendant très important, la Palestine n'a pratiquement pas le contrôle de son territoire, Israël mène une politique de colonisation aggressive voir même d'annexation.

Ce qui a mis le feu aux poudres ces derniers jours, c'est la volonté pour Israël de faire de Jerusalem sa capitale et de la réunir (la ville est scindée en deux avec un côté palestinien et lautre israelien). Ces tensions ont fait tache d'huile sur l'esplanade des mosquées 2e ou 3e lieu saint le plus important pour les musulmans. Et le jour qui fête la fin du ramadan à vu la police investir Al-Aqsa la mosquée sacré présente sur l'esplanade durant la prière des fidèles.

Les images ont fait le tour du monde musulman et c'est la goutte d'eau qui fait déborder le vase.

Voila j'ai tenté de résumer la situation le plus simplement possible même si rien nest simple dans ce conflit. Désolé pour les erreurs et fautes, je suis en t9."
2020-11-10 10:38:10,natooDidou,"&gt; répétés sans cesse depuis quarante ans

Ouais, répétés... mais absolument pas mis en place, au contraire depuis que j'ai l'âge de m'intéresser au sujet (donc en gros depuis 20 ans) je vois exclusivement de la réponse ""sécuritaire"", du ""durcissement"", tout en continuant un modèle de société qui nous envoie même pas dans un mur, mais dans une falaise.

Donc ça fait une génération qu'on continue à faire les mêmes conneries inefficaces, avec comme conséquences des attentats et une partie de la population qui rejette complètement nos valeurs +la xénophobie vue comme une solution normale. Et on s'attend à ce qu'en en faisant encore plus dans la même direction, subitement ça s'améliore ? ""La folie, c'est de faire toujours la même chose et de s'attendre à un résultat différent"" paraît-il.

&gt; d'interdire toute immigration venue d'un pays majoritairement musulman

Tu connais combien de pays qui ont un réel contrôle de leurs frontières ? 

&gt; expulser toute personne professant un islam contraire aux valeurs européennes

Tu remarqueras que ça fait partie de ce que je propose. Mais va expliquer au saoud ""on vous renvoie votre Imam il fait trop ce pour quoi vous l'avez envoyé""... et surtout va expliquer à Dassault et Total qu'on fait ça.

&gt; A quel moment on s'est dit qu'accueillir des Afghans ou des Pakistanais était une idée géniale ?

Quand on s'est dit qu'accueillir des gens avec des diplômes universitaires, des compétences énormes c'était pas con (je bosse avec 2 afghans, c'est les meilleurs ingé en design mécanique que j'aie rencontré, le dernier toubib qui m'a soigné était syrien)  et plus bassement quand on s'est dit qu'il y avait besoin de gens qui acceptaient n'importe quel taf sous-payé. Et a un moment au niveau international on s'est dit qu'accueillir des gens qui risquaient la mort pour leurs opinions politiques, à cause des mêmes trous de cul pseudo-fondamentalistes qu'on se coltine nous mêmes."
2020-11-10 09:40:20,Delphine_Talaron,"Autant de grands discours et de mantras répétés sans cesse depuis quarante ans. Tu as oublié ""avoir une vraie politique dans les citées"", quitte à balancer toutes les fadaises possibles. Tout ça ne mène absolument à rien. Les pays scandinaves comme la Suède sucent les boules de tous les migrants qui viennent chez eux, leur offrent le bon et le meilleurs, et se font remercier à coup de communautarisme, d'insécurité et d'attentats.

Les seules solutions, c'est évidemment d'interdire toute immigration venue d'un pays majoritairement musulman et expulser toute personne professant un islam contraire aux valeurs européennes. A quel moment on s'est dit qu'accueillir des Afghans ou des Pakistanais était une idée géniale ?

Bien sûr, ça n'arrivera jamais, alors on va plutôt continuer à prétendre que le problème vient de nos sociétés et, en conséquence, dépenser des milliards pour rénover des cités où la police ne peut plus foutre les pieds et pour accueillir tous les cinglés de la terre."
2020-11-04 11:37:35,DrCharme,"je pense que c'est une analyse de surface seulement, sur ces 90% qui seraient musulman, combien ont aussi des profils d'asociaux par exemple?

comme je dit dans un autre commentaire, c'est pas nier le problème de l'islam que de dire ""faut probablement creuser plus loin pour expliquer""

et pour etre 100% clair, si une solution immédiate c'est fermer des mosquées radicales et expulser des islamistes, j'ai aucun probleme avec ça, j'aimerai malgré tout qu'on en profite pour travailler sur des solutions à long terme (sociales, economiques ...)"
2020-10-30 12:21:28,smurlikon,"Réponse au commentaire en réponse qui a été effacé:

&gt; Euh ouais alors déjà, moi, je suis athée et je n'ai jamais mis les pieds dans une mosquée.

Moi non-plus.

&gt; Ce n'est pas aux musulmans soft d'affronter les terroristes. Et tu sais pourquoi ? Même si tu n'arrives pas à l'encaisser, les musulmans modérés sont des français comme les autres. Ils sont supposés être protégés par l'état comme les autres.

Va dire ça au Front National qui n’hésitera pas une seconde à déchoir tout ceux qui ne font pas acte d'apostasie (en mangeant un jambon-beurre bien arrosé devant un huissier)… Le trèpe en a rasibus des barbus qui foutent la merde, et il est prêt à tomber dans les bras du Front National.

&gt; Tu voudrais qu'une partie non négligeable de la population aille faire le travail de la police et des services secrets ? C'est pas à nous, musulmans softs et descendants athées de l'immigration, d'aller fermer les mosquées intégristes puisque je le répète, nous ne les connaissons pas... J'vais pas jouer le faf et aller faire des ratonnades random pour donner l'image que je lutte contre le terrorisme aux gens comme toi.

Nous sommes clairement en guerre contre les forces de l’obscurité qui visent à saper les lendemains radieux. Camarade, c’est ton devoir de mettre l’épaule à la roue!

&gt; La seule chose qu'on fait, c'est de dénoncer aux autorités les intégristes quand on les voit... Perso j'ai déjà balancé un prédicateur qui tournait autour de mon terrain de shit. Mes cousins vont avec leurs amis musulmans à toutes les manifs pro liberté d'expression. Qu'est ce qu'ils peuvent faire de plus ? 

Gueulez plus fort. Allez DANS LES MOSQUÉES IDENTIFIÉES COMMES INTÉGRISTES et bottez le cul des prédicateurs ÉTRANGERS, donc, les agents de l’ANTI-FRANCE (cocorico!)!

&gt; Quand il y a un attentat, on apprend à chaque fois que le mec était suivi... Un random qui le dénonce à ton avis ? Les apprentis fdp terroristes sont souvent déjà dénoncés par leur propre famille puisque, les gens qui tombent dans le terrorisme sont rarement en contact avec la population française {puisque selon toi les musulmans ne sont pas français}. Il y a par exemple le fameux reportage canal +, qui montre bien un père de famille musulman aller lui même dénoncer son propre fils. Que peut il faire de plus républicain ? Est ce qu'on a des statistiques sur la provenance des signalements ? Non, mais, compte tenu des situations sociales des personnes qui tombent dans le terrorisme, ils sont forcément dénoncés par des gens qui sont des immigrés eux aussi.

Encore une fois, c’est l’influence néfaste des islamo-gauchistes qui fait hésiter la réponse des autorités.

&gt; Et d'ailleurs, mon père a hébergé des juifs qui fuyaient l'hyper casher, il a été interviewé par la tv israélienne mais, jamais personne ne lui a rien demandé en France. Ca va il a assez prouvé ou il doit partir ?

Quand le FN va prendre le pouvoir, pour ces nazes, ce sera même une circonstance aggravante: imaginez vous, héberger des juifs!

Et pourquoi le FN va prendre le pouvoir, c’est parce que le populo en a razibus et il a sérieusement les jetons.

&gt; Et du coup, comme le mec qui a fourni toutes les armes à ce fdp de koulibaly, était proche de l'extrême droite, il a donc directement participé à l'attentat, doit on attendre de tous les Rnistes qu'ils manifestent contre ça ? 

Le Front National (appellons bien un greffier un greffier, svp) ne demande pas mieux de magouiller afin de prendre plus facilement le pouvoir. Le seul moyen d’y contrer est de faire baisser la pression en boutant effectivement les barbus hors de France.

&gt; Le mec qui est allé dealer avec daesh pour lafarge est un membre du RN... Pourquoi ne pas demander à Marine et sa clique de manifester contre ce mec là ?

Parce que les fachos ont toujours magouillé pour foutre les jetons à la population. Pour ne pas que cette merde accède au pouvoir, il faut lui couper l’herbe sous le pied.

&gt; Et évidemment qu'on a peur de ces gens là, tu prends les prêches de daesh, les gens comme mon père et moi, on est des cibles au même titre qu'un français ""pure souche"" {si tant est que cela veuille dire quelque chose}...La plupart des descendants de harkies ont affronté l'islamisme radical en Algérie il y a 40 ans, par exemple je ne connais pas ma grand mère et, mon père a dû racheter sa sœur qui avait été vendue en esclavage...40 ans plus tard, tout cela n'a plus d'importance puisqu'il a l'outrecuidance de ne pas s'appeller ""jean pierre"" et de croire à sa manière à son dieu.

Vous attendez quoi pour faire un grand geste contre les barbus? Parce que les gens ne voient rien, se disent «qui ne dit mot, consent», et ils vont tomber dans les bras du Front National tout cuit… Et avec la merde qu’ont foutu les islamo-gauchistes, de la façon dont ils ont pourri les mentalités avec leur bordel de rectum politique, c’est pas la Gauche, la vraie, celle avec des camps de rééducation, qui va faire barrage à la grande blonde et ses chemises brunes…

&gt; Ton raisonnement est stupide et, contre productif. Même sur le plan économique... La plupart des immigrés intégrés ont lancé leur business et ont grimpé d'une façon où l'autre l'échelle sociale. Moi je suis revenu en France après mes études parce que je voulais payer mes impôts en France {si je suis encore vivant cest grâce à l'hôpital français car j'ai eu de gros problèmes de santé}, j'ai toujours été un laïcard et, je ne crois plus en dieu depuis que j'ai compris que prier n'allait pas augmenter ma note aux contrôles de maths. Aujourd'hui, comme une bonne partie des musulmans modérés ou personnes athées de culture musulmane, si on continue de vouloir me faire porter la responsabilité de ces actes barbares, bah je vais juste me casser de France en fait. Et, je ne suis pas le seul à pouvoir le faire...

Alors? Vous faites quoi contre les barbus, les laïcards?

&gt; Du coup, continuez comme ça et, vous vous retrouverez avec seulement les immigrés n'ayant pas les moyens de partir et, comme, la constitution empêchera d'expulser des français {tu les envoies où ?}  

En Terre Adélie.

&gt; bah ils resteront. Donc en fait tu ne vas rien régler du tout par cette demonization de celui porte un nom/prénom oriental...

&gt; Ton discours joue le jeu d'un gouvernement à la ramasse qui déplace la responsabilité vers la première cible possible. Franchement tu tiens le discours d'un énarque nourri à l'école du New public management {et j'ai pas envie d'aller chercher moi même le point Godwin donc, je te conseille de te renseigner sur les origines historiques de cette école de pensée}.

Encore une fois, vous prévoyez faire quoi de concret contre les barbus?

&gt; Et comme je sais que je vais être downvoted, je vais me permettre un peu de whataboutism, est ce que tu demandes aux policiers qui ne font pas de bavures de manifester contre les ripoux ?

Bien sûr que non! Les ripoux donnent mauvaise réputation aux 1% de bons keufs… Ils seraient submergés…"
2020-10-29 09:54:48,eldialbo01,"Je me demande quand même comment la France va gérer ça.

La plupart des terroristes ne sont même pas fiché S ou sans antécédents liés à ça, ce qui veut dire que n’importe quel musulman est susceptible de commettre un attentat. (les hommes car apparemment les femmes et les enfants n'ont pas fait d'attentat jusque maintenant) 

On ne peut pas expulser tout les musulmans, même si beaucoup le souhaitent, c'est pas aussi simple . Il y a pas mal de musulmans qui sont très correct, maintenant comment faire la différence entre un bon musulman qui fait chier personne et qui travaille de celui qui va te trancher la gorge. 

En tout cas courage amis Français."
2020-10-20 09:49:17,supterfuge,"&gt;A titre personnel, je pense aussi que tous les collégiens de France devraient avoir des cours sur l'absence de délit de blasphème en France et, à cet effet, des caricatures de Mahomet devraient être montrées dans toutes les salles de cours de France, afin de désamorcer le tabou autour de ce triste personnage qu'est le Prophète musulman.

Le problème c'est qu'encore une fois, c'est pas une nouvelle idée ça.

Les professeurs sont censés avoir une formation sur l'enseignement de la laïcité, la majorité ne l'a jamais eu. 

J'ai pas l'impression qu'il faut encore légiférer, comme on fait à chaque fois. A un moment, faut qu'on applique le droit qu'on a déjà plutôt que de recréer des textes de lois pour satisfaire l'opinion qui ne serviront pas. On peut déjà expulser un étranger, y compris statutaire, s'il commet un crime."
2020-10-18 15:31:06,71SI,"&gt;À ne pas prendre dans l'autre sens : la critique d'une religion n'a pas à dériver de propos racistes.

Euh... en fait c'est dans le même sens que celui que j'évoque. La critique d'une religion *peut* conduire à des propos racistes, même si ce n'est pas toujours le cas.

&gt;Qui parle d'expulser ?

Quand tu dis ""*qu'ils se barrent*"", si ce n'est pas de leur plein gré, comment est-ce que c'est censé arriver autrement que par une expulsion ?

&gt;Je suis fan' de Batman, est-ce que je me définis en tant que fan de Batman ? Non, j'ai un paquet d'autres caractéristiques, à côté. Une de mes meilleures amies est musulmane, on parle presque tous les jours, pourtant ça doit faire deux mois qu'on a pas évoqué l'islam, ni Batman. C'est fou, non ?

Je suppose que tu ne l'appelles pas ""la musulmane"", mais ""ma meilleure amie"", de la même façon que je n'appelle pas mes amis juifs ""les juifs"" ou mes amis pastafariens ""les pastafariens"", et que personne ne t'appelle ""le fan de batman"".

Donc les musulmans ne se résument pas à leur religion... sauf quand on les appelle ""les musulmans"", conformément [au sens de ce terme](https://www.larousse.fr/dictionnaires/francais/musulman/53427)."
