date,author,text
2022-09-04 13:17:22,SpongeBobBzh,"On s'en branle, on doit fermer les mosquées radicales  et expulser les imams, si étrangers, et fermer les paroisses ou institutions catholiques radicales.

L'islam est peut être la religion la plus problématique mais ce n'est pas la seule.

On est en France, un état laïque, on ne fait pas de différence entre les religions. Je vois pas le problème a s'occuper aussi de l'intégrisme catholique, c'est simple a faire et ça montre a 10% de la population française qu'ils ne sont pas des cibles.  Moi athé ca fout en pétard de voir qu'on attaque que l'islam alors j'imagine même pas comment doit le prendre un musulman."
2022-08-31 21:49:29,SteppedHorde,"Les faits qui lui sont reproché datent de plus de 15 ans je crois . Est-ce vraiment légitime de vouloir l’expulser ? Surtout qu’il a radicalement changer entre temps 


Iquioussen est réputé dans le milieux de prédicateurs comme étant un lèche botte du gouvernement et de la France . il parle assez souvent comme quoi il faut aimer la France


Il répète sans arrêt que les enfants d’immigrés sont Français et devraient se sentir Français . Je m’en rappel dans une de ses vidéos qu’il incitait les jeunes dans la salle a brandir le drapeau Bleu Blanc Rouge


Et même une fois ou il disait que la France avec ses loi et sa constitution appliquée mieux la sharia que certains pays musulman"
2022-08-02 08:54:07,SowetoNecklace,"J'ai un paywall sur cet article, alors j'en profite pour reprendre quelques sources sur le sujet qui parlent de Hassan Iquioussen :

[Anadolu](https://www.aa.com.tr/fr/politique/france-vague-d-indignation-face-%C3%A0-la-proc%C3%A9dure-d-expulsion-qui-vise-l-imam-hassan-iquioussen/2650690) reprend les termes du communiqué :

&gt; « Lors de ses différentes et régulières interventions au sein de nos mosquées, Hassan Iquioussen tient toujours des propos en cohérence avec le pacte républicain. Il prône les valeurs nationales de liberté, d'égalité et de fraternité, ainsi que la laïcité. Fidèle à son discours contre les replis identitaires, il milite sans relâche pour promouvoir le dialogue, le respect et le vivre-ensemble », témoignent les signataires.

D'ailleurs, le même article d'Anadolu précise que l’UJFP (union juive française pour la paix) s'est aussi opposée à son éloignement. Je suis allé voir ce qu'était l'UJFP et Wikipédia dit que c'est ""une organisation juive laïque, universaliste et antisioniste s'opposant à l'occupation des territoires palestiniens, qui milite, notamment dans le Collectif national pour une paix juste et durable entre Palestiniens et Israéliens""

Toujours sur le même article d'Anadolu, deux responsables d'associations religieuses dans le Rhône témoignent sur Iquioussen :

&gt; « Nous l'avons toujours connu fidèle à son engagement rejetant la haine de l'autre, condamnant le racisme, l'antisémitisme, l'extrémisme, l'obscurantisme et le terrorisme et prônant l'égalité homme-femme, et a tout au long de son ministère promu sans relâche le dialogue, le respect, la paix et le vivre-ensemble »

Avant qu'on m'accuse d'être un crypto-islamiste, j'ai volontairement choisi un article d'Anadolu parce qu'on peut justement compter sur eux pour défendre Iquioussen. Maintenant, de l'aute côté, [Marianne](https://www.marianne.net/societe/laicite-et-religions/qui-est-hassan-iquioussen-limam-proche-des-freres-musulmans-que-darmanin-va-expulser) qualifie Iquioussen de ""proche des frères musulmans"", mais j'ai trouvé aucune info concrète qui le relie à la galaxie frériste. Ça ne veut pas dire que ce n'est pas le cas ! Les Frères sont très doués dans la création d'organisations nébuleuses.

Un petit point que Marianne soulève qui m'a fait tiquer : 

&gt; Né en France, il avait la nationalité française jusqu'à ce qu'elle lui soit retirée à sa majorité. De nationalité marocaine depuis, il avait alors bénéficié de titres de séjour. C'est à la faveur d'une demande de renouvellement cet hiver de son titre de séjour de dix ans que les autorités françaises ont décidé d'utiliser la loi d'août 2021.

Du coup, je suis allé voir certaines vidéos d'Iquioussen pour voir ce qu’il dit (Au boulot... J'espère que je suis pas sur une liste maintenant).

[Musulman et homosexuel](https://youtu.be/NDmELUdeVng?t=43) : ""Il est évident qu'en tant que musulman je condamne l'homosexualité au même titre que je condamne la consommation d'alcool, le viol ou le vol puisque pour nous c'est un péché condamné dans les textes de manière claire, nette et précise. Ce n'est pas pour autant que je vais chercher les homosexuels pour les pendre puisque ma religion me dit que tosu les êtres humains sont  des pécheurs et que je ne suis pas investi de cette mission de fouiner dans la vie de mon prochain""

Dans cette même vidéo, Iquioussen demande à son assistance : ""Est-ce qu'il y a des musulmans pieux, qui craignent Allah, qui font leurs prières, leur hajj, leur jeûne, et qui sont homosexuels ?"" l'assistance répond ""non"" sans équivoque. Il les reprend alors : ""Vous ne connaissez pas l'invisible des gens, et là vous comme moi on fait un péché qui est pire que l'homosexualité, al-ghayba (parler dans le dos des gens), al-namima (les racontars), c'est pire"". 

C'est donc une leçon assez classique religieuse genre ""Je ne cautionne pas mais je ne juge pas"", comme on en entend 500 fois par jour chez les évangélistes. Et je ne dis pas ça pour défendre Iquioussen en mode DavidGoodEnough, je cherche juste à représenter une idée de son discours.

Un autre essai : [Quel est le sort dans l'au-delà d'un non-musulman qui a agi dans le bien toute sa vie ?](https://youtu.be/mI5tQraZ0Z0?t=60) il répond : ""Puisque Dieu est juste, il récompensera tout le monde"" avant de dire que, si les portes du Paradis sont fermées aux non-musulmans, il existe d'autres au-delà pour ceux qui ont fait du bien sans croire (ça me rappelle les Limbes telles que racontées par Dante dans la Divine Comédie).

Je sais pas, j'ai pas vu tous ses discours évidemment, mais je ne vois pas en lui un champion de la Charia en France, un discours séparatiste ou autre. Je ne sais pas ce qu'il a pu dire en privé quand il n'est pas filmé sur Youtube."
2022-05-02 18:49:02,NuageDeCristal,"&gt;&gt; Tu dis que la FI est plus dangereux que le FN. 
&gt;
&gt;Voilà.
&gt;
&gt;&gt;Désolée mais à quel moment le FN va respecter les droits de l'homme, la liberté de conscience, combattre le sexisme ?
&gt;
&gt;Et hop! Un bel homme de paille!

Non, lecture du programme et des discours des personnes à la tête du FN. J'ai vécu à Béziers, je connais la novlangue de l'extrême droite.
&gt;&gt;La seule chose que tu retiens, c'est que la FI ne tape pas assez sur l'islam (ou les arabes) à ton goût,
&gt;
&gt;Et hop! un autre homme de paille, ou alors une bel amalgame raciste d'ignorant qui ne sait pas faire la différence entre un arabe, un musulman lambda, et un islamiste.

Je sais la différence. Toi non, vu que tu qualifie la FI d'islamiste.
&gt;&gt;que tu préfères une nana qui veut s'octroyer les pleins pouvoirs à un mec qui veut rendre le régime français plus démocratique en se basant sur le modèle de nos voisins européens.
&gt;
&gt;Ben tiens. Et LFI qui dit ouvertement que s'ils perdent les élections ils prendront le pouvoir par la rue? Pourquoi ce n'est pas un problème alors que si MLP disait ca, tu serais la première à crier au fascisme. Mais LFI? Hop! passe-droit.

Le facisme a une définition bien précise. Faire la révolution n'est pas du fascisme. Ou alors la résistance française est pire que le nazisme.
&gt;&gt;Et je parle même pas de R! qui veut littéralement déporter les arabes (Zemmour a promis 1 million de déportation). En quoi c'est respecter les droits de l'homme ? C'est littéralement la politique des nazis.
&gt;
&gt;Et hop! Autre homme de paille, ou bel amalgame entre les criminels et illégaux non francais et les ""arabes"". Zemmour est un vieux réactionnaire sexiste avec une vision romantico-nationale de la France, mais il a dit qu'il expulserait les criminels et délinquants étrangers (et illégaux, je suppose, je ne me rappelle plus des détails). Il a des idées suffisamment faciles à attaquer, des gens suffisamment douteux autour, pourquoi est-ce que vous ressentez le besoin d'inventer des choses, alors qu'en parallèle toute exposition de faits horribles sur le LFI sont non seulement passé sous le tapis, mais systématiquement attaqué par des accusations d'extrême droite, raciste, etc?

Il y a 15'000 prisonniers étrangers en France. Comment ce chiffre peut passer à 1 million ? 

[Je n'invente rien](https://mobile.twitter.com/ZemmourEric/status/1506009922177323013)
&gt;&gt;En quoi c'est respecter les droits de l'homme ? C'est littéralement la politique des nazis.
&gt;
&gt;Littéralement la politique des nazis. Expulser des illégaux, délinquants et criminel. AJA que énormément de pays dans le monde sont des pays nazis. Tu sais par contre qui a une idéologie très proches des nazis? Les gentils identitaires obsessionnés de la race qui sont bien chaud chez LFI, et les islamistes qui sont bien amis avec LFI aussi.

Oui, les fameux Nazis de la France Insoumise qui veut déporter 1 million de juifs. Ah bah non ça marche pas.

Mais bon, apparemment, j'ai pas le droit de faire des hommes de pailles alors que tu en fait allègrement en disant que FI = islamistes. Tu as vraiment un énorme culot."
2022-05-02 18:19:19,Perfilix,"&gt; Tu dis que la FI est plus dangereux que le FN. 

Voilà.

&gt;Désolée mais à quel moment le FN va respecter les droits de l'homme, la liberté de conscience, combattre le sexisme ?

Et hop! Un bel homme de paille!

&gt;La seule chose que tu retiens, c'est que la FI ne tape pas assez sur l'islam (ou les arabes) à ton goût,

Et hop! un autre homme de paille, ou alors une bel amalgame raciste d'ignorant qui ne sait pas faire la différence entre un arabe, un musulman lambda, et un islamiste.

&gt;que tu préfères une nana qui veut s'octroyer les pleins pouvoirs à un mec qui veut rendre le régime français plus démocratique en se basant sur le modèle de nos voisins européens.

Ben tiens. Et LFI qui dit ouvertement que s'ils perdent les élections ils prendront le pouvoir par la rue? Pourquoi ce n'est pas un problème alors que si MLP disait ca, tu serais la première à crier au fascisme. Mais LFI? Hop! passe-droit.

&gt;Et je parle même pas de R! qui veut littéralement déporter les arabes (Zemmour a promis 1 million de déportation). En quoi c'est respecter les droits de l'homme ? C'est littéralement la politique des nazis.

Et hop! Autre homme de paille, ou bel amalgame entre les criminels et illégaux non francais et les ""arabes"". Zemmour est un vieux réactionnaire sexiste avec une vision romantico-nationale de la France, mais il a dit qu'il expulserait les criminels et délinquants étrangers (et illégaux, je suppose, je ne me rappelle plus des détails). Il a des idées suffisamment faciles à attaquer, des gens suffisamment douteux autour, pourquoi est-ce que vous ressentez le besoin d'inventer des choses, alors qu'en parallèle toute exposition de faits horribles sur le LFI sont non seulement passé sous le tapis, mais systématiquement attaqué par des accusations d'extrême droite, raciste, etc?

&gt;En quoi c'est respecter les droits de l'homme ? C'est littéralement la politique des nazis.

Littéralement la politique des nazis. Expulser des illégaux, délinquants et criminel. AJA que énormément de pays dans le monde sont des pays nazis. Tu sais par contre qui a une idéologie très proches des nazis? Les gentils identitaires obsessionnés de la race qui sont bien chaud chez LFI, et les islamistes qui sont bien amis avec LFI aussi."
2021-10-18 07:45:51,DocNCoV,"Je pense qu’à peu près 100% de la population a envie de foutre en taule les prêtres violeurs, expulser au Vatican leurs complices et pire encore. 

Les jours fériés? Je pense que 100% de la population serait content d’avoir quelques jours fériés supplémentaires pour les fêtes religieuses de l’islam (hormis les patrons d’entreprise?).

Edit: j’ai une histoire d’ailleurs à ce sujet! Lorsque j’étais étudiant, dans l’un des hôpitaux où j’ai fait mon externat, les musulmans et les juifs avaient le droit à un jour de congé supplémentaire en plus des six semaines habituelles. J’étais en stage en ORL, un stage absolument horrible, alors j’ai posé un jour supplémentaire alors que j’avais déjà épuisé mes CA. Le chef de service a gueulé. Le chef de pôle a gueulé. C’est remonté jusqu’au Doyen apparemment mais il ne m’a rien dit. Au final j’ai tenu bon en affirmant que j’étais bel et bien musulman et que j’avais droit à mon jour CA supplémentaire. 

Ça a bien fait rire mes coexternes mais ils n’ont pas osé faire pareil. J’ai même fait croire que j’allais encore poser un jour car j’étais juif-musulman et que techniquement j’avais droit de fêter hannucca aussi."
2021-09-25 21:47:11,JeanLucLechemelon,"Déjà on va mettre quelque chose au clair: non je n'ai pas envie de répéter un fichage systématique des musulmans, qui serait de toute façon illégale avec la laïcité. Je ne veux pas non plus expulser des citoyens juste à cause de leur religion. Enfin pour moi ce n'est pas, ça n'a jamais été un ""eux"" contre un ""nous"". Dire cela, c'est reprendre le discours de ceux qui veulent créer une ségrégation dans l'esprit des gens entre les musulmans et les autres Français. Est-ce qu'une mère de famille == un imam fraichement diplomé/endoctriné des écoles coraniques saoudiennes == un imam algérien ou marocain dont on voit avec le conseil du culte musulman qu'ils ne s'entend pas avec le second ? Merci de ne pas les voir qu'au travers de leur religion ou leur ethnie, ça valide la thèse de ceux qui propagent la haine.

De deux: 1914 &amp; 1940 le rapport avec les anticléricaux ? Je sais que Gamelin était un radical centriste mais je pense pas que ça ait pu jouer dans la percée des Ardennes. Pas sûr que le très catholique Weygand ait pu anticiper non plus, quoiqu'il aurait pu être un peu plus réactif. Cette rhétorique fait penser à Maurras, merci d'éclairer votre position à ce sujet .

Italie et Royaume-Uni, ne même pas faire mieux qu'eux ? Aller dire cela à une Sicilienne qui veut avorter. Si vous avez la flemme allez lire le Guépard de Lampedusa, il y donne une description assez fleurie de la mentalité du Sicilien que l'influence de l'Eglise ne vient pas améliorer. Pour le Royaume Uni ? Renseignez vous sur les Irlandais catholiques en Irlande du nord. D'ailleurs je suis pas sûr qu'autoriser des tribunaux islamiques déposséder des gamines de leur héritage pour tout refourger aux fils soit très brillant ([**https://www.secularism.org.uk/opinion/2014/03/sharia-law-is-well-and-truly-operating-in-the-uk-thanks-to-the-law-society**](https://www.secularism.org.uk/opinion/2014/03/sharia-law-is-well-and-truly-operating-in-the-uk-thanks-to-the-law-society)).

Oui notre économie fonctionnait, avait une industrie (dont la disparition est aussi un peu à la base de la faillite de la politique d'intégration actuelle) mais chui désolé, ça veut pas dire qu'un noir ou un arabe avait de meilleures chances d'intégration qu'aujoud'hui. L'état de l'économie d'un pays ne se résume pas à ""resplandissante"" ou ""fonctionnelle"".

Notre laïcité n'a pas raisonnée à elle seule l'Eglise mais elle l'a écartée des affaires publiques et a achevé le processus de subordinnation du spirituel au temporel qui a pris des siècles. C'est ce processus qui permet de vivre en paix aujourd'hui avec une présence de plusieurs religion sans que l'une domine l'autre ou revendique des passe-droits. A-t-on jamais ces dernières années entendu les cathos gueuler aussi fort contre Charlie Hebdo alors qu'ils sont visés au moins aussi crûement par les caricatures ? Voit-on des prêtres catholiques raconter pendant les sermons au calme l'épisode de Sodome et Gomorre pour rappeler que les homosexuels seront punis, tandis que il y a des imams qui citent des passages appelant explicitement au meutre des Juifs ?

Dans vos autres messages vous dites que c'est comme ça, qu'on y peut rien, autant sacrifier des gamines aujourd'hui pour se concentrer sur la seule intégration professionnelle alors que vous dites vous-même que c'est justement le manque d'idéal qui pousse des jeunes à rallier une idéologie mortifère ? De plus, les Etats-Unis sont l'incarnation même de l'idéal de vie tourné vers le job et la consommation et pourtant, ça les empêche pas d'avoir sur leur sol les croyants parmi les plus zélotes du monde occidental.

En attendant, c'est peut-être puéril mais rappeler qu'une gamine n'a pas à aller à l'école avec un voile mais doit au moins attendre sa majorité pour le porter et en attendant découvrir qu'il y a un monde et une infinité de vies possibles pour elles içi sans avoir à prouver par ses vêtements qu'elle est ""pure"", ben je crois que si on renonce à cela, autant s'auto-purifier par l'atome sur-le-champ, il y aura beaucoup de souffrances épargnées. Cela ne nous dispensera pas d'investir massivement pour remettre à niveau l'état déplorable de l'école dans les quartiers mais c'est à rappeler.

J'ai du mal à cerner vers quel est le modèle de société que vous recommandez mais si c'est une copie éco moins de l'anglo-saxon, je vous invite à lire Amartya Sen sur la différence entre monoculturalisme pluriel et multiculturalisme."
2021-09-24 07:07:24,Eadw7cer,"Melanchon c’est comme dab avec une tendence un peu plus ecolo. Zemmour par contre maintenant qu’il fait des propositions politiques ca change tout: enlever les droits de l’homme, expulser tous les immigrés musulman qu’il jugera non assimilé, rétablir la peine de mort pour les arabes, que les arabes nous violent et nous tuent. J’ai pas bien dormi après toute cette haine lol.
En plus il se présente comme le défenseur du catholicisme qui doit détruire les musulmans envahisseurs, venant d’un juif sefarade c’est une leçon d’histoire revisité qui passe bizarrement ?"
