date,author,text
2017-10-25 17:22:13,VoirSous,"&gt;Je conseille aux lecteurs du commentaire ci-dessus de cliquer sur les liens et lire les échanges.
&gt;
&gt;Le premier est cordial et constructif, les interlocuteurs précisent leur positions et Enthoven reconnaît que son interlocuteur a raison.

Tu n'as pas compris sa fausse excuse, qui est ironique puisqu'il en rajoute une couche. 

Argumenter sur l'image de L'UPR ? Non : simplement traiter d'antisémite, puis évidemment s'excuser faussement en ajoutant à l'antisémitisme une accusation de sinophobie et d'europhobie.

Être contre l'UE n'est ainsi plus une position politique sujette au débat, c'est une maladie.

Voilà la gueule du ""débat d'idées"" avec Enthoven. 

&gt;Dans le second, il ne fait que rappeler que l'antisémitisme peut avoir lieu même si la cible n'est pas juive (notion reprise dans le doit français, par exemple [son appartenance ou de sa non-appartenance, **vraie ou supposée**, à une prétendue race, une ethnie, une nation ou une religion déterminée

Personne ne suppose que Macron est juif. Ton interprétation est donc fausse et le commentaire de Enthoven est bien une illustration de ce que j'affirme.

Si quelqu'un (en l'occurrence un des fillonistes) avait dit ""Macron sale juif"", là ton interprétation aurait pu être valable. Mais ce n'est pas le cas. "
2017-10-17 15:31:51,Elorios,Cette sale race me surprendra toujours autant.
2017-10-14 13:01:36,scylk2,"&gt; Votre conjoint est-il couvert à titre personnel par	
oui	non	
un régime obligatoire d'assurance maladie ?  
  
J4AI PAS DE CONJOINT CONNARD ELLE EST OU L4OPTION POUR DIRE QUE J4AI PAS DE CONJOINT ??? EST CE QUE TU PEUX SORTIR DEUX SECONDES TES DOIGTS DE TON GROS CUL QUAND TU DEV UN FORMULAIRE SALE RACE ?"
2017-10-12 14:35:58,Boulaouane1er,"
Ainsi, le 15 juillet 1943 (il a 23 ans), Audiard donne à « l'Appel » – journal ultra –, dirigé par Pierre Costantini (qui finira par se prendre pour Napoléon et sera interné en HP), une nouvelle intitulée « La fin commence à l'aube », curieuse histoire d'un pêcheur assassin. L'atmosphère est mélodramatique : Audiard n'est pas encore Audiard. Il le devient avec une deuxième nouvelle, « le Rescapé du Santa Maria », récit humoristique d'un trois-mâts conquis à l'abordage. Le propriétaire du bateau est un vieux, qui se définit par « une veulerie suante »et « une odeur de chacal ». Son nom : Jacob Brahm. On lui demande : « Juif, hein ? – Juste un tout petit peu, du côté de mon père. »Un autre bonhomme, Ephraïm, est « une synthèse de fourberie ». C'est donc « la conjuration des synagogues ! », qui s'achèvera « à l'heure prochaine de votre pendaison […] manifestation de l'immanente justice ». On est bien dans l'esprit nauséabond de l'époque. La grande rafle des juifs de Marseille a eu lieu quelques mois auparavant. Celle du Vél'd'Hiv date de l'été précédent. Le 14  octobre 1943, un nouveau texte de Michel Audiard : « la Vérité sur l'affaire Loth », pastiche brindezingue de la Bible, où le patriarche est traité de « fidèle corrompu »… En janvier 1944, changement de crèmerie : c'est dans « l'Union française », journal qui prône la création d'« une nouvelle France dans la nouvelle Europe », qu'Audiard s'exprime, sous forme de « reportages » drolatiques. « Big Billy s'est évadé » invente totalement l'évasion du légendaire Arthur Billy, détenu à Sing Sing. « Numéro 22 » et « Hélène est partie », deux autres « contes », paraissent. Dont « l'Anarchiste derrière la porte », dans laquelle Michel Audiard lui-même écoute le récit d'un pote qui lui raconte avoir été la cible des « terroristes », notamment d'un « anarchiste de l'espèce la plus homicide »… Mais seulement en rêve. Destin qui préfigure celui de Philippe Henriot, éphémère secrétaire d'Etat à l'Information de Vichy, abattu le 28 juin 1944.

CHANGEMENT DE TON À LA LIBÉRATION

Puis Audiard devient critique de théâtre. Le 1er juin 1944, il publie un papier élogieux sur un livre intitulé « Autopsie des spectacles », publié « sous les auspices de l'Institut d'Etudes corporatives et sociales », dont le siège social se trouve au 77, rue de Lille. L'ambassade du Grand Reich est située au 78. L'auteur, Jean-Pierre Liausu, plaide pour l'arrêt des « machinations de la juiverie omniprésente »dans le théâtre et dans le cinéma, vomit sur Léon Blum « chez qui se putréfient toutes les essences ju-déïques »et constate que, dans le monde du spectacle, en France, « le juif a triomphé ». Liausu plaide pour l'élimination des syndicats, la réhabilitation des chants folkloriques, le tout « sous le haut patronage du maréchal Pétain, chef de l'Etat français ». Audiard, en soutien de Liausu, écrit : « Le monde qu'il est convenu d'appeler “artistique” et qui demeure dans sa majorité le plus coquet ramassis de faisans, juifs (pardonnez le pléonasme), métèques, margoulins… »Ce « pardonnez le pléonasme »est impardonnable. De même, consacrant sa rubrique à la littérature, Audiard s'en prend au « petit youpin Joseph Kessel », avant d'étriller Elsa Triolet qui a cette « prédilection pour tout ce qui est veule, fangeux, équivoque ». Et puis… Et puis survient la Libé-ration. Changement de ton, donc. Les grands collabos, Luchaire, Darnand, Brinon, Déat, Laval, Bonnard, Rebatet, ont déjà leur rond de serviette à Sigmaringen. Que fait Audiard ? Il s'engage. Peut-être.

C'est lui qui le dit : il aurait intégré le « 1er Cuir » (régiment de cuirassiers) en août 1944. Pour se faire une virginité ? Franck Lhomeau précise que, malgré ses recherches assidues, il n'a pas retrouvé, dans les archives militaires, trace de cet engagement. En revanche, une « fiche d'identité de solde »du soldat Audiard a été proposée dans une vente aux enchères, en 2016. Authentique ? Allez savoir. Mais il y a plus désagréable : une fiche d'adhésion – numéro 74.208, datée de 1942 – au groupe Collaboration, elle, existe. Fondé en 1940 par Alphonse de Châteaubriant (qui voyait en Hitler un nouveau Christ), comprenant le dessus du fumier collabo (Brinon, Bonnard, Augier, Drieu la Rochelle, Laubreaux), ce groupe milite alors pour une Europe sous bannière allemande. Interrogé, une deuxième fois, au commissariat du Petit-Montrouge par le commissaire Pezet, en mars 1947, Michel Audiard affirme que son adhésion s'est faite « à son insu », et qu'il n'a jamais signé. Le doute lui profite. Il n'y aura pas de suite.

Notre homme s'adapte alors aux temps nouveaux. Il devient critique de cinéma dans « l'Etoile du soir », fondé par un authentique résistant fusillé, et adopte un pseudonyme, Jacques Potier. Il proteste contre la condamnation de Clouzot dans l'affaire du « Corbeau », en compagnie de Marcel Carné et de François Chalais (qui avait travaillé à « Je suis partout » et à « Combats », journal de la Milice). Il publie un reportage bidon sur une cérémonie vaudou au quartier Latin, un autre sur la Chine, et, côté cinéma, se met à dénoncer l'abondance des films sur la Résistance : « Avec quelques accents de clairon, une forte dose de mitraillettes, agrémentées d'une légère teinte de croix de Lorraine, à tous les coups ça marche. »Simultanément il s'attaque à Pierre Blanchar, star de « la Symphonie pastorale », et… président du Comité de Libération du Cinéma français chargé de l'épuration. L'une des marottes d'Audiard se fait jour : étriller les héros de la troisième heure, les résistants tortionnaires, se moquer de la saga d'une France courageuse. « Au fond, pense-t-il, tout le monde est pareil, souligne Franck Lhomeau. Combattants et collabos, épiciers et soldats, tout est nivelé. Le courage et la veulerie sont mis au même niveau… » Curieusement Audiard s'en prend aussi à Jean Gabin, dont il débine la « notoire liquéfaction », alors que Gabin, engagé, se bat contre les Allemands. Ils deviendront copains plus tard… Audiard, aussi, tape sur ce cinéma français qui privilégie « les Don Juan du macadam, les pédérastes intellectuels, les résistants vaudevillesques et les aventurières en panne d'affection ». En revanche, il aime Disney et se souvient d'un « authentique chef-d'œuvre : “les Dieux du stade” de Leni Riefenstahl ».

C'est à cette époque, en 1947, qu'il rencontre le réalisateur André Hunebelle, qui lui commande son premier scénario, « Mission à Tanger », dont certains pensent qu'il s'agit d'un démarquage de « Casablanca ». Une étoile est née… Michel Audiard va devenir, en quelques années, le dialoguiste et le scénariste le plus demandé du cinéma français, alternant les réussites (« Gas-oil », « le Désordre et la nuit », « Cent Mille Dollars au soleil ») et les nanars (« Quai des blondes », « Carambolages », « Sale Temps pour les mouches »), puis en devenant lui-même metteur en scène (« Le drapeau noir flotte sur la marmite »). Pourquoi a-t-il eu l'envie d'écrire (dans les années 1980) ce « Chant du départ », livre décousu, mais où on retrouve son sens de la formule : « Véra poétise sur le clitoris et robinsonne sur le fion avec infiniment d'allant » ? Il y étrille Joanovici, « juif bessarabien » (« marqué du lignage du cloporte »), pose qu'« un régime totalitaire devient tout à fait exécrable lorsqu'il se complique d'un régime alimentaire », se souvient qu'il évitait le métro par peur d'être expédié au STO, et rappelle que « le juif Offenbach »n'était plus au goût du jour, sous Vichy. Un grand moment, quand même : sa description de la collaboration avec Patrick Modiano pour adapter « l'Instinct de mort », de Mesrine, en 1978. On n'imagine pas deux êtres plus mal appariés. Modiano, selon Audiard, aurait « transformé le tueur de maquereaux en Christ aux outrages ». Gabin, au passage, a droit à un portrait sur plusieurs pages, pas toujours tendre : c'est un éternel anxieux, « éparpillé dans le cinéma, l'élevage bovin et l'amélioration de la race chevaline ».

Il y a, chez Audiard, un côté anar de droite tendance Céline, on le savait depuis toujours. Les documents exhumés par Franck Lhomeau, et reproduits dans « Temps noir » le prouvent : il y a, chez Audiard, une part d'ombre. Qu'il ait pu écrire pour un journal qui demandait à ses lecteurs, en titre : « Faut-il exterminer les juifs ? », est odieux. Qu'il ait dépeint, dans ses livres, des résistants barbares, et des FFI qualifiés de « délégation d'escarpes »n'est pas à sa gloire. Qu'il se soit laissé gagner par l'antisémitisme de l'époque est simplement indigne. Qu'il ait manié son humour de titi parisien pour camoufler ses années de guerre est, en revanche, compréhensible… Curieuse vengeance du destin : le fils de Michel, Jacques Audiard, a signé, dix ans après la mort de son père en 1985, un beau film intitulé « Un héros très discret », sur un type qui maquille son passé sous l'Occupation. Très discret : c'est ça, c'est exactement ça.

par François Forestier"
2017-09-07 08:40:55,ramensupernova,"&gt; La race serait ainsi une sorte de proxy. Mais à mon avis ça ne tient pas debout et ça ne fait qu'obscurcir le sujet. 

Cette association entre niveau socio-culturelle et ethnie (*race* américaine) sur l'évolution différentielle des maladies est un sujet d'étude en soit. Prenons par exemple une des maladies les plus dangereuses chez les noirs américains, l'insuffisance rénale terminale. De nombreuses études ont identifiés un effet indépendant (et une interaction, il y a les 2) de la couleur de peau et  du niveau socioculturel sur cette maladie ([ici](https://www.ncbi.nlm.nih.gov/pmc/articles/PMC5469551/) et [ici](https://www.ncbi.nlm.nih.gov/pmc/articles/PMC3950900/) qui étaient mes 2 premiers résultats sur pubmed pour ""impact race esrd""). 

Il n'y a rien de ""sale"" à penser que l'évolution d'une maladie est partiellement liée à des facteurs génétiques et que certaines populations puissent partager un pool génétique similaire."
2017-08-20 19:11:49,SmartDarwin,"&gt; L’histoire : la traite et l’esclavage des noir.e.s, la ségrégation raciale instituée aux États-Unis, la colonisation française et d’autres pays européens ont établi de longue date une domination structurelle des blanc.he.s sur les noir.e.s appuyée notamment sur un racisme d’État inscrit dans les institutions, les lois, les pratiques ; il n’existe donc pas de symétrie entre les blanc.he.s et les noir.e.s, ne serait-ce que parce que cette mémoire est profondément inscrite dans les vies noires actuelles. Le point d’énonciation : l’insulte envers un.e blanc.he impliquant sa couleur de peau s’énonce à partir de l’oppression, de la minorisation, de l’invisibilisation, de la violence institutionnelle et relationnelle et non à partir du principe d’une l’infériorité raciale comme le racisme antinoir.e 

Pour l'instant, on ne m'a jamais traité de 'sale blanc' mais quand ça arrivera, je serai bien content de savoir que ce n'est pas parce que ma race est considérée comme inférieure, mais parce que la couleur de ma peau inspire l'oppression, la violence instutionnelle, l'exclavagisme. Me voilà tout regaillardi. La prochaine fois que je croise un allemand, si je le traite de 'sale Nazi', qu'il ne se formalise pas, c'est parce que son aryennité représente l'oppression de mes arrières grands parents. 
"
2017-06-29 20:09:16,Gnafron,Sale race ces chiens verts...
2017-06-23 19:42:00,eurodditor,"&gt; Il n’y a, selon lui, ni « violation manifestement délibérée d’une obligation de prudence ou de sécurité », ni « faute caractérisée exposant autrui à un risque d’une particulière gravité ».

Quel manque de décence. Il faut vraiment pas avoir de race pour écrire un truc pareil.

N'IMPORTE QUI d'autre qu'un gendarme ou un policier s'étant rendu responsable de la mort de quelqu'un pour avoir utilisé un objet dangereux aurait été condamné pour homicide involontaire au minimum, violences volontaires ayant entraîné la mort sans intention de la donner plus probablement. N'importe qui.

On a envoyé, par le passé, des gosses de **13 ans** en taule, accusés de telles violences volontaires ayant entraîné la mort, pour avoir joué avec des pavés et avoir involontairement touché et tué quelqu'un situé en contrebas. Mais un gendarme, adulte, formé, entraîné et muni d'une arme, il tue quelqu'un avec cette arme et une utilisation non-réglementaire, et il y a même pas un homicide involontaire ?

Comme d'habitude, la justice ne veut pas se fâcher avec les enquêteurs. Tout ça c'est une grande famille, on lave pas son linge sale en public, il y a un pacte de non-agression à conserver.

Mais le foutage de gueule est quand-même visible. Et c'est même pas tant une question de Rémi Fraisse et de Zadistes, que d'avoir la plus élémentaire décence que de traiter tous les citoyens de la même manière. Comment peut-on à ce point traiter différemment les dossiers selon qu'un même comportement vienne d'un citoyen lambda ou d'un pandore ? Une telle autorité devrait obliger à **plus** de prudence et d'exemplarité, certainement pas à être un passe-droit.

Le fait que ce soit systématiquement tout le contraire que l'on observe, par pure lâcheté de l'institution judiciaire, me débecte."
2017-06-22 07:47:15,zebilly,Beurre salé MasterRace
2017-06-18 21:34:14,Belphefran,"&gt; nique ta race sale batard vas crever dans d'atroces souffrances je te souhaite de vivre la pire vie qu'un humain puisse vivre sale enculé

Cet homme a le droit de vote."
2017-06-10 09:06:03,tepec,Ou peut-être même un r/sale_race_de_fumeurs ? 
2017-06-01 13:16:22,johnnyturquoise,"&gt;Ils sont très bien les quartiers gentrifiés à majorité blanche. Je ne m'y suis jamais faite traitée de sale pute, sale race, salope, pute de Française, wesh madmoizelle t'es bonne hé dis merci salope et autres joyeusetés

ben moi, si (je suis une meuf)"
2017-06-01 12:50:52,zoudoudou,"Ils sont très bien les quartiers gentrifiés à majorité blanche. Je ne m'y suis jamais faite traitée de sale pute, sale race, salope, pute de Française, wesh madmoizelle t'es bonne hé dis merci salope et autres joyeusetés qu'on m'a balancé dans les magnifiques quartiers de la diversité. "
2017-05-30 13:19:17,Hawne,"&gt; Qui dit lui-même que cette approche pose problème.

Déjà ce n'est pas ""sale"" parce qu'on a simplement mentionné le terme ""problème"", déjà faudrait-il en comprendre le sens au lieu de le sortir de son contexte comme s'il était une maladie honteuse à dénoncer.

Le ""problème"" que cela pose est simplement étymologique et sémantique, utiliser ""race"" renvoyant à un concept plus précis que la ""définition sociale"" à laquelle le terme racisé renvoie.

En fait on aurait pu écrire ""ostracisé"".

Ce qui répond à ta question : Qui décide ? La société, et en l'occurence la nôtre est majoritairement blanche et de manière souvent dominante voire avec des velléités d'exclusivité. 

Et je ne dis rien de nouveau, /u/olympe_d_G offre une définition pertinente que je ne fais que paraphraser. Mais ce n'est pas en pointant du doigt un faux ""problème"" et en évitant soigneusement d'admettre le concept de base (et en essayant de prouver qu'il ne veut rien dire en noyant le poisson) que tu allais pouvoir admettre cela."
2017-05-12 06:17:25,s1ck0phant,"Aujourd'hui, après 12 jours de période d'examen, le plus grand stress de ma vie, 1 malaise, avoir perdu 5 kilos, aujourd'hui à 18h30 heure française (je suis au UK), je serai libre. Ce soir je me met une sale race. "
2017-04-21 20:23:24,Haaveilla,"Osons causer c'est le cliché de la sale race gauchiste, pleine de beaux idéaux, qui passe ses journées à te chier dans la bouche et à te fissurer les boules en 3 actes sur le comment du pourquoi que Uber c'est le mal et qui ensuite te spamme ton facebook avec les photos de merde de leur dernier voyage à Amsterdam où ils ont pu passer 2 jours entre hippies dans un coffee shop pour oublier leur misérable vie. Le tout bien sûr rendu possible par Ryanair et ses billets à 10 balles aller-retour, merci l'Europe et merci l'ouverture des marchés !"
2017-04-21 10:03:19,Pinguinaux,"Tu votes Macron ? Le candidat des banques et des milliardaires, qui ne se font même plus chier à corrompre un politicien lambda avec X années d'ancienneté dans la mafia pour essayer de passer au pouvoir incognito, parcequ'ils ont bien compris que leur électorat de mouton n'est qu'un ramassis de débile superficiel avec la même capacité d'analyse qu'un australopithèque qui associe le feu à un acte divin.

Tu votes Melenchon ? Le mec que tout le monde suce parcequ'il est éloquent, mais perso quand je l'écoute je détecte un sale problème d'élocution qu'il partage avec les vieux post-avc qui annonce le vieux sénile qu'il va devenir. M'enfin, il sera toujours porté par la nouvelle génération qui s'est fait programmé politiquement par l'ancienne qui ont vu la chute du communisme et qui ont tellement fait un déni intellectuel que le système auquel y croyait était un ramassis immonde de merde qu'ils ont éduqué leurs morpions à voter comme eux pour relativiser leur vision politique qui à eu les pires effets sur l'espèce humaine dans toute son histoire.

Tu votes Fillon ? Regarde moi dans les yeux et ose me dire que quand il avait gagné la primaire tu disait pas que ""c'est le seul qui a pas de casserolle"" ? Et maintenant ça va l'orgueil ? Bien sûr que oui, maintenant c'est le programme qui compte pas le bonhomme. De toute façon ton cerveau est manifestement incapable de se remettre en question parcequ'à la première blessure intellectuel il sait que c'est le suicide et qu'il pourra pas accomplir sa mission de perpétrer tes gènes de con plus bornés qu'une mule.

Tu votes Le pen ? Ça te fait pas mal au cul qu'elle se fasse baisé par un algérien ? Ça te fait pas trop mal au cul que ton vote est était dirigé de A à Z par 3 barbus autour d'une kalashnikov dans une grotte sans eau ni électricité à l'autre bout du monde ? T'as l'impression d'être anti-système et libre, mais la vérité c'est que les clampins qui font la guerre dans le désert, qui appartiennent à une race que tu considères comme tout en bas de la pyramide, ont réussi à te dépouiller de ton esprit critique, de tes forces, de ta volonté, de tes engagements. Le grand remplacement il a commencé dans ton cerveau 

Tu votes pas ? Au moins tu va gagner 1h de temps libre par rapport à ceux qui s'obstinent à mettre un bulletin blanc même pas comptabilisé. Mais à part ça tu vaut pas mieux, même si t'es convaincu du contraire. Tu te crois supérieur à pas participer à cette enculerie générale, mais prépare ta vaseline les politiques une fois qu'ils sont au pouvoir ne feront pas la distinction entre ton cul et l'anus des autres moutons. Tu fais l'amalgame des ""tous pourris"" pour un pseudo intellectuel ça la fout mal. Je pense que tu fais sautés 2-3 petites barrières argumentative et tu te plonges corps et âmes chez méluche ou le pen, les extrêmes que t'as toujurs (cru) combattre."
2017-04-13 07:11:34,Myley_Virus,"ton patron est une sale race j'espère que tu lui as dit ! 
"
2017-04-09 11:55:56,LapinTade,"Avec le changement climatique il te faut arrêter de vivre, oublier toutes les joies du quotidien et t’auto-flagéler en pensant que tu fais partie d'une sale race d'animal qui pense qu'à elle même.

^^^/s"
