date,author,text
2022-12-12 08:03:02,MerberCrazyCats,"Pour la version du sud, il faut quelques ponctuations supplementaires:

Putain de sale race de merde, bordel, j'ai oublié mon putain de bigot dans ma putain de piaule de merde, bordel je reviens, boudu con"
2022-12-12 06:46:31,TomeKun,« Putain de sale race de merde j’ai oubliée mon bigot dans ma piaule je reviens. »
2022-12-09 21:19:22,PurplePachyderme,"La vie, cette sale race ! Vous avez quatre heures !"
2022-11-21 13:01:44,Yaski23,"Reforme de l'assemblée nationale : en deça de 80% de présents, l'indemnisation parlementaire sera réduite d'un quart.

Bande de sale race"
2022-11-15 21:06:30,knot93,"Ce qui voudrait dire que le RN est une race.

Une sale race, assurément."
2022-10-27 09:30:01,thyuchev,"Ouais, pareil.

La culture taurine du sud n'est pas monomaniaque. Il est possible d'aimer la course espagnole (corrida), la camarguaise, la landaise, ...

Et je l'ai déjà dit, mais si la réincarnation existe, je signerai 100 fois pour vivre la vie d'un toro de corrida plutôt que celle d'un bœuf d'une race à viande. Dans un cas je vis 4-5 ans peinard de chez peinard dans des hectares pour moi et mes potes tout seuls, je vois grand max 10 hommes dans toute ma vie (jusqu'au dernier jour où j'en vois bien plus). Oui, la fin est brutale, mais je peux si me bats bien échapper à la mort et être gracié. Et dans l'arène, si je suis brave, je serai plus applaudit que le matador. 5 ans de paradis, et une fin célébré par des gens qui m'aiment et me félicitent.

Dans l'autre cas, soit je meurt à quelques mois pour faire de la viande de veau, soit c'est au bout d'un an, parfois dans des conditions d'élevage dégueulasse, et la mort n'est guère moins sale, avec parfois une sacré souffrance."
2022-10-18 14:59:02,la_mine_de_plomb,"Après les mulots, les pinsons ou les crapauds, ils veulent aussi zigouiller les gamins ? Mais quelle sale race de bestioles, bordel."
2022-10-10 15:05:48,zam_aeternam,"Aucune source de ce que je lit des commentaires... Faudra vraiment on m explique la définition de ""mauvaise foi"" qui est interdit dans les règle de la modération. 

Encore une fois lâché comme sa c est de la propagande anti-russe, sa pourrait etre un vrai document mais la la seul source c est ""tkt, puis tout le monde sait que les russe sont des sale race donc sa passe"" /s 

A priori le problème c'est le gouvernement et les élites russe, si on commence a déshumanisé la population russe on devient des merdes et des victimes de propagande."
2022-09-27 19:31:02,Vrulth,Les clients. Cette sale race.
2022-09-19 16:55:37,sifflementdete,"Y a pas de bonne ou de mauvaise blagues, seulement de mauvaises situations.

N'importe quelle blague peut être utilisé pour du harcèlement, même si en général le plus sale du boulot se fait avec les stéréotypes les plus nuls.

Et pour le coup, la haine pour les roux est un très bon exemple de racisme. Aucune nationalité ou culture associés aux roues, on te reproche  tes gênes, ou pour les americano ta ""race""."
2022-09-17 21:13:32,TL_Exp,Il n'y a rien de euh... sympathique dans l'existence misérable des animaux que notre sale race torture et massacre pour le minuscule plaisir de ses papilles à la con.
2022-09-09 09:32:10,CroqueLucioles,"Copain, nous proposons un mauvais moment à passer en échange d'une chance de nous adapter et de survivre tandis que vous proposez une annihilation de la vie telle que nous la connaissons. Ne serait il pas temps que toi et tes semblables rangiez le porte-feuille? Et le pire c'est que votre sale race est généralement la plus encline à propager une idéologie nataliste, pronnant ainsi la souffrance et le malheur généralisé pour des êtres que vous dites aimer."
2022-08-10 19:17:08,etiennedeneuve,"En fait, y’a pas de secret, déjà tu prends de la viande de qualité (race à viande), maturée ou non. Puis tu chauffe ta poêle avec une huile neutre, tu saisi chaque côté sans y toucher pendant 3/4 min max puis, en parallèle, tu fais chauffer du beurre (salé merci les bretons, le beurre doux c’est degeu) puis tu arrose bien la viande. Et la dernière étape, tu laisse reposer 3/4 min"
2022-07-31 16:24:40,Samedi_Noir,"Les huîtres, cette sale race."
2022-07-28 14:56:56,DrunkenRenard,Vocabulaire d'éduc ça. Sale race.
2022-07-05 13:28:05,Leaz31,"&gt;  je n'en exige pas tant de notre sale race si narcissique.

Ah ouais tu fait partie de ces gens là.. Tu compte nous ôter ta présence narcissique bientôt j'espère ? Appliquer en premier lieu à toi même la vision haineuse que tu a des autres ! 

La fameuse ""sale race si narcissique"" qui est la seule à savoir vivre en symbiose avec de multiples espèce, au point d'avoir crée la domestication et d'avoir influencé l'évolution génétique d'autre espèce ! Notre espèce capable de tant d'empathie ! 

Je pense que c'est ça la différence fondamentale entre nous : moi j'aime l'Humain. Profondément. Oui on fait la guerre, les meurtres, le viol et on est capable d'être des grosses sous-merde. Mais quand t'arrête de n'écouter que tes biais de confirmation et que tu te met à écouter les autres, à essayer de les comprendre, à voir vraiment.. Là tu te rend compte qu'en fait l'écrasante majorité des humains sont vertueux et qu'ils cherchent le bien autour d'eux même. 

Mais bon il faut une certaine maturité pour comprendre tout ça, je te l'accorde ! Quand j'étais ado je pensais aussi comme toi que l'humain il EsT TroP MéchAnt.. Puis bon je me suis mis à considérer aussi tout ce que je consideré comme normal jusque là, et en fait bah non, notre espèce est vraiment cool. Il y a toujours des gens prêt à aider, toujours des bonnes âmes quand tu est prêt à recevoir leur aide. 

Et surtout, comparé au règne animal qui est cruel, froid et sans pitié.. vraiment on est beaucoup plus.. humain.


&gt;Mais oui, masculiniste : sinon vous n'auriez pas automatiquement chié la pendule #notallmen face à une remarque parfaitement banale.

Tu comprends vraiment pas c'est fou ! 

Tu aurais dis la même chose dans les années 50 face a un ""boah de toutes façon, la place des femmes c'est au fourneau"" qui était alors une remarque parfaitement banale ? 

C'est par ce genre de ""remarque parfaitement banale"" que s'entretiens le sexisme, le racisme et la haine des autres. Y a personne qui se défini ouvertement comme sexiste ou raciste hein.. 

Là quand tu place ""banalement"" que bah c'est clairement les Hommes qui sont de dangereux prédateurs.. Pfiou oui bon à compris quoi. Laisse nous avoir des personnalités et être des individus s'il te plait ? Il y a des hommes violents, il y a des femmes violentes, il y a des hommes non-violents et des femmes non-violentes. Stop aux généralisations.

Et le pire dans tout ça c'est que je pense que tu t'imagine être ""pro-libération"" par ton discours.. alors que tu entretiens encore et toujours un sexisme d'un autre âge."
2022-07-05 13:15:44,TL_Exp,"Impossible d'être écolo si on n'est pas vegan (mais faut être informé un minimum sur l'impact de l'élevage industriel).

Je dirais bien que c'est impossible de l'être vraiment aussi en l'absence de clairvoyance concernant le mal que l'humain fait et se fait en permanence avec ses sales habitudes alimentaires/économiques etc., mais je n'en exige pas tant de notre sale race si narcissique.

Mais oui, masculiniste : sinon vous n'auriez pas automatiquement chié la pendule #notallmen face à une remarque parfaitement banale."
2022-06-15 06:05:02,marti-kush,La vie.... CETTE SALE RACE !!!!
2022-05-25 08:43:55,manu_justice,"Honnêtement, j'en viens à me dire qu'éradiquer cette sale race - qui est potentiellement la seule race ""intelligente"" de l'univers - le plus vite possible serait ce qui pourrait arriver de mieux."
2022-05-16 09:02:02,DepartureDeep,"&gt; C'est bien pour ça qu'il est a minima nécessaire de se demander qui est le ""nous"" et qui est le ""eux"".

Nous : les blancs, eux : le reste. Nous sommes menacés d'eradication. A partir du moment tu pretends être menacé d'eradication, tous les moyens sont bons. En fait dans l'idée meme d'un remplacement y'a en germe un putschisme anti republicain, puisque, complotisme ou demographie, ce sont des representations de forces qui depassent la sphere politique et appellent donc a une reponse en dehors du cadre politique, genre, les proud boys aux etats unis ou la tuerie nazie recente. 

&gt; Non.

J'ai bien peur que si. A partir meme du moment ou ta prémice est une absurdité essentialisante qui voudrait que les blancs sont un groupe réel fondé dans la biologie, et pas une pure construction, tu crees d'autres catégories, et ces catégories, etrangement sont perçues comme des menaces ou des groupes a dominer. Je ne connais pas de racisme ""indifférent"" où il y aurait deux races qui se regarderaient l'une en face de l'autre (si tu en connais, eclaire moi). Dès lors que t'acceptes le concept de race humaine (entendu au sens moderne de realité biologique, pas l'usage désuet qui signifiait ""peuple""),  tu te places dans un cadre antagoniste, c'est vrai en irlande, c'est vrai au rwanda, c'est vrai pour l'Algérie française, etc.

&gt; Prouve le. Je le trouve au contraire très explicite là où la loi ne pénalise pas les opinions racistes. Evidemment qu'il va être moins explicite quand les discours explicites sont interdits ! Raison pour laquelle il faut supprimer les délits d'opinions.

""Parti national socialiste des travailleurs allemands"". C'est encore des questions qui ont leur réponses dans l'histoire. Le fascisme prétend toujours jouer les règles du jeu, essaye toujours d'avoir une figure acceptable, jusqu'à ce qu'ils pètent un plomb et font une petite nuit de cristal, ou bien massacre des croyants dans une mosquée. Donc oui, evidemment, en effet ils vont essayer d'infecter la société en se pretendant en accord avec ses regles, juridiques, scientifiques avant de la ronger de l'interieur. 

Au passage je n'ai jamais vu une opinion minoritaire autre que de la haine raciale être condamnée pour ce que tu appelles une opinion, c'est vrai pour bouhafs, comme pour faurisson. Si tu en connais, eclaire moi. 

Le racisme s'est toujours basé sur de la pseudo science. C'est pas différent avec le GR. C'est dans le titre, remplacement. C'est a dire, qu'on enleve quelque chose pour mettre autre chose a la place - il y a cette idée de menace, donc d'antagonisme. Ils ne parlent pas, de transition démographique, ils ne font pas de lecture en termes d'objets sociaux reels mais de blocs raciaux, a savoir une pure fantaisie. Les italiens n'etaient pas blancs a une certaine epoque, du meme que les irlandais ou les grecs. En tant que descendant d'Afrique du Nord, en France je suis un Arabe, aux Etats unis je suis un caucasien. La blancheur, c'est appliqué au petit bonheur la chance. C'est comme si je te disais, bon en ce moment je pense que les axiomes fondamentaux des maths c'est mes pets, demain peut-être que ca sera la forme des nuages. 

&gt; ça a toujours été un problème démographique à la base, les gens qui veulent se cacher la réalité croient que c'est un problème économique ou social

Mais est-ce meme un problème ? A partir du moment ou, encore une fois tu pars de la premice que les blancs forment une grande famille ayant des intérêts de race, en fait tu peux faire une thèse, réinventer l'anthropologie de a a z, les bases de ton raisonnement sont anti scientifiques. C'est comme si on etudiait le climat du point de vue d'un creationiste.


Donc oui, ca peut sembler un peu degueulasse, de punir ceux qui deblaterent leur haine. Moi je vois ça comme l'hygiène (tu me permets celle là) intellectuelle du pays. 4chan, montre très bien que la liberté d'expression absolue mène a une domination de discours completement lunaires. Ils revendiquent leur droit de dire que le complot juif a cree une false flag operation, bon, je pense qu'on peut s'en dispenser - ils sont là pour corroder la société, ce sont des militant factieux qui veulent s'en prendre à ta liberté, meme si, je comprends que la banalisation des discours suprematistes blancs pousse a leur accorder du credit.

Quand ton enfant dit sciemment à un gamin ""sale noir"" tu l'eduques. Je vois pas en quoi ce serait différent pour des grandes personnes incapables de faire le moindre raisonnement ! Ca serait comme dire, j'autorise la connerie voulue à grande échelle. 

Je comprends tes arguments de principe, cela dit, je ne pense pas que tu puisses nier que le néant intellectuel est constitutif de toute pensée raciste, et qu'à partir de là on perd des ressources eminemment precieuses, du temps, de l'espace dans la discussion publique, a débattre avec eux."
2022-05-10 23:10:12,Irkam,"&gt; Incroyable les voitures plus petites que les voitures plus grosses polluent moins !

Alors pourquoi on prend pas des voitures plus petites ? On est devenus trop débiles pour ça ?

&gt; Mais que fait cette sale race incapable de se payer 3 véhicules écologiques pour ses différents type de voyage ?

Ah ouais on est devenus incapables d'utiliser un coffre de toit et on doit avoir un camtar pour toutes les occasions."
2022-05-10 18:47:54,hurricanebones,Incroyable les voitures plus petites que les voitures plus grosses polluent moins ! Mais que fait cette sale race incapable de se payer 3 véhicules écologiques pour ses différents type de voyage ?
2022-04-28 08:27:48,Shukruth,"Ca j'en doute fortement. 

Dans le cas de Bouhafs, comme le cas de Zemmour, les condamnations pour racisme qui peuvent donner lieu à une interprétation (genre pas les ""sale négro"" / ""sale arabe"") sont jugées en fonction du contexte de la phrase et du discours général de la personne incriminée. Dans le cas de Zemmour les juges ont conclu que ses discours xénophobes donnaient bien un sens racial à ""mineur isolé"" malgré ce qu'il disait pour sa défense, et c'est pareil pour Bouhafs qui par exemple traite de ""collabeur"" tous les arabes qu'il considère comme des traitres à leur race.

Tout le contraire de Jadot qui n'a jamais de discours antisémites hormis cette fameuse phrase maladroite"
2022-04-08 14:52:43,Mirisme,"La discrimination est non spécifique. On a inventé le mot racisation pour justement parler spécifiquement du processus de discrimination par la race qui joue sur des processus particuliers et différents de par exemple la discrimination à l'handicap.

Oui, c'est la dérive classique de ce genre de concept, ils deviennent des vecteurs d'identités alors qu'ils n'ont pas vocation à l'être. Il existe un problème similaire en psychopathologie où les gens s'identifient à leur troubles ""je suis un dépressif"" et limitent leur capacité d'action en faisant ça. On parle de réduction au diagnostic, pour autant l'abandon des diagnostic est rarement préconisée alors que c'est une problématique importante et reconnue.

&gt;Si on insulte quelqu’un de connard marseillais, de sale belge, c’est aussi se faire raciser ? On voit vite le problème de ce genre de classement.

Non, c'est de la discrimination nationaliste, géographique ou ethnique (selon le cas de figure) qui n'a pas de terme consacré à ma connaissance."
2022-04-01 02:43:49,lenva0321,"&gt; Immobiliser c'est pas la même chose que tuer...

Sauf que si. T'as 4 mecs en face de toi t'attaquant chez toi de nuit et un gosse à protéger dans la piece d'a coté.

Ta seule solution c'est un coup qui va les mettre hors de combat dans 100% des cas. T'as pas (PAS) l'option d'échouer parce que sinon toi ou ton proche trinquent systématiquement. Donc tu fait quoi ? Bha tu frappe, DUR. Et ca peut (va) tuer. Parce que t'as pas de moyen de savoir, et peut pas offrir de temps libre aux attaquants.

Dans la vie réelle, si t'as pas de tazer, t'as souvent pas d'option ""non mortelle"" dans la seconde à coup sur. Tu préfère crever ou voir un proche crever parce que faut pas se défendre trop dur ? C'est pas ca la réalité.

Surtout que même après une balle, parfois les gens se relevent et continuent quelques secondes/minutes, donc tu dois viser à coup sur souvent. Le gars avec une balle dans la jambe, il te tuera dans la minute après dès qu'il réalisera ce qu'il s'est passé (tjours à 14min de la police hein) en gueulant des trucs charmant genre ""tu va voir jvais te niquer ta race sale fils de pute/putaing/.... tu va voir jvais tuer et t'décapiter et"". Et s'il à un flingue sur lui (probablement aussi légalement qu'attaquer de nuit) il va le dégainer et viser ta tête dans le délais qu'il aura. C'est ca un bandit/cambrioleur hein, il est pas la pour discuter autour d'une tasse de café.

Un coup insuffisant, c'est un bandit et tout ses potes qui sont maintenant au courant que t'es là, les à vu, et leur à laissé quelques secondes pour se reprendre et t'attaquer sans rater ni récriminations eux.

Surtout, qu'après celui ci soit tombé, t'en à encore potentiellement TROIS AUTRES à arrêter dans les 3 secondes à venir tout aussi violement (avec le même genre d'état d'esprit de te massacrer; surtout après avoir vu un premier tomber), ou ils vont aussi sans doute s'en prendre à toi (et toi, t'as qu'une santé là). Tu n'as aucune idée de leur réaction sous adrénaline dans les secondes à venir sachant déjà qu'ils n'ont aucun regard pour les conventions sociales.

4 bandits qui petent ta vitre de nuit, c'est toi ou eux (parce que eux vont pas appeler les flics pour s'auto reporter en plus, ils vont te tuer, tuer tes proches, vider ton logement puis disparaitre à l'étranger dans la nuit, sans que personne ne sache à temps qui c'est). 

Donc oui en tuer un en défense est hélas approprié. 

\*10min musique de hotline policiere le temps que quelqu'un décroche\* ""bonjour et bienvenue au 17, ne quitez pas un policier va prendre votre appel immédiatement dès que possible... bonjour, et bienvenue...""

^ ca c'est après coup pour signaler l'incident à la police, quand t'as le temps de dégainer un téléphone une fois en sécurité.

La réalité de la plupart du pays c'est pas le président qui gueule ""police !"" et à 2 GIGN/forces spé/... qui débarquent dans la pièce dans les 3 secondes et engagent automatiquement à vue d'oeil pour lui.

&gt; Si quelqu'un est dans la rue et t'insulte, tu sais pas s'il a un couteau non plus, ça te donne pas le droit de le tuer.

Dans la rue tu passe ton chemin, à domicile t'as aucune option.

&gt; Ça s'appelle un meurtre dans ce cas

Ben non, et tu déforme en toute connaissance, ca s'appel la légitime défense.

&gt; On ne se fait pas justice soi même dans un pays civilisé.

Dans ton ""pays civilisé"" imaginaire t'as pas 4 bandits mafieux qui pètent ta vitre t'attaquer la nuit chez toi. Et ils vont pas partir gentiment parce que tu leur demande, ils vont sortir un couteau et te tuer pour supprimer les témoins de leur premier crime et gagner 3j pour s'enfuir le temps que la police découvre ce qu'il s'est passé.

La réalité idéale ne colle pas aux faits, donc faut faire avec.

Cet agriculteur était entièrement en légitime défense de tirer et tuer son attaquant à domicile. Surtout avec un gosse de 3 ans à protéger, en sous nombre, par surprise.

Le mec qui hésite pas à attaquer de nuit en bande, il hésitera pas à te tuer anonymement avec son arme non déclarée au passage pour supprimer un témoin et gagner du temps pour fuir la police. Ca sera juste une charge de plus pour lui.

Ca me fait marrer ces gens qui prétendent que se faire attaquer par surprise comme ca par un groupe de bandits t'as le temps de faire dans la dentelle. Ben non.

Les gens civilisés c'est pas des bandes de bandits serbes cagoulés qui pètent la vitre la nuit et rentrent par effraction."
2022-03-31 03:52:22,idee_fx2,"Disséquée après son retour... Des fois, l'humanité est vraiment une sale race."
2022-03-29 09:37:35,centrafrugal,"&gt; l’immigration. « Les racisés sont une sale race »

On est supposé assimiler immigrés et racisés maintenant?"
