date,author,text
2019-06-20 16:14:07,shadowSpoupout,"En quoi une piqûre d'abeille devrait être plus douloureuse qu'une piqûre de guêpe ?

Au passage, les guêpes c'est vraiment une sale race vicieuse, ça pique pour un oui pour un non, parce que tu les as regardées de travers, etc, alors qu'une abeille faut la pousser à croire que tu vas la tuer de toute façon ou que tu menaces sa ruche pour qu'elle te pique."
2019-06-18 14:16:07,Mirisme,"&gt; Le truc c'est que tu met des pommes et des poires dans ton exemple. La cooperation entre entreprise peut-être bonne pour l'entreprise (oligarchie), mais le truc c'est qu'on tente de maximiser c'est pas l'entreprise ou ses benefices, mais l'efficacité de production d'un produit, et ça y a eu pas mal de preuve empirique quand à l'efficacité de la concurrence pour ça.

Ouais enfin toi tu peux tenter de maximiser ça, qu'est ce qui garanti que le système ancap maximise ça? C'est là tout mon problème. Effectivement la concurrence des acteurs et leur libre association permet à la solution la plus efficace d'émerger mais c'est partir du principe que le seul moyen de gagner dans le système est de fournir le meilleur produit possible. Qu'est ce qui garanti que l'objectif qui va être mis en avant est bien l'efficacité de production du produit et pas l'entreprise, ses bénéfices, ou le contrôle social des roux (nan parce que c'est une sale race les roux, moi j'ai une entreprise de sécurité, on le dit pas trop mais on surveille les roux et si on peut on leur casse les jambes).

Mon problème n'a jamais été l'efficacité de la concurrence pour produire des produits mais l'existence même des conditions qui permettent à cette concurrence de produire efficacement. Rien de garanti des conditions de concurrence dans une société ancap.

Oui ils sont plus présent parce qu'ils sont autoritaires mais ils ne font pas forcément grand chose. Prenons un parent autoritaire, il est très présent, il surveille, met des tartes dans la tronche mais se limite à ça. Prenons un parent avec un style démocratique, il va demander beaucoup à l'enfant, le punir en cas d'infraction mais va aussi négocier avec lui les règles de vie, il va aussi lui apporter du soutien en cas de besoin. Je considère que le second parent en faisant plus de chose a une approche plus développée que celle du parent autoritaire. C'est sensiblement pareil pour la Chine et d'autant plus pour la Corée du Nord. Du coup je parle de développé dans le sens traditionnel et géographique du terme, avec une structure plus élaborée, complexe et soutenant plus de chose.

Ouais enfin t'a aussi plein de révolutions échouées et de toute façon ça ne change rien à mon propos, les révolutions c'est le dernier recours en terme de changement social et les révolutions qui ont eu du succès l'ont eu dans des systèmes ayant perdu quasi toute légitimité et engendrant déjà des souffrances considérables pour en plus avoir des résultats plus ou moins probants. Et du coup ça ne change rien au fait qu'avoir plus de fric change tout si tu n'as pas une portion suffisante prête à se révolter. C'est le principe du pouvoir et de sa légitimité. Tu n'as pas besoin d'être à 100% légitime pour te maintenir au pouvoir et du coup tu peux faire plein de merde dans l'espace restant. Je ne vois pas en quoi le système ancap garanti que l'usage du pouvoir sera toujours légitime, le truc de la concurrence pure et parfaite ne tient pas pour moi comme je l'ai dit plus haut.

Ouais enfin, tout le monde n'a pas envie d'aller faire milice et le travail de police est légérement plus élaboré que de se balader avec un flingue, surtout dans une société où supposément le principe de non-aggression fait loi. Tu peux pas tout régler avec des tatanes dans la gueule si tu veux avoir une quelconque légitimité, contrairement aux états qui ont plus de latitude à ce niveau. Enfin si tu peux si la concurrence est très peu légitime, c'est à dire si elle fait grave de la merde. En fait, j'ai du mal à faire la différence entre ancap et néoféodalisme corporatiste."
2019-06-17 12:58:54,ItsACaragor,"(Voix d’Alain Chabat) Est ce que vous avez déjà vu...

... la pire sale race de la terre ?

(Video) 

... maintenant, oui !"
2019-06-06 17:34:32,pkip,"Ça m’arrivait avant la nouvelle boxtv (la dernière je crois bien) 

Soit : tu tapotes dessus, ou claque la un peu (déconseillé mais ça a donné des résultats)

Soit : les piles, échange les entre elles, change les, etc

Soit : en fait c’est ta box tv qui lag cette sale race de pu!e !! 

Appelle orange et fait échanger la boxtv et la télécommande, parfois ils peuvent changer uniquement la télécommande et c’est bien aussi

J’ai du changer de boxtv/télécommande environ 1 fois par an... (a noter que je tape dessus uniquement après qu’elle commence à bugger et que j’ai déjà essayer la patience)

Voilà mon expérience ;)"
2019-06-05 12:16:25,Kiwwhi,"Chronopost c'est de la sale race, ils m'ont fait le coup plusieurs fois. Je choisis toujours la livraison en bureau de poste maintenant."
2019-05-30 18:58:21,_Handsome_Jack,Tu as de drôles d'amis pour un lutin rose. Je vais me méfier de ta sale race maintenant.
2019-05-18 12:25:43,Orthopedux,"Mais ferme ta gueule sale fils de pute. Descend que je te nique ta race, enculé ! 




De rien."
2019-05-12 22:07:03,Cerwyn_rav,"J'ai passé mon adolescence (collège et un peu de lycée) dans le 93 (La Courneuve) en banlieue parisienne. En plus du racisme anti-blanc, y a le racisme généralisé du non musulman. 

""Tu fais pas le ramadan? T'es une meuf en plus? T'es sale et t'es une pute et c'est comme ça et on t'emmerde toi et ta famille et on va te cramer toute ta race jusqu'à la fin du temps."" J'exagère à peine. :)"
2019-05-04 15:30:59,Narvarth,"Je sais pas si t'es sérieux. Gros troll non ? Allez je vais quand même répondre.

&amp;#x200B;

J'ai fait 700 km pour venir dans cette ville. Je connaissais pas bien ce quartier même si j'avais bien vu que c'était  pas du tout le quartier de blanc csp++. Ca ne me posait pas de problème. Tu te dis que tu vas t'intégrer en participant aux associations, genre prof bénévole  pour les plus jeunes.

Et puis le quotidien te rattrape. T'en arrives à stresser à l'idée de rentrer chez toi le soir. Et à un moment tu lâches l'affaire. Des anecdotes sur ce quartier, j'en 1000 (en 18 mois...), sans parler de celui où y'a mon boulot (également un quartier en difficulté, comme les 3/4 de la ville).

J'ai été  menacé de mort à cause d'un accrochage en voiture. Le gars parlait pas français. 1er réflexe, il sort son mobile et appelle du renfort.  Je me retrouve seul au milieu d'une bande d'enragés qui me bousculent physiquement :  ""*on va te retrouver, on a ta plaque, on va te niquer sale race, toi ta chienne de femme et tes  batards""* (bof, j'ai même pas de gosses...). Les mecs ont ensuite pris la fuite quand la foule s'est attroupée.

(le gars était 100% en tort).  La police n'a rien voulu faire, ni prendre une plainte, ni même une main courante. Genre c'est normal dans ce quartier, ""*on va pas en faire des classeurs*"" (ils m'ont même poussé dehors parce que j'insistais !).   Les mecs habitent dans le quartier. Tu crois que ça donne envie d'y revenir le soir (en bus, ta voiture est épave)? Quel est le message envoyé par la police selon toi ?

Mes voisins du dessus dealaient dans la  cage d'escalier. Déjà c'est pas génial.  Je leur avais prêtés une caisse à outils. Je l'ai jamais revue : en plus aucun respect.  Ils foutaient la musique à fond tous les soirs.   Et c'était moi l'emmerdeur à qui ils voulaient casser la gueule parce que je voulais *juste dormir* à 3h du mat en semaine.

T'imagines pas physiquement ce que c'est de pas dormir pendant des semaines. Ca finit par empiéter sur toute ta  vie, le boulot etc. Une nuit j'ai pété un câble et j'étais prêt à leur rentrer dans le lard. Y'a un plus modéré que les autres qui s'est interposé sur le mode ""*faut nous excuser, on est des oisifs...*"".

Les gars ont fini par claquer la porte en me faisant des doigts.

&amp;#x200B;

Le voisin du dessous battait sa femme, qui hurlait tous les soirs. Celui d'en face dansait en slip sur son balcon (même en hiver), et  foutait sa musique tellement fort que la 1e fois j'ai cru  que c'était dans mon bâtiment.

Lui, il avait clairement des problèmes psy. La police vient. La musique s'arrête 30 minutes. La police part. La musique recommence.

On m'a défoncé ma boite pour piquer des  chéquiers (comment savaient ils que c'était des chéquiers ?).

Le voisin du dernier étage (aussi blanc que moi) s'est fait littéralement vider son appart en pleine journée.

&amp;#x200B;

Je me suis fait voler 2 VTT, (gros) cadena coupé la 1e fois, volé dans un bâtiment fermé à clé la 2e. Mais bon sang, pourquoi voler des trucs dans un quartier de prolo ?

Un week end, je mets mon vtt dans le coffre de la bagnole pour aller faire un tour en forêt. Je pose la roue avant 30s sur le mur adjacent le temps de monter fermer ma porte d'appart. Je redescends, plus de roue. 30s. Non seulement les mecs guettent, mais en plus une roue de VTT, si c'est pas pour me faire chier ?

&amp;#x200B;

Je rentre chez moi à vélo, je mets un petit coup de sonnette parce que des ""jeunes"" sont sur la piste cyclable. Au moment où je passe, y'en a un qui crache dans ma direction. Mais putain, je t'ai fait quoi ? Je suis tranquille, j'ai jamais agressé personne...

&amp;#x200B;

Je pourrais écrire un bouquin.

&amp;#x200B;

Mais bref, je suis pas là pour gérer toute la misère du monde ni lutter pour les causes perdues.

J'ai autre chose à faire."
2019-05-03 13:10:12,xAlecto,Je suis une sale race :/
2019-05-03 12:47:22,petermacaloai,"Je pense que je vais être un peu extrémiste dans mes propos mais les gens qui utilisent de petits coupe-ongles pour se couper les ongles (pas les p'tites peaux) ont vraiment une sale race. 

Voilà c'est dit."
2019-04-30 08:09:52,maxibestofbigmac,"Il n'est que question de logique. La voici:  
  
- Le voile représente son attachement à l'islam. Ca veut dir que tu adhères à cette idéologie religieuse.  
  
- Cette idéologie religieuse considère les non croyants comme des kouffirs, des personnes inférieures aux musulmans et autres religieux.  
  
- Se balader en voile signifie: ""J'adhère aux valeurs de l'Islam qui font de toi un être inférieur selon cette idéologie"". (Et plein d'autres trucs comme ""si t'es gays tu mérite la mort"", ""la parole d'une femme vaut moins que celle d'un homme"", ""mon modèle est un pédophile""...)  
  
C'est comme si je porte un costume SS dans la rue, qu'un juif me confronte en me disant que ça le choque et que je lui rétorque ""Attend, est-ce que je t'ai traité de sale race ? Non ? Alors ne m'embête pas. Je porte cet uniforme si je veux et si tu t'en plaint c'est que tu me discrimine""."
2019-04-29 10:03:30,yurt-dweller,"Avec ma copine on est repassé au capotes après la naissance de notre 2ème enfant ; elle ne veut plus de la pilule à cause du dérèglement hormonal, ne veut pas du stérilet à cause ru risque d'augmenter ces règles déjà très abondantes... je respecte tout ça. Donc bon, capotes.

Alors déjà le truc des capotes, c'est qu'on ne sent rien, sauf en utilisant le haut de gamme (SKYN master race), et encore. Je sais pas si c'est pareil pour tout le monde, moi perso c'est vraiment pas la même chose. 

Donc on a pris la sale habitude de commencer sans capote, et de la mettre en cours de route. 

Déjà c'est pas top parce que ça la stresse un peu, et moi aussi, et que ça peut vite faire retomber l'ambiance quand tu t'interromps pour farfouiller dans le tiroir à côté du lit.

Mais alors samedi soir, on est passé à deux doigts de la cata.  J'avais l'impression que ça pourrait durer des heures, je lui dis, elle se lâche un peu, et tout d'un coup  je me rends compte que non, ça va pas faire,je lui ai dit ""attend attend, retire toi!"" (elle était au-dessus), j'ai lâché la purée littéralement 2 secondes après qu'elle se soit écarté.

Donc on a décidé de se calmer sérieusement, de mettre une capote dès le début, et tant pis pour les sensations...

Bref, vivement la pilule masculine, bordel de merde."
2019-04-23 10:20:47,Bizzik_,"&gt; C'est plus le côté ""pour t'aimer, il faut que tu aimes toi aussi mon chien"" qui m'inquiète.

Oh tiens, moi aussi elle avait ca. Et vas y que je vais développer un peu plus.

A la base moi j'ai rien contre les animaux de compagnies, ni les chiens en particulier. Même si je suis plus chat, parce que j'en ai toujours eu étant gamin, et que c'est globalement plus facile à vivre (sauf quand t'es allergique).

Mais j'ai eu une mauvaise expérience vers 12/13 ans qui m'a filé une peur irrationnelle, surtout envers les ""gros"" chiens, ceux qui ont la capacité de vraiment te faire mal si ils veulents (caniche ? balek). Une peur du genre à changer de trottoir en ville si je dois passer à côté d'un berger allemand.

Et donc je rencontre mon ex, qui a un [Airedale Terrier](https://www.google.fr/search?q=Airedale+Terrier&amp;source=lnms&amp;tbm=isch&amp;sa=X&amp;ved=0ahUKEwiSr46l_OXhAhUGlxQKHV1ADOIQ_AUIDigB&amp;biw=1880&amp;bih=977). Un beau bestiau en plus, il fait une 30aine de kilos.

Et donc elle m'a dit le fameux ""si tu veux être avec moi, il va falloir que tu acceptes et aime le chien"". Soit, je vais faire un effort, parce qu'en plus de l'aimer, ma peur est juste infondée donc faut que je travaille dessus.

Ca pas été facile au début, mais heureusement c'est une crème ce chien. C'est une race très intelligente, qui apprend à la vitesse de la lumière et est super fidèle si il te respecte. Il est juste très heureux de voir les gens, assez massif et gauche en plus de ca. C'est pas une race dite de chasse, mais il a un flair excellent et il adorait chasser les oiseaux et les chats du quartier. Donc le sortir seul les premières fois (je me suis forcé à initier) c'est un challenge.

Une fois la période d'apprentissage passé, il fallait moi aussi que je devienne ""maitre"" du chien. Normalement il faut être très ferme et cohérent avec ces chiens la, sinon ils comprennent pas et deviennent très vite têtu. Donc c'était à moi de me montrer très ""sévère"" et ferme.

Sauf que de son côté, elle avait ce double langage de fermeté/laxisme. C'est à dire que chez moi, je ne voulais pas du chien sur/dans le lit : pour des raisons ""d'hygiène"" (c'est pas que le chien est sale, quoi qu'un peu mais pas tant que ca, mais plus pour les poils qu'il sème partout) et aussi parce que le lit c'est le lieu de repos des maitres etc... et donc si tu dois marquer ton territoire et ta hiérarchie, c'est une étape importante.

Sauf que ma copine n'avait de cesse d'enfreindre cette règle d'or, en m'accusant de ne pas assez aimer son chien. Et quand je lui répétait qu'il fallait assoir notre domination, elle comprenait. Puis recommençait le lendemain, quand j'étais au boulot. Vive mon autorité.

Au final c'est pas ca qui a pesé dans la balance de notre séparation, mais je pense qu'à terme ca aurait pu."
2019-04-20 07:57:40,agumonkey,"Vu qu'on chie un peu sur les pratiques enculatoires de SFR, quand j'ai ete prendre la fibre, j'ai demande au vendeur [0] le truc le moins cher, il me dit 20e bla bla bla.. Orange c'est 23 mais faut remplir un formulaire a la con pour ca sinon c'est 28 donc je dis ok.

Une fois chez moi je tente de voir l'activation de la ligne et en gros sur le site: ""Fibre SFR: 15e/mois"" .. Etrangement, une rage profonde m'a envahi. Le mec avait rajoute l'option sfr cine mes orchidees sans me demander mon avis.

Vraiment les vendeurs quelle sale race (sauf les bons vendeurs, mais y'a les bons vendeurs et les mauvais vendeurs)"
2019-04-17 10:44:50,Bizzik_,"&gt; Chienne de vie.

La vie cette sale race !

Vous avez 4h."
2019-04-13 06:02:30,-Malky-,"&gt;C'est la même sale race qui utilise digital au lieu de numérique

Mouais, en même temps y'a moins de trucs amusants à faire avec 'numérique', exemple : la [journée de la femme digitale](https://fr.wikipedia.org/wiki/Journ%C3%A9e_de_la_femme_digitale)"
2019-04-08 08:31:41,ScalSaver,"En gros, t'arrive même pas à en écrire un nouveau à chaque fois ?

RENDS MOI MON BÉBÉ, SALE RACE D’INCOMPÉTENT."
2019-04-07 15:17:04,[deleted],"Ca reste une insulte raciale. Le fond de l insulte est la race. Si je dis ""noir debile"", ça veut pas dire ""sale noir"" mais la haine raciale est présente.

Du coup ton ""well akchually"" sent vraiment l apologie."
2019-03-31 15:29:36,DrFolAmour007,"Par exemple, l'esclavagisme des noirs aux amériques.

Les colonies françaises n'étaient pas rentables (tout comme les colonies portuguaises et anglaises et espagnoles...), c'était pour les rois un moyen de jouer à ""qui a la plus grosse"", pour parler crûment. Les colonies ont surtout permis aux bourgeois de s'enrichir. Le peuple européen avait aboli l'esclavagisme avec la chute de l'empire romain (les invasions barbares étaient en fait un progrès social énorme pour l'Europe), et les cités moyen-âgeuses étaient un modèle de coopération et de liberté (par la présence des guildes et des villes libres).

Bref, le peuple européen n'a pas profité de la colonisation, au contraire, afin de soutenir la colonisation il a eu à payer énormément de taxes. Les produits venant des colonies étaient aussi à destination quasi exclusive de la bourgeoisie parisienne (épices, fruits exotiques, alcools...). Donc, de riches propriétaires/mercenaires, ont fait fortune aux amériques, avec l'aide de la bourgeoisie et aux dépends du peuple, et, surtout, vu que ce sont des gens sans scrupules, ont utilisé des esclaves et les ont mal-traités (suffit de voir les récits de Saint-Domingue), pratique abolie en Europe depuis plusieurs siècles! Et les français des colonies qui se battaient pour les droits des noirs et la fin de l'esclavagisme étaient pas vraiment aimé et soutenu par le gouvernement. (voir l'histoire de Pierre Savorgnan de Brazza)  
Quand aux esclavagistes, et bien il y en avait des noirs aussi! Déjà en Afrique, apparemment 1/4 des Africains étaient esclaves d'autres tribus africaines. Aux amériques il y a eu aussi beaucoup d'esclavagistes noirs, et ils traitaient pas leurs esclaves beaucoup mieux que les esclavagistes blancs...

Tout ça pour dire que l'esclavagisme, que l'on raconte souvent comme Blancs esclavagistes, Noirs esclaves, ben non, c'est pas vraiment un problème de race. Des noirs esclavagistes y en a eu, sans parler des Arabes et Asiatiques. Et des Blancs esclaves y en a aussi eu beaucoup (plus de 2 millions de blancs ont fini esclaves dans l'empire Ottoman).

Non, l'esclavagisme est un problème de classe! Encore une fois une classe bourgeoise qui exploite le peuple - dans le cas de la France, exploite le peuple blanc par l'impôt et le travail non rémunéré à sa juste valeur, et exploite le peuple noir par le travail forcé sous la torture, l'esclavagisme bien sale comme à Saint-Domingue. Il faut arrêter de racialiser des problèmes de  classes sociales!

&amp;#x200B;"
2019-03-14 10:43:19,DecadoW,"""Espèce de sale sale""

""sous race"""
2019-03-13 08:36:26,TontonSergio,"Quand je vois des pubs comme ça, je me demande toujours comment sont de nos jours les gens qui posaient à l’époque. Est-ce qu’on arriverait à les reconnaître ? Ou bien le temps n’est-il qu’une sale race qui abime tout (sauf le vin) ?"
2019-02-28 22:12:24,SimpleZero,"L'Académie française -&gt; sale race infâme, caïd. "
2019-02-27 15:10:14,0TheG0,"Putin : Fuck

Connard/Batard : Bastard

Enculé/Va te faire enculer  : Fucked/Get fucked

Pute : Bitch

Fils de pute : Son of a bitch

Nique ta mêre : (you go) Fuck your mom

Sale chien : Dirty dog

Salope : Whore

Nique ta race : Fuck your race (weird but efficient)

Sac à merde : Bag of poop

Sac à foutre : Bag of cum

PD : gay (seen as an insult, otherwise you would say ""homo"" or ""homosexuel"")

&amp;#x200B;"
2019-02-20 10:49:51,Moiiineau,"J'ai un peu rate le debat des derniers jours mais je croyais que l'antisionisme et l'antisemitisme etaient deux concepts differents.

Si je comprends bien Finkielkraut s'est fait traiter de 'sale sioniste de merde' - comment est-ce que ca rentre dans ""injure publique en raison de l'origine, l'ethnie, la nation, la race ou la religion.""?

Je veux dire le sionisme c'est une ideologie politique, si il s'etait fait traiter de 'sale communiste de merde' y'aurait eu des poursuites similaires?"
2019-02-19 13:18:23,WakatepeBaboune,"Ce n'est pas du racisme, c'est simplement faire état (probablement maladroitement) de différences entre populations.

Le concept de race est toujours débattu, mais le racisme commence lorsqu'un jugement de valeur ou une notion de supériorité sont émis à l'encontre d'une ""race"". Dire que les blacks ont la peau généralement plus foncée n'est pas raciste. Par contre dire qu'ils sont une race inférieure parce qu'on a l'impression qu'ils ""sont tout sale"", en est."
