date,author,text
2021-03-16 23:50:51,Crocblanc_13,"&gt;Et perso j'ai pas trop vu Bruno le Salé enfiler une tenue camouflage et  prendre une batte pour faire des ratonades. Faut redescendre un peu!

Comme Usul.

&amp;#x200B;

&gt;pour satisfaire un complexe de supériorité et se faire plus royaliste que le roi

La c'est toi qui fait de l'interpretation, c'est pas un argument.

Allez on va faire ce que Mediapart a pas fait, on va prendre une de ces video de Bruno le Sale est ont va decortiquer car comme tu le dis

&amp;#x200B;

&gt;Faut être honnête intellectuellement 5 secondes et arrêter de prendre les gens pour des cons

Voila une de ces video :

[https://www.youtube.com/watch?v=O7CxNE7YCqo](https://www.youtube.com/watch?v=O7CxNE7YCqo)

**0:50** , argument ""pourquoi parler de diversite dans les medias, car les chinois vont deployer la 5G chez nous ""

Mais quel est le putin de rapport.. regler le probleme de diversite dans les medias, empeche de  vieiller a ce que la chine possede l'ensemble des infra lie a la 5g ?

**1:30** ""Les hommes ne peuvent pas se faire b\*\*\* par des producteurs pour avoir un role et apres venir pleurer""

Oui c'est vraiment ce qui se passe avec toutes les femmes, le probleme dans cette affaire c'est vraiment la femme , pas le producteur, comme avec Darmanin n'est ce pas ? La femme a eu ce qu'elle voulait alors pourquoi elle vient pleurer.

Bref culture du viol.

**4:05** Kingdom delivrance, pas de diversite.

Bon.. la je met l'article de Numerama en question en source, ce que le youtuber ne met d'ailleurs pas dans la description.

[https://www.numerama.com/pop-culture/328809-kingdom-come-deliverance-un-jeu-raciste-le-pretexte-historique-ne-tient-pas-face-a-lhistoire.html](https://www.numerama.com/pop-culture/328809-kingdom-come-deliverance-un-jeu-raciste-le-pretexte-historique-ne-tient-pas-face-a-lhistoire.html)

Le developpeur en chef est connu pour être un bon reac, dit qu'il fait un jeu fidel historiquement, ce qui n'est pas le cas, l'un des ellements qu'il fallait par contre absolument qu'il soit fidele c'etait ""pas de noir"", ""jeu fidel historiquement"" qu'il l'est pas du tout donc ...

**8:20**  :  Nell Ivrin le blanc est stupide

Bon j'ai met la video de Quotidien qui repond a cette calomnie cree par Generation Identitaire.

[https://www.tf1.fr/tmc/quotidien-avec-yann-barthes/videos/zoom-non-nell-irvin-painter-n-a-jamais-tenu-de-propos-anti-blancs.html](https://www.tf1.fr/tmc/quotidien-avec-yann-barthes/videos/zoom-non-nell-irvin-painter-n-a-jamais-tenu-de-propos-anti-blancs.html)

""le blanc"" , c'est trump, c'est pas les blancs, elle parle de trump.

Alors vers **8.27** il te sors ""Faites disparaitre les blancs, on est la couleur de la honte, ce genre de discours me rappel quelque chose "" ( moustache d'Hittler )

bon .... je te cite :

&gt;Faut être honnête intellectuellement 5 secondes et arrêter de prendre les gens pour des cons

&amp;#x200B;

Tu me permets je saute direct a la conclusion, je perds des neuronnes a l'ecouter, c'est pire que Hanouna.

&amp;#x200B;

**15:00** Magnifique, ""Je ne saisserais de dire que le pire des racismes, c'est le racisme de gauche"".

Oui oui, generation Identitaire qui souhaite conserve la ""purete de la race"", virer ""les etrangers"" ( noir arabe juif ) hors de france, Sarkozy avec son ""karsher"" , les discours de MLP, le probleme c'est vraiment a gauche...

&amp;#x200B;

Bref anti-intelectualisme primaire, qui ignore tout les travaux qui existe concernant les difficultes d'acces a l'emploi des personnes qui ont des teintes de peau autre que blanc en france.

Et cela fait 605k vue.... franchement même chez Hanouna c'est plus intelligent.

Et les gens qui ecoute cela et sont convaincu de cela, ils ont je suis sur le sentiment d'être intelligent et d'être superieur a tout ces ""wokes/sjw"".

Alors qu'ils ont jamais du ouvrir un livre de Aime Cesair ou Frantz Fanon pour essayer de ce faire un avis plus pousse."
2021-03-11 09:13:29,MiskatonicBookClub,"&gt; en sindarin

Khuzdul race maîtresse, sale oreille pointue !"
2021-03-07 17:31:35,cinqduhuit,"Je ne sais pas s’ils appellent à tuer les juifs et les arabes, mais par contre une des élues UNEF a appelé publiquement à « exterminer les blancs cette sale race », la même qui a organisé des réunions en non mixité (pour ne pas dire sans mecs blancs hétérosexuels).
Donc effectivement je me permets de les mettre dans le même sac."
2021-03-05 17:03:28,[deleted],"Emmanuelle Oster la connaît, cette musique : « Nous, on gère les conséquences de ce phénomène, pas les causes, explique-t-elle dans son bureau du commissariat de la rue Marcadet, l’un des plus importants de France. La plus grande partie de leur journée, ils ne sont pas dans la délinquance. Ils stagnent. Ce qui génère de l’exaspération, c’est leur comportement : ils crachent, ils ne portent pas de masque, ils vivent d’expédients. Mais si les jeunes ne font rien, sur quelle base légale je les fais bouger ? Ils n’ont pas d’adresse, pas de papiers d’identité. On ne va pas leur dire “rentrez chez vous”. La question, c’est : pourquoi ils sont là ? Ce n’est pas à moi de répondre. On n’a pas la base légale pour être efficaces. On est un peu démunis, quoi. »

En une minute, le chaos

La laverie ne ressemble plus à rien. Le sol est encore plus sale que d’habitude : mégots, canettes, traces noires de semelles de baskets, traînées d’eau. Une bassine pleine a été déposée près d’une machine à laver : le plus jeune du groupe, en caleçon bleu, assis dans un tambour, y trempe ses pieds noirs et abîmés par des baskets étroites qu’il porte sans chaussettes. Houppette blonde, yeux étirés, joues rondes : son joli visage est intact. Il ne peut pas avoir plus de 13 ans : il a des petites cuisses rondes d’enfant.

Des clients de la laverie se glissent entre les mômes et la fumée épaisse pour récupérer leurs draps et leurs vêtements. L’odeur prenante du shit se dégage jusque dans la rue. Ils ont les yeux rivés vers le sol comme s’ils craignaient de provoquer une bagarre simplement en croisant leurs regards. En réalité, les jeunes ne les voient même plus. Un passant exaspéré saisit les sacs de sandwich par terre et les balance de l’autre côté de la rue. Les garçons courent récupérer ce qu’ils peuvent.

Il est autour de 20 heures quand un employé de la laverie pousse brutalement la porte. Il est encadré par deux gros bras du quartier. Il hurle que ça n’est plus possible. En une minute, c’est le chaos. L’homme, la quarantaine bien tassée, est massif. Il saisit Ayoub par les épaules, le sort du tambour et le secoue très fort. Il hurle qu’il va le tuer. Les autres gamins tentent de s’interposer, il les pousse violemment, l’un est projeté contre une machine, un autre par terre. Ayoub proteste – « j’ai rien fait, je lavais mes vêtements » (ce qui est exact).

L’adolescent fait le mouvement de s’avancer vers son agresseur, comme pour s’expliquer. L’autre n’y tient plus : « Tu n’as rien fait ? Et ça ? » Il saisit des sacs en plastique pleins de vêtements et de nourriture qu’il balance dehors avant de lui coller une gifle, puis une autre. Ses deux amis, jusque-là passifs, comprennent qu’il est à un rien du coup de trop. Ayoub saigne, il y a des traces de sang par terre. Ils raisonnent leur pote : « Allez, c’est un gosse. » L’autre continue : « Je vais le tuer, je vais le tuer. » Ayoub hurle et répète qu’il n’y est pour rien. Il voulait juste laver son pantalon. Debout pieds nus et en caleçon, il a le visage trempé et en sang. Il est terrorisé et pleure comme un enfant : « Je lavais juste mes vêtements, je lavais juste mes vêtements. » Sa voix se perd dans le boucan et les cris des adultes qui menacent : « Si on vous revoit là, on vous défonce. » La dizaine d’adolescents sortent. Ils stationnent dehors autour de la laverie. Ayoub s’en va – il dort dans un squat à Aubervilliers ces jours-ci.

Des habitants exténués

Dix minutes plus tard, l’incident est oublié. « Des bastons, il y en a tout le temps », observe Hana en sirotant son lait fermenté, pas du tout impressionnée par la scène à laquelle elle vient d’assister. Un peu plus tard dans la soirée, un Algérien qui s’était pris une bouteille en verre sur la tête en pleine journée au milieu des riverains effrayés est revenu le visage toujours ensanglanté, un tesson à la main : Hicham* s’est fait défoncer le crâne. On ne compte plus les pétitions, lettres ouvertes et suppliques envoyées jusqu’à l’Elysée par les habitants du quartier, exténués de voisiner avec ces jeunes livrés à eux-mêmes et d’assister à leurs rixes quotidiennes. « Il y en a même une qui a écrit à l’Elysée en se plaignant qu’ils crachent, explose de nouveau Emmanuelle Oster à l’évocation de ces courriers. Mais qu’est-ce que vous voulez que j’y fasse ? Un Maghrébin, ça crache dans son pays et ça crache en France ! Je ne vais pas faire l’éducation des Maghrébins ! Ça n’est pas raciste que de dire ça ! »

Quelques jours plus tard. 14 décembre. Laverie du bas de la rue. « Allez, qui veut naviguer ? », supplie Hana. Les garçons ne sont pas chauds, pas ce soir. Elle hausse les épaules, elle trouvera bien quelqu’un d’autre. Naviguer, c’est trouver de l’argent. « Moi, c’est l’argent, le flouze qui m’intéresse », dit-elle. Elle repart pour rejoindre la laverie du haut de la rue, celle qui est près de l’école élémentaire. De loin, elle aperçoit Farah qui ne marche pas droit. Elle est bien coiffée, habillée coquettement, jeans moulant, pull rouge, ceinture de contrefaçon et petit sac en cuir. Son visage, soigneusement maquillé, est strié d’une dizaine de hachures noires, comme des croisillons, sur le front et les joues. Elle lève ses manches : ses bras portent les mêmes traces.

La veille, Farah s’est lacéré elle-même le corps et le visage. Autour du poignet, elle porte un bracelet d’identification en plastique. « Je sors de l’hôpital. » Elle s’exprime avec peine, les mots ne sortent pas, sa mâchoire dévie à gauche : « Ma langue est lourde. » À peine sortie, elle a repris de l’ecstasy et des « saroukh ». Elle fume quelques cigarettes avec Hana, pleure en demandant si son visage « restera comme ça toute la vie », puis se dit partante pour naviguer. Mais elle est trop mal en point : il faut appeler les pompiers. Quelques jours plus tard, renvoyée de son foyer, elle est partie à Bruxelles avec un groupe de jeunes rencontrés sur Instagram. Eux quittaient l’Espagne.

20 h 30, dans la laverie d’où ils se sont fait débarquer quelques jours plus tôt. Parce que les rues sont maintenant vides, la musique que crachotent les smartphones paraît de plus en plus forte. Il y a le rap qu’écoutent Hana et quatre garçons au fond de la laverie. Les vidéos que regarde Ayoub, allongé au fond d’un tambour en caleçon. Il attend à nouveau que son unique pantalon sèche.

Un petit couple est là : Inès* et Younès*, qui ne se déplacent qu’ensemble. Italienne d’origine marocaine, elle a 13 ans. Craintive et discrète, elle a été victime d’un viol collectif il y a quelques mois. Lui a 16 ans. Il est arrivé de Casablanca il y a un an. Une voiture part pour Bruxelles le lendemain soir. Ils sont pressés d’y être. Comme leurs copains, ils voyagent. Un peu partout en France mais aussi en Belgique, en Allemagne, en Suède… Ils franchissent les frontières, en voiture ou en train, au gré des saisons et des plans, pour aller retrouver un cousin ou un ami ou s’éloigner de Paris parce qu’ils sentent que ça chauffe pour eux.

Trois garçons déboulent. On étreint l’un d’eux, bonnet bleu. Ça faisait longtemps qu’il n’était plus venu. Croyant avoir affaire à une avocate, il nous tend sa fiche de sortie d’une maison d’arrêt de la région. Wassim* a volé un portefeuille. Récidive, ça n’a pas loupé : deux mois. Il a quitté la prison le matin même avec ce qu’il avait sur le dos. Personne ne l’attendait nulle part : il est revenu à Barbès. Deux heures plus tard, après avoir fumé suffisamment de joints pour avoir les yeux rouges, il est allé « naviguer » avec deux autres garçons. On ne l’a pas revu. Hana non plus, qui cette nuit est rentrée se coucher sagement dans son squat de Seine-Saint-Denis.

Accro au quartier

Février 2021. Célia est de retour à la Goutte-d’Or. À la mi-décembre, elle a fugué de son foyer aux Pays-Bas. « C’était dans un endroit où il n’y avait rien, pas de magasins, pas de cafés, rien… La campagne, mais il n’y avait même pas de chèvres ou de poules. Rien ! » Elle est d’abord allée en Allemagne, où elle a récupéré sa grande copine Hana. Hana, qui en avait marre de Paris, s’est barrée après Noël. Ensemble, elles sont retournées à Amsterdam. La police les a arrêtées. Hana a été conduite en centre fermé en attendant son rapatriement en France.

Célia, majeure, a pu rentrer sans encombre. Et la revoilà à la Goutte-d’Or, par - 2 °C, sans manteau sur son jogging noir. Devenue accro au quartier, son chez-elle depuis ses 14 ans, elle ne cesse d’y revenir. Elle y a pourtant traversé le pire, ce qui arrive à toutes ces filles : la drogue, les viols, les grossesses non désirées, la délinquance. Et elle est à nouveau dans le pétrin. Il y a quatre jours, elle s’est fait embarquer pour outrage à agent. Un flic a cassé sa bouteille de vodka, alors elle a pété les plombs, elle lui a dit « nique ta race de keuf ». Il a tout filmé avant de l’embarquer en garde à vue. Elle ne peut pas s’empêcher de rigoler en racontant ça. Quelques nuits plus tôt, le campement situé dans des tunnels sous la gare de Lyon où elle s’était trouvé une place a été évacué. Elle y dormait avec deux autres filles et des dizaines de migrants, des hommes. Depuis, elle s’est trouvé une place dans un squat.

Célia aura 19 ans dans quatre jours, mais, pour elle, l’avenir est devenu un concept flou. « Je ne peux rien prévoir. Je ne sais pas ce qui va se passer tout à l’heure ou ce soir… » Elle sait juste qu’elle ne veut plus dormir dans son squat de Saint-Ouen. La veille, ils étaient quinze à vouloir « la forcer »."
2021-03-03 06:00:33,lamiermont,"À la lecture ce ""on"" me paraît confirmer au contraire qu'il faut plutôt comprendre ""nous, toutes les femmes"" (et même au-delà car l'article invite tout le monde à ""déconstruire"" Gainsbourg).
1. L'article dit ""attention Gainsbourg était misogyne"". Énorme découverte ! Le problème est que très tôt - je crois que c'est quasi en même temps que son accession aux médias, Gainsbourg avait dit ""non seulement je suis misogyne mais en+ je suis misanthrope. Il ne me reste pas grand chose..."". Ça arrive à pas mal de personnes, d'être déçues voire irritées voire en colère contre le genre humain (quand on lit les paroles de L'HOMME à Tête de Chou par exemple, on n'a pas une super image du genre masculin :-)) Et être misanthrope, quand on a soi-même été victime de brimades  et de persécutions (Vichy bien sûr, mais aussi moqueries constantes sur sa"" sale gueule "") ça se comprend, non ? Si on ajoute à ça que la"" démonstration ""de l'article repose, sur ce point de la misogynie, essentiellement sur la chanson des"" sucettes"", on se dit que le dossier a charge est mince. D'autant plus mince que comme tant d'hommes, tant de femmes aimaient et aiment toujours Gainsbourg, la personne mais surtout son art, la compréhension de sa ""misogynie"" comme masque provocateur est assez massive, en fait. Au Féminin aurait pu au moins en tenir compte. Ça a échappé à la rédactrice et à la rédaction. Gainsbourg a fait un album, Rock Around The Bunker, dans lequel il est... Hitler. Alors Gainsbourg, un nazi aussi, tant qu'on y est ? 
2. Gainsbourg, un ""harceleur"", limite ""prédateur sexuel""? La plupart des éléments biographiques à notre disposition attestent du contraire. Une timidité maladive qui le pétrifiait sur place et l'empêchait de ""faire le 1er pas"". Les femmes, aussi bien celles, nombreuses, qui voulaient une chanson de lui, que celles, +nombreuses, qui voulaient le... connaître intimement on va dire, venaient à lui, en fait. Les témoignages à décharge, qu'évidemment l'article passe totalement sous silence, font état d'un Gainsbourg plutôt attentionné, charmant, pas du tout en mode ""araignée qui attrape la proie qui s'est trop approchée de son trou"". Mais il est légitime de rappeler (je l'avais moi-même lu il y a qques semaines) que certains témoignages, notamment celui de Lio, incitent à penser l'inverse. Je ne prends pas ce qu'elle dit à la légère. Simplement, une approche un peu +équilibrée n'aurait pas dévalué la portée, problématique en effet, de ce qu'a dit Lio. Mais dire ""Gainsbourg = Weinstein"", franchement !!! Les chanteuses qui lui ont commandé des chansons ont-elles été obligées de payer de leur personne ? Parce que c'est ça, ""Weinstein"". Juliette Gréco? Françoise Hardy ? Catherine Deneuve ? Isabelle Adjani ? Elles auraient été soumises à un chantage sexuel par Gainsbourg ?!? Ça ne tient pas une seconde. 
Quant à Catherine Ringer (traitée de pute parce qu'elle avait fait du porno) j'avais trouvé en effet Gainsbourg particulièrement dégueulasse à son égard, il y a +de 30 ans quand j'avais vu cet extrait vidéo. Et ça m'avait fait très mal pour elle, qui devait l'admirer en tant qu'artiste. Se faire insulter et rabrouer comme ça par l'artiste dont on est fan, c'est horrible et dégueulasse. Mais est-ce parce qu'on a fait des choses dégueulasses (ou plutôt ""fait quelquefois"" des choses dégueulasses) qu'on EST un dégueulasse? C'est un peu +compliqué que ça à mon avis. Par exemple moi je me trouve souvent dégueulasse, pour les vilaines pensées que j'éprouve ou les vilaines choses qu'il m'arrive de dire, mais dans mon entourage on n'est pas d'accord. Je pense que ça vaut pour la plupart des gens normaux, y compris ceux qui se cachent derrière la provoc et à qui il arrive de dire des choses horribles. 
Concernant ses liaisons avec trois femmes mineures à la toute fin de sa vie, leurs témoignages sont à dispo dans la presse. Elles étaient toutes venues à lui, toutes avaient dit qu'il n'avait jamais été méchant, qu'elles avaient conclu avec lui après plusieurs jours de fréquentation. Pas vraiment le genre prédateur matznevien. Gainsbourg était une épave à la fin de sa vie, mais pas suffisamment naufragée pour attraper les jeunes femmes d'une façon moralement ou légalement condamnable. Suffisamment en revanche, pour dire des choses assez infâmes à Catherine Ringer, Lio ou Whitney Houston, c'est vrai. Ça n'en fait pas pour autant un prédateur sexuel. 
Nabokov, l'auteur de Lolita, était-il un prédateur sexuel ? Non. Jane Birkin a-t-elle cru une seule seconde que Gainsbourg était un prédateur sexuel ? Non plus. Je parle d'eux parce qu'ils sont tous deux les catalyseurs de l'album Histoire de Melody Nelson qui est une œuvre d'amour fou, définitif et inconsolable, d'un homme pour une femme. Une mineure de 15 ans certes (""14 automnes et 15 étés ""). Sauf que Lolita, comme Histoire de Melody Nelson, est une FICTION et que Birkin était majeure quand ils sont tombés amoureux. Toutes ces accusations tendant à accréditer l'idée ""Gainsbourg = Matzneff"" sont infondées, ridicules et diffamatoires. 
3. Gainsbourg raciste néo colonial ? L'article évoque les lyrics de chansons écrites... fin des années 50 / début des années 60... Préjugés et images d'Épinal pullulaient à l'époque, formaient une idéologie qui dominait plein de monde, Gainsbourg compris. Mais 20 ans +tôt, d'autres préjugés pullulaient, qui avaient failli, eux, l'envoyer en camp de concentration ! De ça il n'est pas question dans l'article. Ce qui est d'autant +étonnant que nous savons depuis Aimé Césaire que la logique de l'antisémitisme nazi est la même que celle du racisme impérialiste britannique, français, néerlandais, belge ou portugais. Gainsbourg raciste ? Aux yeux des légionnaires fachistes qui voulaient lui faire payer sa Marseillaise reggae chantée avec un orchestre jamaïcain, il ne l'était pas en tout cas. Ils le voyaient plutôt comme un traître à sa patrie et à sa race (blanche). Mais pour ces gens là, le juif est congénitalement cosmopolite et donc un blanc traître à sa patrie et sa race. Gainsbourg raciste ? Ridicule. Gainsbourg homme de son temps ayant parfois écrit des paroles stupides empreintes de préjugés racistes ? Oui, et s'il était toujours vivant, lui qui collait obstinément à son époque et son présent, il l'aurait, je pense, volontiers reconnu. Ça n'empêche pas que malgré tout, Couleur Café est une chanson pas mal, quand même. Moi j'aime pas trop, mais objectivement c'est pas mal. Un vrai tube qui accroche. 
Raciste, la chanson White and Black Blues écrite juste avant sa mort ? À comparer aux 100aines d'autres lyrics indifférentes à la question raciale, sublimant et/ou explorant le côté obscur de l'amour entre les femmes et les hommes. Regarder ce côté obscur en face, fait-il de l'auteur des lyrics un VRAI prédateur raciste misogyne pédophile ? Je pense que NON. Au Féminin commet un contresens et troque la forme contre le fond. Ok, Gainsbourg a écrit certaines lyrics assez nulles juste avant de crever. Une mort précoce ayant d'ailleurs provoqué le désespoir de... sa fille.
4. L'inceste. Je pense qu'Au Féminin devrait provisionner un peu de fric au cas où, parce que sa fille Charlotte a là de quoi attaquer le journal en justice. Imagine-t-on une fille violée par son père vouloir transformer sa maison (c'est-à-dire le lieu de ces prétendus abus) en... musée ?? C'est juste n'importe quoi. l'inceste est pratiqué dans le secret. Et si Gainsbourg a parlé ouvertement de l'inceste, c'était justement pour le rejeter, pour éloigner le mal, comme en témoignent ses lyrics : ""l'amour que nous ne ferons JAMAIS ensemble.""
On a tellement coutume, en ce moment, de critiquer le mode de féminisme dont avec d'autres Au Féminin s'est paré, en l'accusant d'importer la grille de lecture américaine, que ça en devient un poncif répétitif et convenu (pléonasme). Mais en l'espèce, je suis obligé de dire que l'accusation d'importation Made in USA n'est pas infondée. ""soyez prévenus avant de l'écouter"", écrit la journaliste. Il ne manque plus que l'étiquette ""beware, explicit lyrics"" collée sur le devant du CD, que les ligues de vertu ultra conservatrices... américaines avaient imposée dans les années 80-90. Mais je sais bien que selon toute probabilité (j'en suis sûr et certain en fait, mais je ne connais pas ce journal ni ses journalistes) le personnel d' Au Féminin n'est pas une bande d'ultra conservateurs bigots réacs. La tournure de cet article montre donc que la contradiction est partout (la contradiction règne en tout temps et sur toute chose, dans notre univers, c'est pas moi qui le dit, mais Hegel et Marx) : chez Gainsbourg comme chez Au Féminin. On peut se dire misogyne et en réalité ne pas l'être. On peut se dire progressiste et employer sans y penser les mêmes méthodes que les réacs."
2021-02-27 01:40:35,shadowSpoupout,Espèce de sale race
2021-02-24 18:42:56,usernamesareshorther,En vrai la race qu’on va se mettre quand les bars vont rouvrir va être très sale
