date,author,text
2020-02-22 13:02:51,RandomLasius,S'asseoir sur le référendum était probablement le plus gros coup de pute du siècle mais je pense que Macron le dépasse si on fait le cumul des points
2020-02-22 12:34:37,UltraChilly,"Je déteste ce que les guignols ont fait de la politique française en général, et ce que les émissions du type le Quotidien en font aujourd'hui. Quand tu te moques gentiment d'un fils de pute ça le rend plus humain et sympathique, quand tu te moques gentiment d'un mec honnête ça en fait un candidat ridicule que plus personne ne prend au sérieux. Quand chaque ""débat"" de comptoir se solde par une réplique des guignols ou un meme tu peux plus parler sérieusement de politique et si c'était déjà grave dans la sphère privée à l'époque des guignols, je trouve ça vraiment désolant de voir politiques et journalistes eux-mêmes adhérer à ce genre de discours sur twitter et dans les émissions de télé."
2020-02-21 16:21:58,PatrickBalkano,"Quatre chose sur cette affaire.

**Griveaux est un idiot**

Quand on est le Porte Parole Officiel du Gouvernement Français, on envoie pas sa bite  à des inconnues sur Instagram

**Griveaux était mal parti**

Il incarnait toute l'arrogance de l'élite Parisienne. Il semblait bien plus intéressé par le pouvoir que par le job. 

https://www.lesinrocks.com/2019/07/18/actualite/politique/abruti-fils-de-pute-pas-les-epaules-les-mots-doux-de-benjamin-griveaux-a-ses-concurrents-a-la-mairie-de-paris/

Son programme de détruire une gare géante pour construire un central park, c'était réellement n'importe quoi.   Je pense que les gens l'ont bien senti.


**Griveaux est un tartufe**

Il fait campagne en mettant en avant sa femme, en mettant en avant ses enfants, sa vie privée, il passait son temps en évoquant les valeurs familiales. Si il n'avait pas tenu ce tissu de mensonges, il aurait pu répliquer sur TF1 *""Et alors? Vous aimeriez Madame qu'on vous mette des vidéos de vous nue sur internet ? C'est ma vie privée. Je continue ma campagne""*

**Griveaux est une victime**

Enfin, Griveaux est une victime. Parce qu'il y a beau être un idiot arrogant et tartufe, personne ne mérite de subir ce qu'il a subi. Il y a des limites en politique."
2020-02-21 15:02:33,Oriflamme,"Autant du IAM ou Mc Solaar je pouvais trouver ça cool.

Mais dernièrement j'ai mis le top 10 des tendances spotify pour voir, et ça fait mal...

En gros c'est des variations de ""t'es une pute vive le pognon"" vaguement rappé avec de l'auto-tune (paradoxe ?) et une beatbox pourrave. 

Alors oui la musique c'est subjectif, mais j'arrive pas à déceler une parcelle de talent chez ces ""artistes"".

Je me suis senti exactement comme ça : [https://youtu.be/sfOzTl1pVyg](https://youtu.be/sfOzTl1pVyg)"
2020-02-21 09:04:34,TURBOGARBAGE,"&gt;""expliquer (comprendre) n'est pas excuser""

Ouais, et j'explique qu'il y a une différence majeur entre attaquer des groupes violents et attaquer des civils à cause de leur couleur de peau.

Il est malhonete de metre au meme niveau les chasseurs de skins et les fafs parce qu'ils n'avaient pas du tout le meme objectif.   


&gt;Parce que désolé hein, mais un groupe ultra violent qui fait la police  de la pensée dans l'espace public c'est pas franchement mon idéal,  quelque soit le bord de celui ci.

Et moi, mon idéal,c 'est pas une police qui, quand ils choppent des fafs violents, les laissent partir avec un tract du FN.  Il y a un moment faut accepter que quand il y a injustice et que les pouvoirs publique ne font rien, les gens font justice eux meme.  


D'ailleurs, il est assez rigolo de comparer l'attitude de ce ""groupe ultra violent qui fait la police de la pensée"", et notre police nationale en 2020. Parce qu'aux dernieres nouvelles ces gens etaient bien plus capable de faire regner l'ordre que la bande de fils de pute sadique qu'on a en ce moment."
2020-02-20 21:30:23,Charledegaulle,Y'a vraiment un fils de pute qui a downvote ça ?
2020-02-20 19:37:43,HHWKUL,"Ça fait presque mal au coeur pour lui.
&gt;Bon ben, je vais démissionner si ça dérange pas trop.
&gt;Poutine : non. T'es ma pute."
2020-02-19 16:09:38,Polewix,"&gt; Les stagiaires ont la main lourde
Les excès de zèle viendraient principalement de la « nouvelle génération » de policiers. En effet, le centre de rétention partage son site avec le centre régional de formation de la police – anciennement l’école nationale de la police de Paris. Il accueille beaucoup de fonctionnaires en formation ou des jeunes tout juste sortis d’école.

&gt; Dans la bouche de plusieurs retenus, ce sont ces « jeunes », « les stagiaires », qui leur font « la misère ». Dans la salle des coffres et ailleurs. « Ils nous insultent tout le temps. Des : “Nique ta mère”, “Fils de pute”… Ce n’est pas normal », s’indigne Yousef. « Avec les gradés, on peut parler, il n’y a pas de problème. Mais ils se mettent en retrait et permettent aux jeunes de faire tout ce qu’ils veulent », continue-t-il. « Les stagiaires se forment sur les étrangers, ils se font la main sur les plus faibles. On les reconnaît avec leurs épaulettes vertes », observe Bacar.

Elle est jolie la jeunesse."
2020-02-19 15:36:16,JeSuisLaPenseeUnique,"Branco a l'air d'être un sale con mais alors, la multiplication des titres de presse à base de ""BRANCO CE GROS FILS DE PUTE QUI COMPLOTE COMME UN CONNARD, DÉCOUVREZ POURQUOI CETTE IMMONDE ORDURE FAIT DES TRUCS DE GROSSE MERDE"" ça sent quand-même bizarre. On a rarement vu la presse se ""payer"" un mec d'une façon aussi violente sans y mettre aucune forme. Mon premier réflexe est de penser que ça cache quelque chose."
2020-02-19 10:50:09,kyncani,"Extrait : ""l’autre pute de mila qui insulte les musulmans on l’invite a la tele limite en mode star et la koba il a dis un bail sur les pd c bon on dirait c la fin du monde wsh c plus grave l’affaire mila que d’avoir mal parler des pd""

C'est du touite de qualité..."
2020-02-19 09:09:30,Dubwize,"*Tribune : Le gouvernement a créé une cellule militaire pour (mettre une des divers missions de la gendarmerie)*  =&gt; scandale !

Au delà du contenu, quel titre pute à clic"
2020-02-19 07:54:58,Abrruti,"Décidément j'arrive pas à comprendre le sens de cette affaire.

&amp;#x200B;

Le type est donc décommandé pour une remarque homophobe partagée sur son fil snapchat, citons les organisateurs du festival d’Arras :

&gt;*«Si nous voulons croire en la maladresse d'un jeune homme dont les  actes ont pu dépasser la pensée dans un contexte d'hyper connectivité,*  ***il n'en demeure pas moins que les idées qui ont été véhiculées n'ont pas  leur place dans la Citadelle*** *(d'Arras)»*

Ok très bien pourquoi pas, mais du coup quand le type rappe ceci :

&amp;#x200B;

&gt;En cours j'étais plutôt violent, en aucun cas j'me laissais faire  
J'avais tout juste c'qu'il faut, souvent apprécié par toutes les filles  
Matrixé par The Wire, j'ai eu envie d'bicrave  
J'ai harcelé Deuspi, pour qu'il me pousse du shit  
Il m'a dit : ""fais partir, ramène vingt-six et garde le reste  
Mais p'tit frère fais belek, est-ce que t'es sûr de prendre des risques ?""  
Et regarde j'ai tout compris  
J'ai grandi, j'ai appris, que faire du bénéfice, coffrer nan c'est pas si facile  
Tout l'temps ma mère me répète de faire attention à mes potes  
La plupart c'est des putes quand ils pourront ils t'la mettront dans l'cul  
&gt;  
&gt;\[...\]  
&gt;  
&gt;J'suis passé d'plaquettes aux kilos, police va t'faire enculer  
Si tu t'soucies du regard des gens, tu vas jamais y arriver  
En peu d'temps j'leur ai tré-mon  
Et regarde ma nouvelle montre  
C'est à mon buzz qu'elle s'agrippe  
Cette pute compte pas lâcher la grappe

Dans son titres phare, on a pêle-mêle des saillie homophobes, sexistes, anti-flic et une apologie que trafic de stupéfiant. Ce que le mec s'apprêtait à chanter sous les applaudissement et les yeux satisfaits des organisateurs. 

Ça ne posait donc strictement aucun problème en matière d'idées véhiculées en vérité."
2020-02-18 08:35:53,Irkam,"Ce matin j'ai manqué me manger une ~~grosse pute~~ sinistre conne au téléphone par l'arrière alors que je déboîtais. Elle était visiblement trop pressée de rejoindre la file de mecs derrière une voiture à 90 (sur une route limitée à 90), et moi pas assez pressé de faire de l'interfile à 90.

Mais bon, ça je m'en fous parce-que :

1. Je l'ai déposée 20m plus loin
2. Je lui ai fait un doigt avant, pendant, et après, en la regardant rager au téléphone dans le rétro.

Là où je m'en fous moyen c'est que ça fait genre 20-30 ans qu'on dit aux gens que téléphoner au volant c'est une idée de merde, et qu'il-y en a toujours pour se croire au dessus de ça. Qu'on dit aussi que pour le peu de temps que tu gagnes pour aller bosser ça sert à rien de rouler trop vite et trop près des autres."
2020-02-17 17:44:04,gromfe,"J’étais en train de me faire la remarque, surtout en lisant cet article du Parisien: [http://www.leparisien.fr/faits-divers/affaire-griveaux-qui-est-alexandra-de-taddeo-la-compagne-de-piotr-pavlenski-16-02-2020-8260989.php#xtor=AD-1481423553](http://www.leparisien.fr/faits-divers/affaire-griveaux-qui-est-alexandra-de-taddeo-la-compagne-de-piotr-pavlenski-16-02-2020-8260989.php#xtor=AD-1481423553)

Donc griveaux a envoyé une photo de sa teub sur les réseaux sociaux, a une fille qu'il a rencontré sur les réseaux sociaux, mais c'est pas la faute a Griveaux, c'est la faute aux réseaux sociaux...

Et surtout, ce qui me fait un peu halluciné, c'est qu'en parallèle de leurs grand discours un peu grotesque et leur mise en scène de l'outrage autour du ""la vie privée c'est sacré, c'est le droit de l'homme le plus fondamental etc..."", ils diffusent tous au même moment des dizaines de photos gros plan de cette femme, comme si elle était recherchée pour meurtre, alors qu'elle n'est accusée de rien du tout pour le moment...

Le Parisien la décrit comme une brillante étudiante en droit,  « tétanisée » et « dépassée par l'ampleur des faits » , qui aurait aussi bien pu être manipulée, la photo lui être volée etc...pour l'instant ya aucun élément, mais les même qui pleurnichent sur la teub de Griveaux, probablement parce qu'il se sentent plus directement menacés, n'ont aucun scrupule a se poser en tribunaux médiatiques et a jeter en pâture cette fille a la vindicte populaire pour qu'elle se fasse traiter de pute, de garce manipulatrice etc...par tous les Macroniste déchainés, sur les mêmes fameux ""réseaux sociaux"".

Quand tu rajoutes a ça le fait qu'a priori le premier a avoir diffusé cet info, c'etait...Benalla...sut twitter, ça donne vraiment un tableau dégueulasse peint a la gerbe..."
2020-02-17 16:16:19,JeSuisLaPenseeUnique,"&gt; Mais ce n'est pas la communauté musulmane qui décide s'il faut condamner ou non les harceleurs.

Bien-sûr que si. La pression sociale ça a une influence folle sur les gens, sans doute bien plus que le seul système judiciaire. L'acceptabilité sociale des actes est un critère majeur qui dicte le comportement des gens. Être condamné moralement unanimement a tendance à les réduire, l'absence de condamnation à les laisser pourrir chez les personnes qui ont des prédispositions. On intériorise tous des normes sociales, les valeurs qui nous sont transmises par le groupe ont un effet majeur sur la manière de pensée et les passages à l'acte.

Si tu veux faire un truc mais que tu sais que si ça se sait, tout le monde autour de toi va te voir comme le dernier des fils de pute, tu vas y réfléchir à deux fois, alors que si tu sais qu'autour de toi tout le monde autour de toi hausse les épaules en mode ""meh"" voire te défendra, il est beaucoup plus probable que tu oses.

Ton environnement social a une influence absolument massive sur ton idéologie, tes façons de penser, tes actes, etc. On se crée tous une société mentale à partir de la société réelle (en résumé le ""qu'en dira-t-on"") qui décide pour l'essentiel de nos actes. Ce sont des mécanismes hyper étudiés en psychologie sociale, il y a des kilotonnes de littérature scientifique sur ce sujet."
2020-02-17 15:40:16,userfromfrance,"Un journaliste, c'est soit une pute soit un chômeur..."
2020-02-17 11:07:05,paul_emploi,"Hier avec madame nous sommes allés au salon de l’érotisme, donc petit retour sur expérience.

Le lieu en lui même, pas super bien éclairé, pas chauffé et sol en béton, mais je pense que les organisateurs n'ont pas eu le choix. A l'intérieur, plein de stands avec des accessoires et des vêtements. Avantage, beaucoup de références, inconvénient, c'est plus cher que dans un magasin traditionnel.

Les activités : Durant toute la journée sur la scène centrale il y a des spectacles ou des danseur·euse·s viennent présenter leurs numéros. Madame à été déçue, parce que les femmes font du nu intégral, mais pas les hommes. Les artistes font des dédicaces après leurs numéros. 

Les activités bonus : Il y a la ""zone hot"" avec deux spectacles plus explicites. Le premier était sympa avec une femme qui fait un strip tease sur un cerceau qui tourne, le second, ambiance *french cancan*, pas top.

Il y a un spectacle réservé au femmes, gratuit, madame était très contente, même si pas de nu intégral. Pendant le spectacle, madame en admiration (ou plutôt, bavait) devant le danseur en se mordant le bout du doigt, il s'en est rendu compte et l'a fait voir à tout le monde.

Le Cinemax, c'est du porno en direct sur une scène privée. C'est un peu gauche parce qu'ils essaient d'enrober ça dans une scène d'un vrai film. nous avons eu droit à *The Mask*, avec deux acteurs. Une scène classique sans pénétration anale, avec ""colier de perles"" et femme fontaine. Le présentateur en profite pour faire de la prévention, dire que le porno n'est pas un guide de comment faire l'amour, que l'acteur ne prend pas de cachet pour bander, que l'actrice n'est pas une pute et distribution de capotes à la fin.

La seule activité que nous n'avons pas faite, c'est le strip tease en solo pour les homme à 10€ l'entrée. Avec les femmes en petite tenue devant qui allument  les hommes seuls pour faire rentrer de l'argent dans les caisses. madame à même proposé de me le payer, pour que je m'occupe pendant son spectacle réservé au femmes.

Globalement c'est un peu franchouillard, mais très sympa. Madame à pu voir des femmes normales en petite tenue et se rendre compte que même avec de la peau d'orange et/ou des bourrelets on peu faire bander les hommes. Moi j’ai pu voir les danseurs et me rendre compte qu'il faut que je continue la musculation...

Pour finir le commentaire de madame :

""Le milieu du sexe est loin d'être à égalité Homme/Femme, il est temps d'en tenir compte afin de faire évoluer les choses : les hommes cachent leur oiseau, tandis que les femmes montrent tout ! 

Je dois dire que parler de  prévention est très important, mais, ça ne devrait pas être mentionné que dans un spectacle de pénétration à 10 € !
La prévention, l'éducation et la protection devrait être un acquis, quelque soit notre age ou notre porte monnaie !

De plus, nous avons observé que du sexe sage (pas de shibari), malgré les accessoires bondages mis en vente... Autant présenter les accessoires dans une mise en scène, c'est bien plus vendeur !"""
2020-02-17 06:40:44,Quotillon,"[Un allumeur : il allume des réverbère !](https://youtu.be/GqqCgtxWf0E)

[Une allumeuse : c'est une pute !](https://youtu.be/GqqCgtxWf0E)"
2020-02-16 11:45:29,TB54,"&gt; « eh vas y sale pute file ton numéro »

Les insultes c'est pas sur l'affiche. Pour le reste (des mecs de cet aspect et de cet âge, seuls ou en petits groupes, faisant chier des amies à leur passage) j'en ai vu des tas à Paris. Parfois avec ce genre de gestuelle, plus souvent en les suivant et en leur parlant contre leur gré comme des gros lourds."
2020-02-16 11:36:10,sacado,"Ces trois là je les imagine plus à la manif pour tous à gueuler contre la pma qu’à demander « eh vas y sale pute file ton numéro » à toutes les nanas qui passent, mais c’est possible que mes représentations soient biaisées."
2020-02-15 18:56:44,TB54,"Mais c'est pas ce que je dis (que ""ça peut arriver""). Je dis que c'est tout aussi massif. 

Je le cite : *""On sait tous que c'est très courant que les mecs qui font du harcèlement de rue, qui insultent les filles de putes et de salopes et qui demandent des 06 sont des quarantenaires avec des dégaines de mecs qui bossent dans des bureaux option trotinette électrique"".*

Bah si. Clairement, d'expérience, c'est courant. On va certes plutôt remplacer ""salope"" et ""pute"" par des termes plus fleuris, mais à ce stade ça change rien au côté oppressant de l'expérience. 

Ces assocs sont ridicules de nier le harcèlement des jeunes de cités, mais lui est ridicule de pas se rendre compte que les filles ont pas attendu les mecs de cité pour subir ça en masse."
2020-02-15 15:06:48,usernamesareshorther,"&gt; La force de l'ISF c'est justement qu'il permettait de l'investissement dans les PME et des dons, puisqu'on pouvait obtenir une réduction en faisant l'un des deux.

Non il y avait simplement un abattement fiscal si tu investissais dans des PME à travers les FCPI. Vu l’état de l’industrie en France, je dirais que ça n’a pas vraiment fonctionné.

Et au vu des levées de fonds des startups en ce moment, et de l’état des IDE en France, je pense que l’investissement en France n’est pas une source d’inquiétude présentement. Peut-être est-ce lié à la disparition d’un impôt débile qui taxait une simple valeur de marché du capital. 

Ton article sur les associations est risible, titre pute à clic au possible dans lequel t’as foutu les deux pieds. C’est les dons aux associations à travers l’ISF qui ont été réduits de 50%, soit 150 millions d’euros, sur les 7,5 milliards de dons chaque année. Il suffit qu’ils fassent le don en l’inscrivant sur leur déclaration de revenus plutôt que de patrimoine pour baisser la valeur des dons   provenant de l’ISF."
2020-02-15 08:42:33,plifplafplouf,"""Dora, si tu changes 4 lettres, ça fait pute.

Coincidence? Je ne crois pas. """
2020-02-14 16:36:34,KamionBen,"Merde je viens de fermer la page, mais je viens de faire une aventure de 5 lignes qui commence par un mec bourré, et à la fin sa mère est une pute :-)"
2020-02-13 14:39:34,SuperMoquette,"&gt;L'homme âgé de 46 ans a surpris des cambrioleurs qui avaient fait intrusion dans sa propriété et a gravement blessé l'un d'entre eux


Le karma. Si ça peux calmer ces voleurs quelques temps ça sera ça de pris 
J'aime pas trop les voleurs et les fils de pute"
