date,author,text
2020-07-19 11:11:39,PasLoMaNi,"Le Liban est dans une situation absolument catastrophique.

- Le système politique est extraordinairement corrompu. 

- Le pays importe plus de 90% de ce qu'il consomme et n'exporte rien

- Le système bancaire est une pyramide de Ponzi géante

- Il y a une milice armée jusqu'aux dents avec son propre État

Le pays a connu une guerre civile violente pendant 15 ans. Ca a commencé quand des gentils palestiniens  ont débarqué armés jusqu'aux dents depuis la Jordanie voisine. Jordanie qui les a expulsé lors de Septembre Noir pour tentative de coup d'État. Les familles chrétiennes s'y sont opposés et il y a eu des affrontements violents. Ca a continué jusqu'à ce que le pays plonge dans le chaos total. Les affrontements sont montés crescendo avec des interventions étrangères (dont notamment la France) et les gens se sont bien sur la gueule. Des familles ont égorgées car elles avaient la mauvaise carte d'identité dans un check point.

Une bonne émission : 

https://www.youtube.com/watch?v=7DzCTqjloOU

 Ensuite, il y a eu les accords de Taief en Arabie Saoudite signés en 1989. Le Liban devient un cake qu'on partage. 
 Tous les criminels de guerre sont tous devenu leaders politiques en costume cravate. Le système politique repose totalement sur la corruption et le sectarianisme : 

https://www.youtube.com/watch?v=OvH12P3Paz4

La Syrie a continué une occupation militaire du Liban dans toutes les villes du pays, notamment Tripoli mais aussi la capitale Beirut. Israël a pris 20 km au sud et exigé que les Syriens partent d'abord. Les chiites, avec leur milice pro-iranienne ont continue de se battre avec les israéliens. Jusqu'à annoncent qu'ils se barrent en 2000 et ""maintenant foutez nous la paix"". Sauf que depuis, le Hezbollah refuse de désarmer. Il prétend que Israël voulait voler le Liban (non, ils ont débarqué car on leur tirait dessus) et qu'une autre invasion est imminente car tout leur pouvoir repose sur leur milice. Donc il a qualifié toute personne appelant a la paix de traitre. Il déclare aussi que les israéliens ont volé les fermes de Cheeba alors que avant, littéralement personne ne disait qu'elles étaient libanaises et que l'ONU a pourtant confirmé un retrait israélien intégrale.

L'enjeu, c'est créer un ennemi, l'antagoniser au maximum, pour continuer ""la lutte"" pour rester hyper armé et bien bien dominer le Liban. Une partie de l'opinion publique gobe tout. La Syrie a elle continué l'occupation militaire de la capitale et les chiites trouvaient ca très bien. 

Par la suite, le premier ministre Rafic Hariri, qui a contribué a la reconstruction du pays, est assassiné en 2006 par la Syrie juste pour l'avoir critiqué. 

https://en.wikipedia.org/wiki/Rafic_Hariri

Le Tribunal International pour le Liban a été envoyé sur place mais il n'a jamais pu terminer son enquête car les suspects sont en fuite : 

https://www.mediapart.fr/journal/international/141018/assassinat-de-hariri-l-histoire-d-une-enquete-accablante-et-d-un-proces-fantome?onglet=full

Les Syriens ont tué tous leurs critiques comme Samir Kassir. Il y a eu grands mouvement après la mort de Hariri. Un mouvement du 14 mars exigeant la fin de l'occupation syrienne et le mouvement du 8 Mars exigeant de continuer une occupation militaire syrienne (oui, vous avez bien lu)

https://en.wikipedia.org/wiki/March_8_Alliance

https://en.wikipedia.org/wiki/March_14_Alliance

En 2008, deux après une guerre, il y a des affrontement hyperviolents entre partis politiques et autre un risque de guerre civile  :

https://fr.wikipedia.org/wiki/Conflit_libanais_de_2008

Ensuite, il y a eu la crise Syrienne qui a déstabilisé totalement le Liban. Il y a eu notamment  une vague de refugié absolument monstrueuse. Et ensuite des affrontements armés entre pro-syrien et anti-syriens.  Les assasinats des anti-Syriens ont continué : 

https://www.franceinter.fr/emissions/rendez-vous-avec-x/rendez-vous-avec-x-17-novembre-2012

Aujourdhui, le pays est dans une ruine absolument totale. Même les feux rouges sont éteints. Plus personne ne veut aider le Liban. La France a donné plein d'argent et il n'y a toujours pas d'électricité. Les pays arabes estiment que c'est une colonie iranienne et que la classe politique les insulte. L'Iran utilise la religion comme arme mais voit le Liban comme sa pute. Leur seul enjeu réel, c'est d'avoir une milice et une frontière pour attaquer (sans prendre de risque) si on veut stopper leur nucléarisation. Le FMI affirme que le gouvernement libanais refuse de coopérer avec lui : 

https://www.lemonde.fr/international/article/2020/07/16/au-liban-le-parti-des-banques-fait-barrage-au-plan-du-fmi_6046350_3210.html

Ca risque de mal finir.

https://www.france24.com/fr/%C3%A9co-tech/20200709-liban-un-risque-d-effondrement"
2020-07-18 20:28:45,stefgo777,"Une accusation n est pas une culpabilité. C est tellement facile d accuser. Je peux t accuser de viol gratuitement. Tu seras mis en garde à vue et tu devras attendre le procès pour prouver ton innocence. Scénario de fiction bien entendu. C est pas à la rue de faire la justice. Allez Gérald, relève les noms, ce sub est bourré de calomnies. Fais toi innocenter et fais taire ces langues de pute !!!"
2020-07-18 08:38:45,Valentin_Tournebize,Puté C vré les feuilles dé zarbres ki tombe merde je croivé ke CT juste en hiver ossi!
2020-07-17 13:01:35,Ivan_Groznyy,"Faut nous comprendre quand on voit la majorité de Flammands en Belgique

Ces fils de pute s'offusquent toujours quand ils se rendent compte que tu sais pas parler néerlandais alors que tu es en Belgique"
2020-07-15 14:47:03,Folivao,"C'est normal, on a tous connu ces galères. Comment va la grande au fait ?

Ta grand mère la pute je vais te la lever !"
2020-07-15 07:43:49,La_mer_noire,"Les gens qui disent ça se laissent chier dessus par leur patron ? Ça me rappelle un mec qui disait que vu qu'il paye des impôts, Macron c'est sa pute. Donc ce type est la pute de son patron ?"
2020-07-14 19:13:56,AnarchyinGroland,"Tu peux aussi filer des ouaterportes aux journalistes qui disent ""adolescents"" pour des jeunes de 23 ans ultra-récidivistes qui tabassent à mort des chauffeurs de bus. Ou aux juges qui libérent le mec qui a tabassé Marin.

Je pense que t'as loupé le propos. les fils de pute n'ont pas de couleur politique."
2020-07-13 17:56:15,MathlePicard,"Je me suis juste amusé à te paraphraser, si tu trouves ma paraphrase dénué de sens c'est peut-être être que ton comm l'était.  C'était le but de ma paraphrase te faire comprendre le vide et l'absurdité de ton propos. Manifestement le message n'a été compris qu'à moitié. 

mais je vais m'arrêter là vu le nombre de fils de pute que tu vois autour de toi, ça doit être effrayant de vivre dans ton monde.

Je te laisse dans ton monde de l'insulte et du mepris.tu as l'air de t'y complaire."
2020-07-13 10:32:59,Lucius-Faust,J'ai été traumatisé par cette putain de truc de merde de sa race la putain de pute ! J'étais un gosse et c'était passé en pub la putain de sa race de saloperie de merde ! POURQUOI PUTAIN POURQUOI ?!
2020-07-13 06:46:44,TB54,"Quelques remarques, notamment à partir de tes réponses ici :

&gt; mon correct 7 sur 10 

Ça ça commence un peu mal, mec... C'est pas qu'un concours objectif. Un jour tu plairas à quelqu'un, et probablement pour tout un tas de raisons qui seront pas objectives, mais seulement liées au fait que ton physique et ta personne lui parle. Et ce sera entre autre lié à ce que tu renvoies - si ce  que tu renvoies est que tu cherche absolument un vagin à baiser, tu vas avoir un gyrophare au-dessus de la tête, tout le monde te captera à 100m. Il faut déjà te resociabiliser, et reprendre confiance en toi, car ça :

&gt; J'ai volontairement annihilé mon ego et réprimé toute potentielle fierté ces dernières années ; je m'abstiens d'entreprendre quoi que ce soit, à petite ou grande échelle. Je vois de la vanité partout et je refuse globalement d'exister et de jouer le jeu de dame nature qui consiste à vivre gouverné à différents degrés, quoi qu'il arrive, par les divers instincts et besoins biologiques que cette pute nous a collés dans le crâne

... ça porte un nom, tu es probablement en dépression.

&gt; Et j'ai justement arrêté d'entretenir mes amitiés (masculines) parce que justement elles ne promettent rien de romantique. Donc, selon moi, ""à quoi bon"" ?

Si tu n'arrives pas à sortir de cette logique ""utilitariste"", dis-toi simplement que côtoyer des gens socialement, être ""lubrifié"" socialement, est de toute façon nécessaire à ta capacité à provoquer et digérer une rencontre sexuelle et amoureuse.

&gt; (sur le fait de rencontrer les gens naturellement, sans chercher directement). Seulement c'est à l'opposé de comment je vis depuis toujours. Et malheureusement il n'y a que moi qui y puisse quelque chose.

Si tu as un ordi portable, prends au moins l'habitude d'aller travailler/geeker dans des bars. Au pire ça te ré-habituera à être entouré de gens. Au mieux tu finiras par devenir un habitué, à faire connaissance avec les gens sur place, etc.

Bonne chance !"
2020-07-12 10:44:54,Areat,Mais est ce que ça fait d'eux des fils de pute xénophobes ? Je ne crois pas que le Danemark ait franchit une limite à partir de laquelle un pays basculerait dans cette catégorie.
2020-07-12 08:26:26,SpongeBobBzh,"Mouais tu oublie une chose importante quand même, le PCF n'est pas un ramassi de fils de pute xénophobes."
2020-07-11 09:08:12,sentosa92,"Il faudrait réellement confisquer toutes les motos au pot trafiqué et mettre des amendes énormes , plus de 3000€ à ces motards qui ne respectent pas la loi.

Ça rapporterait de l'argent mais il faudrait pour ça avoir un peu de courage politique et ne plus avoir peur du lobby de certains motards écervelés.

Et de manière plus large , je suis même favorable à l'interdiction de la moto en ville entre minuit et 6heures du mat.
Il ne se passe pas une nuit sans que je sois réveillé par un de ces fils de pute qui passe à toute vitesse avec sa grosse moto de course.

C'est épuisant et insupportable, ça finit par me rendre haineux envers tous les motards alors que j'imagine que beaucoup d'entre eux sont des personnes raisonnables qui possèdent des motos moins voire peu bruyantes.

Il serait vraiment temps d'être beaucoup, beaucoup  plus sévères envers les quelques motards qui pourrissent nos nuits et nos vies."
2020-07-10 12:40:15,Meneldyl,"Il y en a assez pour qu'on ai tous les jours un fait divers du style ""déjà condamné 36 fois - dont trois fois pour viol ou agression sexuelle - à seulement 24 ans, il écope de trois mois de prison avec sursis après avoir tabassé une femme qui n'a pas répondu positivement à ses ""suce moi sale pute""""."
2020-07-10 10:30:09,Zanarto,"Et c'est comme ça qu'on devient une pute américaine ou soviétique ou chinoise bientôt.


Quand De Gaulle sort de l'OTAN, c'est parce qu'il a des armes atomiques pour s'assurer que ni Washington ni Moscou n'interviendra pour le dégager par la force et mettre un vassal à sa place.

Quand Mitterrand prend le pouvoir, pas question d'intervenir pour renverser le gouvernement. Les faucons US ont tremblé de peur et Mitterrand a du les rassurer sur ses ambitions internationales.

La France a toujours eu une diplomatie florissante et une position indépendante, et c'est parce qu'elle a les moyens de la défendre.


Alors tu peux bitcher sur le nucléaire, mais c'est bien cette équilibre de la terreur qui a empêché une WW3 en Europe."
2020-07-10 09:28:36,B1DC2B865D99,"Je vois pas le rapport ? La il est sujet d’une chienne qui est maltraitée et je fais tout mon possible pour l’aider là où toi tu aurai probablement fermé les yeux sur la situation alors quel intérêt de t’arrêter sur une malheureuse parenthèse qui ne t’es même pas destiné avec pour seul but de gratter quelque up a ton com, T’es une pute à buzz à ce point ? Vraiment pathétique..."
2020-07-09 23:46:06,Anto-Yuutsu,"Mon meilleur ami habitait à puteaux. Puis il a violé ma meilleure amie... Ce mec est une pute, oh"
2020-07-09 16:41:57,romiglups,"Un assassinat c'est un homicide volontaire prémédité. Je ne crois pas que le fils de pute ait pensé à ça le matin en disant ""Tiens je vais me faire un gendarme"". 

Il a vu une herse et une gendarme , il a choisi la gendarme (sans doute en pensant qu'elle /allait/avait le temps de/ fuir). C'est un meurtre, pas un assassinat."
2020-07-09 13:36:02,syknetz,"Le subreddit LoL, c'est aussi le subreddit qui a supprimé des articles parce que ""c'est le site où travaille un mec qui est content ban du subreddit"", et qui supprimait tout les articles sur un sujet important parce que c'était ce mec qui avait eu l'histoire d'origine, et du coup la modération voulait un article qui ne source pas (soit un article de fils de pute comme on dirait dans le milieu).

Et de modérateurs indépendant, mais qui avait enregistré le subreddit valorant des jours/semaines à l'avance et qui s'étaient déjà passé modérateur.

C'est un subreddit de merde, avec des règles de modération absurdes."
2020-07-09 12:27:59,capquintal,*pleure en pute de la Jonquera*
2020-07-09 10:55:51,Kyomobiya,Merci de poster ça. Je connaissais l'affaire mais j'avoue ne pas avoir penser a la partager. Quoi qu'il en soit je me demande encore combien de gros fils de pute sevissent impunément chaque mois on en trouve des nouveaux cest dingue.
2020-07-09 07:22:36,MDMAStateOfBeing,"&gt;Toi t'as pas encore vue une militante féministe se foutre d'un mec qui explique avoir été violé pendant 15 ans par son grand frere et lui dire ""que ca l'aidera à comprendre ce qu’être une femme signifie"". Et se faire applaudir.

Putain, mais quelle pute. Ca m'etonne pas cela dit, y a des sujets sur le sub feminisme faisant l'apologie des violences domestiques contre les hommes avec l'aval des modos. Se revendiquer woke n'a jamais ete une preuve que quelqu'un n'est pas une enorme merde toxique."
2020-07-09 03:26:43,RadomFish,"&gt;Le site Covidinfos.net, spécialisé dans les contenus farouchement anticonfinement, s’est fait l’écho au début de juin d’une étude particulièrement critique. A l’image de son titre choc : « “Le confinement est véritablement l’escroquerie sanitaire du XXIe siècle”, selon une étude qui souligne la responsabilité de l’OMS. » 

Le Monde fait du pute à clic en reprenant le titre de ce qui est manifestement un site ultra orienté.

L'article est un débunk de l'article de base."
2020-07-08 09:36:16,A_french_chinese_man,"Hey tu me gardes une place steuplé ? Jsuis en réu avec Sylvie en salle Finistère et ça risque de tarder un peu  
Hors de question de bouffer avec Christian ce fils de pute"
2020-07-08 08:56:19,RadomFish,"Twitter doit rester sur Twitter. Slate est un journal bas de game dont le seul objectif est de faire du pute a clic.  Et Facebook est rarement (jamais ?) Intelligent. 

&gt;Par contre, les commentaires Facebook, c'est une bonne façon de juger de la validité d'un sujet ?

Ce n'est pas si simple. Les Raids sur les réseaux sociaux vont souvent de paire avec des actions discutables de sociétés. Les RS étant une vitrines les attaquer est souvent la première chose qui est faite. Ce n'est pas une science exacte, j'ai seulement demandé à l'auteur si il avait plus d'info qu'une simple pancarte. C'est toujours bien de demander des sources complémentaires ex : un article de presse ou d'autres personnes qui comfirme la photo.

&gt;(Et en plus tu les lis assez pour savoir que ça arrive ""souvent"".

Je ne vois pas trop le rapport avec ce que je fais hors de Reddit. Je n'ai pas a m'expliquer. 

&gt;Je ne te comprends absolument pas. Il n'y a aucune logique dans ton aversion pour twitter et autre si tu utilise Fb pour faire des stats au doigt mouillé.

Je n'ai pas dans mon commentaire dit "" y a rien sur facebook donc tu dis de la merde"" j'ai au contraire demandé si OP avait un peu mieux qu'une pauvre photo de pancarte. 
Twitter permet de voir de bonnes chose mais c'est les déchets qui sont quasi systématiquement post sur r/france."
2020-07-08 08:53:24,Cerrebos,"Je valide l'option hobby, surtout si tu te découvre un truc cool que t'as envie de faire et que tu ignorait aimer avant.

Tu peux faire du paramoteur, de l'ébénisterie, des trucs écolos genre pêche a l'aimant dans la Seine, te trouver une passion pour le skateboard/pute/coke comme cité plus haut, ça fonctionne aussi (enfin fait gaffe quand même), de la musique/peinture/couture, du miel, etc...

Les hobby c'est cool et t'as justement un peu de temps pour voir ce que tu voudrais faire. Rencontrer des gens ça viendra tout naturellement avec le hobby, et entre passionnés d'un même truc, la communication passe facilement."
2020-07-08 08:30:36,eeeklesinge,"&gt; Par rapport à  l'antisémitisme j'ai juste dis que **citer les faits** te transforme parfois en bête immonde et  tu te fais pulveriser par le chantage à l'antisémitisme, beaucoup ce sont fait avoir ou ce sont repentis de leurs propos.

Oui sauf que c'est pas la réalité et tu cites aucun fait donc c'est cool mais j'ai cité ce qu'il disait et à aucun moment y'a un doute sur le fait qu'il visait tous les juifs et que c'était bien antisémite. Quand tu dis qu'en gros les juifs doivent mourir pour le reste de l'humanité y'a pas vraiment de place pour l'interprétation faut arrêter de se foutre de la gueule du monde. 

&gt; Enfin en attendant ce n'est pas "" les fascistes "" qui ont rendu la France tel qu'elle est aujourd'hui.

Tu veux expliciter ? C'est les juifs ? 

&gt; Pourquoi devrait on interdire la publication de livre, quel qu'il soit ? 

On parie que tu changes d'avis le jour ou un sombre fils de pute publie un guide sur comment t'assassiner toi et ta famille, avec toutes les infos qui vont bien, sous prétention que t'es pédophile ?"
2020-07-07 07:36:19,Rascar__Capac,Pute pute pute
2020-07-07 07:01:12,[deleted],Ce titre pute à clique... mais c’est pardonné.
2020-07-07 06:35:49,Chapalyn,"Je me rapelle dans ma premiere année quand j'etais en Norvege je faisais de l'escalade en salle, et quand je ratais un truc bien sur je jurais...

Et donc j'avais appris a tous les norvegiens labas comment dire ""putain de bordel de merde d'enculé de fils de pute"". C'etait trop marrant de les entendre jurer comme des charretiers avec leur accent norvegien !"
2020-07-06 23:25:29,Irkam,"""Mange merde"" reste un de mes préférés avec ""pute borgne""."
2020-07-06 22:46:06,1_5_9_8_0,"Alors pour le coup, je me rappelle de quelque chose qui doit rassembler l'idée de chrétienté, ou tout du moins une partie, avec fille plutôt que femme. C'est une sorte de version médiévale de fils de pute : fille de moine (pouvait aussi, sans doute, s'utiliser avec fils). En gros ça veut dire que ta maman elle t'a eu parce qu'elle a eu des relations avec un moine de passage. Donc en gros bah double peine pour toi."
2020-07-06 18:41:18,Sigerbjorn,"""Le truc DE machin. On dit fils DE pute, pas fils À pute, tu le retiens une fois et c'est bon, putain.""
 - *Bescherelle ta mère*."
2020-07-06 18:34:11,moicestgege,"Bof ca depend j'utilise race énormément dans mes insultes.
Mais l'important d'une bonne insulte est d'etre creatif  c'est sur que fils de ta rzce rend pas super bien mais avec quelques ajout ca fais bien. Fils de race de pute (t'insulte pas juste la merr mais tous ces ancetre) je pense que faut vraiment elaborer le truc un peu plus les gitans font ca tres bien dailleur."
2020-07-06 10:58:00,[deleted],"Les anciens avaient bien cerné l'animal et composé ce monument de sagesse paysanne: [La vache, la vache, quelle pute cette vache, la vache elle est barjo!](https://youtu.be/sBitudplQvc?t=31) (vous cliquez à vos risques et périls )"
2020-07-06 06:56:19,mister_patate,"Toujours le même problème avec l'historique des personnalités. On peut vouloir glorifier le passé de résistant de Pasqua et l'effacer de l'histoire pour la suite mais comment fixer la limite ?

On peut aussi supprimer toutes les plaques Maupassant, Malraux, Rousseau qui étaient de sacré fils de pute malgré leurs talents."
2020-07-03 10:18:02,Quirky_Inflation,"Le jour où j'ai acheté 2 kg de Pute en Allemagne pour faire un barbecue avec des potes, on était refaits"
2020-07-03 09:47:28,Chapalyn,"Un coussin en norvegien c'est ""pute"" aussi, donc c'est super rigolor tu as des grosses pute des petites pute, des pute confortables voire des pute gonflables !"
2020-07-03 09:23:35,Delicious_Fart,"Pratiquement rien à voir, mais brochette en allemand, c'est ""Spiess"". Quand on est francophone et qu'on l'entend pour la première fois, on entend ""ch'pisse"" et ça me fait toujours rire.

La dinde, c'est ""Pute"" aussi... j'ai dix ans!"
2020-07-02 17:13:48,canyoueartheC,Ce site est d'un niveau de pute à clic jamais atteint.
2020-07-02 13:45:03,clee-saan,"Stupéflip, pute et slip, le crou, tous ces groupes la"
