date,author,text
2019-12-03 09:19:23,ZeBarbu,"Je boude un peu le FL pour des raisons que je garde pour moi mais je viens donner des nouvelles. Sinon AFCM va avoir le coeur qui saigne et Clee risque de se mettre à travailler pour de vrai à force de s'ennuyer.

Ca fait quelques temps que le moral est au plus bas. Vraiment très bas. J'ai fait du repli, coupé les communications, passé beaucoup de temps à ne rien faire et avoir des idées sombres.

Puis j'ai décidé de rebondir, et je me suis remis à chercher du boulot. J'ai toutes les SSII de paris qui me courent apres, comme à chaque fois. Alten, Extia, Altran... J'ai eu 12 appels hier, j'ai répondu à aucun. Ils me dépriment encore plus.

J'ai reçu pas mal de messages hier, y compris de gens qui m'écrivent rarement. En particulier une amie qui me dit que mon meilleur ami d'enfance part en couille et qu'elle s'inquiete et que je dois faire un truc. Mais quoi ? Autant vous dire que c'est pas le bon timing. Ca l'est jamais en fait. J'ai parfois l'impression d'être l'observateur passif dans un cockpit d'un crash en train de se passer. Tout le monde semble devenir dingue, de plus en plus fort et plus en plus vite, et j'essaie de m'isoler mais c'est difficile. Rhinocéros, quoi.

Pole emploi m'a fait un coup de pute en fin de semaine. Le 28, ils m'ont désinscrit pour un motif purement bureaucratique de dossier (uniquement un truc de leur part en plus). Donc ils m'ont coupé mes allocations sans me prévenir, après que je me sois actualisé. J'ai eu la surprise de me retrouver sans versement aujourd'hui, déjà en découvert avec mon loyer qui tombe demain et j'ai rien à bouffer à part des pois chiches et des citrons confits. Ca devrait se résoudre sous 72 heures, mais en attendant, je vais me faire niquer pour mon loyer, ma banque, tout ça quoi.

En rentrant de pole emploi à l'instant, je vois des mecs qui posent la fibre dans mon immeuble. Enfin une bonne nouvelle, me dis je.

Je vais enfin rentrer chez moi, et là, ma gardienne d'immeuble surnaturelle m'attrape. Elle commence à parler à toute vitesse de trucs décousus. C'est parti du fait que je portais un casque sur les oreilles et de faire attention à pas me rendre sourd, à des conseils bizarres sur manger du ginseng et acheter des trucs à la croix rouge. Mais elle m'a vraiment mis mal à l'aise quand elle m'a dit des trucs du genre ""Je vois en toi Jesus, ton physique mais aussi ton âme. Tu es une incarnation de quelque chose"" entre autres déraillements sur le diabete, le métier de traduction (elle sait pas que je suis là dedans à la base...), un profilage psy chelou religio/astro bizarre.

&amp;#x200B;

Ah oui, et j'ai bourré tinder comme un porc car mon compte premium arrive à expiration et j'ai l'intention de le supprimer car ça m'a rien apporté. Je match beaucoup, avec que des gens étranges. En particulier une fille avec qui j'avais déjà matché y a 3 ans, qui m'avait dit au bout de 2 heures qu'elle voulait venir chez moi pour que je l'enfile sans préliminaires et qui a oublié qu'elle m'a déjà parlé, manifestement.

&amp;#x200B;

Faut que je me motive à répondre aux vautours de SSII et autres RH, allez.

Essayez quand même de passer une bonne journée, et pour pas être radin, commencez par essayer [ça](https://www.youtube.com/watch?v=2Jvdy6khEmA), ça devrait fonctionner."
2019-12-02 09:55:51,lunki,"Puis ça met une jupe qui descend sous les genoux, avec des bas qui montent au dessus des genoux, sinon c'est une pute qui va corrompre nos enfants."
2019-11-30 11:14:54,Varyxos,Mais le Bacqueux sympa c'est aussi un fils de pute en soi. Il reporte pas le son collegue qui tire au flash ball et amène pas le gamin a l'hopital. Le seul bon perso c'est Salah.
2019-11-28 22:30:37,MilesNaismith,"Et les pompiers font des carences (remplacements) d'ambulances également, mais ils aiment pas car ça leur coûte du pognon et ils ont l'impression de faire du taxi sanitaire. D'où leurs grèves récentes avec écrit ""Pute du 15"" sur les VSAV...

Alors qu'en fait, ambulanciers comme pompiers font de l'urgence relative et absolue, des foulures de chevilles comme des avc..."
2019-11-28 14:34:46,syncope61,"Autant pour les mecs je peux vaguement comprendre, autant les femmes je pige pas. A quel moment ça fait rêver d'être mariée (enfin soit ça soit faire la pute comme dit l’article) à un soldat (pour ne pas dire terroriste meurtrier) dans un ""pays"" paria international, sans garantie de retour/survie, en étant donnée a un autre mec a la mort du premier... Sérieux pour une femme qui a grandi en France en allant a l'école et tout pour moi c'est renoncer a son humanité pour devenir du bétail volontairement."
2019-11-28 11:36:57,holiquetal,Les vierges au paradis c'est sympa et tout mais y a pas moyen d'avoir genre une avance?? 1 pute maintenant et genre 71 après la mort?
2019-11-27 20:51:15,whateverdude3858,"Déjà on arrête de centrer la parole sur la sensibilité des gens choqués par le fait que les banlieues soient homophobes. Des idiots utiles qui laissent le discours se faire accaparer par les affreux réactionnaires. Soit ils sont de très mauvaise foi soit ils ne connaissent pas du tout le terrain.

Le premier constat est le refus de la différence dans ce milieu. Que ce soit la féminité (""pas le droit à la jupe sinon t'es une pute""), l'homosexualité ou l'intellectualisme. Il y a un culte malsain de la domination, de la violence et de l'hypermasculinité/machisme. Je n'irais pas dans le détail pour savoir si ça vient de la culture et/ou des conditions socio-économiques parce que sinon je vais me prendre une avalanche de ""NotAll..."".

La solution magique serait que les parents fassent leur boulot et disent à leurs enfants que ces différences sont normales et qu'elles doivent être respectées mais malheureusement ""dans la bouche des enfants réside bien souvent la vérité des parents"". Ces discriminations ne viennent pas de nulle part et sont souvent des cas de reproduction sociale.

Du coup, que reste-t-il ? L'éducation nationale et ses profs débordés, qui viennent de décrocher le CAPES face à des élèves qui voient en eux l'autorité qu'on doit abattre ? Peut-être une petite campagne de sensibilisation à coup d'affiches que personne ne lit ? Ou bien faire intervenir des associations LGBT ? Pourquoi pas, ça risque pas de faire de mal.

J'ai pas de solution miracle et de toute manière, c'est pas mon rôle. Mais en tout cas, il faut arrêter de jouer les vierges effarouchées lorsqu'on dit que la banlieue n'est pas un paradis gay friendly et que sa violence est spécifique."
2019-11-27 10:42:27,Sharblue,"Modable, via workshop, mais pas fan des mods (il est déjà très bon sans).

Les aliens je sais pas, y’a un dlc avec des aliens je crois, et sinon t’as des scénarios aléatoires.

Genre là j’ai des mirages télépathiques beaucoup trop fréquents qui font dormir 1/4 de mes colons qui ont le trait « rêveur »... bien chiant, mais l’histoire liée est assez sympa. Très psychédélique, ça colle très bien avec le genre.

Fin définie pas vraiment, plutôt du endgame.

Au début tu fera avec ce qu’il y a la surface. Ensuite tu t’attaques aux forages. Mais tous ont des quantités limitées. Du coup a un moment faudra se tourner vers les « merveilles » qui coûtent super cher en ressources mais en produisent à l’infini.

Et puis, si ta map est terraformée, tu pourra quitter l’espace restreint des dômes et décupler ta production.

Tu peux avoir d’autres initiatives sur la planète, tu peux échanger des ressources et technologies avec eux, ou leur faire des coups de pute (j’imagine qu’eux pourront refaire la même)."
2019-11-26 17:18:06,JeanBombeur83,Enfoiré ça reste assez vague. Après même entre potes les insultes violentes ça reste assez malvenu. Aucun de mes amis me dirait fils de pute sans se manger une petite béquille.
2019-11-26 16:16:17,LordEmmerich,"Généralement avec mes potes il ya aucune censure. Même si je ne dis jamais fils de pute car il y a ma règle du ""pas les mamans"""
2019-11-26 09:09:36,usernamesareshorther,"&gt; Après oui, tu peux t’arrêter sur le fait que l’équipe de cash n'a réussi à infiltrer qu'une seule usine de tannerie en Italie, et que de se fait, ils parlent principalement d'elle. 

Franchement, tu te rends pas compte à quel point ce que tu dis est malhonnête. 

Ils n’ont pas réussi à infiltrer qu’UNE usine, ils ont eu accès à probablement beaucoup plus d’usines, mais quel intérêt de faire un reportage sur toutes les usines respectueuses du code du travail ? On voit d’autres usines dans ce reportage, on voit pleins d’autres personnes, mais ils font leur gros titres sur le cas particulier qui pose problème et après des gens un peu benêts pensent qu’il s’agit d’une généralité et qu’ils n’ont réussi à infiltrer qu’elle. 

Après les gens un peu naïfs vont dire « le luxe français est fait par des ouvriers exploités en Italie » alors que c’est pas du tout le cas.

Au fait, je ne parlais pas du reste du reportage, les 3/4 de ton message sont HS, je parlais spécifiquement des méthodes dignes de pute-à-clics que Mme Lucet et ses compères font dans leurs reportages pour faire buzzer ! 

Et que ce soit sous-traité, y’a rien de mal à cela, un maroquinier n’est ni un tanneur, ni un éleveur."
2019-11-25 14:48:33,pasterp,"C'est sympa ce midi je suis rentré dans mon immeuble et le voisin du dessous m'a insulté direct pour de ""la musique toute la nuit"". Enfin ça je l'ai appris après 3 minutes d'insulte sur ma mère. Sauf qu'hier j'ai regardé un film et c'est tout.
La dernière fois il m'avait déjà engueulé sur de la musique chez moi toutes les nuits alors que j'étais absent depuis 2 semaines. Je sais pas si je dois le croire et que mon film était à ce point audible ?

Il refuse de me croire sur quoi que ce soit, et entre insultes et menaces qu'il profère je comprends pas pourquoi il est pas juste venu toquer les soirs en questions.

D'ailleurs mon répondant aux insultes du genre ""fils de pute"" ça a été ""ben votre mère doit être fier de vous"". Sauf qu'il a clairement 3.5x mon âge."
2019-11-25 14:15:02,RhumTriplePeptides,"J'ai plutôt l'impression qu'elles essaient plutôt de briser le tabou qu'il y a sur le sujet en le signalant. Aujourd'hui les seules violences faites aux femmes dont on a le droit de parler ce sont celles perpétrées par des hommes blanc hétéro. Elles rappellent ici qu'il ne faut pas se taire sur les autres profils d'agresseurs, c'est un focus sur un seul autre profil, ce qui peut être reproché, mais c'est je pense, également, l'un des profils d'agresseurs les plus actifs en région parisienne.     
Je ne veux pas vivre dans une France ou on finit dans des situations comme au R-U ou des gangs de violeurs n'étaient pas inquiété par la police parce que ces gangs étant composés à plus de 80% de personnes d'origines indiennes et pakistanaise, la police ne faisait rien car elle ne voulait pas être taxée de racisme dans la presse et plus généralement par l'opinion publique.

J'ajouterai que pour le voir il n'y a pas besoin d'aller dans la rue dans le 19ème ou le 18ème arrondissement ou même le 93. Ma copine m'a montré un fil twitter ou une femme parlait de sexualité et donnais des conseils... La quantité d'insultes qu'elle s'est prise à base de ""t'es qu'une salope"" ""respecte toi, espèce de pute"" ""ton père doit être fier de toi"", j'en passe et des meilleures, les mecs ont été jusqu'à chercher les coordonnées de ses parents quand même...     
La femme en question était d'origine maghrébine donc je ne sais pas si ça influe sur le public qui a pu voir ses tweets et donc qui a répondu mais toutes les insultes que j'ai vue était d'hommes noirs ou arabes, j'ai pas tout regardé ça m'a vite énervé donc il y a surement d'autre profils mais je n'en ai pas vraiment vu."
2019-11-25 13:14:16,chatbicheou,"Je suis assez contente en voyant les commentaires de constater que les mentalités ont changé en quelques années.   

On se souviendra de ce fait divers où une enfant de 11 ans avait porté plainte pour viol quand un homme l'avat coincée dans un ascenceur et forcé à faire un fellation alors qu'elle n'avait même jamais embrassé qui que ce soit, et que le procureur avait classé sans suite. Grosse indignation, suivie de l'argumentation no-étayée par l'avocat préféré de r/france  que a) cette gamine était noire et immigrée et faisait plus que son âge; b) sa mère vendait des photos plus que suggestives d'elle et que c'était donc une pute. Peu de personnes pour dire que cette enfant devait être portégée de sa mère alors. Beaucoup en revanche pour affirmer qu'une ""pute"" de 11 ans, ça ne se fait pas violer, ça induit en erreur l'homme."
2019-11-25 11:13:23,electriCT,"Polanski n'est pas le seul violeur pédophile, et Cantat n'est le seul fils de pute qui cogne des femmes.

A aucun moment ça ne dit que TOUS les hommes sont comme ça. Ca dit qu'il y a tout un pb de société et d'éducation qui permettent a DES hommes d'en arriver là.

C'est quand même ouf de sortir le #notallmen alors qu'OP ne dit pas ça."
2019-11-25 08:44:22,Unit824,L''expression fils de pute vient bien de quelque part.
2019-11-24 12:50:39,Moonti,"""Maintenant avec 100% de fils de pute en plus !"""
2019-11-23 17:01:55,dogDroolsCatsRules,"https://www.bedetheque.com/media/Planches/PlancheA_302274.jpg

Marrant, le premier que je trouve en tapant ""fils de pute"" dans google image est un gaucho."
2019-11-23 16:57:45,Makerobxa,"Ah bah y'en à d'autres, suffit de taper ""fils de pute"" sur Google, y'en a pleeeeeeeeein !"
2019-11-22 17:59:33,Dubwize,"Quel titre pute à cliques ! Le rapport porte sur la ""*la* ***lutte*** *contre les* ***groupuscules*** *d’****extrême droite*** *en* ***France*** "", présidé par une Députée LFI et avec un rapporteur LREM. L'élément en question, sur un texte de 1.4 millions de caractères, est (le [paragraphe complet](http://www.assemblee-nationale.fr/15/rap-enq/r2006.asp#P1790_427008) ):

&gt; **Recommandation n°** **31**: étendre le champ d’action du CIPDR à la radicalisation identitaire et à d’autres formes de radicalisation (anarchiste, antisioniste, *vegan* *etc*.) ; élargir le champ du site « Stop-Djihadisme » aux formes précitées de radicalisation et le rebaptiser « Stop-Radicalisation » ; introduire un module de sensibilisation aux risques liés aux différentes formes de radicalisation dans le cadre du service national universel. 

Oui, je trouve aussi que c'est une idée de merde mais non aucune ligne de ce rapport ne dit que les végans ou les anarchistes seraient aussi dangereux que les djihadistes."
2019-11-22 09:09:45,Troufee,Ça dépend aussi beaucoup du prix de la passe. Une escort qui gagne 300 balles en une heure avec un client n'a pas la même pression qu'une pute du bois de Boulogne qui fait ça pour 30 balles.
2019-11-21 20:57:53,Analbator,"Aux confins de la fo­rêt de Bro­cé­liande, le vil­lage de Broons, dans les Côtes-d’Ar­mor, fi­nit de dé­jeu­ner ce 3 avril. Il est 14h30 et on s’ap­prête à sor­tir le ba­lai dans le res­tau­rant d’Odette et Ber­trand quand se pré­sente sur le seuil, dont la porte ouvre sur la na­tio­nale 12, un aréo­page en cra­vate. Le pré­sident de la Ré­pu­blique, de belle hu­meur, le pré­sident de l’As­sem­blée na­tio­nale, Ri­chard Fer­rand, les dé­pu­tés Flo­rian Bachelier et Her­vé Ber­ville, tous s’at­tablent de­vant leur pa­vé de boeuf aux en­dives brai­sées sur fonds d’ar­ti­chaut, le me­nu du jour à 12,50 eu­ros. Dans l’angle de la salle du Mi­di Vin, le chef de l’Etat a convié Loïg Ches­nais-Gi­rard, le pré­sident de la ré­gion Bretagne. L’hé­ri­tier de Jean-Yves Le Drian est un so­cia­liste res­té so­cia­liste. C’est bien le pro­blème – et d’ailleurs l’ob­jet de ce ren­dez-vous faus­se­ment câ­lin. Le prin­temps s’avère mo­rose, la cam­pagne des élec­tions eu­ro­péennes pa­tine, aus­si Em­ma­nuel Ma­cron re­trousse-t-il ses manches. As­sis en face de lui, le pré­sident, en­tou­ré de ses trois fi­dèles, n’at­tend pas le des­sert pour dé­fi­nir la rai­son de cet apar­té : « Il va fal­loir que tu cla­ri­fies ta po­si­tion avant l’élec­tion. Ce n’est pas te­nable. » Si­lence. Le Bre­ton laisse pas­ser quelques se­condes. Re­garde cha­cun des convives. Puis ré­pond, cal­me­ment : « Je suis prêt à en dis­cu­ter, mais pas dans cette confi­gu­ra­tion-là. » On ignore s’ils ont pris des îles flot­tantes, mais ce qu’on sait, en re­vanche, c’est qu’un mois plus tard Ches­nais-Gi­rard ap­pelle à sou­te­nir la liste so­cia­liste. Un re­vers qu’Em­ma­nuel Ma­cron trai­te­ra à sa fa­çon : leur con­ver­sa­tion est bri­sée net. Do­ré­na­vant, le pré­sident de ré­gion s’en­tre­tien­dra avec Ri­chard Fer­rand pour les ques­tions bre­tonnes et, si l’im­por­tance le re­quiert, avec le Pre­mier mi­nistre. « Quand on le gifle, il ré­pond par l’in­dif­fé­rence. Il veut rap­pe­ler qu’avoir des échanges en direct avec le pré­sident de la Ré­pu­blique est un pri­vi­lège dont il ne faut pas abu­ser », com­mente un mi­nistre. Loïg Ches­nais-Gi­rard se conso­le­ra d’ap­prendre que ce trai­te­ment ne lui est pas ré­ser­vé.

Ma­na­ge­ment « dar­wi­nien ». Le pré­sident de la Ré­pu­blique ré­pugne au conflit, il abhorre la dis­pute et élève ra­re­ment la voix. Il coupe. Gé­rard Lar­cher, pré­sident du Sé­nat, tra­verse la même pé­riode gla­ciaire de­puis qu’il a em­pê­ché la ré­forme consti­tu­tion­nelle et lais­sé les sé­na­teurs en­quê­ter à grand bruit sur l’af­faire Be­nal­la. « Em­ma­nuel Ma­cron fait montre d’une grande sé­duc­tion puis, cons­ta­tant que ce­la ne suit pas, il mé­prise. C’est tout à la fois un im­mense char­meur et un im­mense cy­nique. De­puis qu’il a com­pris que le Sé­nat ne mar­che­rait pas avec lui, il fait comme si Gé­rard Lar­cher n’exis­tait pas », confie son ca­bi­net. Fi­ni, là aus­si, les conver­sa­tions du soir, les ren­dez-vous entre le chef de l’Etat et le pré­sident de la Haute As­sem­blée, «mais, at­ten­tion, il de­meure ex­trê­me­ment ré­pu­bli­cain sur le pro­to­cole. Là, c’est ni­ckel ». Tou­te­fois, si Gé­rard Lar­cher veut joindre l’exé­cu­tif, il doit contac­ter Edouard Phi­lippe. « Tant que vous êtes sur un mode de rai­son­ne­ment qui lui convient, il est ex­trê­me­ment at­ten­tif, ana­lyse Mi­chel Sa­pin, son an­cien voi­sin de Ber­cy. Mais, lorsque vous évo­quez un su­jet avec le­quel il est en désac­cord, il ne dit pas “je ne suis pas d’ac­cord”, ses yeux partent ailleurs, dans une sorte d’ho­ri­zon loin­tain, qu’il fixe sans ar­rêt. Vous avez l’im­pres­sion que le per­son­nage n’est plus là.» Comme si convaincre l’autre se­rait un gâ­chis de temps et le si­lence, la forme su­bli­mée et dé­dai­gneuse d’une im­mense confiance en soi.

Ber­nard Mou­rad, en­core pour quelques se­maines pa­tron de Bank of Ame­ri­ca-Mer­rill Lynch France, a connu dès 2008 le jeune ins­pec­teur des Fi­nances Em­ma­nuel Ma­cron. Li­bé­raux, am­bi­tieux, po­taches et lit­té­raires, les deux qua­dras se plaisent, s’ap­pellent « mon la­pin », s’écrivent sur Te­le­gram, et leur lien per­dure ain­si. « Em­ma­nuel Ma­cron est ex­trê­me­ment ha­bile et duc­tile pour évi­ter les conflits fron­taux », re­marque le ban­quier d’af­faires, dé­cri­vant en sou­riant un ma­na­ge­ment « dar­wi­nien », où le plus fort triom­phe­ra à la longue du moins so­lide et ce sans que le chef s’en mêle. D’ailleurs, le pré­sident ne dit pas autre chose quand il em­ploie sa for­mule ima­gée : « J’at­tends que les es­car­gots dé­gorgent. » Une tech­nique dont on a consta­té les ef­fets lors de l’in­ter­mi­nable dé­mis­sion de Gé­rard Col­lomb,

Merci Pressreader et google (https://www.pressreader.com/france/le-point/20191121/282011854196487)"
2019-11-21 09:09:07,harcole,"Il a pas dit titre mensonger, il a dit titre pute à clic."
2019-11-21 06:43:26,drpoucevert,"titre pute a clic:

  "" La partialité de l'IGPN qui étouffe délibérément les affaires de violences policières et les déclarations de l'Intérieur et de la directrice de l'IGPN ne reconnaissant pas les violences policières (...)  Il demande la désignation immédiate d'un juge d'instruction compte tenu du caractère criminel de cette affaire."""
2019-11-20 15:16:42,jaguass,C'est du vol et du plagiat. J'aime pas trop les voleurs et les fils de pute.
2019-11-20 12:52:07,abisbis,J'aime pas trop les voleurs et les fils de pute.
2019-11-20 02:56:00,AnarchyinGroland,"&gt; le point Staline 

Le point Staline c'est quand on traite quelqu'un de coco. Donc non.

&gt; Mais à l'époque on le savait pas ce qui se passaient en URSS.  

Dés la guerre d'Espagne les républicains on constaté le genre de fils de pute qu'était Staline. Il a aussi fait assassiner les cocos hors URSS qui étaient critique. T’inquiète ca se savait. Mais les communistes mondiaux ont choisit de pas le voir. Voir de mentir."
2019-11-19 23:52:38,JeanneHusse,"C'est pas pire que Alban machin. Lui il a vu que Dieudo était cramé mais qu'en terme d'interprétation il avait tout révolutionné dans les années 90-2000, il s'est dit je vais tout pomper personne va oser dire quoique ce soit au risque de se faire accuser d'être fan de Dieudo.

C'est pute, mais fin."
2019-11-19 10:12:34,DoNDaPo,"PUTE PUTE PUTE PUTE PUTE PUTE PUTE PUTE PUTE PUTE PUTE PUTE PUTE PUTE PUTE PUTE 
SALOPE
PLUS HAUT PLUS HAUT PLUS HAUT PLUS HAUT PLUS HAUT PLUS HAUT PLUS HAUT PLUS HAUT PLUS HAUT PLUS HAUT PLUS HAUT PLUS HAUT PLUS HAUT PLUS HAUT"
2019-11-19 09:10:22,UtilisateurAOP,"- Pute, Pute, Pute, Pute, Pute, Pute

- Bah, Workne ?!!

- Demande-toi pourquoi t'es sur Terre pas pourquoi c'est vulgaire"
2019-11-19 08:42:52,HenrySeldon,Première réaction en lisant le titre : « Ho le fils de pute »
2019-11-18 14:31:27,LeKaiWen,"Le documents ne parle pas non plus de Ouighur spécifiquement, seulement de terroristes. Bien sûr, on peut s'amuser à l'interpréter comme ça, mais ce serait de l'interprétation, pas clairement une fuite compromettante de la part du gouvernement Chinois, contrairement à ce que cet article pute à clic sous-entend.

Va lire le document qui a fuité au lieu de croire ce média de merde, et cite moi ici le passage qui parle de persécuter les Ouighurs, s'il te plaît."
2019-11-18 09:29:02,LeKaiWen,"Je suis d'accord avec tout ça. Je critique juste le fait que l'article ici prétende que des documents internes qui ont fuité contiennent des preuves de la répression visant spécifiquement les musulmans ou les Ouighurs, alors que non, ici le document parle exclusivement du terrorisme, et ne révèle donc rien d'explicitement embarassant pour le pouvoir Chinois a priori.

Mais je suis d'accord que le mot terroriste est peut-être utilisé pour désigner les musulmans, ce ne serait pas la première fois, on le sait bien, même en France. Je dis juste que ce document ne démontre pas du tout ça, contrairement à ce que l'article, pute-à-clic, avance."
2019-11-17 12:48:11,JustABaziKDude,"La pincée d'aspirine sur le cassage de tête des républicains.  

*Mr ~~sandman~~ chairman*  
Nan Mr chairman il t'emmerde et il ajourne enculé, pas un mot de plus de votre stratégie d'empapaoutage de fils de pute! Tiens, et on va faire une standing ovation pour cette brave femme histoire de vous les casser un peu à vous et à votre mafieux, violeur, raciste, et j'en passe, de président.    
*coupe le mic*  

Franchement c’était super intéressant et comparé à ce chialeur de Kavanaugh, elle a vraiment tenu la longueur.  
Mais la plupart des prises de parole des républicains rendent le truc plus pénible qu'autre chose tellement ça file l'envie de leur claquer la bouche.  
Edit: *""There is no camouflaging that corrupt intent.""*  
T'a raison, j'avais pas assez fait attention à sa dernière intervention, c'est vraiment un bon discours de conclusion avec un rappel des faits et cette fin en mode cliffhanger sur cette dernière phrase.  

Edit 2:  
&gt;Ann Telnaes, The Washington Post: [Yovanovitch's emotions](https://www.washingtonpost.com/resizer/89kl5feIoEK4NcmpL6SKPMxY1zw=/1440x0/smart/arc-anglerfish-washpost-prod-washpost.s3.amazonaws.com/public/W5FF2IMKJ5HXNAKL7BVVXR4K3Q.jpg)"
2019-11-17 08:01:09,ioutaik,"C'est plutôt quand quelqu'un critique leurs fils que leurs filles, mais oui.

La directrice du primaire où j'allais s'en est pris plein, elle prévenait la police mais y'avait rarement des vraies conséquences.  
De ce que j'ai compris, le nouveau directeur se laisse faire maintenant :/

Je me rappelle de cet exemple : une racaille avait mis un chewing-gum dans les cheveux d'une fille et l'avais insulté (""pute blanche"").  
La directrice l'avait évidemment puni, et le lendemain les parents étaient venu lui dire qu'ils allaient la tuer, devant tout le monde..."
2019-11-16 20:40:28,xroche,"Bonjour, aujourd’hui l'histoire c'est qu'on vous a sodomisé bien profond, vraiment c'était pas prévu, vraiment disolé, mais en fait pour tout vous dire...

AH FAUT QUE JE JE FASSE LA PUTE POUR MON SPONSOR, C'EST TROP TOP, ACHETEZ BANDE DE CONS

Ah désolé, donc Pif gadget de merde etc.. donc vous avez été mis bien profond par les cocos.

Désolé."
