date,author,text
2020-06-04 07:20:49,Folivao,"**En décembre dernier, un policier dénonçait ses collègues après avoir découvert qu’ils échangeaient des messages racistes, antisémites, sexistes et homophobes dans un groupe WhatsApp privé. Cinq mois plus tard, ils sont toujours en poste, en attendant leur passage en conseil de discipline.**

«Le racisme n’a pas sa place dans la police républicaine », affirmait Christophe Castaner le 27 avril, après la diffusion d’une vidéo dans laquelle des policiers traitaient un interpellé de « bicot », à l’Île-Saint-Denis. La condamnation morale du ministre, ferme, a été suivie d’effets : deux agents ont été suspendus à titre conservatoire, sitôt l’enquête ouverte. Mais une autre affaire démontre que la police a encore du ménage à faire dans ses rangs.

Mediapart et ARTE Radio ont eu accès à des dizaines de messages vocaux échangés par des policiers, fin 2019, sur un groupe privé WhatsApp qui comptait onze membres. Parmi ces agents, en poste ou anciennement en poste à Rouen, six passaient des heures à s’envoyer des audios qui relèvent du suprémacisme blanc. 

Persuadés de l’imminence d’une « guerre raciale », pour laquelle ils affirmaient stocker des armes, ces policiers (titulaires et « adjoints de sécurité », les emplois-jeunes de la police) accablaient d’injures tous les « ennemis de la race blanche » : les femmes (des « putes », même les policières), les Noirs (des « nègres »), les Arabes ( des « bougnoules »), les gens du voyage (des « putain de manouches »), les Juifs (des « fils de pute » qui « dirigent le pays » en compagnie des « gauchistes »), les homosexuels (des « pédés »). « Pour vivre heureux, vivons casher », plaisantaient entre eux ces policiers, soucieux de rester discrets sur leurs échanges. « On est fichés F, F comme fachosphère. »


Comme le révélaient le quotidien [Paris-Normandie](https://www.paris-normandie.fr/actualites/faits-divers/pute-a-negre-arabo-negroide-a-rouen-un-policier-porte-plainte-contre-ses-collegues-racistes-BG16238867) et le site [76actu](https://actu.fr/normandie/rouen_76540/racisme-sexisme-homophobie-policier-rouen-depose-plainte-contre-six-collegues_30857245.html) dès le mois de janvier, ces faits ont été découverts et dénoncés, en décembre 2019, par un policier noir de 43 ans. En poste à l’Unité d’assistance administrative et judiciaire (UAAJ) de Rouen – un service qui sécurise la préfecture et le tribunal, veille au bon déroulement des audiences et escorte les justiciables –, ce sous-brigadier prénommé Alex se trouvait dans une guérite en compagnie d’un adjoint de sécurité quand il a vu s’afficher des messages mentionnant son prénom sur le grand écran de son collègue. Celui-ci a accepté de lui montrer les échanges, puis d’en consigner une partie : 180 pages pour la seule période du 4 novembre au 26 décembre 2019.

Assisté de l’avocate Yaël Godefroy, Alex a adressé un rapport à sa hiérarchie le 23 décembre et déposé plainte contre six de ses collègues dans la foulée, pour « provocation non publique à la discrimination », « diffamation non publique en raison de l’origine, l’ethnie, la nationalité, la race ou la religion » et « injures non publiques en raison de l’origine, l’ethnie, la nationalité, la race ou la religion ». Le directeur départemental de la sécurité publique (DDSP), Éric Maudier, a également signalé ces faits à la justice.

Mi-janvier, le procureur de Rouen, Pascal Prache, a ouvert une enquête confiée à l’IGPN. Sur le plan pénal, ces conversations à caractère privé ne sont passibles que d’une contravention, pouvant aller jusqu’à 1 500 euros.

En parallèle, la direction départementale de la sécurité publique (DDSP) a mené une enquête administrative, confiée à son service interne de déontologie. Aujourd’hui « bouclée », selon une source policière, cette procédure « va se traduire par un renvoi des fonctionnaires concernés devant le conseil de discipline ». La date de l’audience n’est pas encore connue. Dans la police, les conseils de discipline débouchent sur des propositions de sanction – pouvant aller jusqu’à la révocation –, entérinées ensuite par l’échelon central du ministère de l’intérieur.

À ce stade, les policiers mis en cause exercent toujours leur métier au contact du public. Ils n’ont pas fait l’objet de suspension mais « ont été affectés à de nouvelles fonctions au sein de leur service », précise cette source policière. Leurs téléphones n’ont pas été saisis et ils se sont vantés, avant leur convocation, d’avoir déjà effacé une grande partie des messages.

Inquiète de ne pas voir avancer l’enquête, l’avocate d’Alex a écrit au procureur de la République le 2 juin. Dans ce courrier, Yaël Godefroy s’étonne que son client n’ait « pas été interrogé depuis son dépôt de plainte » tandis que son collègue, celui qui lui a montré les messages dans la guérite, n’a « toujours pas été entendu ». « Mon client craint la perte ou l’altération des éléments de preuve », écrit Yaël Godefroy, pour qui « il est impératif de faire constater et retranscrire ces messages en intégralité » avant que « le contenu des échanges » n’ait disparu pour toujours. Contacté par Mediapart, le procureur de Rouen indique que « l’enquête confiée à l’IGPN est toujours en cours » et précise qu’« une audition a d’ailleurs eu lieu » mercredi.

Cinq mois après sa plainte, Alex a accepté de sortir du silence. Sans vouloir « décrire la police comme un milieu malsain », il estime que le racisme « existe vraiment » au sein de l’institution et reste « tabou ». Son témoignage, [recueilli par Ilham Maad pour ARTE Radio](https://www.arteradio.com/son/61664080/gardiens_de_la_paix), est à écouter ci-dessous, entrecoupé de messages audio échangés par ses collègues Gilles, Camille, Julien, Thibaut, Xavier et Guewen. Une logorrhée sur l’inégalité des races, dénonçant une « invasion » de l’Europe, mâtinée de paganisme et de survivalisme, qui se complaît dans la répétition d’injures racistes et d’allusions sexuelles."
2020-06-03 20:34:37,Masuku68,"Ouais enfin le contexte ça vous casse toujours pas trop le cul alors je vais prendre un exemple issu de la page Wikipédia que tu as toi-même donné à quelqu'un en référence. Section misogynie, ce qui m'a interpellé vu que encore une fois quand on est capable de lire au delà de la couche d'injures, le mec m'a pas l'air très porté là dedans à part des taquets aux pseudo-féministes qui déservent leur cause par des combats ridicules. Je ne nierai toutefois pas qu'il est un peu viriliste. On y trouve une citation du Raptor qui suggère un coup de frein pour tester un port de ceinture et de jeter la ""pute"" sur le trottoir. Je suis d'accord, c'est pas joli joli et plutôt misogyne.

Sauf que CONTEXTE: https://youtu.be/Cs4ZGmiyxfw
Alors on prend son cerveau, on racle les insultes et de quoi est-il question dans ce cadre: Annaliese, ""féministe"" d'origine hawaienne, emmerde son chauffeur Uber parce qu'il a une danseuse hawaiienne sur son tableau de bord de façon assez peu constructive. Quand le monsieur fait preuve de civisme et lui propose de descendre si c'est si grave, ""non amenez moi à ma destination mais je vais continuer à vous pourrir la vie. En plus vous promouvez ainsi l'oppression des Asiatiques et... Vous êtes asiatique? A quel point? Est-ce que vous êtes assez asiatique pour que votre avis importe? Donnez moi votre nom que je pourrisse votre vie sur Internet."" Alors que pendant ce temps, le pauvre chauffeur garde un calme assez olympien.

Du coup, quand Ismail parle de la violenter en règle... Est-ce parce que c'est une femme? Est-ce qu'il trouverait anormal le même traitement sur un homme? Indice, il a dit qu'un mec serait déjà à l'hosto ou dans le coffre si y faisait un quart de son cirque. Il raille également ce qui me semble être un homme par le clip ""You're a fucking white male"", no offense si je mégenre cette personne. Si la forme du Raptor est bien peu élégante et assez brute cela va sans dire et que tel un Cyrano je ferais bien observer qu'il aurait pu dire ça de bien des façons plus élégante, n'en reste pas moins que c'est pas de la misogynie vu que ce n'est pas le statut de femme qui est mis en cause mais l'attitude pédante et absurde d'une féminazi.

Et non je vais pas m'amuser à écrire des pavés de ce genre sur mon tel pour chaque accusation pourrie de ce genre dans ton ""recensement"" ou la page Wiki ou tout autre article de ce genre qui a pour seule conclusion en général ""le Raptor est un misogyne antisémite raciste homophobe d'extrême droite et il est suivi par une communauté de fachistes. Tout ceux d'ailleurs qui le défendent sont des fachos"" (résumé des tweets qui détractent le Raptor ou ceux qui le défendent dans les #BoycottNordVPN, c'est une généralisation, je dis pas que ton recensement cherche à spécifiquement conclure ça mais qu'on en est pas loin au final). Si pour toi, c'est ok de couper les apports financiers d'une personne pour la faire taire (mais c'est pas de la censure hein) de sorte à conforter un courant de pensée unique (oulàlà le grand ""ennemi politique"" qu'est le Raptor), je t'invite à lire des ouvrages qui montrent les bienfaits de ce genre de dictatorat de la bienveillance, type 1984 ou Ikigami. 

Sur ce, je te laisse dans ton petit monde. Ne cherche surtout pas à confronter et à t'intéresser au bienfondé d'idéologies différentes de la tienne, tu risquerais de développer des idées déviantes d'extrême droite après tout. Bonne soirée"
2020-06-03 15:10:27,capquintal,"C'est bien ce que je dis. Quand tu vois le bordel que c'est quand tu monte viteuf une taxe sur le diesel, je vois mal le ""peuple"" accepter de réduire massivement son niveau de vie et ses prestations sociales pour aller dans le sens d'une hypothétique protection apportée par la décroissance, quand t'as l'empire du milieu à côté qui à décidé d'envahir le monde. Je me vois pas defendre face à une invasion chinoise avec des vieux bambous et plus d'Internet.
 Sans le capitalisme , il sera impossible de maintenir le niveau de vie actuel mais aussi le niveau technologique. Les systèmes de santé seront plus au niveau, et de toute façon on pourra pas les financer. Sans parler de la fable du ""on peut créer des emplois sans croissance yaka diviser le travail"" en ignorant que la seule manière de faire ça a croissance stable , c'est du coup de baisser d'autant les salaires.
La décroissance, c'est juste un pari perdant sur le fait le reste de la planète va subitement arrêter d'être rempli de fils de pute juste parce qu'on à décidé d'être des hippies. 

Le seul problème écologique à court terme , c'est le niveau de CO2 produit par le monde. Au lieu de reduire nos ressources en misant sur le fait que le reste du monde fera pareil (spoiler : non.), on devrait les investir dans une transition vers du tout électrique propre et une meilleure isolation."
2020-06-03 14:45:46,dyonysos,"Il me semble reconnaître ce doux accent du Nord. 

""Chui une pute moa ?"""
2020-06-03 14:06:28,Kyomobiya,"Je comprends tout à fait ton point de vue, dans ce cas j'avoue que la phrase est compréhensible. Dans mon post je dénonce essentiellement l'usage de cette phrase sans nuance et pour avoir l'air cool. J'avoue que je n'avais pas songé à la réalité mais encore une fois je me refuse à foutre les flics tous ensembles dans le même panier, je ne vais pas réargumenter là dessus j'ai mon point de vue tu as le tiens et je pense qu'on est très proches d'être sur la meme longueur d'onde.   
Comme je l'ai dis plus bas je me suis déjà mangé des gaz, des coups de boucliers, etc... mais il ya énormément de flics en France et je peux pas croire que ce sont tous des fils de pute racistes et sadiques. Je pense à ceux et celles qui ont poussé ma meilleure amie à porter plainte pour viol par exemple. Fuck ceux qui t'ont mis en danger et qui t'ont menacé, fuck ceux qui se prennent pour des cowboys et qui savent pas faire la part des choses et qui se croient investis d'une mission.

J'avoue que je pense que j'aurais aussi pensé fuck le 17 si j'avais été à ta place... j'éspère que tu vas bien malgré tout ça. Les choses doivent changer du côté des flics ça ça fait absolument aucun doute par contre."
2020-06-03 10:36:41,cleverDonkey123,"Bouygues s'est mis à faire comme SFR, à savoir des ""upgrades"" non sollicitées des forfaits qu'il faut soi-même refuser. Je pense qu'une étude poussée serait à même de révéler que les marketteux derrière cette innovation sont en fait des fils de pute. À confirmer bien entendu."
2020-06-03 08:50:52,Sabba_Malouki,Est-ce qu'on dit fils *à* pute ? Non !
2020-06-03 07:34:35,asimovwasright,"&gt;Selon moi, la surfacturation dont parlent les médias Européens est un argument qui ne tient pas au vu des chiffres

Ils ne font que répéter les vieux arguments du patron d'arianegroup. Puis ça arrange tout le monde de penser qu'il y a forcément un coup de pute derrière la perte d'influence de l'EU dans l'espace.  

C'est confondu avec les lancements pour l'armée qui sont facturés plus chers mais 1) ne sont pas assurés 2) demandent beaucoup plus de boulot 3) doivent respecter une date de lancement. 

Il n'y a pas de subvention comme on l'entend en Europe. Et si SpaceX avait reçu 1$, Boeing aurait lancé un procès pour en recevoir 10.

Avant la NASA demandait à une boite privée de développer une fusée mais c'était la NASA qui était responsable des retards et surcouts alors que maintenant elle achète un service, les rôles sont inversés et ce n'est plus cette drôle de situation où c'était plus intéressant pour la boite privée d'enchérir petit sur l'appel d'offre, puis d'exploser les budgets et les délais vu que quoi qu'il arrive la NASA était obligée d'allonger et d'attendre.

Et depuis longtemps on sait qu'Ariane 6 sera dans le rouge avant son premier décollage et va y rester, ce n'est même plus un débat. 

Mais le peu que ça va couter pour équilibrer les comptes n'est rien comparé à un accès indépendant à l'espace, important pour la sécurité nationale. Celle de la France et celle des autres pays EU."
2020-06-01 17:56:35,rienquelaverite,"en réalité ça se fait beaucoup plus qu'on crois je pense, j'aurai pu le faire il fut un temps SI j'avais été dans la merde.  


si quelqu'un le fait il va pas le faire en mode frère lache une pomme fais pas ta pute, mais il va le faire discrètement du coup personne sera au courant ? :emojithinking:"
2020-06-01 16:45:08,rienquelaverite,"sérieux comment partir d'une relation de cul et la transformer en amitié / amitié plus. je suis juste incapable, dès que je baise direct ensuite c'est une relation semi sauvage.  
ça déclenche en moi le fait de plus avoir confiance, de me dire que c'est une fille facile et qu'elle va me manipuler (et c'est arrivé), etc.  


surtout quand la fille te relance 1000x, qu'elle veut plus que du cul, moi j'arrive pas dans le sens ou si c'est partit d'un sentiment de conquète animale je reste là dessus (pourtant, je voudrais ne pas rester là dessus, mais le soucis c'est que même en voulant, j'y arrive pas). donc des conseils / techniques, surtout que pour garder un peu de chasse gardé sur nos corps, le problème viens aussi qu'ensuite la fille va elle aller chercher du cul quand elle aura envie, et que ça continue en ambiance qui nique qui.  


j'essaye d'etre clair, je le suis peux etre pas, j'ai déjà réussis en posant les choses sur le long terme, mais quand les deux ont envie (de sexe), j'y suis jamais arrivé. pourtant, je veux me faire des amis, avoir le coeur-amitié le coeur-relation sociale, parce que ça me nique ensuite, quand la fille me parle etc, j'arrive pas a lui apporter la considération que j'apporte de base a une relation sociale saine.  


je sais qu'entre guillemet je dis ""c'est une pute"", mais c'est pas ça, enfin je pense que c'est pas facile, la preuve je veux changer les choses et j'y arrive pas : / (et je dis tout ça a 0% pour me la péter, j'ai déjà énormément souffert de ce type de relation, grosse dépression)."
2020-06-01 12:41:26,MapsCharts,Fils de pute*
2020-06-01 12:16:51,Zee-Utterman,Mhhhmmm Pute
2020-06-01 11:39:33,lulZghost_,FILS DE PUTE
2020-05-31 22:20:43,salpetre_gondole,"Effectivement, aborder les gens sur internet avec un ""supprime fils de pute"", ça brise les codes..."
2020-05-30 18:00:14,TraditionalTale,"Disons que si tu te débats pour éviter de te faire menotter en lâchant des ""fils de pute"", t'as de grande chance de pas être un honnête citoyen quand même."
2020-05-30 15:03:07,people-are-very-whor,"C est pourtant une bonne remarque de fils de pute, mais bon."
2020-05-30 13:04:20,IamHumanAndINeed,"&gt;""Wallah wallah ... bande de fils de pute""

La belle jeunesse comme on l'aime."
2020-05-29 19:25:00,AnarchyinGroland,"Enquete collégiale,  un consultant des forces de l'ordre, un representant associatif, monsieur tout le monde.

Mais bon dans un pays où la justice est devenue la pute de l'Elysée, on peut rever."
2020-05-29 15:00:42,AnarchyinGroland,"C'est quand meme drole de voir la presse des deux coté...

Et après yen a pour dire que la presse-pute n'exist point et que ""cay la libairtez d'opignons""."
2020-05-29 14:18:14,Peysh,"Le problème c'est pas tant le voile, après tout osef complet, chacun fait ce qu'il veut, c'est la pression sociale sur celles qui ne veulent pas se voiler et qui se font traiter de pute si elles ne se voilent pas.

Et pour celles là, le moins de voile il y a, et le plus c'est moqué, le mieux elles se portent. 

Il faut lire les journalistes algériens parler de la progression de l'islamisme dans les années 90, et comment ça s'est répandu, et de la pression insoutenable que ça a collé a celles qui ne voulaient pas. Dans leur famille, dans la rue, partout.

Parce que le voile ne vient généralement pas seul, c'est juste la pointe visible de l'iceberg du reste du lavage de cerveau. 

Alors je fais ma part, le voile c'est tout pourri.

edit : voir ou ils en sont [maintenant](https://www.elwatan.com/pages-hebdo/etudiant/le-hidjab-malgre-moi-14-02-2018)"
2020-05-29 06:11:33,CapriiiCestFiniiiii,"Je PUTAIN comprends que FILS DE PUTE ce genre de ENCULÉ pathologie puisse BITE COUILLE être pénible, étant moi-même JE T'EMMERDE atteint du TÊTE DE GLAND syndrome de Gilles de la Tourette."
2020-05-28 21:44:46,Mazertyui,"Est-ce que vous trouvez pas QUE LES GENS DE DROITE C'EST VRAIMENT DES GROS ENCULES DE FILS DE PUTE DE MERDE ET J'AI NIQUE LA FEMME DE MON PATRON CA LUI APPRENDRA A CE GROS PORC HAHA ! Achetez la k7 de mon spectacle aujourd'hui et recevez en bonus une photo dédicacée de Jack Lang ! 

Très très gros comédien par contre, faut juste pas que le texte soit de lui."
2020-05-28 20:37:54,RoxSpirit,"Ils ne reculent devant rien.

Ils vendront des Lego contrefait ces fils de pute !!!"
2020-05-28 17:26:02,jeyreymii,"La mort...

A LA PUTE !"
2020-05-28 17:24:48,6edf1sh,"La France à vraiment des grosses merdes en politiques , ça veut tout filmer le pays mais on baise son Froc quand on montre 4 fils de pute tabassé un mec pour rien , ça ferme les yeux sur les Gilets Jaunes mais on réouvre les Bars car un Humoriste Dépassé alcoolo de merde à envie."
2020-05-28 13:22:37,PurpleSteam,"Bah y'a quand même un consensus assez large au niveau des insultes.

Fils de pute, enculé, ACAB ca ne laisse pas trop de place à interprétation."
2020-05-28 07:56:09,televisionus,"Le whataboutism temporel : ah oui, X est un fils de pute aujourd'hui, mais Y a été méchant il y a un siècle et demi, alors hein bon."
2020-05-28 07:53:01,keepthepace,"Au cas où, fdp = ""fils de pute"" généralement sur le web francophone. On évite d'utiliser cet acronyme en général."
2020-05-27 23:19:24,Analbator,"Le rappel à l'ordre : une simple notification. Le rappel à l'ordre est tout simplement une injonction faite par un employeur à son salarié, qui l'enjoint de stopper le comportement qui est à l'origine des troubles au sein de l'entreprise. Contrairement à l'avertissement, il ne constitue pas une sanction disciplinaire.

Et oui j'en sais quelque chose sur le fait que ce n'est pas facile de s'interposer mais quand t'as un minimum de cervelle tu le fais pour éviter que les choses empirent. Là il allait pas sortir son flingue pour buter le collègue qui aurait retenu sa main, ils sont justes complices, comme le montre le coup de pied de petite pute une fois que le mec est dans la voiture."
2020-05-27 19:23:14,Sam_4_74,"Vous aurez l'obligeance de faire fi de mon langage peu châtié, mais quel énorme fils de pute qu'est ce damoiseau"
2020-05-27 17:27:12,zeanphi,Ah la pute.
2020-05-27 16:21:18,xroche,"&gt; La confiscation de leurs biens est confirmée, avec une disposition particulière pour leur résidence du moulin de Giverny (Eure) dont une quote-part devra être restituée à leurs enfants, nus-propriétaires

Je sais pas vous mais moi j'aime pas trop les voleurs et les fils de pute."
2020-05-27 12:09:34,ahmetakkus,Et bim! Et ca rentre fils de pute!
2020-05-26 14:31:41,YamaJii,"&gt; il y a souvent un contexte qui explique le geste

alala el famoso contexto, cette semaine j'ai vu une video d'un policier mettant des coups de pied dans le CRANE d'un homme a terre qui ne resistait pas, explique moi quel contexte justifie cela? Quel contexte justifie d'avoir 4 policiers sur un homme au sol déjà menotté? C'est hulk? et je parle meme pas de toutes les derives pendant les gilets jaunes.

&gt; il y a une enquête et une sanction

faux. L'IGPN n'a quasiment jamais condamné, il y a qu'a voir les fils de pute de poulets coupables des affaires theo et adama, ou encore ceux qui ont éborgnés le gilet jaune, et je parle meme pas de benalla.

C'est une mafia ils font partie de la meme famille.

&gt; D'autres part il faut savoir que les violences envers les policiers sont beaucoup plus nombreuses que les violences de la part des policiers.

des stats? Surtout que les violences policières commencent a peine a etre filmees mais pour 1 de filmée qui fait le buzz t'en a 50 silencieuses, y'a qu'a voir le comportement de ces petites salopes lorsquils ont dit a un individu ""qu'il ferait mieux de se noyer le bicot"".

Bien sur tout ca c'est quand on est équipé et avec les collègues hein en jour de repos on fait profil bas et on baisse gentiments les yeux tel le bon toutou qu'on est.

Mais quand bien meme il y aurait plus de violences de citoyens envers les policiers que vice-versa, c'est quand meme pas une raison en fait, y'a un code des procedures et une justice et ils doivent etre respectes un point c'est tout y'a aucune tolérance à avoir. Un mec te manque de respect? Tu le menotte, l'emmene en GAV puis laisse la justice faire son boulot, c'est pas à toi de l'administrer toi-meme selon tes emotions de l'instant sinon ca devient l'anarchie en fait"
2020-05-26 13:36:13,ljog42,"Vrai nom, mais j'ai systématiquement bloqué les différents partages d'information (adresse, numéro de tel, anniversaire etc...) ajoutés au fil des années, là j'étais passé en compartimentage Firefox, j'ai des bloqueurs de trackers dans tous les sens et j'ai désactivé manuellement tout ce qui pouvait l'être.

Je me demande si FB forcerai pas des désactivations pour pousser les gens à ""valider leur compte"" avec des infos personnelles, j'ai du leur envoyer mon numéro de téléphone pour faire appel de la décision par exemple...

Il y a la loi Avia qui vient de passer aussi, pas mal d'activistes LGBT ou travailleur/ses du sexe qui voient leur compte sauter parcequ'ils utilisent des mots comme ""pute"" ou ""pédé"" mais ce n'est pas mon cas. Le dernier com un peu polémique que j'ai envoyé c'était ""le confucianisme c'est bien myso quand même"" on est loin du Sieg Heil

Pas partagé de contenus piratés non plus"
2020-05-24 18:03:02,HHWKUL,Le type il se fait jeter comme une pute en début de mandat et là il accepte de revenir ?  Il est accro le pauvre.
2020-05-24 15:56:03,rienquelaverite,"le pire c'est que oui dans les deux sens.. le mec me l'a apporté et monté chez moi, et c'était fils de pute inclus (il s'est comporté comme un fils de pute du début a la fin)"
