date,author,text
2022-12-01 19:51:32,Flat-Neighborhood-55,Tu as oublié la trainée de merde des calanques de Cortiou et les boues rouges mais sinon c est pas mal.
2022-11-30 18:27:35,StupLapinou,"&gt; l’histoire larmoyante dans laquelle le très courageux papa d’une adorable petite fille est abandonné par sa traînée de femme du jour au lendemain car en fait elle le trompait, avant qu’elle ne revienne 10 ans plus tard pour le supplier de lui redonner une chance car sa famille lui a terriblement manqué ! Mais le courageux papa (qui a affronté toutes les épreuves de la vie) (et dont la fille est forcément éveillée et aimante) la voit pour ce qu’elle est (une horrible traînée qui n’a en fait pas de remords), et contre le déluge de sentiments qui l’envahit, repousse courageusement cette immonde prostituée car il ne pense qu’au bien de sa fille, fille qui d’ailleurs refuse tout contact avec sa mère ! 

Putain ma vie est un copy pasta de reddit 

Enfin c'est pas exactement ça mais ça y ressemble quand même, je dois bien le reconnaitre"
2022-11-30 14:44:15,PMMeYourSteamBacklog,"Tu peux calculer le nombre de tours complets de reddit que tu as faits en comptant le nombre de fois où tu es tombé sur les deux ~~exercices créatifs~~ sujets suivants : 

-	“My(18F) boyfriend (42M) [inserér menace de rupture si “elle” n’accepte pas une demande de truc sexuel outrageant avec à la fin “je ne sais pas quoi faire, dois-je accepter 5 partouzes par semaine ? Je l’aime tellement mais je suis perdue ! On vient de fêter nos 10 ans ensemble”]

-	une nouvelle variante de l’histoire larmoyante dans laquelle le très courageux papa d’une adorable petite fille est abandonné par sa traînée de femme du jour au lendemain car en fait elle le trompait, avant qu’elle ne revienne 10 ans plus tard pour le supplier de lui redonner une chance car sa famille lui a terriblement manqué ! Mais le courageux papa (qui a affronté toutes les épreuves de la vie) (et dont la fille est forcément éveillée et aimante) la voit pour ce qu’elle est (une horrible traînée qui n’a en fait pas de remords), et contre le déluge de sentiments qui l’envahit, repousse courageusement cette immonde prostituée car il ne pense qu’au bien de sa fille, fille qui d’ailleurs refuse tout contact avec sa mère ! Et à la fin ils vont voir le psy ensemble. 

Sinon y’a aussi ce truc que j’ai pas vu depuis longtemps, une capture d’écran d’un twit genre “ce matin mon fils ne voulait pas aller à l’école car il était fatigué. Message reçu ! Aujourd’hui c’est ciné et macdo, car même les enfants ont droit d’être fatigués et d’avoir un break”, aussitôt suivi par 50k haut-votes et un déluge de “OMG SUCH A GOOD MOM !!!”. 

J’ai trop traîné par ici."
2022-11-30 01:47:39,gotchock,"Sans parler du top 200, un de mes meilleurs amis d'école d'ingénieurs a grandi dans une famille séparée d'ouvriers, à se faire à manger tout seul le soir et à être boursier.

Brillant élève, il a enchaîné des stages + traînee programs dans une grande multinationale automobile avant même d'être sorti d'école d'ingénieur (il s'était démerdé pour caler des cours l'après midi et bossait le matin dans sa boîte). Aujourd'hui il est pas millionnaire, mais a déjà acheté une maison à sa mère, gagne très, très bien sa vie comparé à tout le reste de la promo. Un pur self made, brillant."
2022-11-28 08:39:33,Chapalyn,"Le probleme du Cx c'est que c'est juste ""la forme"", ca ne donne pas toute les info sur l'aerodynique. Genre 2 voitures avec la meme forme auront le meme Cx, mais si une des 2 est plus grosse (de partout), elle aura une trainée plus gross (Cx fois ""aire du devant"")"
2022-11-22 14:25:48,Le_Poufre_Bleu,"# Climat – Analyse : Jets de peinture et de soupe sur les œuvres d’art : « Ça vous choque ? Tant mieux ! »

Statue aspergée de peinture ce vendredi à Paris, jets de soupe et collages de mains ou de visages sur des tableaux : depuis des mois, des activistes du climat perturbent les grands musées internationaux. Est-ce si ridicule, alors que les gouvernements continuent d’échouer à mener les politiques nécessaires ?

*«L’écovandalisme monte d’un cran. »* C’est par cette déclaration scandalisée que la ministre de la culture Rima Abdul-Malak [a dénoncé](https://twitter.com/RimaAbdulMalak/status/1593608361236480007), vendredi 18 novembre, le jet de peinture orange, devant la Bourse de commerce à Paris, sur une sculpture de Charles Ray, figure majeure de l’art contemporain et protégé de François Pinault, propriétaire du musée.

*« Art et écologie ne sont pas antinomiques. Ce sont au contraire des causes communes ! »*, a ajouté la ministre, remerciant les employés s’affairant déjà à faire disparaître toute traînée orange sur ce *Horse and Rider*.

L’action [a été revendiquée](https://twitter.com/derniere_renov/status/1593578043083194370) par le collectif écologiste Dernière Rénovation, dont les militants se mobilisent depuis plusieurs semaines en France en bloquant des routes et en interrompant des spectacles ou des rencontres sportives. Le collectif indique faire partie du réseau [qui multiplie ces dernières semaines](https://www.mediapart.fr/journal/ecologie/061122/l-activisme-ecologiste-cree-un-malaise-dans-les-musees) les actions-chocs, notamment dans les musées, pour dénoncer l’inaction climatique des gouvernements.

Non que l’idée soit nouvelle pour les militants du climat. Décembre 2016. Un jet de liquide noir s’écrase sur l’un des plus célèbres tableaux de Vincent Van Gogh, *Tournesols*, exposé à Amsterdam dans le musée qui porte son nom. Personne n’assiste à l’outrage mais une vidéo intitulée *« Blackout Shell »*, du nom du groupe pétrolier anglo-néerlandais, montre quelques secondes de l’action, en noir et blanc, dans un hurlement lancinant de sirène.

Le film s’achève sur un slogan : *« L’art sponsorisé par le pétrole ne vaut pas la peine d’être vu. »* À l’époque, Royal Dutch Shell finance la prestigieuse institution culturelle. Un mécénat contesté par les activistes regroupés derrière la bannière [*« Fossile Free Culture NL »*](https://fossilfreeculture.nl/intervention/blackout-shell/) (*« Culture libérée des hydrocarbures Pays-Bas »*).

En réalité il s’agit d’un canular : personne n’a jeté de faux pétrole sur l’œuvre d’art. La provocation est restée au stade du trucage vidéo. Mais après quelques années de campagne pour bouter l’argent pétrolier hors des musées, les activistes obtiennent gain de cause. Désormais, à Amsterdam, le Rijksmuseum, les musées Van Gogh, le Stedelijk, ainsi que la salle de concert municipale, [n’acceptent plus de mécènes](https://www.mediapart.fr/journal/ecologie/191122/%C2%A0%20https://www.museumsassociation.org/museums-journal/news/2020/09/amsterdams-museum-quarter-free-of-fossil-fuel-sponsorship/#) liés aux hydrocarbures.

14 Octobre 2022, National Gallery de Londres. Deux militantes du collectif Just Stop Oil déversent deux boîtes de soupe de tomates sur une autre version des *Tournesols*. *« Qu’est-ce qui a le plus de valeur ? L’art ou la vie ? Est-ce que ça a plus de valeur que la nourriture ? Que la justice ? Êtes-vous plus préoccupés par la protection d’un tableau ou par celle de la planète et de ses habitants ? »* Les images des deux activistes collant chacune leur main au mur pour signer leur méfait, et brandissant des canettes de soupe Heinz, enflamment les réseaux sociaux.

En Grande-Bretagne, Just Stop Oil gagne en quelques heures une notoriété phénoménale et un déferlement de critiques : *« Vous vous trompez de cible »*, *« Vous ne cherchez que le spectacle et le buzz »*, *« Vous faites fuir les gens »*, *« Vous êtes narcissiques et inutiles »*. En France, des journaux conservateurs titrent sur *« les bouffons du climat »*, ou *« quand l’écologie se saborde »*.

Six ans se sont écoulés entre les deux actions. Le désastre climatique s’est aggravé à tous les points de vue – gaz à effet de serre, canicules, sécheresses, mégafeux, inondations. Les stratégies des activistes en prennent acte et évoluent. En 2016, ils ciblent un coupable de complicité avec le crime climatique, le musée qui accepte l’argent sale du pétrole. En 2022, ils utilisent l’œuvre d’art comme ressort de scandale pour envahir les médias avec leur message : *« Juste en finir avec le pétrole ! »*

Alors que la COP27 à Charm el-Cheikh [peine dans ses dernières heures à trouver un accord](https://www.mediapart.fr/journal/international/dossier/cop27-l-urgence-d-agir) pour aider les pays pauvres à se protéger du désastre climatique, remettre du scandale dans la routine diplomatique du climat ne peut, *a priori*, que réjouir.

Mais chercher à choquer le public et à provoquer les médias présente-t-il le moindre intérêt pour contrer le dérèglement climatique ? Tout ce tumulte peut-il servir aux communautés touchées par la catastrophe ? Ou se résume-t-il à l’écume d’un buzz que le capitalisme industriel va digérer avec gourmandise ?"
2022-11-19 15:57:10,Elegant-Variety-7482,"&gt;Le soucis c'est si tu trompes des gens ou que tu abuses de ton pouvoir.

Ses ex parlent ""d'emprise"". Le fait d'être YouTubeur célèbre doit évidemment influencer sur son comportement. 

&gt;Mais en tout ça rien d'illégal ou de répréhensible a avoir une vie sexuelle remplie ou diverse. Des tas de gens ont pleins de relations sexuelles multiple et rien est anormal c'est pas le bon combat / axe d'attaque

Ah mais grand bien leur fasse. Par contre si derrière le chemin ton Dom Juan il laisse une trainée de témoignages le décrivant comme un manipulateur, bon, tu peux commencer à te poser des questions.

Il s'agit pas ici de faire son procès mais d'échanger sur ce qu'on pense de son plaidoyer. Il se met lui-même en posture de jugé avec ce format.

Verdict : je gobe pas sa pillule."
2022-11-19 15:06:20,ToineMP,"Petit truc débile, ça modifie la traînée, pas le cx qui lui est constant. La traînée étant 1/2 x rhô x Cx x V2"
2022-11-16 11:48:45,Mohrsul,"En avançant le bateau se crée son propre vent. C'est la même chose quand on court ou qu'on roule à vélo par exemple. Ce vent ""vitesse"" s'ajoute au vent ""réel"" pour donner le vent ""apparent"". Les bateaux de course comme celui de Caudrelier sont tellement performants (comprendre rapport poids/puissance et diminution des efforts de traînée indésirables) qu'ils arrivent à se créer un vent ""vitesse"" important et donc aller plus vite que le vent ""réel"". Dans le jargon on enlève les guillemets parce qu'on les appelle vraiment comme ça."
2022-11-11 16:53:18,paodealho,"J'ai trois idées:

1 - J'ai jamais vu dans cette zone, mais normallement ce type de protuberence existe en rétro pour réduire la cohèrence des structures aérodynamiques et tuer les sources de bruit du type tonal/sifflement qui peuvent être géneré dérrière des obstacles de ce type et beaucoup gêner les passagers. C'est le même principe de l'spiral autour de l'antenne.

2 - C'est possible aussi qu'il soient des génerateurs de vortex (normallement ils ont des formes triangulaires, mais on sait jamais) mis là pour déclancher de la turbulence et ainsi réduire la traînée aérodynamique, grossièrement comme les trous dans les balles de golf. C'est le même principe physique que l'option 1 mais avec une autre motivation.

3 - 1 et 2."
2022-11-11 14:53:02,Mohrsul,Si c'est un dispositif pour éviter les tourbillons d'air c'est surtout pour des raisons acoustiques que de réduction de la traînée.
2022-11-11 10:31:14,bokrass,"&gt; option ""généreuse"" a +2-4€

Ouch ça s'est répandu comme une traînée de poudre ce genre d'aberration, la stratégie devient parfois d'avoir un plat pas assez copieux pour prendre les menus coloris qui grimpent, qui grimpent...

Le plus édifiant pour illustrer ça c'est les tickets restaurant. Avant... Ça payait le restaurant du midi. Maintenant je paie la moitié d'un restaurant. Ou du fast food pas bon."
2022-11-02 18:52:22,Practical_Engineer,"1) Tu ne remplies pas un dirigeable moderne à l'hydrogène. Sérieusement personne propose ça depuis 1936.

2) La trainée aérodynamique augmente en fonction du carré de la vitesse, si tu as une vitesse faible ce n'est plus tant que ça un problème.

3) Le dirigeable de flying whales est prévu pour faire de longues distances à vitesse faible pour transporter des marchandises et est donc dans le cas où l'avantage vient au dirigeable."
2022-11-02 17:32:36,thecuboide,Non un dirigeable a une efficacité énergétique plus faible qu'à peu près n'importe quel moyen de transport. Tout simplement parce que l'immensité de sa voilure fait que sa traînée aérodynamique est monumentale. En plus a cela il faudrait ajouter une quantité d'électricité titanesque pour faire de l'hydrogène vert pour le remplir.. hydrogène que l'on pourrait utiliser pour faire directement fonctionner des avions autrement plus rapides et efficaces
2022-10-28 17:48:41,asimovwasright,"Les Russes ont spécifiquement menacé Starlink. (ce qui montre bien la stupidité vu que spacex peut envoyer des satellites plus rapidement que la Russie fabriquer des missiles)

Que des orbites basse (500km) qui sont nettoyés en 5 ans max [rien que par la trainée](https://i1.wp.com/scng-dash.digitalfirstmedia.com/wp-content/uploads/2020/01/altitude-2.jpg).

Le syndrome de kessler est bien plus compliqué à déclencher que le résumé hollywoodien qu'on voit souvent

Et le GPS à 20000km n'est pas du tout visé"
2022-10-28 10:43:34,Pelm3shka,"Première expérience : ma mère qui se fait arrêter en voiture car elle avait coupé une route de campagne au lieu de faire le tour du rond-point alors qu'il n'y avait personne. J'avais ~5 ans, et a priori j'étais persuadée que la police allait l'emmener en prison et que je ne la reverrais jamais, je pleurais tellement dans la voiture qu'ils ont abrégé (mais quand même donné l'amende).

À 19 ans, je me suis faite agresser dans la rue tôt en allant à l'université (vol avec violence, deux hommes m'ont étranglée avec une clef de bras, trainée à l'écart dans une ruelle, je ne pouvais plus respirer pendant un temps qui m'a paru extrêmement long, j'ai un doute sur le fait de m'être évanouie, mais je pensais que j'allais mourir comme ça, puis un passant a dû les faire fuir, ils ont quand même pris mon sac de cours...). Le commissariat de Lille a refusé mon dépôt de plainte quand je suis arrivée à pied plutôt choquée et à peine en état de parler (je me tenais la gorge), parce que je n'avais pas ma carte d'identité que je venais de me faire voler.
Le commissariat de Villeneuve d'Ascq a refusé 2 fois mon dépôt de plainte ce même jour car il me manquait d'abord mon numéro de carte bancaire (volée), la copie de ma carte d'identité, puis le numéro IMEI de mon téléphone aussi volé.
Quand ils ont enfin accepté de me recevoir vers 14h-15h (agressée à 7h), j'avais grâce à la gentillesse de l'accueil de ma résidence crous pu accéder à ma chambre étudiante pour aller sur mon pc récupérer tous les documents nécessaires, et j'avais notamment fait une copie de la localisation en temps réel de mon téléphone volé. Ils ont refusé de s'y rendre (le commissariat) et m'ont dit d'appeler le 17. J'ai été moi-même sur place et me suis rendue compte que c'était un camp de rom de genre 50 caravanes en plein milieu du campus, donc je ne suis pas allée jusqu'au bout ^^' J'ai appelé le 17 en leur expliquant la situation, ai attendu à côté de la cabine téléphonique pendant au moins une heure la patrouille, en demandant l'heure de temps en temps aux passants qui ont dû me prendre pour une SDF. Quand la patrouille est arrivée, ils ont compris qu'à deux ils n'iraient pas dans le camp, donc ils m'ont demandé de descendre de leur véhicule, m'ont dit qu'ils ne pouvaient rien faire et sont partis.
Quand vers 17h je suis enfin retournée vers ma chambre étudiante, le directeur de l'université à qui le crous avait remonté l'information est la première personne à m'avoir proposé d'appeler ma mère (J'étudiais à 6h~ en voiture de chez mes parents).

J'ai oublié : la 3ème fois au commissariat de Villeneuve d'Ascq, en salle d'attente, je me souviens qu'il y avait un poster sur les violences conjugales. La seule autre femme avec moi, la 30aine, avait un œil au beur noir. Elle a été reçue un peu avant moi à l'accueil, et de loin j'ai entendu ""si vous le quittez pas vous voulez qu'on fasse quoi"", j'ai cru comprendre que c'était pas sa première visite. Elle est repartie sans être reçue dans un bureau, donc ils ont dû refuser sa plainte aussi.

Voilà mon expérience de la police l'OP, j'espère que ça répond à ta question."
2022-10-23 09:57:15,radioactive_glowworm,"Putain je me suis fait traînée à Catane lors d'un séjour UCPA passé à crapahuter sur les volcans de Sicile et à visiter des petites villes sympas sur l'île, je sais pas pourquoi mais j'ai été en malaise total toute la journée."
2022-10-19 08:45:55,SophieBio,"Je ne ferais absolument rien de visible. Je n'ai pas envie d'être traînée dans la boue à la moindre occasion. Bains publics ? En pleine crise climatique et énergétique, et que les piscines ferment, cela serait décrié fortement et ferait un scandale, type « trajets en avion des milliardaires ». Même, des financements de la recherche en médecine serait critiqué fortement. Rien n'est jamais assez, tout en étant trop et en étant pas fait correctement.

En fait, tout ce que tu ferais de visible serait hautement critiqué, peu importe quoi. Donc, je vivrais sous les radars sans trop attirer l'attention.

Vivons heureux, vivons cachés."
2022-10-14 17:16:36,V0uges,"Je me suis traînée à la boulangerie et ai acheté un pain de mie pour la soirée croque-monsieur. C’est un bordel à couper et préparer car le pain est brioché mais bordel, qu’il est bon. J’aurais du en prendre un deuxième à grignoter devant la télé ce soir. No ragrets."
2022-10-11 16:29:32,Saezher,"La largeur et la longueur , ce sont des dimensions critiques pour l'espace en ville.

Largeur et hauteur , c'est critique pour l'aérodynamique et l'efficience énergétique .
Une certaine longueur peut même servir a une meilleur aéro (moins de traînée )."
2022-10-04 17:43:31,Snyourk,Il manque la fin a partir de 9:50 sur la vidéo qui est vraiment le summum de l'immonde quand les connards qui viennent de mitrailler la voiture se donnent même pas la peine de faire semblant de porter secours à la passagère qui s'effondre dans la rue après être sortie de la voiture toute seule et s'être trainée jusqu'à la barrière la plus proche avec une tâche de sang dans le dos assez énorme pour être visible sans ambiguité sur une caméra de téléphone à 20m de nuit...
2022-09-28 06:01:26,Sulfamide,"Tu imagines quoi comme scénario ?

Moi j’imagine le scénario suivant :

Khadija a mis le voile toute sa vie depuis ses 12 ans. Elle se rappelle le jour où son père l’a vue ne pas le remettre en sortant du lycée. Ce jour-là son père l’a traitée de pute qui se fait baiser par des Français, et lui a peut-être mis une claque, elle se souvient plus très bien. Depuis son voile ne la quitte plus. C’est le sien et elle l’aime, parce que elle, c’est pas une pute, et elle se fera jamais baiser, encore moins par un Français ! De toute façon elle a pas vraiment une âme de rebelle contre ses parents parce que sa mère lui a toujours dit qu’une fille qui veut aller au paradis doit être obéissante et bonne aux tâches ménagères. 

Elle fait un bon bac ES, elle aime bien ses copines et elle pense pas plus que ça à leurs tenues légères, et elle est amoureuse de son prof d’histoire-géo depuis le jour où ils ont fait une activité sur le mouvement des suffragettes. Elle sait pas si c’était à cause de ses yeux bleus, sa voix grave, ou la fierté qu’elle avait ressentie pour ces femmes qui avaient arraché le droit de vote aux chiens d’Anglais. En revanche elle trouve que sa prof de philo est vraiment une traînée et c’est sûr qu’elle ira en enfer parce qu’elle veut être l’égale des hommes. 

À la télé, on parle beaucoup des amalgames qu’on fait sur les musulmans. On en avait parlé un jour en philo, mais entre les gens de la classe, de toute façon cette pute de prof de philo n’a pas d’autorité et elle dit que de la merde. Puis le débat a continué pendant la récré. Hugo il va voter Le Pen. C’est un con mais elle s’en fout, tous les français traitent les arabes de terroristes de toute façon.

Elle passe sa licence. Elle pense plus vraiment aux Français. Elle croit pas non plus que tout le monde la prend pour une terroriste. Elle aimerait bien montrer Rachid à sa maman parce qu’il est gentil avec elle et doit vraiment se marier. Un jour tout le monde parle de Charlie Hebdo. Elle voit passer une caricature moche où on voit un homme maigre avec une étoile au milieu des fesses. Elle avait jamais pensé au fait que les hommes avaient un trou du cul, c’est drôle. Pareil pour les couilles vues de l’arrière. À la télé, une petasse à lunettes avec un décolleté de pute explique que les caricatures du prophète sont une attaque envers les musulmans. Elle rage contre ces français qui osent montrer les couilles du prophète (sala lahu 3alaihi wa salam). Elle rencontre sa copine Vanessa qui porte un très joli short vert pâle (c’est sa couleur préférée) et lui en parle pour partager un peu sa rage. Vanessa lui dit qu’en plus « on a même pas le droit de représenter le prophète en image, n’est-ce pas ? ». Elle lui répond ouais, même si elle savait pas. Mais maintenant sa rage est une colère ancestrale. Évidemment qu’elle savait ça elle avait juste oublié…

Elle va se marier avec Rachid. Vanessa n’est pas invitée. Elle connaît presque tous les invités, mais juste de nom. Elle se dit que ses copines de quand elle était étudiante ne sont pas là. Heureusement, t’imagines Vanessa avec ses tenues de putes ici ? Qu’en penseraient les autres ? De toute façon c’était pas une bonne fréquentation.

Tu valides le scénario ?"
2022-09-28 00:07:06,jayma_ks,"Le narratif russe s'installe déjà (même sur ce topic d'ailleurs): ""c'est les US qui ont fait ça"".

Suffit de regarder la trainée de troll russophiles dans les commentaires d'une vidéo aléatoire sur le sujet:

https://www.youtube.com/watch?v=MMkOLJPTJAA"
2022-09-25 09:29:49,F-b,Pour info la jeune femme qui parle à la fin c'est la même militante qui s'est faite traînée parterre durant la conférence de presse de Le Pen durant le second tour. Pauline Rapilly Ferniot. Je suis fan !
2022-09-21 21:11:50,Le_Grand_Dadais,"So. There are two problems with your situation.

The first is, you cannot obtain a ""visa de long séjour"" from France. As a general rule, you enter a country with a purpose and leave when this purpose is finished. You are currently in France for sightseeing purposes (90 days max). You cannot request an extension on that, you have to apply for a completely new visa. Which is why **you need to be in your country of residence to apply**. So to obtain a proper visa, you need to go back to the USA.

The second problem is, to obtain the ""long term stay"" visa, you need to justify the reason for your stay. In your case, the *au pair placement agreement* (https://france-visas.gouv.fr/en/web/france-visas/trainee-caregiver). So you need the family and you to have a proper agreement, that you will give as justification for your stay.

As a final note, the process is the same for whichever nationality except those in the European Union. So unless this family has had only EU au pairs, they are messing with you. Well, seeing that you are in an irregular situation, I assume that you do not get the legally required 320€ per month stipend from the family? Or the required 1 free day a week?"
2022-09-16 22:47:39,Perokside,"Suffit de regarder comment ça se passe dans les autres pays, genre aux Pays-Bas ou les mineurs qui veulent ""tester par curiosité des trucs interdits"" se tournent vers... des dealers de rues, ou ceux qui veulent économiser comparé aux prix des coffees et se tournent vers... des dealers de rues.  

Le fameux argument de la fumette ""drogue passerelle"" vers des substances plus fortes et addictogène c'est surtout le non-sens propagandesque des Etats-Unis avec leur fameuse ""war on drugs"" qui s'est répandu comme une trainée de coke dans le reste du monde occidental.  

De la à croire que si on légalise, les ""djeunz rebelles qui veulent dire Fuck à l'autorité"" vont se mettre à aller topper de l'héro ou du crack, faut être matrixé à un niveau que ces mêmes drogues ne t’amènes pas."
