date,author,text
2020-04-02 08:01:50,MadensFork,"Confinement : pourquoi beaucoup de femmes pensent être enceintes
Pixabay
5-6 minutes

Depuis le début du confinement, nombreuses sont les femmes qui croient être enceintes parce qu'elles n'ont plus leurs règles. Pourtant, ce retard des menstruations n'est pas forcément signe de grossesse. Il est surtout une conséquence de bouleversements vécus en cette période anxiogène. Explications avec une gynécologue. 

""Bébé en chemin "". Depuis le début du confinement en réaction à l'épidémie de coronavirus, ce message circule comme une traînée de poudre sur les réseaux sociaux. Beaucoup de femmes confinées pensent être enceintes en ce moment. En cause : un retard voire plus du tout de règles. Sur Twitter, beaucoup d'internautes s'en sont émues, et inquiétées.

    J’ai une semaine de retard pourtant je risque pas d’avoir une qqlconque grossesse je comprend pas la
    — p’tit biscuit (@AladiiiiiiiiN) March 24, 2020

    Confinement jour 7: mes règles se sont confinées elles aussi j'ai 3 semaines de retard youhou
    — לאה mireille-djenteuse (@wrinklemaze) March 22, 2020

    Bon faut m’expliquer pourquoi toutes les meufs mettent dans leurs stories « bébé en chemin »
    — mld twenty (@mld_75) March 24, 2020

    mes regles ont du retard tant mieux elles font le confinement aussi
    — ???̈?? \u25e1̈⁷ (@galaxyIoki) March 23, 2020

À tel point qu'Ovidie, la réalisatrice féministe, a publié un sondage sur son compte Twitter : "" Depuis la pandémie vos règles sont comme d'habitude, décalées ou ont carrément disparu ?"" Si 60% de femmes ont répondu qu'elles continuaient d'avoir leurs règles normalement, 40% ont en revanche des règles perturbées depuis le début du confinement.

    Pour le moment les réponses sont vachement intéressantes. Moi elles ne viennent pas. Et visiblement et on est quelques unes à ne plus être réglées...
    — Ovidie (@Ovidieofficiel) March 26, 2020

Une anomalie de fonctionnement

Mais quel est le rapport entre le confinement et les menstruations ? Une explication assez simple et on ne peut plus sérieuse. ""Les traumatismes vécus ont toujours perturbé le fonctionnement ovarien chez les femmes. C'est parce que la région du cerveau qui gère les émotions est située très près du complexe hypotalamo-hypophysaire qui commande le cycle ovarien, ainsi, quand une femme vit un choc, une angoisse ou un bouleversement notable, ses règles s'en retrouvent souvent affectées"", note Suzanne Dat, gynécologue à l'hôpital de Moissac et présidente du collège de gynécologie du Midi. Selon la professionnelle, c'est parce que le confinement peut être vécu comme ""quelque chose qui isole de la vie relationnelle, c'est la solitude, la privation, le manque et la frustration"" qu'il est source d'un désordre psychologique. 

Que les femmes qui ont un retard se rassurent : ""C'est une anomalie de fonctionnement et non pas une lésion"", précise la spécialiste. Par ailleurs, si chez certaines patientes, les règles disparaissent simplement sans qu'il y ait une grossesse, chez d'autres patientes qui ont du mal à avoir un enfant, un bébé peut se mettre en route, un peu par miracle : "" Le traumatisme psychologique peut aussi engendrer une grossesse chez certaines femmes qui ont un problème de fécondité, le traumatisme peut ainsi jouer en leur faveur"". 
""C'est comme si mon corps ne pouvait pas gérer plusieurs choses à la fois""

En revanche, rien ne permet de prouver un quelconque rapport entre le coronavirus et les menstruations. ""Le virus a un tropisme purement alvéolaire, il n'affecte pas le système digestif, ni rénal, je ne vois pas en quoi il pourrait agir sur la commande ovarienne, ce n'était déjà pas le cas avec le H1N1"", ajoute Suzanne Dat qui s'attend à recevoir beaucoup de demandes d'IVG pendant et après le confinement. 

Véronique est enseignante en Seine-Saint-Denis. Elle a eu les symptômes du coronavirus et confirme qu'il n’y a pas eu d'incidence sur ses règles directement. Mais un retard de quatre jours, lié au bouleversement émotionnel. ""J'attendais mes règles le 20 mars, à ce moment-là je n'avais plus de symptômes, pourtant, elles ne sont apparues que le 24 mars, donc bien après la fin de la gêne respiratoire et des gargouillis dans l'intestin"", remarque-t-elle. ""C'est comme si mon corps ne pouvait pas gérer plusieurs problèmes en même temps, j'avais déjà connu ça quand j'avais eu l'appendicite à 35 ans, mais à cette époque, je n'ai plus eu mes règles pendant un an, le temps que mon corps se remette de l'opération"", se souvient l'enseignante. 

Bébé ou pas, il y a en tout cas fort à parier que les tests de grossesses risquent de s'écouler comme des petits pains."
2020-03-30 10:47:51,atjoad,"&gt; Une des théorie qui tient la corde sur l'apparition de ce nouveau virus est la réduction drastique de l'espace accordée eux espèces sauvages et leur mélange et contact de plus en plus fréquent avec des humains qui entraînent de plus en plus de transmission animal/homme. Donc, on peut voir sa phrase comme une manière un peu poétique de présenter cette théorie, loin du new age et autre

Le coronavirus d'aujourd'hui, c'est de la rigolade à côté de la peste noire qui a exterminé la moitié de la population européenne, sans même parler du choc épidémiologique provoqué par l'arrivé des Européens, qui a exterminé plus de 90% des populations Amérindiennes. Tout ça trouve racines il y a plus de dix millénaires, avec la domestication des espèces et les débuts de l'agriculture. 

On remonte jusqu'à où ? Il y a un million et demi d'années, l'apparition d'Homo Erectus, son alimentation carnivore assez inédite parmis les grands singes couplée à ses talents de bricoleur de divers instruments de mise à mort ont été un désastre pour la méga faune africaine. Lors de ses sorties successives d'Afrique, l'être humain s'est rependu comme une traînée de poudre à travers le monde. La motivation principale ? Le gibier de chasse, qui disparaît à peine après quelques générations. Parmis les mythes les plus anciens de l'histoire de l'humanité, on trouve le thème majeur de la disparition des animaux, que l'on vient à déifier et à implorer de revenir ... Il y a fort à parier que c'est cela qui se joue sur les parois de Chauvet et de Lascaux. 

L'humain est une espèce invasive ? Et un virus, alors ? La singularité fondamentale de l'humain face au reste du monde, ce n'est pas le potentiel de destruction, mais (jusqu'à preuve du contraire) la capacité à culpabiliser ...

""La nostalgie du paradis, c'est le désir de l'homme de ne pas être homme"" - Milan Kundera"
2020-03-22 14:14:53,latournequitete,C’est un **crime de guerre**. La république tchèque doit être traînée devant la CPI.
2020-03-18 09:54:30,Vahron,"&gt; Dans ce pays, où les commerces et transports n’ont pas été fermés, l’épidémie a été maîtrisée grâce, notamment, au civisme de la population, en contraste avec l’atmosphère de panique en Occident, observe, dans une tribune au « Monde », Christophe Gaudin, universitaire français en poste à Séoul.

&gt; Tribune. Dans son Essai sur le don, paru en 1923-1924, l’anthropologue Marcel Mauss (1872-1950) forgeait un concept devenu célèbre, celui de « fait social total », dont il se servait pour cerner un certain ordre de phénomènes qui, disait-il, « mettent en branle dans certains cas la totalité de la société et de ses institutions ». C’est bien sûr le cas des épidémies qui, lorsqu’elles frappent, font aussitôt office de révélateurs et offrent pour ainsi dire une vue en coupe de la société tout entière.

&gt; Inutile, d’ailleurs, de remonter jusqu’à la peste noire ou la grippe espagnole (qui d’ailleurs toutes deux provenaient déjà d’Extrême-Orient) pour s’en convaincre. Même dans le cas d’un virus, par chance considérablement moins mortel tel que le SARS-CoV-2, nos sociétés se révèlent dans l’épreuve plus fortes ou plus fragiles – c’est selon – qu’on ne le croyait. Cette pandémie a en effet ceci de remarquable qu’elle est la première à se répandre à une telle allure sur une telle échelle, pour ainsi dire en temps réel. En quelques semaines, le foyer de l’infection s’est déplacé de l’Asie à l’Europe, permettant toutes les comparaisons, et mettant au jour des vérités fort désagréables pour l’Occident.

&gt; Contamination très rapide

&gt; Prenons le cas de la Corée du Sud, le premier pays à avoir été touché massivement hors de Chine. Elle a particulièrement joué de malchance puisque l’épidémie s’y est répandue comme une traînée de poudre dans une secte protestante à la mi-février. Des milliers de personnes qui priaient en se donnant la main ont été contaminées du jour au lendemain, réunissant toutes les conditions pour une explosion.

&gt; Or ce qui saute tout de suite aux yeux si l’on trace le parallèle avec la France ou l’Italie, qui pourtant ont eu davantage de temps pour voir venir, c’est que le pays n’a à aucun moment été mis en quarantaine. A l’exception de Taegu, la ville du sud où l’épidémie s’est déclarée et a jusqu’à présent pour l’essentiel été contenue, les commerces n’ont jamais fermé. Les transports ont continué à circuler normalement. A aucun moment, on n’a assisté à une quelconque ruée sur les produits de première nécessité – il suffit de se rendre dans n’importe quel supermarché pour s’en apercevoir. Si le système de santé a été éprouvé comme partout, il n’a jamais été question, comme en Italie, de faire un tri parmi les malades.

&gt; « Fait social total » en effet, l’épidémie offre l’occasion d’une introspection urgente dans les pays occidentaux. En s’arrêtant aux particularités de tel et tel pays voisins, pour mettre en regard par exemple la France et l’Italie, critiquant ou valorisant telle décision quotidienne dans la gestion de la crise, on ne parviendrait qu’à noyer le poisson. Un fait énorme, aveuglant dans son évidence, se donne ici à voir à l’échelle mondiale, lorsqu’on compare ce qui est comparable à travers les continents, à savoir des pays riches et qui se réclament de la démocratie. Ce fait, c’est la façon dont l’épidémie a été tout de suite maîtrisée en Corée et au Japon (à Taïwan, pour l’instant, elle n’a même été constatée que de façon résiduelle), par rapport à l’atmosphère de panique qui se répand en Occident."
2020-03-14 17:59:18,KvitDod,"&gt; C’est bien sûr en tant qu’ancien membre de l’UEJF dans les années 1970, ainsi qu’ancien proche du Rabbin Léon Askenazi, Manitou, président de l’UEJF au début des années cinquante, et dont j’ai dirigé le centre d’études à Jérusalem pendant 4 ans, que je vous écris. Mais c’est surtout en tant qu’historien, spécialiste de la Shoah, ainsi qu’amoureux de la vérité et de la liberté.

&gt; L’UEJF a une attitude liberticide qui consiste à imposer une vérité historique.

&gt; Je viens d’apprendre que vous avez attaqué en justice le journaliste Eric Zemmour pour avoir affirmé que le gouvernement du Maréchal Pétain avait sauvé les Juifs français. Cette décision de l’UEJF est doublement scandaleuse.

&gt; D’abord, même si les propos d’Eric Zemour étaient erronés, ce qu’ils ne sont pas, en quoi cette affirmation est-elle une négation de la Shoah ? Eric Zemmour a-t-il dit que des Juifs qui habitaient en France n’avaient pas été déportés et n’avaient pas été gazés à Auschwitz ? Pas du tout. J’ai attentivement écouté l’émission de CNews, et il a même parlé de « l’extermination et des camps nazis », ce qui paraît étrange pour qui est accusé de négation de crime contre l’humanité par l’UEJF. En réalité, l’UEJF a une attitude liberticide qui consiste, en détournant une loi anti-négationniste, à interdire tout débat historique et à imposer une vérité historique concernant une question importante, l’attitude de Vichy vis-à-vis des Juifs, mais question qui n’a rien à voir avec la réalité de l’existence de la Shoah. Lorsque dans les années 1970, l’historien israélien Yéhuda Bauer a affirmé que le nombre de victimes au camp d’Auschwitz-Birkenau était beaucoup moins important que les 4 millions qui étaient affirmés à l’époque, de nombreux historiens ou encore porteurs de mémoire, notamment au Mémorial de la Shoah à Paris, se sont levés pour dénoncer les propos de Bauer qui réduisaient soi-disant l’importance de la Shoah. Tout le monde sait très bien aujourd’hui qu’il y a eu au plus un 1,2 million de victimes à Auschwitz-Birkenau. Si la loi Gayssot avait existé à l’époque, l’UEJF aurait-elle traînée le Professeur Bauer devant les tribunaux ? Voilà pourquoi, au nom de la défense de la liberté, il faut dénoncer la démarche de l’UEJF."
2020-03-12 07:00:37,romiglups,"En baissant la vitesse pour commencer. Le vol c'est une gestion de l'énergie : moins de vitesse égale moins de portance égale descente. Ensuite ce n'est pas vrai que le nez pointe toujours ""plus haut"", les avions en descente ""pointent"" plus vers le bas qu'en montant, de nombreuses vidéos de spotters le montrent. Sinon ils seraient à une trop forte incidence vis à vis du flux d'air, et ils décrocheraient ! Pour aider l'avion a garder la portance nécessaire aux basses vitesses, des appendices aérodynamiques mobiles appelés volets et becs augmentent la surface de l'aile et donc sa portance et augmentent beaucoup sa trainée. Le but est alors d'arriver à une vitesse suffisemment faible (\~140 noeuds en seuil de piste sur un A320). Tout ceci dépend de la masse de l'avion, de la densité de l'air et de la température, mais les données affichées par les avions modernes en tiennent compte.

Au dernier moment de l'atterrissage l'avion effectue un arrondi, ce qui consiste à pointer le nez de l'avion vers le haut en réduisant la vitesse encore plus, pour que le train principal touche en premier autour de 120 noeuds (évidemment cela dépend de l'avion). Sur les Airbus on entend clairement le flight director annoncer ""retard retard"" en dessous de 10 ou 20m. ""Retard"" est un anglicisme aéronautique demandant de mettre les gaz au minimum. C'est à ce moment là que la vitesse par rapport à l'air s'efface et que la vitesse sol devient la donnée importante pour que l'avion puisse freiner. C'est pour celà que les avions se posent avec le nez dans le vent : tant qu'ils sont en vol le pilote ou le pilote automatique gèrent la vitesse de l'avion par rapport à l'air, dès que l'avion touche le sol c'est fini. S'il y a 30 ou 50 km/h de vent dans le dos, l'avion va toucher à 140 noeuds au lieu de 120 et les pneus, les freins et la longueur de la piste ne sont pas prévu pour celà.

 

Beaucoup d'accidents récents (comme ceux de Pegasus Airlines) avec des avions tanqués au bout ou après la piste résultent de vitesses sol trop élevés avec toucher trop tard et trop vite, faute d'avoir bien monitoré dans des conditions difficiles la vitesse de l'avion et donc son énergie, et d'avoir refusé un ""Go Around"" complètement banal mais qui fait mal à l'égo."
2020-03-08 19:50:42,noaimpara,"Sorry to be a bummer, but interneships or trainee programs are very rarely paid in Paris. You’ll get food stamps at best."
2020-03-04 13:59:12,Narann,"&gt; Donc, les tests seront désormais faits maison, hors de tout contrôle médical ?

Oui, mais ce sera totalement illégal. Je pense qu’à long terme, ça change tout :

* Ça veut aussi dire que si tu refuses, la société est de ton côté.
* Jusqu’à présent, la société ne donnait pas son avis, donc tu pouvais croire à l’un ou l’autre (et suivre tes proches). Ici, la société prends parti: Si tes proches te disent de le faire, c’est illégal.

La loi ne fait pas tout et c’est toujours un pari d’en mettre une en place qui pourrait ne pas trouver écho dans la société. Pourtant, c’est aussi ce qu’il reste au plus fragile. Si on ne faisait pas de loi sur la violence (conjugale, parentale) au prétexte que tu ne peux pas la faire appliquer, ou que ça risque d’engendrer des stratégies de contournement, tu prends aussi le risque de laisser les victimes seules avec leur bourreaux.

Il existe des violences conjugales/parentales qui ne trouvent pas de suite avec la justice (aucune plainte, aucun procès), mais qui, par le simple fait de l’existence de la loi, permettent à la victime de s’y « opposer » (partir pour ne plus les subir, parce que, non, ce n’est pas « normal », la société le dis, je peux porter plainte et j’aurais raison).

Pour revenir au religions : Au même titre que les idées libérales, les religions/croyances doivent constamment se justifier auprès des nouvelles générations. Ne pas pouvoir le faire sans pousser à l’illégalité, c’est un puissant frein dans la tête d’un jeune qui doute un peu. Tu viens aussi aider les personnes en contacte avec les victimes ; personnelles enseignant, hospitalier, etc. qui peut s’appuyer sur la loi pour informer les victimes.

Alors oui, tu auras forcément des gens qui continuerons de le faire, certains par croyances, d’autres par obligation, mais le pari est qu’il y en aura plus qui ne le feront pas.

Ou peut-être que, comme la prostitution et la drogue, ce sera un fiasco, que beaucoup de jeunes filles préfèreront faire le test plutôt que de passer pour une _traînée_ auprès de leurs copines.

Bref, la loi n’est qu’une étape."
2020-02-28 08:39:41,The-PEagle,"Je dirais que oui, le fait est que quand tu sais où sont tes foyers tu peux endiguer/ralentir la propagation avec des mesures de limite des déplacements ou de quarantaines. 
Une population comme celle là risque fort de faire de nouveaux foyers, voire même une ""trainée"" de contamination sur leur passage."
