date,author,text
2021-10-04 08:18:40,asimovwasright,"L'appartement est suspendu au-dessus des eaux bleues de la Méditerranée, sous le casino de Monte Carlo de la légende de James Bond. Dans le port en contrebas, des membres de la famille royale, des magnats et des oligarques naviguent sur des yachts de la taille d'un iceberg.

Les origines modestes de Svetlana Krivonogikh n'indiquent pas qu'elle avait les moyens d'acquérir une propriété donnant sur ce terrain de jeu de l'élite mondiale. Cette Russe aurait grandi dans un appartement communal surpeuplé de Saint-Pétersbourg et aurait occupé des emplois tels que le nettoyage d'un magasin de quartier.

Mais des documents financiers jusqu'alors non divulgués, combinés à des documents fiscaux locaux, montrent que Mme Krivonogikh, 46 ans, est devenue propriétaire de l'appartement de Monaco par l'intermédiaire d'une société offshore créée quelques semaines seulement après avoir donné naissance à une fille. L'enfant est né à une époque où, selon un rapport des médias russes de l'année dernière, elle entretenait une relation secrète, depuis des années, avec le président russe Vladimir Poutine.

L'unité de luxe de Krivonogikh au Monte Carlo Star est révélée par des documents obtenus par le Consortium international des journalistes d'investigation (ICIJ) et partagés avec le Washington Post. Ces documents, connus sous le nom de ""Pandora Papers"", révèlent qu'elle possède une société écran dans les îles Vierges britanniques et qu'elle a recours à une société de services financiers de Monaco qui travaille simultanément pour un ami milliardaire de Poutine.

Les dossiers n'indiquent pas où elle a trouvé l'argent pour payer un appartement qui coûtait 4,1 millions de dollars en 2003 et qui vaut probablement bien plus que cela aujourd'hui. Mais la transaction a coïncidé avec une période où Mme Krivonogikh aurait entretenu une relation avec M. Poutine et amassé un étonnant portefeuille d'actifs en Russie, selon Proekt, un site d'investigation russe en ligne qui a révélé son lien présumé avec le chef du Kremlin et qui a depuis été mis hors la loi en Russie.

Un porte-parole du Kremlin a rejeté ce rapport lorsqu'il a été publié l'année dernière. Mais les détails concernant l'appartement renforcent son affirmation principale, à savoir qu'après le début de sa relation présumée avec Poutine, Krivonogikh a accumulé des biens souvent liés à ses proches collaborateurs d'une manière ou d'une autre.

Avant le rapport de Proekt, les liens de Krivonogikh avec le cercle restreint de Poutine avaient fait surface mais n'avaient pas attiré l'attention du public. La Bank Rossiya a révélé en 2010 qu'elle était l'un de ses principaux actionnaires par l'intermédiaire de sa société OOO Relax. La banque basée à Saint-Pétersbourg a ensuite fait l'objet de sanctions de la part du Trésor américain, qui l'a qualifiée de ""banque personnelle de hauts fonctionnaires de la Fédération de Russie"".

Mme Krivonogikh n'a pas parlé de sa relation présumée avec M. Poutine ni de sa remarquable accumulation de richesses.

Mais sa fille, qui a eu 18 ans cette année et s'appelle Luiza Rozova, a alimenté les spéculations sur sa paternité dans des interviews, profitant de cette attention pour se constituer une audience en ligne croissante. Sur les photos, Rozova a une ressemblance frappante avec le président russe, et elle a reconnu cette ressemblance tout en refusant de confirmer ou de nier que Poutine est son père.

Aucun père n'est mentionné pour Rozova dans les documents officiels russes obtenus par Proekt et examinés par le Post. Mais ces documents font état d'un deuxième prénom, ""Vladimirovna"", qui est un patronyme signifiant ""fille de Vladimir"". Sur son compte Instagram, qui compte plus de 83 000 followers, elle donne son nom comme ""rozova luiza v.""

Krivonogikh n'a pas répondu aux demandes de commentaires qui lui ont été envoyées par l'intermédiaire de ses entreprises basées à Saint-Pétersbourg, de la Bank Rossiya, de sa fille et du cabinet de services financiers de Monaco. Les efforts déployés pour joindre Krivonogikh à trois adresses résidentielles qui lui sont associées n'ont pas abouti.

Un porte-parole du Kremlin n'a pas répondu à une demande de commentaire soumise par l'ICIJ au nom du Post et d'autres organisations médiatiques partenaires du projet Pandora.

Les indices reliant Krivonogikh à la propriété de Monaco sont contenus dans le nouveau dépôt massif de documents financiers. Les documents Pandora comprennent des feuilles de calcul, des mémos, des factures et des courriels obtenus auprès de cabinets d'avocats, de bureaux comptables et d'administrateurs de trusts qui opèrent dans certaines des juridictions financières les plus permissives du monde. Le trésor contient plus de 11,9 millions de documents, soit plus que ceux exposés il y a cinq ans dans les Panama Papers, une collection similaire de dossiers qui a déclenché scandales et réformes.

Ces documents mettent en lumière les manœuvres financières cachées de dirigeants mondiaux, d'investisseurs milliardaires, de célébrités, d'athlètes et d'autres clients d'élite. La cachette offre une vue particulièrement large de la façon dont beaucoup des personnes les plus fidèles à Poutine se sont enrichies de façon exorbitante et ont caché des actifs à l'étranger, alors même que le président russe a dénigré l'Occident et appelé les élites russes à garder leurs capitaux chez elles.

Les dossiers montrent, par exemple, que Konstantin Ernst, cadre dans le secteur des médias, a obtenu une participation dans une opération immobilière lucrative après avoir obtenu les louanges du dirigeant russe pour avoir contribué à l'organisation des Jeux olympiques d'hiver de 2014 à Sotchi. Le projet consistait à convertir des complexes cinématographiques de l'ère soviétique, toujours détenus par l'État, en magasins et appartements privés. Le partenariat d'Ernst n'a pas été divulgué publiquement mais est détaillé dans les documents de Pandora liés au projet.

Dans une déclaration écrite, M. Ernst a confirmé son implication dans le projet immobilier, mais a nié qu'il s'agissait d'une ""compensation pour les Jeux olympiques de 2014"". Il n'a pas répondu aux autres questions soumises par le Post, l'ICIJ et d'autres partenaires médiatiques, mais a déclaré : ""Je n'ai commis aucune action illégale.""

D'autres documents montrent que Herman Gref, le directeur de la banque publique russe Sberbank, détenait plus de 50 millions de dollars en espèces et en créances de prêts à l'étranger pour sa famille en utilisant des comptes aux Samoa, au Panama et à Singapour, bien qu'il soit le visage public le plus important du système bancaire public russe.

Les autorités de Singapour ont signalé des transactions impliquant Gref et deux de ses collègues russes, selon un rapport d'audit de l'Autorité monétaire de Singapour inclus dans les dossiers Pandora, et ont ensuite infligé une amende de 1,1 million de dollars à la société financière gérant les actifs de Gref pour non-respect des règles de lutte contre le blanchiment d'argent. Une porte-parole de l'autorité monétaire de Singapour a déclaré que la société avait payé l'amende et avait pris des mesures correctives pour remédier à ces manquements.

Gref a refusé de commenter par l'intermédiaire d'une porte-parole de la Sberbank.

Dans l'ensemble, les documents renforcent la description de la Russie comme un pays où une élite proche du pouvoir gagne des millions de dollars et protège cette richesse personnelle en utilisant des structures financières opaques à l'étranger.

Cinq ans après les révélations des Panama Papers, les nouveaux dossiers montrent que, plutôt que de renoncer à l'utilisation de comptes offshore, les Russes fortunés et leurs gestionnaires de fonds ont cherché à devenir meilleurs pour dissimuler leurs actifs. Dans un passage, un avocat qui représentait deux amis de longue date de Poutine a averti une société panaméenne de ne pas répéter les bévues qui ont conduit à la fuite nommée pour ce pays.

""Vous êtes obligé de garder le secret pour nos clients"", a écrit l'avocat dans un message de 2016, ""et de ne pas rendre faisable du tout une deuxième histoire de Panama Papers.""

Une traînée de documents :

Les personnes impliquées dans l'organisation de l'achat du Monte Carlo pour Krivonogikh ont pris des mesures qui garantissaient que son nom et son statut de propriétaire n'apparaissaient pas dans les dossiers publics.

Le 2 avril 2003 - presque exactement un mois après la naissance de la fille de Krivonogikh - une société écran appelée Brockville Development Ltd. a été constituée sur l'île de Tortola, dans les Caraïbes, selon les documents contenus dans le coffre-fort Pandora. Quelques mois plus tard, selon les registres immobiliers de Monaco, cette société écran a acheté l'appartement à Monaco pour 3,6 millions d'euros, soit environ 6 millions de dollars d'aujourd'hui, après ajustement en fonction de l'inflation.

L'immeuble est ""très recherché par les plus riches du monde"", selon le matériel promotionnel en ligne d'une société immobilière de Monaco. Les appartements ""lumineux et aérés"" du complexe sont dotés de ""terrasses spacieuses idéales pour dîner en plein air ou pour observer les superyachts les plus luxueux du monde qui entrent et sortent du célèbre Port Hercule"", écrit la société.

Les dossiers de Pandora n'indiquent pas précisément à quel moment Krivonogikh est devenu le ""propriétaire effectif"" de Brockville, un terme qui désigne la personne qui contrôle en fin de compte une société offshore ou qui en bénéficie financièrement, même si d'autres noms figurent sur les documents d'enregistrement. Ceux-ci indiquent qu'elle était la propriétaire effective dès 2006."
2021-09-29 12:02:28,deyw75,"Mercredi 22 septembre, en pleine journée, à Brest, une jeune fille de 16 ans a été agressée sexuellement par un homme à deux pas du cœur commercial de la ville.

Une adolescente de 16 ans a été agressée sexuellement, mercredi 22 septembre, en plein jour, vers 15 h 45, et en plein cœur de Brest, rue de la 2e DB, tout près de la rue Jean-Jaurès et du centre commercial de Coat-Ar-Guéven. Cette information s’est répandue comme une traînée de poudre ces derniers jours dans le milieu commerçant. Elle a été confirmée officiellement ce mardi soir, par Nicolas Hoarau, le commissaire central de Brest.  
  
Isolée à l’abri des regards  
Selon les éléments recueillis auprès de la victime, la jeune mineure aurait été isolée sous la contrainte dans un lieu situé à l’abri des regards. L’agresseur aurait alors procédé à des gestes d’attouchement, et aurait tenu des propos très explicites ne laissant aucun doute sur ses intentions. Finalement, l’adolescente serait parvenue à se libérer de l’emprise de son agresseur, avant que les choses n’aillent plus loin.  
  
Placé en garde à vue, puis laissé libre faute d’éléments suffisants  
Très choquée, la victime ne s’est pas présentée immédiatement au commissariat. Ce n’est finalement que dimanche dernier qu’elle a trouvé la force de venir déposer plainte. Son témoignage, recoupé avec d’autres remontées d’informations émanant des commerçants qui constatent depuis leurs vitrines des faits récurrents de harcèlement de rue ces dernières semaines, a conduit les enquêteurs à interpeller trois hommes dans la journée de dimanche.  
  
Seul l’un d’entre eux a été placé en garde à vue, mais il a été finalement laissé libre à l’issue de son audition, faute d’éléments suffisants. L’enquête se poursuit."
2021-09-27 05:41:04,farfromtrou,Ça c’est un truc qui est vertigineux : le nombre de types qui ne passeront pas à l’acte juste à cause de la loi ou du regard des autres. J’imagine que cette catégorie est 10 fois plus remplie que celle qui passe à l’acte (qui doit représenter la trainée de la gaussienne)…
2021-09-21 14:27:49,Freaks-Cacao,"J'ai dit que le produit kpop vendait aussi l'illusion de la disponibilité sexuelle, pas que ça ne concernait que les femmes. Ça confirme quand même qu'une trainee ou une Idol ne peut rien faire contre la menace de Molka, ils et elles sont très vulnérables, mais très probablement plus elles que ils. 

Dans le cas de Hyuna en particulier je ne connaissais pas cette subtilité mais je trouve que ça ne change pas grand chose au schmilblick, j'ai peine à trouver ça plus justifié. Pourquoi ce besoin de démentir si vite, surtout si les concernés veulent admettre, et pourquoi les virer leur sauve la face ? Pour moi c'est une honte supplémentaire de les virer, et le fait de démentir confirme quand même que c'est une honte d'avoir des idoles publiquement sexuellement actifs."
2021-09-18 19:58:02,hiddenexene,La France traînée dans la boue par le UK sur r/Europe... Quand le UK est légitime sur ce sujet ?
2021-09-18 11:05:08,Yadynnus,Nous sommes effectivement dans une région où il y a beaucoup de gens qui refusent la vaccination. Il y a un effet de groupe avec des influences antivax importantes qui se répandent comme traînée de poudre.
2021-09-16 07:25:24,Tencreed,"Me souviens d'une nana qui en avait tellement plein le cul qu'elle a balancé des pitits cailloux sur des robocops.
Elle s'était faite défoncer la gueule, puis traînée dans la boue sur les médias nationaux."
2021-09-15 09:14:37,01Syd,"Certes mais l'extrême gauche pour l'instant c'est Mélenchon, et il n'est pas en odeur de sainteté dans les médias. Et il n'y a pas d'équivalent de Zemmour en EG, du moins pas à la télé (et même en littérature ce sont surtout les penseurs historiques qui sont lus). 

Le fait est qu'on épingle (à raison) CNews et cie pour surreprésenter l'ED. Sans dire que le cerveau des humains est dénué d'esprit, la télé est bien évidemment vecteur d'influence, ne serait-ce que chez les gens qui s'informent peu ailleurs. Et même ceux qui s'informent ailleurs (sur les réseaux sociaux par exemple), le fait qu'aujourd'hui la moindre fake news grossière se propage comme une trainée de poudre montre que beaucoup n'ont pas le même rapport à l'information que toi et moi. 

C'est pas pour rien que les candidats ont un temps de parole alloué à la télé, c'est qu'on sait que des gens se font leur avis comme ça, et par nature il y a peu de chances qu'ils optent pour le discours noyé dans la masse."
2021-09-13 10:53:39,Octave_Ergebel,"La base d'une relation, c'est la confiance. Ça donne l'impression qu'elle a eu un besoin de ""lâchage"" pour ""se rattraper"". Il y a des mecs comme ça aussi hein. J'espère que tu n'es pas dans le schéma homme à femmes = Don Juan /femme à hommes = traînée !"
2021-09-07 08:38:23,Matttthhhhhhhhhhh,"Presque tout juste.

La définition de comète m'a fait bondir par contre.

Théoriquement, un astéroide et une comète, c'est pas du tout la meme chose. Le premier s'est formé dans la partie relativement chaude et intérieure du nuage protosolaire, alors que la seconde s'est formée dans la partie extérieure, bien plus froide. Ils n'ont donc, en théorie, rien à voir l'un avec l'autre. 

Un astéroide peu etre primitif, cad ayant très peu changé depuis sa formation il y a 4,6 Ga. C'est un agglomérat très poreux de chondres (sphèrule ignée) et de matrice (poussière intersticielle). Certains astéroides sont différenciés, cad qu'ils étaient assez gros pour fondre et subir une différenciation, comme les planètes telluriques. 

Une comète, c'est un gros morceaux de glace sale, composée de matériaux de très basse température, ainsi que des grains présolaires (e.g., SiC).

Cette image simpliste cache une réalité bien plus complexe bien évidemment. La mission Stardust de la NASA a ramené des poussières de la comète 87P/Wild 2 en 2006. La grosse surprise fut que, contrairement aux attentes, cette comète contient pas mal de matériel de haute température, comme des chondres. Ca montre que les comètes et les astéroides, bien que fondamentalement différents, partagent quelques caractéristiques. Il apparait donc qu'il y a un continuum entre astéroides et comètes. 

Mais malgré ça, ces deux objects restent très différents. Donc on ne peut pas dire qu'une comète est un astéroide dégageant une trainée de poussière. C'tout."
2021-09-06 15:07:34,refreshfr,"Si je ne me trompe pas, pour résumer:

- Astéroïde: Gros caillou dans l'espace
- Comète: Astéroïde qui dégage une traînée de gaz/poussière
- Météoroïde: Petit astéroïde (&lt;1m)
- Météore: Astéroïde qui entre dans l'atmosphère
- Bolide: Météore très lumineux (+ brillant que Vénus)
- Météorite: Ce qu'il reste d'un météore une fois au sol (dans le cas où il ne s'est pas totalement désintégré)"
2021-08-28 21:44:53,[deleted],traînée verte ça faisait pas inclusif.
2021-08-27 14:01:02,tatref,"Certains téléphones (Google Pixel) font de la compensation automatique.

Le temps de pose est de 3-5 min, et ça ne produit pas de traînée. Par contre ça fait un effet vignette, mais les photos restent très bien."
2021-08-17 08:19:05,thePeete,"&gt;Sur chaque demi-aile, le sens de rotation des hélices des deux moteurs est inversé, le mouvement descendant des pales se produisant entre les moteurs environ au milieu de l'aile, de sorte que l'écoulement du souffle des pales soit concentré.


&gt;(...)

&gt;Cette configuration a été principalement choisie afin de limiter la dissymétrie qui se produit en cas de panne moteur et plus particulièrement d'un moteur externe (ce qui est fréquent sur un avion militaire sur un théâtre d'opération). Mais elle a aussi de nombreuses implications : des efforts moindres sur la voilure, d'où un allègement possible de la structure. De plus, la taille de la dérive a pu être réduite puisque la correction en lacet peut être moindre en cas de panne moteur, ce qui réduit la traînée. Ces deux caractéristiques permettent une plus grande distance franchissable ou l'emport d'une charge utile plus lourde pour une même quantité de carburant

[source](https://fr.wikipedia.org/wiki/Airbus_A400M_Atlas#Sens_de_rotation_des_h%C3%A9lices)"
2021-08-09 17:30:08,lniko2,"Elle n'est pas trainée en place publique parce que c'est mal (ça l'est), mais parce que c'est utile"
2021-08-01 15:40:04,incoralium,"Quelle naïveté c'est incroyable...

Par où commencer.. ha bah tiens :   
- Qu'est-ce qu'est-ce qui vous fait dire que le pass sera temporaire ? ( Absolument tout indique le contraire) 

- Le fameux ""rien à cacher"" est une aberration, l'anonymat profite à tous. D'ailleurs, pourquoi n'utilisez-vous pas votre nom et prénom pour poster ici ? 

- Le test PCR ce n'est pas juste "" une tige au fond du pif "", c'est avant tout une mesure demagogue et inutile dont l'obligation pour aller faire ses courses et chercher les enfants a pour unique but de faire souffrir sur le long terme ceux qui refusent de se soumettre à la vaccination. En outre ça représente 210€ par semaine et par personnes, tant qu'à faire. Je me demande si Macron a complètement oublier son idée de passer pour un ""président des jeunes"" avec ça...

- Malheureusement, si, les mesures virtuelles et contraignantes sont les seules à lancer les manifestations. Mais oui, la surveillance de masse est l'une des plus dangereuses atteinte à nos libertés. C'est la raison pour laquelle la Chine est une dictature d'ailleurs, mais ça en France les gens ne comprennent pas. Pour eux une dictature ces forcément avec des militaires partout, et ne se rendent pas compte de la part de la technologie dans la mise en place d'un système totalitaire. 

- Enfin, vous parliez justement de cette surveillance, mais la pass sanitaire est la dernière pièce pour la mise en place du ""système chinois"". La présentation d'un identifiant personnel qui donnera lieu à des restrictions de droits entre les citoyens. Le covid, ce n'est qu'un prétexte pour le mettre en place. Mais retenez bien qu'il n'y a eu qu'une seule fois dans dans l'histoire de France  qu'il n'y a eu de tels disparités de droits au seins de la population de manière arbitraire. C'était sous Pétain.( Et encore, ils n'avaient que des registres manuscrit. )

Dans les années 70, alors que venait de naître a peine 10 ans auparavant la 5 République censée marqué la rupture avec le régime de Vichy et les abominations commises par la France (déportations et rafles), qui aurait cru qu'on en arriverait là ? Le VIH, qui est arrivé à cette période, se répand comme une traînée de poudre et décime les jeunes et les parents. Qui aurait imaginé ficher les sero-positifs, les empêcher d'aller faire des courses, d'aller à l'hôpital, d'aller au restaurant ? 

On marche sur la tête... On a oublier l'histoire. Et on force les autres à obéir. Il y aura des dénonciation, il y aura des  de prisonniers. Le Covid n'est qu'un prétexte. Le pass sera là jusqu'à la fin de la 5eme République."
2021-08-01 01:30:22,lapilule,"Là où j'étais on pouvait signaler ce genre de trucs, ils testent la personne et hop ils la renvoient chez elle. C'est pas faire du mal à quelqu'un, puisque clairement elle est pas là de sa propre volonté, ou elle est déjà en échec, et y a largement la queue au portillon pour qu'une autre personne qui en a besoin la remplace.

Ça marche pas si yen a dix à chaque fois par contre...

J'ai vu ça dans tous les centres où j'ai été les fumeurs planqués, à mon avis s'ils ont un minimum de jugeote et se cachent tu peux essayer de résister... Par contre dans le cas de connard  qui t'encourage ou qui fument n'importe où en laissant une trainée derrière, pas de pitié ils ont qu'à rentrer chez eux."
2021-07-31 15:07:28,Francois-C,"&gt; L'infarctus s'est déclenché une douzaine d'heures avant le décès

Et il y a encore pas mal de millions de Français à vacciner : à chaque fois qu'une personne mourra peu de temps après avoir reçu le vaccin, et il y en aura forcément un certain nombre, les antivaxx se précipiteront aussitôt pour crier au scandale et raconter ce qui les arrange, tandis qu'il faudra examiner méticuleusement chaque cas pour savoir la vraie cause.

C'est le problème récurrent depuis que certains utilisent Internet et les réseaux sociaux pour diffuser de la désinformation destinée à créer des mouvements d'opinion ou à pousser les gens à la révolte : les mensonges vont comme une traînée de poudre tandis qu'il faut du temps pour établir la vérité."
2021-07-26 19:08:51,Warm-Sheepherder-597,Difficile à faire avec toutes les caméras autour et les gens qui se répandent comme une traînée de poudre sur Facebook et YouTube.
2021-07-25 07:31:20,charlytrenet,"Peut être, mais à voir avec le variant delta qui se propage comme une traînée de poudre"
2021-07-21 20:31:19,Moonpolis,"Ca me rends dingue, la communication du gouvernement  a ete une immondite sans nom depuis debut 2020. Ils ont dit tout et leur contraire, en traitant la population d'imbecile au passage car le gouvernment n'etait pas capable d'assumer ses erreurs (les masques inutiles car en realite pas de stock, etc.), en fin de compte, au lieu d'amener doucement a des obligations, on se retrouve avec des choix drastiques du jour au lendemain sans transition.

La vaccination a trainee en longueur pour les personnes agees, voici que la grande majorite n'a eu acces au vaccin que en Mai, pourtant tout a coup, le vaccin est necessaire des debut Aout autrement tout est interdit, et on touche au contrat de travail ?

Les manifestations n'etaient pas seulement antiVax, elles etaient anti-gouvernementale, et cela, c'est different."
