date,author,text
2018-09-06 06:48:40,Papierdecrayon,"Bonjour tout le monde,

désolé du pavé mais **puis-je / dois-je demander une revalorisation de mon salaire ??** J'ai fais un post sur ce sujet assez tard hier donc je repost ça sur le FL avec un peu plus de détails pour avoir plus de visibilité.

Je ne sais pas si ma question à vraiment sa place ici mais je connais personne autour de moi qui saurait me conseiller. Je suis relativement  jeune, naïf et sans trop d’expérience professionnel.

J’ai eu l’opportunité de faire mon stage de fin de master en Allemagne, dans une grosse boite, pour 6 mois (appelé internship).

Par la suite je me suis fait recruter pour un « traineeship » pour 1  an et on m’a récemment proposé de renouveler mon contrat encore 1 an (à  partir de septembre 2018)… mais toujours en tant que « trainee »…

Donc au total 6 mois de stage + 24 mois de trainee. J’ai accepté et  signé. Oui, je me fais carrément avoir je sais. D’un autre coté je  relativise puisque les 6 autres « trainees » qui ont commencé avec moi  n’ont pas eu la chance d’être renouvelé tout court.

J’aime mon travail et même en tant que trainee je gagne au final assez bien ma vie, je ne pense pas pouvoir gagner facilement un salaire  plus élevé ailleurs. Concrètement je viens à la base d'un IAE de province très moyen mais je me suis bougé le cul pour faire en parallèle un double master en Allemagne.

A part quelques stages je n'ai pas d'autres expériences professionnels et en tant que trainee je suis payé 43k brut  (2.3k net par mois). Au final je relativise car même si je me fais avoir sur mon statut dans l'entreprise, quand je compare ma situation avec celle des autres  étudiants de ma promotion je n’ai vraiment pas à me plaindre.

**MAIS**

Aujourd’hui j’ai appris qu’administrativement j’étais enregistré dans le système de l’entreprise en tant qu’employé temporaire, l’équivalent  d’un CDD quoi.

Il est d’ailleurs mentionné nulle part dans mon contrat que je suis  un « trainee ». Ni dans mon premier contrat ni dans mon nouveau contrat  qui a débuté lundi. Seule l’annonce en ligne faisait référence à un contrat de « traineeship » quand j'ai postulé.

Cette nuance est assez importante puisque concrètement je dois dorénavant reporter mon temps de travail régulièrement (chose que je ne  faisais pas jusque-là car les « trainees » ne sont pas considérés comme des employés temporaires). En tant qu’employé temporaire mon statut est simplement différent.

Du coup je m'interroge, puisque je n’ai pas/plus le statut d’un «  trainee » mais celui d’un employé temporaire dans le système de l’entreprise, est-ce que je peux raisonnablement demander une revalorisation de mon salaire et de mes acquis ? Demander à être éligible pour les bonus  annuels ? etc… ?

Il me semble que les trainees ont tous leurs salaires alignés sur la  même grille salariale et que les employés temporaires ont également une grille de salaire, qui est plus élevé que la grille de salaire des trainees.

J’ai déjà signé un contrat pour un an avec un salaire défini et  l’absence d’avantages qui sont normalement proposés aux autres employés temporaires.

Mais d’un autre coté l’entreprise n’est-elle pas légalement (ou  politiquement) obligée de me fournir un salaire aligné sur les salaires  des employés temporaires avec l’accès aux même avantages qu'eux ?

Puis-je/Dois-je profiter de cette  « erreur » qui fait que je suis  officiellement comptabilisé comme un employé temporaire pour demander  une revalorisation de mon salaire et de mes avantages ?

Que feriez-vous à ma place ?"
2018-09-06 06:37:24,AlexKidd777,"&gt;Par la suite je me suis fait recruter en tant que « trainee »

J'ai lu ""en tant que trainée"" 

Je suis pas réveillé ce matin...."
2018-09-05 23:17:15,the_thor_69,"Pour le coup demander ça sur airfrance est complexe car si tu avais été en France j'aurais pu t'aider mais je ne connais pas la législation du travail allemande qui est bien plus souple que la France (par exemple en terme de minima)

  


Pour info trainee en anglais ça veut dire stagiaire donc ça fait une sorte de stage de 2 ans 1/2... Je sais pas quel est ton niveau de diplôme mais c'est un peu la carotte.."
2018-09-05 08:55:02,evrything,"* Sur le trottoir, sur les plantes, sur le mobilier urbain, sur les bagnoles. Bref, sur le bien public ou le bien privé d'autrui.

**Feu vert, je pisse**

* Dans des toilettes publiques puantes jonchées de seringues et de boites de Rohypnol.

**Pas de souci, je pisse**

* Sur des chiottes dégueulasses, même avec trainée de merde et du foutre séché.

**C'est bon, je pisse**

* Dans des toilettes à peine plus propres, couvertes de graffitis obscènes, à l'humour douteux, et m~~a~~essages nazis.

**Ok, je pisse**

* Une affichette avec un slogan radfem.

**Arg, ça me la coupe!**
"
2018-09-05 08:38:20,PereCastror,"Les petites éoliennes sur les bateaux de plaisance ça existe déjà pour recharger différents appareils électriques dans le bateau.
Par contre, si tu pensais à une grosse éolienne sur un cargo par exemple, ça n'aurait aucun intérêt car ça demanderait beaucoup d'énergie pour faire avancer le bateau et vaincre la traînée induite par l'éolienne et l'énergie produite par l'éolienne sera forcément moins importante que le surplus d'énergie qu'elle demande. (C'est pas très clair mais j'espère que c'est compréhension sinon je reexpliquerai)"
2018-09-02 18:54:16,AdrianPimento,"&gt; AJA que les chiennes aussi avaient leurs règles.

C'est atroce, quand j'étais petit j'ai été traumatisé par la chienne de mes parents qui, 1 à 2 fois par an, se traînait l'arrière-train sur le carrelage par les deux pattes avant en laissant une longue traînée de sang :s"
2018-08-26 11:58:33,EAStoleMyBike,"&gt; muarf prétendre que parler de white priviledge c'est du racisme...

[Et ça ?](https://pbs.twimg.com/media/DlaBZmhW0AE5iNB.jpg)

[Et ça](https://pbs.twimg.com/media/DlaIr1ZXoAAEeIw.jpg)

[Ca aussi](https://pbs.twimg.com/media/Dle3eKcUYAArvsL.jpg)

[Tiens tiens...](https://pbs.twimg.com/media/DlflqINWsAAwUeO.jpg)

[Offres d'emplois racistes à la BBC (cette fois en Angleterre)](https://metro.co.uk/2018/01/19/bbc-criticised-for-banning-white-job-applicants-for-trainee-role-7243601/)

[Discriminations raciales anto-blanc et anti-asiatiques à Harvard](https://www.theatlantic.com/education/archive/2017/10/a-federal-investigation-into-reverse-discrimination-at-harvard/542220/)

[Et la première partie des articles recensés par le lien que je citais](https://twitter.com/i/moments/1031915920694935554)"
2018-08-09 16:20:21,Pippin1505,"C'est pas un probleme d'age, c'est toute l' Amerique du sud qui est fortement religieuse et conservatrice. 

L'avortement est interdit presque partout, parfois même en cas de danger pour la mère. 
C'est pareil au Brésil, où la Cour Suprême est en train de réexaminer la question . Pour l'instant l'avortement est possible en cas de viol, mais il y a tant de trucs ""à prouver"" qu'en pratique c'est impossible.

Pour continuer sur l'exemple Brésil, que je connais mieux,  faut imaginer que ""socialement"" t'es au niveau de la France de 1920: 

* je connais une nana qui a été chassée de la maison par son père pour être tombée enceinte à 16 ans. 

* il y a encore des ""chambres de bonnes"" dans les plans des maisons pour le petit personnel

* Vivre en couple sans être marié est quasi impensable (i.e. tes amis coupent les ponts avec toi parceque tu vis ""comme une trainée"", vécu par une amie Argentine qui vivait à Paris avec son fiancé)

* Ils ont tenté (au Brésil toujours) de faire réinscrire l'homosexualité comme maladie psychiatrique 

* Une fille qui arrive à l'hosto pour ""fausse couche"" sera dénoncée par le personnel médical pour tentative d'avortement, et arrêtée par la police. En général, elles prennent un cocktail de tous les médicaments teratogenes qu'elles trouvent...

bref... On oublie souvent à quel point le reste du monde est très très conservateur et religieux.

"
2018-08-09 07:59:22,Sumrise,"Oh purée, ce ""bar""? Je m'y étais fait trainée par deux ami*e*s. 

J'étais pas vraiment dans mon élément... Bon ensuite un des danseur m'a offert pas un mais deux verres. Donc bon...  

"
2018-08-05 12:09:17,amicaze,"Hmm ouais tu as sans doute raison, il m'avais semblé que dans le coefficient de traînée il y avait une unité de surface, je m'y connais pas trop."
2018-08-05 11:58:44,meuzobuga,"Tu confonds coefficient de trainée et trainée. Tu crois vraiment qu'un Captur pénêtre dans l'air comme une 911 ?

Dans le calcul de la trainée, on multiplie par la surface frontale, grosso modo largeur x hauteur du véhicule. Et là, en hauteur, les SUV ils prennent cher."
2018-08-05 11:03:58,bofbof71,"il faut considérer la surface frontale * le coefficient de trainée. 
"
2018-08-05 10:00:01,amicaze,"Non, le captur à un coefficient de traînée égal à une DS3 ou une porsche 911 selon les modèles."
2018-08-05 09:56:58,amicaze,"Encore une fois c'est pas aussi simple, un Captur à le même coefficient de trainee qu'un Ds3 ou qu'une porsche 911, suivant les modèles de porsche."
2018-08-01 08:41:10,JackSeller,"Enorme sensation de déjà vu hier, j'ai pu voir cette couverture de magazine https://imgur.com/a/Ns16uEz

C'est un dessin et je vous assure que c'est une copie conforme d'une photo qu'on a pris mes amis et moi en Croatie en 2015, je suis celui au milieu.

les maillots sont les mêmes, les morphologies de chacun sont les mêmes, même situation 2 qui sautent, un qui plonge.

C'est tellement gros comme coïncidence !

J'arrive pas a remettre la main sur cette photo, ce n'est pas moi qui l'ai prise comme j'étais sur la photo, je contacte tous ceux qui étaient présents juste pour avoir confirmation.

Donc du coup mon explication serait que la photo a trainée sur les réseaux sociaux et qu'un dessinateur de magazine s'en est servi pour sa couverture.

Après que je tombe dessus c'était improbable aussi, qu'est ce que vous en pensez ? 

EDIT : petite faute"
2018-07-19 07:19:10,MilesNaismith,"En général, une trainee d'urine entre l'endroit ou tu l'aperçois et celui où tu t'es caché ensuite. "
2018-07-18 12:59:34,[deleted],"mais t'es une fille? Je comprends pas ta première phrase. 

Le double standard s'explique pour différentes raisons : si ta copine tombe enceinte tu ne peux jamais être sûr d'être à 100% le père, donc vaut mieux limiter les risques en prenant quelqu'un qui ne soit pas une trainée. Ensuite, il est plus facile pour une nana d'avoir eu plein de partenaires que pour un homme. Le challenge pour elles est donc plus de s'abstenir. Une femme qui a vu plein de queues est l'équivalent d'un mec qui ne voit pas de chatte. Par contre, un homme quant à lui augmente sa valeur s'il a été capable de séduire une tonne de meufs, ça veut dire qu'il a une certaine validation sociale. C'est aussi simple que ça."
2018-07-18 11:33:36,[deleted],"&gt; Nous sommes encore dans une société où, pour l'immense majorité des gens, un mec qui tronche plein de filles est un étalon, et une fille qui se fait tringler par plein de mecs une traînée.

bah oui encore heureux."
2018-07-18 11:24:10,ethelward,"&gt; tu ne vois pas des femmes agresser des mecs dans la rue en tout cas pas à ce point

1. Une fille ne fait pas généralement 10cm de plus que le mec qu'elle voudrait agresser, avec la masse corporelle qui va avec.

2. Nous sommes encore dans une société où, pour l'immense majorité des gens, un mec qui tronche plein de filles est un étalon, et une fille qui se fait tringler par plein de mecs une traînée."
2018-07-18 11:02:03,Sherokan,"Oui t'inquiète je critique pas forcément les gens qui l'utilise hein, c'est comme ça. Je trouve ça juste curieux comment un expression qui ne veut rien dire viennent remplacer une expression très française et très valable en une traînée de poudre.

Par contre les gens qui utilisent digital à la place de numérique eux ils pourraient tous brûler en enfer :D."
2018-07-14 11:30:30,afrofagne,"&gt;""Il s'agit d'une erreur"", a indiqué à LCI le colonel Olivier Célo, chef du service d'information et de relations publiques de l'armée de l'air. ""Il doit s'agit d'une erreur de configuration"", a précisé l'officier, expliquant que l'avion qui a laissé un traînée rouge, utilisé a priori en remplacement d'un autre appareil, aurait dû ""donner du bleu dans une configuration normale"". 


&gt;""J'espère que les Français retiendront surtout que l'avion concerné avait à son bord un militaire blessé"", a ajouté le porte-parole de l'armée de l'air auprès de LCI."
2018-07-14 10:25:40,Alazareth,"Plus de surface pour se casser la gueule en moto sous la pluie ! 

Sachant que vu l'état des passages piéton actuel, ça va finir en grande traînée grise dégueulasse sur 12 mètres..."
2018-07-14 10:05:49,La_France_mise_sous,Ou alors au moment de lâcher la bombe tu te rend compte que ton avion lâche une trainée de fumée bleue.
2018-07-14 09:54:03,6594933,"Si on regarde bien on peut distinguer ""C'est en faisant n'importe quoi qu'on devient n'importe qui"" se dessiner dans la trainée"
2018-07-14 08:50:57,ASK_IF_I_STILL_RUN,Il y avait une raison pour la traînée rouge  à la place de la bleue lors du passage de la patrouille de France ?
2018-07-09 08:51:53,Yseader,"Pas réellement étonnant, surtout quand ça concerne ""les méchants étrangers"", il suffit d'un truc balancé aux personnes qui sont convaincues qu'on est ""envahi"", sans avoir de preuve solide, ni rien et ça fait comme une traînée de poudre.

De même pour les intox qui ressortent après des années, c'est de plus en plus courant."
2018-07-04 07:58:23,Brainbrin,"Oué, enfin, cadavre vectorisé ça fait surtout une trainée rougeâtre derrière le semi-remorque."
2018-07-03 16:17:48,thefoxinmotion,"""Le résultat n'était pas difficile à deviner"" ? ""C'est encore pire"" ? Il y a beaucoup de demeurés du 18-25 qui ont reçu des menaces de morts suite à sa chronique ? Qui ont dû déménager ? Qui se sont fait cambrioler ? Dont la gamine a aussi été traînée dans la boue ?

Il n'y a que le 18-25 qui réagit comme ça aux critiques, même les plus virulentes, parce que c'est une secte de timbrés."
2018-07-03 14:38:03,Irkam,"C'est pas plutôt internship dans ce cas là ?

Perso ça m'a toujours fait chier quand on marquait ""trainee"" sur mon poste alors que j'étais ""intern"". J'ai pas payé et j'étais pas payé par l'Etat pour faire ce que je faisais. J'étais stagiaire bordel."
2018-06-30 16:39:29,karameloss,Définir la sexualité d'une personne par son travail résultat : tu es fleuriste tu es gay coiffeur aussi proctologue une vraie traînée 
2018-06-30 15:18:31,Galien_dArcy,"Allez c'est parti :

- tooling
- next step
- behavior
- meetup
- effet whaou
- nice to have
- pour le run
- agile
- show stopper
- doer (en oposition au client grand compte qui lui est glandeur)
- quick&amp;dirty
- easy to have
- feature
- rampup
- tradeoff
- scale up
- scale out
- mood (de l'équipe, pour que le client sache sur quel presta blâmer ses echecs)
- impediment
- idempotent (mon préféré, ça se repend comme une traînée de poudre, évidemment personne ne sait ce que ça veut dire. C'est le côté fun de la chose)
- dev. by design
- as a service (employé à la place du point pour clore une phrase)
- TDD
- data centric
- ~~escalator~~ elevator pitch
- pain point
- sachant (en opposition au client grand compte qui lui est ignorant)
- transformation digitale (le digital est important, si tu le remplace par numérique tu va passer pour un _has been_).


Voila de quoi te faire une chouette grille.
"
2018-06-26 09:02:25,Hasbjorn,"« Dis-moi où est l’argent » : l’antisémitisme au cœur d’un procès

Le procès de cinq hommes doit s’ouvrir mardi devant la cour d’assises du Val-de-Marne pour vol, viol et séquestration au domicile d’une famille juive en 2014.
Quand ils ont poussé la porte et déboulé encagoulés, gantés, ce lundi 1er décembre 2014 à midi, elle a juste eu le temps de crier : « Jonathan ! » Illico, elle s’est vu intimer un « chut ! » brutal. Elle se souvient avoir été plaquée contre un mur, assise sur le canapé du salon, puis traînée avec son compagnon dans la salle de bains. Là, lui s’est vu coller un fusil à canon scié dans la bouche : « Dis-moi où est l’argent ­sinon je te bute (…) on sait que ton père est juif et que vous avez de l’argent ! »

Après quoi, ce fut son tour : « Et toi, t’es quoi ? » Elle a osé la ­vérité : « Rien du tout. (…) Mes parents habitent en Normandie. » Une heure plus tard, elle était malgré tout abandonnée dans une chambre de l’appartement dévasté, pieds et mains liés sur un clic-clac, tee-shirt relevé, à demi étouffée par ses sanglots et le Scotch sur ses lèvres.

Avec son visage rond, ses yeux verts las, Laurine C. sera sans doute la silhouette la plus fragile du procès des auteurs présumés de ce vol devenu viol, à partir de mardi 26 juin, devant la cour d’assises du Val-de-Marne. Elle avait 19 ans en 2014. Ils sont cinq, aujourd’hui, presque de son âge, à être renvoyés des chefs notamment de viol, séquestration, extorsion, violences aggravées et association de malfaiteurs, selon l’enquête judiciaire et l’ordonnance de mise en accusation que Le Monde a pu consulter. Le tout avec la circonstance aggravante d’antisémitisme.

Cinq grands gaillards habitués des après-midi désœuvrés sur les bancs de la Pointe du lac, à Créteil. Laurine C. y avait emménagé un mois plus tôt, chez ses beaux-parents, juifs pratiquants. Elle la Normande timide, ni juive ni athée, juste éprise de leur fils.

« Les envoyés de Mohamed Merah »

Quatre ans après, à Créteil, s’est installée comme une méfiance latente sur les rives de ce quartier populaire bâti autour d’un lac artificiel, prisé d’une petite communauté juive banlieusarde. Aux yeux d’habitants qui ont accepté de se confier, les « braises » ayant conduit au drame sont toujours inflammables. L’annonce, quelques jours après les faits, sur ces mêmes berges, de l’antisémitisme comme « grande cause nationale », par le ministre de l’intérieur de l’époque, Bernard Cazeneuve, n’y a rien changé. On était alors un mois avant l’attaque de Charlie Hebdo et de l’Hyper Cacher.

Les affaires Sarah Halimi, en 2017, et Mireille Knoll en mars, ces vieilles dames de confession juive tuées dans des circonstances troubles, à leur domicile parisien, sont aussi passées par là. Autour de ce bassin, autrefois la fosse d’une gigantesque décharge, les promeneurs se sont toujours partagés les berges, sans trop d’encombres, avec le trafic de stupéfiants. L’appartement des beaux-parents de Laurine C., un T4 de location en deuxième étage, donnait lui-même sur une impasse, à deux pas du deal et des cygnes. Mais l’idée que les eaux grises du lac puissent désormais apparaître aux cités voisines – d’où venaient les agresseurs – comme le premier pas vers l’embourgeoisement a fait s’envoler ce que beaucoup appréciaient, justement, à Créteil : l’insouciante tranquillité.

La deuxième victime, Jonathan B., le compagnon de Laurine C., un garçon tranquille de 25 ans aux cheveux gominés devenu chauffeur VTC, sera l’autre témoin attendu de ce procès, pour raconter cette heure de huis clos particulière. Lui non plus n’a pas compris les raisons de l’acharnement, ce jour-là. Israël, l’alya, shabbat, la cuisine cacher, très peu pour lui. Il venait de passer un an avec Laurine, dans une caserne de Bernay (Eure), où il était gendarme. L’hébergement chez ses parents était transitoire, le temps de se réorienter.

Il a seulement réalisé que les choses tournaient mal quand l’un de ses bourreaux a évoqué « ses frères de Syrie » et de « Palestine ». « On est les envoyés de Mohamed Merah », aurait-il ajouté, selon des propos rapportés dans une écoute téléphonique.

« Elle t’a déjà trompé ? »

Sans surprise, pour les avocats de la défense, le nerf de la guerre sera là. Tenter de démontrer, durant les dix jours d’audience, que malgré les mots, la mezouza arrachée, la photo d’un rabbin et les phylactères jetés par terre, ce que cherchaient les cinq acolytes, c’était d’abord de « l’argent ». L’appartement entier a été mis à sac, pas que les symboles de judéité, pourront-ils se prévaloir. Trois semaines plus tôt, certains des agresseurs présumés avaient en outre mené un commando ­similaire chez un retraité juif du quartier. Il avait été roué de coups sans qu’aucune parole antijuive ne soit prononcée. C’est sur cette base, fin 2016, que la juge ­d’instruction avait abandonné la circonstance aggravante d’antisémitisme.

Un rebondissement barré par l’indignation des parties civiles. En octobre 2017, la chambre de l’instruction a requalifié les faits comme à l’origine. Parmi les motifs invoqués : la façon dont le domicile du couple avait été repéré. Le père de Jonathan B., 64 ans, retraité du secteur bancaire, avait l’habitude de fumer à sa fenêtre. Le vendredi, il se rendait à la synagogue, kippa sur la tête.

« On sait que ton père, c’est celui qui a la Mercedes noire et qui sort le samedi avec le truc sur la tête », avait invectivé l’un des accusés lors du cambriolage. « Tout le monde sait que les juifs ont de l’argent », a aussi avoué, plus tard, le plus jeune des accusés, Cheik-Omar S., 21 ans, croyant bien faire en expliquant que les juifs sont faciles à identifier car « ils ressemblent aux Arabes » mais « sont tous dans le secteur du lac. Et ils ont leur kippa ».

L’accusation sera malgré tout gênée par l’absence, lors des débats, d’un dénommé Houssame H. ­Celui à qui sont attribués la plupart des dérapages antisémites et les incitations au viol les plus crues, selon les récits corroborés des victimes et de ses complices présumés. Un jeune sans diplôme, 18 ans lors des faits, en fuite en Algérie et depuis sous mandat d’arrêt. « Ça te dirait que ta copine suce une queue de black ? (…) Elle t’a déjà trompé ? », « Est-ce que tu l’aimes ton copain ? (…) Vraiment ? », aurait-il pris un plaisir sadique à déclarer au jeune couple, tout en faisant tomber des couteaux d’argenterie sur le dos de Jonathan ligoté derrière le canapé.

Tags antisémites

Lors de l’enquête, les policiers ont vainement tenté de sonder son entourage. Son père notamment, domicilié au douzième étage d’une tour de la commune voisine de Bonneuil-sur-Marne. « Moins on en entend parler, mieux on se porte », s’est-il contenté de résumer à son propos, dressant à gros trait le portrait d’un gamin fugueur, déscolarisé depuis ses 14 ans, « bête » et « con ».

Au rez-de-chaussée de l’immeuble, les brigadiers ont découvert un local recouvert de tags antisémites : « A bas les juifs », « Morts aux juifs », ou encore, à côté d’une tête gribouillée au feutre noir avec de grands cheveux bouclés : « Sale fils de pute de rabbin juif. » Finalement, il a été établi qu’Houssame H. avait pris un vol de Roissy pour Oran, dès le 4 décembre 2014.

Qui a violé ? Telle devrait être, au final, la principale question pour la cour et les jurés. Qui a enlevé son gant, ce jour-là, soulevé le tee-shirt de Laurine C. et lui a fait tendre ses jambes dans l’espoir vain de savoir où était sa carte bleue puisqu’elle n’en avait pas. Le témoignage de la jeune femme porte les traces de son traumatisme : hésitant, contradictoire, il achoppe avec la défense elle aussi louvoyante des deux principaux mis en cause dans ce dérapage final. Sous la cagoule qui la violait, Laurine C. aurait décelé un visage « noir ». Ils étaient deux, ce jour-là, à correspondre à cette description. Deux vêtus d’une même doudoune sombre à capuche surmontée d’une fourrure. Mais aucune expertise n’a pour l’heure permis de les distinguer.

"
2018-06-22 12:16:03,A_french_chinese_man,"LE PLUS FORT TRAÎNÉE

"
2018-06-22 12:07:19,Carl-Gearhart-Bush,DIS LE PLUS FORT TRAÎNÉE
2018-06-20 17:26:06,Hao73,"Le problème de la prise de poids vient essentiellement des normes de sécurité (crash test, déformation) qui sont demandées sur les véhicules.

Pour ce qui est du coefficient de traînée, je ne sais même pas si les constructeurs s'y intéressent plus que ça.

"
