date,author,text
2019-03-03 05:14:00,weshlamifa,"« C’est pas les quartiers nord, ici. »

Ouais bein ce serait pareil si on avait de l'argent dans nos quartiers pour payer des techniciens d'entretien, pour modifier l'agencement des passages routiers et piétons et de quoi payer une milice (ça va d'un gardien avec sa loge à la police de proximité). 

Et nos vaillants ne prennent pas de risques et préfèrent ne pas perdre de l'argent qui, à la place d'aider le quartier, pourrait servir à envoyer plus rapidement la mifa dans un coin posé. On revient au même objectif de «tranquillité», de «cadre de vie si agréable» sauf qu'on le cherche ailleurs.

La municipalité nous fait la nique et délaisse nos quartiers et on s'étonne que des gens qui le peuvent (qu'ils soient riches ou pas-trop-pauvres) et ont une volonté collective d'investir dans la maintenance de leur quartier s'en sortent mieux ???

Chez ces gens là, qui prennent peur et s'enferment, il y a toujours eu du racisme (en PACA c'est abusé) et le raisonnement typique c'est «ce type a la peau noire et les quartiers avec des noirs c'est la merde et j'ai pas envie qu'il ramène avec lui sa part de merde, ça va salir le quartier tu sais» (entendu tel quel quand je cherchais un logement pour mes études...).

Cependant, c'est surtout les problèmes de stationnement (c'est l'anarchie à Marseille), la haine générée par la guerre d'Algérie (pas exclusive à Marseille mais elle y est très présente) et le relativisme culturel exécrable (j'ai pas une tête à faire des apéros et j'en fais pas, et alors?) qui sont les principales raisons de ce communautarisme tandis que devant les journalistes et les caméras on parle de «bien-vivre collectif» qui est plus politiquement correct et rentre facile dans les têtes.

Des entre-soi de ce genre (où on choisit les bonnes personnes), remplis en majorité de vieux et adaptés pour eux dès le début ou après des travaux de modernisation, on en verra de plus en plus : la très prochaine génération des 75ans+ veut vieillir chez soi et pour les investisseurs c'est le nouvel eldorado après les ehpad.

Des lectures :

https://hal.archives-ouvertes.fr/hal-01417666/document

https://marsactu.fr/dossier/serie-petites-histoires-de-residences-fermees/

https://www.lemoniteur.fr/article/logement-residences-seniors-la-ruee-vers-l-or-gris-a-commence.2023525
"
2019-02-05 09:59:11,Loi_3_Janvier_1973,"Je me permets de poster cet article car l'autre post sur le sujet est une ""simple"" vidéo YouTube sans autres explications sur les conséquences. Ce n'est pas un article, donc bien que sur le même sujet, l'un est un article complet et l'autre une vidéo sans explications.  
  
Extraits:  
  
""Dans une vidéo diffusée sur Snapchat, le rappeur Mister You vante la qualité du cannabis vendu dans l’un des plus gros points de deal du Val-de-Marne. Une «publicité» répréhensible.  
  
Le rappeur Mister You joue les égéries. Pas pour une ligne de vêtements ou un parfum, mais pour promouvoir un haut lieu du trafic de cannabis dans le Val-de-Marne ! Le stade Gabriel-Thibault, située devant la cité Henri-Barbusse, à Villejuif.  
  
« Dédicace à Caliweed, dans le 94, à Villejuif […] » lance Mister You face caméra, avant d’ouvrir les boîtes de conserve et d’humer l’odeur qui s’en dégage. « Hmmm, ajoute-t-il. De la Calibomba, de la Bouddha Waze, oh ouais frérot ! Qu’est-ce qu’il y a là-dedans ? […] Hmmm, Nique sa mère la police ! […] », lâche-t-il, avant de s’allumer un joint.  
  
Mais que risque Mister You ? « Deux infractions peuvent être retenues, détaille maître Calvin Job, avocat au barreau de Paris. Selon l’article L 3421-4 du code de la Santé publique, qui interdit la provocation ou le trafic de stupéfiant, il encourt cinq ans d’emprisonnement et 75 000 € d’amende. Une peine aggravée si des mineurs sont touchés. ».  
  
La deuxième infraction concerne « la détention de produit stupéfiant, pour lequel il risque dix ans d’emprisonnement et 75 000 € d’amende, selon l’article 222-37 du code pénal ».  
  
Younes Latifi, 34 ans, alias Mister You, rappeur atypique et professionnel de la mise en scène, est connu pour avoir construit sa carrière lors de deux ans de cavale à narguer la police. Finalement arrêté en 2010, il est condamné pour trafic de cannabis à trois ans de prison, dont un avec sursis, par le tribunal correctionnel de Paris.""  

"
2019-01-31 15:04:46,Fdurke,"Fallait pas marcher sur les plates bandes de la Police et essayer de magouiller dans le dos du PR et à la nique des Services. 
"
2019-01-26 19:39:37,Fennec-murder,"Nique l'IGPN.

Moi je vais proposer au grand débat un comité de salut publique. Administré par des citoyens. On a pas à faire confiance à une justice qui laisse Benalla courir dans la Pampa et colle 6 mois en comparution  immédiate à un pauvre con qu'a un casque et un fouloir.

La Police n'a aucune légitimité pour enqueter sur la Police."
2019-01-19 00:51:20,kami-no-kohai,"Je vis citer ce grand poete qu'est cut killer 

""Woop woop that's the sound of da police
Ah ah ni-nique la police
Woop woop woop that's the sound of da police
Nique nique nique nique la police""

Je ne suis pas sur de bien comprendre. Je pense que c'est un mec qui entend le son de la police et qui est content car il saitqu'on va lui sauver la vie et du coup veut leur faire l'amour. J'ai  bien compris ?
"
2019-01-09 07:37:33,Thouny,"Je travaille sur des modèles de compte-rendu de travail pour des collègues... sous Word.

La pratique actuelle c'est - comme souvent je pense - de récupérer un ancien compte-rendu et de retaper le nouveau à la place. Et parfois en agrégeant le contenu de plusieurs anciens rapports. Cette méthode montre rapidement ses limites, et est assez gore en réalité : problème de police changeante dans le document, jointure de sections qui niquent la numérotation, tableaux vides qui se baladent ci et là (sans déconner c'est le diable ça), sauts de lignes en lieu et place de sauts de page, etc.

Les styles ne sont qu'à moitié appliqués, genre t'as des titres qui utilisent Titre 1 (par exemple), d'autres qui utilisent bien ce style mais sont dans des zones de texte flottantes (à la limite, ça, c'est pas trop chiant), d'autres qui sont mis en forme comme des T1 mais qui sont comptés comme un autre style... et des lignes vides qui sont en Titre 1 (ça nique la table des matière et ça peut être assez chiant à trouver).  
Notez que ça peut ne pas trop mal marcher si le rédacteur parvient à se démerder pour garder la pagination de ses chapitres.  
Mais si d'aventure il se retrouver à devoir mettre à jour la table des matières... c'est l'apocalypse.

La première chose à faire, c'est de nettoyer tout ça, et d'essayer de créer un document modèle qui pourra servir de base à tous les autres. Donc je reprends tout, j'applique les bons styles, j'en crée quand y a besoin, etc.  
Il s'agit également de caler les tableaux, insérer des sauts de page où il faut, etc.

En fait déjà ça c'est plus compliqué qu'il n'y paraît. Parce que souvent, le rédacteur veut retrouver dans le modèle un truc auquel il s'est habitué dans ses rapports actuels, mais qui est la conséquence d'un problème qui l'emmerde par ailleur.  
Donc faut discuter, essayer de trouver des solutions.

Ensuite, faut essayer d'améliorer le rapport. Souvent y a des trucs qu'ils voudraient autrement, sauf qu'avec le monstre de Frankenstein qu'il utilise, la moindre modification un peu exotique fait tout péter. Avec un modèle un peu propre, on peut commencer à changer des trucs.

Sauf qu'assez rapidement, je me heurte à plusieurs barrières. Déjà, mes propres limites techniques (je ne suis pas un foudre de guerre, l'informatique m'emmerde, je fais pas ça par plaisir) ; et également les limites de l'outil (la différence entre les deux limites étant parfois floue, Word fait sans doute des tas de trucs dont je n'ai pas idée).

Je me heurte également à un écueil assez indépassable je pense : il faut trouver un compromis entre automatisation et personnalisation. Faut un modèle robuste, mais souple. Robuste (et contraignant) pour pas que ce soit la foire, mais en même temps il faut que ça puisse s'adapter à tout ce que l'on pourrait avoir besoin d'écrire dans un rapport.  
Par exemple, je comptais beaucoup sur les tableaux, mais en fait c'est beaucoup trop limitant dans pas mal de cas.

Et enfin, il y a un paramètre à prendre en compte, c'est qu'il faut que ce soit manipulable par le rédacteur. Pas seulement utilisable, mais manipulable : si tel élément lui pose problème, dans l'idéal il faut qu'il sache le modifier, ou le supprimer. C'est important : je vais pas rester 10 ans, et quand je serai parti je ne serai plus disponible en cas de pépin. Donc si le modèle n'est utilisable que tant que je suis là et disponible... ce n'est pas un bon outil.

Et évidemment le rédacteur lui demande des trucs qui ne respectent pas tout ça. Lui il veut que ça récupère des tableaux qu'il crée à droite et à gauche et les insère automatiquement, que la mise en page ne se barre pas en couilles dès qu'il bouge un truc *mais* il veut quand même pouvoir placer ses images où il veut sur les pages, etc.

Comme moi, ils ont tendance à se dire que l'informatique, c'est automatique, donc que si tu as tes données quelque part en format informatique, alors Word devrait pouvoir les insérer automatique là où tu veux. Mais ça marche pas comme ça :(  
Parfois j'ai envie de sortir R pour leur faire une feuille en Markdown (je maîtrise pas LaTeX) qui permet en effet de récupérer les données de tableaux pour les insérer dans un rapport etc., rien que pour leur montrer qu'ils ont pas envie de devoir utiliser ça, et que donc on va se contenter de Word et de ce qu'il permet de faire."
2018-12-08 14:14:57,Franchementballek,"J’entends bien ce qu’il dit, et je comprends la détresse, mais tu donnes l’impression de te laisser emporter par l’emotion, il faut être objectif dans ce genre de situation: réponse par l’humiliation à des délits/crimes = abus.

Peut être qu’une grande part de ces lycéens c’est des gros cons qui le méritaient. Mais il faut suivre les procédures, faire confiance à la justice même si ça fait mal au cul parfois, sinon tu risques de décrédibiliser toute l’institution. 

La majorité des policiers sont bons et justes, mais s’ils petent un câble et reproduisent la loi du plus fort parce que ça fait 10/20/30 ans qu’ils se mangent des « nique ta mère » tous les soirs notre Pays a perdu.

En tout cas ils ont perdus la confiance de ses 150+ lycéens, comme ils perdent, souvent dans des conflits du quotidien, la confiance d’autres citoyens, avec le silence de leurs collègues bons et justes.

C’est pas de leur faute et c’est un métier très difficile. Ils sont devenus les seuls représentants de l’ordre et de l’etat et c’est très souvent dans des situations conflictuelles. La Police de proximité qui a été supprimée en 2004 je crois par Sarkozy permettait justement d’avoir un rapport avec la police plus calme, j’ai appris à faire du quad et du cross avec la police de proximité de mon secteur! Maintenant il n’y a même plus de discussion.

Pardon pour « haine viscérale » je me suis emporté, j’avais l’impression que peu importe leur sort et la façon dont ils ont été traité tu les jugeait sans plus de détails, j’attendais un article avec les faits."
2018-12-08 11:55:32,FranzStrudel,"Conçois-tu qu'il existe une différence entre la Police et les policiers ?

OP fait l'amalgame entre les deux, et je dis non a ça.

Les policiers sont des citoyens, par contre la Police est une institution de l'État. 

Si je dis ""Nique la police"" j'insulte l'État, les actions/décisions du préfet, la politique du ministre de l'intérieur, plein de choses mais aucun être humain. Et certainement pas les policiers.

Faire l'amalgame c'est déresponsabiliser le gouvernement et semer la zizanie au sein du peuple."
2018-12-03 19:19:24,ClassiestManOnEarth,"Don't forget to bring a yellow vest, you may not find one here. Also, train yourself by inhaling tear gas, just a bit every day. You need to be able to shout "" nique la police"" ( fuck the police) loudly. Running skills are also required (good performances on the half mile are appreciated), just as throwing things.

Seriously, the riots only happens on satuday or sundays and in a few places. Ask the desk of you hotel a paper map of Paris and to pin the locations to avoid, they will gladly help you. Don't hesitate to ask them any advice."
2018-11-08 18:04:59,Sharblue,"Grandiose, mais qu’est-ce qui t’en empêche, hein?

J’veux dire. Je suis technicien justement. Déjà j’ai pas vu ça écrit.

Mais je vois pas comment ça peut juste être mis en application.

Donc c’est « juste » ça qui t’a dissuadé ? Ou c’est le concours en lui-même?

Au pire tu t’inscrivais, t’y allais en mode « fuck la police, j’utilise mes compétences techniques tavu » et voilà. Ça passe t’as niqué le système.

Ca passe pas, tant pis, t’aura essayé.

Et vu a quel point les concours, c’est casse couilles. Et que c’est vraiment pas la formalité à passer avant d’aller poser son cul dans un fauteuil à rien foutre."
2018-11-05 07:51:45,Irkam,"Je ne me laverai plus jamais les mains. J'ai dit bonjour au claviériste de Carpenter Brut. Voilà. J'ai passé une soirée énorme. Et je suis au taf avec le tshirt du tour, nique la police."
2018-11-01 18:51:35,mrhotpotato,"Air France =  ""Inaction des authorités"", ""Pas de vagues"" et en même temps ""Nique la police"". Contradiction quand tu nous tiens..."
2018-10-23 19:53:16,Numerous_Ball,"Et ça te marrait pertinent comme analyse ? Parce qu'à moi pas du tout.

&amp;#x200B;

J'habite dans un quartier bien bobo de Paris. J'ai jamais vu un graffiti dans la cage d'escalier. Est-ce vraiment par peur du gendarme ? Si je prenais un marqueur maintenant et que j'allais écrire ""nique sa mère"" dans la cage d'escalier ils enverraient la police scientifique pour faire des relevés ADN pour me retrouver ? Non, je pourrai sans doute continuer à vivre tranquillement sans payer pour mon méfait. Et pourtant, non seulement je ne le fais pas mais en plus de ça personne d'autre ne le fait.

&amp;#x200B;

Alors quelle est la vrai différence ? Bah ça c'est une question complexe à laquelle on ne peut pas répondre lapidairement en deux phrases en mode ""moi je suis pas politiquement correct, je dis les choses comme elles sont ! Nique la bien-pensance !!""

&amp;#x200B;

Mais allez, je vais essayer d'apporter quelques éléments plus constructifs. Déjà, je sais que dans mon immeuble même si je décidais de pourrir la cage d'escalier ça serait résolu dans la semaine. On paye des centaines d'euros de charge, on a un gardien attitré etc... Lundi prochain c'est comme neuf. D'un autre coté si tu vis dans un immeuble à moitié insalubre pour commencer je peux te dire que ton graffiti de teub à noël il y est encore... Alors si ton immeuble est déjà moisi, un peu plus, un peu moins... En comparaison ça parait sans doute moins grave. Si t'as vécu toute ta vie dans un immeuble tagué ça te choque sans doute moins, alors qu'à moi ça me passerait même pas par la tête. Mais bon, ça c'est des excuses de gauchiasses, alors quoi d'autre ?

&amp;#x200B;

Un autre élément c'est que dans ces barres d'immeubles de banlieue t'as souvent des jeunes qui squattent, probablement les mêmes jeunes qui s'emmerde et dégradent les lieux. Pourquoi? Moi j'ai jamais fait ça, quand j'invitais des potes on allait dans ma chambre, on regardait la télé, on jouait à des jeux etc...

&amp;#x200B;

Sauf que quand t'es dans un petit appart où t'as une chambre minuscule que tu partages avec tes frères et sœurs et ou les murs se rapprochent plus du carton que de la brique, bah quand tu veux être un peu peinard avec tes potes tu vas ailleurs. Et je la joue pas en mode ""Les Misérables"" là, c'est quelque chose que j'ai vécu chez des potes moins fortunés que moi qui habitaient dans des immeubles où mes parents me laissaient pas aller tout seul le soir quand j'avais 16 ans.

&amp;#x200B;

Alors si tu peux tu vas chez un pote qui a un meilleur appart. Sinon tu peux essayer d'aller dans un bar ou au ciné, mais pour ça faut de la thune (et accès à un ciné pas trop loin). Sinon tu peux rester dehors. Mais des fois il fait froid dehors, ou il pleut, alors tu fais quoi ? Bah tu squattes dans l'escalier.

&amp;#x200B;

Alors après on est d'accord que même arrivé à ce point là, si le gars décide de taguer le mur c'est complètement sa responsabilité et c'est une connerie. Mais après de là à faire un raccourci avec ""les gens du 8ème font pas ça"" ça me fait doucement rigoler."
