date,author,text
2021-07-30 12:16:26,C6H12O7,"*Nique la police, vive la guedro*

*Dès l'ouverture, y'a les gyro*"
2021-06-09 06:49:10,240-185,"Voiture braquée : suite.

Comme prévu, véhicule économiquement irréparable. J'ai dû restituer le véhicule de remplacement et faire les 4 kilomètres qui me séparent de l'agence à pied, faute de transports en commun efficace.

Obligé de déménager UNE TROISIÈME FOIS EN DEUX ANS parce que le syndic et la police ne feront rien pour arrêter le voisin indélicat qui m'a niqué ma bagnole."
2021-06-04 12:18:26,NonSp3cificActionFig,"- Vous avez aussi écrit, une semaine plus tôt ""Nique la police"". Vous maintenez ces propos ou pas ?

- AH oui, mais nan. C'était à prendre comme un compliment, m'sieur l'agent. Vouuuus.... vous êtes libre vendredi soir ?"
2021-06-01 16:48:02,asakakaron,"Dans une semaine y'aura un ""nique ta mere la police"" et deux trois graffiti pourraves dessus malheureusement.

Y'a un mur autorisé en bas de chez moi et y'a des bons qui font des fresques superbes dessus et des trouducs sans talent qui passent derrière systématiquement pour y accoler leurs petits signes de gang merdique et tout pourrir."
2021-05-04 15:51:21,Dowdidik,"C'est fou ces raisonnements cherchant à faire entendre que c'est un bon président quand il veut bien. Ca revient un peu à dire ""papa me frappe des fois, mais bon il m'a dit que j'avais bien travaillé à l'école cette fois"". Est-ce que ça fait de ce papa un bon papa ? Est-ce que papa nous félicite pour notre travail parce qu'il est gentil et se préoccupe de nous ou bien parce qu'il pense que c'est grâce à lui et à ses tartes qu'on a eu une bonne note ? On doit le remercier et le valoriser pour ça ?

Parce que oui Macron fait frapper des gens, a une politique de plus en plus autoritaire, et c'est pas en mettant des œillères dès qu'il ""fait son boulot"" que ça va aller mieux. Et dire un mot gentil sur l'e-sport, c'est exclusivement de la com, et le boulot du président c'est pas exclusivement de la com, c'est aussi des prises de décision, des choix dans l'équipe gouvernementale, etc. 

Évidemment on ne s'attend pas à ce que les politiciens soient 100% honnêtes dans leur prise de parole public, il faut bien arrondir les angles et mettre le plus grand nombre d'accord pour que ça se passe bien, mais faut juste ouvrir les yeux deux secondes et bien comprendre qu'il va chopper des points là où il peut parce que c'est favorable pour sa personne à lui et pas pour nous. Et derrière il nous nique dès qu'il en a l'occasion avec son libéralisme à outrance et la précarisation des classes les plus pauvres.

""C'est bien ça montre l'importance de l'e-sport"". C'est vraiment une blague cette argument, il faut que le président dise un truc pour qu'on se rende compte de son importance ? On est où là sur le plan de la réflexion personnelle ? Ce qu'il fait, prendre les gens pour des cons et les laisser croire qu'ils ont de l'importance à ses yeux, marche parfaitement et le thread le montre très bien. Et si l'argument qui suit c'est que ""c'est son travail de féliciter les sportifs etc pour le rayonnement de la France"" bah on s'accorde pour dire qu'il fait ça par pur devoir et je vois pas en quoi c'est mieux. Le problème c'est pas qu'il dise ça, au final, c'est que les gens croient qu'il est sincère et que ça montre une quelconque reconnaissance complètement fantasmée. 

Ca me fait penser aux vidéos où on voit un Obama rigoler comme un gai luron avec Bush et qu'ils se font des blagounettes en direct à la télé ""l'air de rien"", comme si que c'était leur nature d'être des joyeux drilles. Comme si voir sourire un type le rend forcément agréable, peu importe ses méfaits quotidiens et l'immense part de responsabilité dans tout un tas de drames. Faut pas être dupe, toute info du genre, toute image, etc, est réfléchie par une équipe bien payée pour remonter la côte du bonhomme, et tomber dans le piège de croire que tout ça est naturel, bien venu, plein de chauvinisme transpirant la sincérité, ça devrait vous énerver.

Mais au lieu de ça, on crache sur ceux qui se contentent de douter de sa sincérité alors qu'on a toutes les raisons de le faire. Vous supportez tellement pas un avis divergent du votre que ça se règle à coup de downvote et de ""vous êtes jamais contents bande de vilains"".

J'ai l'impression que beaucoup effacent leur historique mentale dès qu'il se passe un truc, aussi insignifiant soit-il. ""Oh, il vient de dire un truc gentil, donc je n'ai plus besoin de penser à la convention citoyenne pour le climat, à la loi sécurité globale, au fait qu'il ne fait rien pour que la police arrête les violences excessives et disproportionnées... en fait il est sympathique quand on regarde bien !"" Manquerait plus qu'on le voit en sueur en direct après un attentat, comme pour Hollande, le voir improviser un discours en mode ""on tiendra ok les copains"" et boom la cote de popularité economy stonks"
2021-04-23 08:17:56,-aRn-,"&gt; Mais putain les pompiers quoi. ""Passe encore"" quand c'est la police, je trouve ça stupide mais je comprends la """"""logique""""""

Uniforme, état, ""nique la France""..."
2021-04-20 16:46:36,CulteDeLaRaison,"&gt;Le maire divers gauche de  Meylan (Isère) cherche à s’opposer à la construction d’une église  catholique intégriste sur le territoire de sa commune. Comme le maire  d’Albertville il y a deux semaines, il fait face à l’impossibilité pour  un maire de refuser la création d’un lieu de culte pour un motif autre  qu’urbanistique.

Deux semaines après [le coup de colère du maire d’Albertville](https://www.marianne.net/societe/laicite-et-religions/pourquoi-le-maire-dalbertville-se-dit-condamne-a-accepter-une-ecole-privee-musulmane) contre l’installation d’une école privée hors contrat musulmane sur le  territoire de sa commune, c’est au tour du maire divers gauche de Meylan (Isère) Philippe Cardin de s’opposer à la construction d’une église,  catholique traditionaliste cette fois-ci. Avec près de 650 m² pour une  petite ville de 17 000 habitants, cette nouvelle église serait le plus grand lieu de culte de la commune et vise à rassembler des fidèles venant de toute la région. Mais, alors que la municipalité refusait de  lui accorder son permis de construire, le tribunal administratif de Grenoble a cassé cette décision, en se fondant uniquement sur des  critères urbanistiques.

Dans un communiqué publié en début de semaine, le maire de la commune Philippe Cardin admet que « *ce recours permettait principalement de gagner du temps* ». Mais il dénonce malgré tout dans une interview donnée au [*Parisien*](https://www.leparisien.fr/societe/le-maire-de-meylan-ne-veut-pas-deglise-integriste-dans-sa-commune-de-lisere-19-04-2021-TP3LMVV2WNB2VGDNBKDGYQEL54.php) un projet mené par « *des intégristes dangereux pour la République* » dont les fidèles « *exacerberont les violences, les tensions* ». Philippe Cardin en appelle au ministre de l’Intérieur et aux parlementaires pour l’aider à obtenir gain de cause.

## « Des intégristes dangereux pour la République », selon le maire

L’église en question est affiliée à la Fraternité Sacerdotale Saint Pie-X de  Mgr Lefebvre, qui refuse [le Concile Vatican II](https://fr.wikipedia.org/wiki/IIe_concile_%C5%93cum%C3%A9nique_du_Vatican) et campe sur des  positions traditionalistes. Le maire de Meylan souligne leur proximité avec le parti d’extrême-droite Civitas et se dit révolté par une  conférence prononcée au prieuré Saint-Pierre-Julien-Aymard sur sa commune en 2018 et intitulée « *Pourquoi et comment lutter contre les droits de l’Homme ?* », pendant laquelle aurait été effectué un appel aux dons pour la construction de cette nouvelle église.

« *Comment accepter la présence d’un groupe intégriste qui ne reconnaît pas la liberté de croire ou l’égalité entre les femmes et les hommes à  proximité du lycée fréquenté par 1 500 jeunes, nos enfants ?* », se demande dans son communiqué le maire de la commune, qui appelle à « *faire société en empêchant les endoctrinements et en favorisant le dialogue et le respect* ». « *Je ne peux croire* », affirme-t-il, qu’« *alors même que le projet de loi confortant le respect des principes de la  République et de lutte contre le séparatisme est en débat au Parlement, un tel groupe niant régulièrement les valeurs de notre République puisse impunément construire un tel lieu de culte démesuré pour notre commune.* »

## Pas de droit de regard

Mais, comme dans le cas du maire d’Albertville s’opposant à la création d’une école privée musulmane, la municipalité se heurte à l’impossibilité légale pour les pouvoirs publics de refuser un permis de construire pour des motifs autres qu'urbanistiques ou d'ordre public. « *Lors de l’installation d’un nouveau lieu de culte, une municipalité n’a aucun droit de regard sur le contenu de la croyance professée* explique Clément Benelbaz, maître de conférences en droit public à  l’Université Savoie-Mont-Blanc et auteur d’une thèse de doctorat sur le concept de laïcité dans le droit français. *Le maire ou le préfet ne  peuvent s’y opposer que sur des critères d’urbanisme ou de police et, dans ce cas précis, le tribunal administratif n’a pas été dupe du  caractère infondé du critère urbanistique invoqué par la municipalité.* »

Cette libre implantation garantit, selon le juriste, l’égalité de traitement des cultes : « *C’est un principe phare de la loi de 1905 : tout comme les religions ne peuvent pas s’immiscer dans l’activité de l’État, inversement le politique ne peut pas s’immiscer dans le contenu des croyances, dire aux  citoyens ce qu’ils peuvent croire ou ne pas croire. Dans un régime laïque, toutes les convictions religieuses sont mises sur un pied  d'égalité et l'État n'a pas à porter de jugement sur leur contenu.* »

## « Un principe phare de la loi de 1905 »

Pourtant, nombreux sont les maires à tenter de s'opposer à la création de nouveaux lieux de cultes sur le territoire de leur commune. « *Cela arrive fréquemment depuis les années quatre-vingt*, commente Clément Benelbaz. *Des  maires jouent sur des critères d’urbanisme pour s’opposer à  l’implantation de lieux de cultes sur leur commune. Mais, généralement, le juge administratif ne si trompe pas et comprend si l’argument tient  la route ou non* ».

Le cas de la mairie d’Albertville a donné lieu à un [amendement de dernière minute](https://www.google.com/search?client=firefox-b-d&amp;q=Albertville+amendement+derni%C3%A8re+minute+Marianne) à la loi confortant les principes de la République. Ce dernier vise à  interdire le financement d’écoles privées pour des motifs tirés des  relations internationales ou pour cause de menace contre la souveraineté  de la nation. Il ne saurait s’appliquer dans le cas d'un lieu de culte."
2021-04-10 22:27:13,Sasha_Viderzei,"Et ça les enfants, c’est pour ça que le slogan c’est ""nique la police"" et pas ""nique les pompiers""."
2021-03-12 13:28:11,Gaazoh,Moi je dois traverser la rue pour sortir la poubelle. 9 fois sur 10 je le fais après 18h. Nique la police.
2021-03-05 17:03:28,[deleted],"Emmanuelle Oster la connaît, cette musique : « Nous, on gère les conséquences de ce phénomène, pas les causes, explique-t-elle dans son bureau du commissariat de la rue Marcadet, l’un des plus importants de France. La plus grande partie de leur journée, ils ne sont pas dans la délinquance. Ils stagnent. Ce qui génère de l’exaspération, c’est leur comportement : ils crachent, ils ne portent pas de masque, ils vivent d’expédients. Mais si les jeunes ne font rien, sur quelle base légale je les fais bouger ? Ils n’ont pas d’adresse, pas de papiers d’identité. On ne va pas leur dire “rentrez chez vous”. La question, c’est : pourquoi ils sont là ? Ce n’est pas à moi de répondre. On n’a pas la base légale pour être efficaces. On est un peu démunis, quoi. »

En une minute, le chaos

La laverie ne ressemble plus à rien. Le sol est encore plus sale que d’habitude : mégots, canettes, traces noires de semelles de baskets, traînées d’eau. Une bassine pleine a été déposée près d’une machine à laver : le plus jeune du groupe, en caleçon bleu, assis dans un tambour, y trempe ses pieds noirs et abîmés par des baskets étroites qu’il porte sans chaussettes. Houppette blonde, yeux étirés, joues rondes : son joli visage est intact. Il ne peut pas avoir plus de 13 ans : il a des petites cuisses rondes d’enfant.

Des clients de la laverie se glissent entre les mômes et la fumée épaisse pour récupérer leurs draps et leurs vêtements. L’odeur prenante du shit se dégage jusque dans la rue. Ils ont les yeux rivés vers le sol comme s’ils craignaient de provoquer une bagarre simplement en croisant leurs regards. En réalité, les jeunes ne les voient même plus. Un passant exaspéré saisit les sacs de sandwich par terre et les balance de l’autre côté de la rue. Les garçons courent récupérer ce qu’ils peuvent.

Il est autour de 20 heures quand un employé de la laverie pousse brutalement la porte. Il est encadré par deux gros bras du quartier. Il hurle que ça n’est plus possible. En une minute, c’est le chaos. L’homme, la quarantaine bien tassée, est massif. Il saisit Ayoub par les épaules, le sort du tambour et le secoue très fort. Il hurle qu’il va le tuer. Les autres gamins tentent de s’interposer, il les pousse violemment, l’un est projeté contre une machine, un autre par terre. Ayoub proteste – « j’ai rien fait, je lavais mes vêtements » (ce qui est exact).

L’adolescent fait le mouvement de s’avancer vers son agresseur, comme pour s’expliquer. L’autre n’y tient plus : « Tu n’as rien fait ? Et ça ? » Il saisit des sacs en plastique pleins de vêtements et de nourriture qu’il balance dehors avant de lui coller une gifle, puis une autre. Ses deux amis, jusque-là passifs, comprennent qu’il est à un rien du coup de trop. Ayoub saigne, il y a des traces de sang par terre. Ils raisonnent leur pote : « Allez, c’est un gosse. » L’autre continue : « Je vais le tuer, je vais le tuer. » Ayoub hurle et répète qu’il n’y est pour rien. Il voulait juste laver son pantalon. Debout pieds nus et en caleçon, il a le visage trempé et en sang. Il est terrorisé et pleure comme un enfant : « Je lavais juste mes vêtements, je lavais juste mes vêtements. » Sa voix se perd dans le boucan et les cris des adultes qui menacent : « Si on vous revoit là, on vous défonce. » La dizaine d’adolescents sortent. Ils stationnent dehors autour de la laverie. Ayoub s’en va – il dort dans un squat à Aubervilliers ces jours-ci.

Des habitants exténués

Dix minutes plus tard, l’incident est oublié. « Des bastons, il y en a tout le temps », observe Hana en sirotant son lait fermenté, pas du tout impressionnée par la scène à laquelle elle vient d’assister. Un peu plus tard dans la soirée, un Algérien qui s’était pris une bouteille en verre sur la tête en pleine journée au milieu des riverains effrayés est revenu le visage toujours ensanglanté, un tesson à la main : Hicham* s’est fait défoncer le crâne. On ne compte plus les pétitions, lettres ouvertes et suppliques envoyées jusqu’à l’Elysée par les habitants du quartier, exténués de voisiner avec ces jeunes livrés à eux-mêmes et d’assister à leurs rixes quotidiennes. « Il y en a même une qui a écrit à l’Elysée en se plaignant qu’ils crachent, explose de nouveau Emmanuelle Oster à l’évocation de ces courriers. Mais qu’est-ce que vous voulez que j’y fasse ? Un Maghrébin, ça crache dans son pays et ça crache en France ! Je ne vais pas faire l’éducation des Maghrébins ! Ça n’est pas raciste que de dire ça ! »

Quelques jours plus tard. 14 décembre. Laverie du bas de la rue. « Allez, qui veut naviguer ? », supplie Hana. Les garçons ne sont pas chauds, pas ce soir. Elle hausse les épaules, elle trouvera bien quelqu’un d’autre. Naviguer, c’est trouver de l’argent. « Moi, c’est l’argent, le flouze qui m’intéresse », dit-elle. Elle repart pour rejoindre la laverie du haut de la rue, celle qui est près de l’école élémentaire. De loin, elle aperçoit Farah qui ne marche pas droit. Elle est bien coiffée, habillée coquettement, jeans moulant, pull rouge, ceinture de contrefaçon et petit sac en cuir. Son visage, soigneusement maquillé, est strié d’une dizaine de hachures noires, comme des croisillons, sur le front et les joues. Elle lève ses manches : ses bras portent les mêmes traces.

La veille, Farah s’est lacéré elle-même le corps et le visage. Autour du poignet, elle porte un bracelet d’identification en plastique. « Je sors de l’hôpital. » Elle s’exprime avec peine, les mots ne sortent pas, sa mâchoire dévie à gauche : « Ma langue est lourde. » À peine sortie, elle a repris de l’ecstasy et des « saroukh ». Elle fume quelques cigarettes avec Hana, pleure en demandant si son visage « restera comme ça toute la vie », puis se dit partante pour naviguer. Mais elle est trop mal en point : il faut appeler les pompiers. Quelques jours plus tard, renvoyée de son foyer, elle est partie à Bruxelles avec un groupe de jeunes rencontrés sur Instagram. Eux quittaient l’Espagne.

20 h 30, dans la laverie d’où ils se sont fait débarquer quelques jours plus tôt. Parce que les rues sont maintenant vides, la musique que crachotent les smartphones paraît de plus en plus forte. Il y a le rap qu’écoutent Hana et quatre garçons au fond de la laverie. Les vidéos que regarde Ayoub, allongé au fond d’un tambour en caleçon. Il attend à nouveau que son unique pantalon sèche.

Un petit couple est là : Inès* et Younès*, qui ne se déplacent qu’ensemble. Italienne d’origine marocaine, elle a 13 ans. Craintive et discrète, elle a été victime d’un viol collectif il y a quelques mois. Lui a 16 ans. Il est arrivé de Casablanca il y a un an. Une voiture part pour Bruxelles le lendemain soir. Ils sont pressés d’y être. Comme leurs copains, ils voyagent. Un peu partout en France mais aussi en Belgique, en Allemagne, en Suède… Ils franchissent les frontières, en voiture ou en train, au gré des saisons et des plans, pour aller retrouver un cousin ou un ami ou s’éloigner de Paris parce qu’ils sentent que ça chauffe pour eux.

Trois garçons déboulent. On étreint l’un d’eux, bonnet bleu. Ça faisait longtemps qu’il n’était plus venu. Croyant avoir affaire à une avocate, il nous tend sa fiche de sortie d’une maison d’arrêt de la région. Wassim* a volé un portefeuille. Récidive, ça n’a pas loupé : deux mois. Il a quitté la prison le matin même avec ce qu’il avait sur le dos. Personne ne l’attendait nulle part : il est revenu à Barbès. Deux heures plus tard, après avoir fumé suffisamment de joints pour avoir les yeux rouges, il est allé « naviguer » avec deux autres garçons. On ne l’a pas revu. Hana non plus, qui cette nuit est rentrée se coucher sagement dans son squat de Seine-Saint-Denis.

Accro au quartier

Février 2021. Célia est de retour à la Goutte-d’Or. À la mi-décembre, elle a fugué de son foyer aux Pays-Bas. « C’était dans un endroit où il n’y avait rien, pas de magasins, pas de cafés, rien… La campagne, mais il n’y avait même pas de chèvres ou de poules. Rien ! » Elle est d’abord allée en Allemagne, où elle a récupéré sa grande copine Hana. Hana, qui en avait marre de Paris, s’est barrée après Noël. Ensemble, elles sont retournées à Amsterdam. La police les a arrêtées. Hana a été conduite en centre fermé en attendant son rapatriement en France.

Célia, majeure, a pu rentrer sans encombre. Et la revoilà à la Goutte-d’Or, par - 2 °C, sans manteau sur son jogging noir. Devenue accro au quartier, son chez-elle depuis ses 14 ans, elle ne cesse d’y revenir. Elle y a pourtant traversé le pire, ce qui arrive à toutes ces filles : la drogue, les viols, les grossesses non désirées, la délinquance. Et elle est à nouveau dans le pétrin. Il y a quatre jours, elle s’est fait embarquer pour outrage à agent. Un flic a cassé sa bouteille de vodka, alors elle a pété les plombs, elle lui a dit « nique ta race de keuf ». Il a tout filmé avant de l’embarquer en garde à vue. Elle ne peut pas s’empêcher de rigoler en racontant ça. Quelques nuits plus tôt, le campement situé dans des tunnels sous la gare de Lyon où elle s’était trouvé une place a été évacué. Elle y dormait avec deux autres filles et des dizaines de migrants, des hommes. Depuis, elle s’est trouvé une place dans un squat.

Célia aura 19 ans dans quatre jours, mais, pour elle, l’avenir est devenu un concept flou. « Je ne peux rien prévoir. Je ne sais pas ce qui va se passer tout à l’heure ou ce soir… » Elle sait juste qu’elle ne veut plus dormir dans son squat de Saint-Ouen. La veille, ils étaient quinze à vouloir « la forcer »."
2021-02-28 22:43:11,chatmioumiou,"Ouais ok, je vois vous êtes de ceux qui pensent que les banlieues c'est la jungle des bonobos.

On va empêcher des gamins de 15 ans de planter leur semblable grâce à des médiateurs et des assistants sociaux qui vont pouvoir expliquer à papa, maman et les enfants bonobo que c'est pas bien de tuer des gens. Ils n'ont pas de morale, faut leur enseigner. La France doit élever les enfants des gens qui y vive. L'école gratuite, la cantine gratuite, le logement a loyer modéré, les aides sociales, c'est pas assez... La vie est trop dure.

Vous croyez sincèrement qu'un gosse de 15 ans qui plante un autre gosse ou le gamin qui sert d'alarme anti police en bas de la tour fait ça a cause du manque d'argent dans l'éducation et l'orientation ?

Vous croyez que le petit en bas de la tour un matin il s'est dit ""Je ne vais jamais devenir médecin a cause de mon lieu de naissance !!!! Nique la société ! Je vais devenir dealer ou tuer quelqu'un !""


La société elle doit faire quoi ?

Aller chercher les mec du quartier qui passent leurs journées à boire du café et jouer au amigo et leur donner un taff pas trop fatiguant payé 3000€/mois ?

Allee chercher le petit qui est en train de partir en vrille et l'enfermer dans une classe où il a pas envie d'être et foutre la merde pour ceux qui veulent travailler ?

On doit payer les enfants de banlieue pour aller a l'école, un petit 1000€ par mois et 10 000 € au diplôme ?

Foutre tous les cassos qui branlent plus rien depuis le cp en bac pro menuiserie ou mécanique comme ça ils vont s'occuper, foutre la merde, et empêcher les gens qui veulent vraiment devenir menuisier d'apprendre leur métier tranquille ?

Payer des educateurs pour aller expliquer a des gosses que dealer c'est mal pour se faire envoyer chier par des gamins qui ont des liasses de billets dans les poches équivalentes aux salaire dudit éducateur ?

Payer les grands frères pour qu'ils ""assurent"" la ""tranquilité du quartier"" ? Des mecs qui n'ont aucune formation, qui font un peu ce qu'ils veulent et dont on ne sait pas bien à quoi ils servent ?

La banlieue c'est pas un film de canal+ avec Omar Sy et Djamel Debbouze qui aident un petit arabe a sortir du deal en lui apprenant à danser du hip hop, lui faire découvrir la vie, la morale, le sortir de sa misère, et faire de lui un neurochirurgien, et son papa et sa maman qui ne parlent pas français qui pleurent a la fin a la remise des diplômes."
2021-02-22 14:02:10,ToineMP,"Comme l'auteur(e) du poste, je n'ai pas l'impression que le message soit le bon. Tu as écouté la chanson ?

Ça dit qu'ils ont grugé le confinement, pas appliqué les gestes barrières, ils s'amusent à courir pour échapper à la police. Et ils disent juste qu'il faudrait les appliquer pour revenir à un monde normal.

Alors déjà le premier message est nul, et en plus le 2eme est faux. Les gestes barrières c'est une solution pour temporiser en attendant les effets du vaccin, pas la solution ultime.

Ils ont très peu rappelé les gestes d'ailleurs.

Je m'attendais à mieux, leur avis personnel est trop passé dans cette chanson, ils s'en foutent, ça les fait chier. Je ne jette pas la pierre je suis comme eux, jeune, pas à risque, une famille pas à risque, j'en ai marre de voir mon quotidien niqué pour des vieux qui se promènent masques sous le nez.

Mais pour autant, le message demandé n'y est pas."
2021-01-09 02:41:10,nuclear_durendal,"Bah au final, je dirais qu'il a heureusement niqué lui même ses chances de faire un coup. 

Il a trop insulté et méprisé l'armé, ces collaborateurs, la police, la justice ect. Mais il conserve encore un soutien énorme. 

40% d'approval après les évènements du capitole, c'est énorme."
