date,author,text
2020-07-15 19:06:16,GatsbyLeRepugnant,"«Il m’a eu» : le Gilet jaune qui a interpellé Macron raconte son 14 juillet

Par Cyril SimonLe 15 juillet 2020 à 17h31, modifié le 15 juillet 2020 à 18h57

En 18 mois, Richard Z. a eu le temps de penser aux mots qu'il opposerait au chef de l'Etat si tous deux s'asseyaient autour d'une table. Seulement voilà, ce mardi 14 juillet 2020, il n'y avait pas de table. Juste celles de pique-nique qui jalonnent les grandes allées du jardin des Tuileries. Allées offertes cet après-midi-là aux touristes… et à Brigitte et Emmanuel Macron.

Il est environ 18 heures quand ce Gilet jaune de la première heure, figure du mouvement dans l'Aisne, tombe sur le président, veste en cuir sur le dos, et accompagné de son épouse. S'en suit une discussion chaotique d'une dizaine de minutes, avec lui et d'autres contestataires. Un échange vite devenu viral.

« Vous êtes mon employé », entend-on dire notamment au président ce demandeur d'emploi de 48 ans, alors qu'il dénonce les violences policières et notamment le rôle des brigades d'intervention motorisées (les BRAV-m). « Si tout le monde est cool, il n'y aura pas de problèmes », rétorque Macron.

Joint par Le Parisien, ce père de famille de cinq enfants a accepté de nous raconter cette séquence. Et le fil de cette journée qu'il affirme avoir terminée au commissariat de police, « bloqué plus de quatre heures », pour un contrôle d'identité sans rapport avec son échange élyséen.

« Macron souriait alors que je venais de me faire gazer »

Au téléphone, ce cariste de profession peine à contenir sa colère. Il y a aussi des regrets dans sa voix. Comme l'impression d'avoir été piégé. Venu manifester aux côtés des soignants, il prend le métro ce mardi après-midi et débarque « par hasard » aux Tuileries avec quatre amis. Le cortège venait alors d'être dispersé place de la Bastille, sans nasse policière mais sous quelques jets de gaz lacrymogènes.

Par « peur de dire une bêtise », Richard refuse d'abord de s'approcher du couple présidentiel, déjà cerné par les smartphones des badauds. Finalement, tout bascule après que lui et d'autres entonnent leur slogan habituel : « Macron démission !» « Un bon 14 Juillet. Vous pouvez vous égosiller. Il y a une démocratie », ironise Macron. Tout sourire, le chef de l'Etat prend tout le monde de court, ses gardes du corps les premiers.

Ces trois phrases du président sonnent le début du brouhaha. « Tu vas virer, tu vas virer ! », tance le manifestant, hors de lui. « A ce moment-là, j'étais fou de rage. C'est de la provoc' et une forme de mépris. Déjà que je suis sanguin, mais alors c'est encore pire face à quelqu'un que je n'aime pas », confie Richard Z., avouant regretter les noms d'oiseau prononcés.

« Macron souriait alors que je venais de me faire gazer 50 minutes avant, poursuit-il. Comment voulez-vous qu'on réagisse ? On ne peut pas réagir normalement. Dans des conditions pareilles, c'était compliqué. Je n'ai pas de regrets sur le fond, mais j'aurai aimé expliquer nos revendications plus clairement, c'est sûr. »

« Il m'a eu, c'est clair »

Dans l'agitation, plusieurs dossiers quand même seront survolés. Réforme des retraites, maintien de l'ordre, rémunération des soignants … Ce n'est pas ce qui retiendra l'attention : au-delà des questions que cet échange pose sur la sécurité présidentielle, il s'est terminé de manière plus apaisée qu'il n'a débuté. « Il m'a eu, c'est clair. À la fin, le ton est redescendu. Il a du bagou. Je n'arrivais même pas à le maudire, comme j'explique à la fin du direct », sourit Richard, agacé. « Je pense qu'il l'a fait exprès de venir voir le gueulard de la bande », souffle-t-il.

Depuis ce coup d'éclat impromptu, Richard Z, a déjà refait plusieurs « lives ». Pour surfer sur ce quart d'heure de célébrité ? Surtout, semble-t-il, pour se défendre face au déchaînement observé sur Facebook. Des internautes Gilets jaunes lui reprochent sa supposée tendresse face au président. « Je ne voulais pas être irrespectueux et donner une mauvaise image des Gilets jaunes. Beaucoup de gens ont aussi cru que j'avais dit « Respect » à Macron à la fin, mais ce n'est pas moi », insiste-t-il.

Dans une autre vidéo, on apprendra aussi que son 14 juillet ne s'est pas terminé aux Tuileries, mais à quelques kilomètres de là, au poste de police du 15e arrondissement. Il affirme en être ressorti, avec son fils et deux amis, un peu avant 23 heures. Un gros quart d'heure après avoir parlé à Macron, des gendarmes mobiles les ont en effet arrêtés aux abords des Tuileries. Ce qu'attestent des images qu'il a lui-même tournées. « On ne chantait pas, on n'était pas cagoulés, et on ne portait pas de gilets jaunes, précise-t-il. On s'est juste dit au début que ça n'allait pas durer longtemps, surtout avec la gendarmerie qui est plus sympa en général ».

Un contrôle d'identité pendant « plus de quatre heures »

Au final, ce contrôle d'identité, dans une zone où toute manifestation se revendiquant des Gilets jaunes était interdite par la préfecture, durera « plus de quatre heures », estime Richard Z.

« On devait être près d'une centaine au total à être mis à l'écart par les gendarmes. Ils nous ont trimbalés à plusieurs endroits. Avec de multiples fouilles et contrôles de pièces d'identité. Finalement, une bonne partie a fini dans les fourgons de la police nationale, détaille le natif de l'Aisne. Une fois au poste, on nous a mis dans une pièce commune. Chacun notre tour, on a une nouvelle fois présenté notre identité. Cela n'avait aucun sens. Même la relève de nuit au commissariat ne savait pas ce qu'on faisait là ».

Contactée ce mercredi, la préfecture de police de Paris n'était pas en mesure dans l'après-midi de nous détailler le pourquoi de ce contrôle d'identité que le manifestant juge « abusif ». S'il ne semble pas lié à la rencontre avec Macron, le symbole est en tout cas saisissant. À peine le sujet de la défiance police-citoyens évoqué avec le président de la République qu'un nouvel épisode vient illustrer ce malaise grandissant.

Il y a cinq jours, le désormais ex-défenseur des Droits Jacques Toubon avait une dernière fois alerté sur « l'urgence » de réformer le maintien de l'ordre à la française. Parmi ces demandes, figurait justement l'interdiction de ces « contrôles d'identité délocalisés », qui consistent à interpeller une personne dans la manifestation pour la contrôler ensuite en marge du défilé, parfois dans un commissariat. Et cela alors même qu'elle dispose d'une pièce officielle. Richard Z. ne prévoit pas de porter plainte, ce que d'autres manifestants ont fait ces derniers mois pour ce type d'affaires. « Je n'ai pas de temps à perdre avec ça », grince-t-il."
2020-06-17 08:11:44,DumbYokel,"Est-ce que tu m'as vu objecter les raisons de l'arrestation ? Je ne crois pas. Tu le dis toi même, les flics sont des bourrins violents, et tu brandis comme excuse que ""c'est normal, parce que la police les attire et leur permet de cogner sans risquer aucune conséquence"" ? Tu ne vois pas que c'est *exactement* le point que je souligne ?

Le problème des violences policières est structurel, et le mal est ancré bien profond. Les flics les plus enclins à dénoncer cette violence systémique de l'intérieur sont ostracisés ou placardisés. Une petite minorité de vrais fascistes vicieux fait ce qu'elle veut, pendant que la grande majorité ne pose pas de question. ""On a fait que suivre les ordres, la procédure."" Couvrir cette violence les en rend tout autant responsables. Il y a pu y avoir des bons flics dans le passé, mais je crois bien que cette époque est révolue. Nique la police. Ils devraient s'estimer heureux de recevoir des pavés, et pas des molotov."
2020-06-16 21:56:49,Kinovy,"Tu fais tourner le petard jean eudes ? A ouai non parce qu’un peu de partage dans cette société qui part non mais alors complètement à la dérive moi j’en peux plus tu vois non mais com plè te ment à la dérive tu vois et un autre monde est possible tu vois non mais moi j’en ai la con vi ction.
Et chacun doit jouer son rôle tu vois, moi tu vois par exemple j’écris « woua les flics empêcheurs de rêver » tu vois je les insulte de ma révolte et je pense que c’est ca ré ment nécessaire tu vois et petit à petit tu vois en répandant la tolérance tu vois franchement ET LA JE VOIS JOHN LENNON PUTAIN JEAN EUDES ton aphgan il me révèle des choses tu vois putain mais tous unis vers demain j’ai envie de dire et nique la police putain mais ouai mais trooooop."
2020-06-07 09:06:43,IkiOLoj,"Le civil a pas choisit d'être civil, il peut pas démissionner de sa condition de civil quand il en a marre d'être là victime de policiers racistes. 

La policier lui est la de son propre gré, il est payé pour ça et il a choisit de servir les civils. 

Difficile donc de mettre sur le même plan le discours du civil qui dit que le policier ne le protégeant plus il n'a plus besoin de lui, et celui du policier qui dit que le civil devrait avoir peur de lui parce que sinon il va l'enculer. 

En fait le travail du policier n'est jamais aussi honorable que quand ils protègent la capacité de ceux qui disent nique la police a la faire."
2020-06-06 13:00:35,Orkaad,"Ou alors: le mot de passe est du genre ""nique la police"" et OP est bien embêté."
2020-06-03 13:16:19,amour_epais,"Tu remets en question les slogans en fait. Depuis que la police existe elle est haïe et les gens se rallient autour de slogans qui cristallisent cette haine. Avant on disait Mort aux Vaches, CRS = SS, Nique la police, etc... Maintenant c'est ACAB et Fuck le 17.

Et tout le monde peut être concerné par la police, suffit que ta tête leur revienne pas."
2020-06-02 13:26:37,otto_ritaire,Nique la police.
2020-06-01 16:51:14,rienquelaverite,"Je suis VNR. Je reprend le déconfinement avec plein de mauvaises bases que j'ai laissé ici ou là. Je dois SURMONTER le tout, rester dans les bonnes bases, toujours.

Samedi, j'ai fait une grosse rando de 4h de ouf, en mode escalader des montagnes et tout, a la fin de la journée je me suis niqué le pied hyper betement a cause d'un faux mouvement, maintenant j'ai mal.

Mon relais colis est un enfoiré, il m'avait insulté l'année dernière, il me disait genre ""t'es un gogole de cité"" en sous entendu parce que l'année dernière j'avais tenté te taper la tchatche avec lui et que c'était mal passé. Là je suis allé récupérer un colis en mode totalement normal, espérant qu'il m'ai oublié, et là il me regarde droit dans les yoeux (un peu trop..) ""comment allez vous ?"" je répond ""très bien et vous ?"" et il répond pas. Sale con, si t'a pas envie de devenir fou travail pas dans 10m\^2 sans pause midi 6jr/7 dans un relais colis minuscule. Fais autre chose.

Sinon j'ai encore échangé un t shirt chez h&amp;m, et je me suis encore fait avoir j'avais pas vu un signe distinctif que j'aime pas mais ça encore je m'en fou !

Enfin, j'avais oublié ma carte de transport donc j'ai du me taper 1/2 km a pied avec ma douleur au pied, youhou.

&amp;#x200B;

Sinon anecdote des clochards se sont tapés dessus a l'arrét de tramway, c'est devenu chaud car l'un a commencer a lui fracasser sa béquille sur le dos (une histoire de téléphone). J'ai commencé a crié et des mecs ont séparés, la police était là 8sec après la séparation meme pas. anecdote pour anecdote. J'ai mallll putain ça me saoule.

Bonne rentrée du travail, moi j'ai comme plan d'avoir le pied totalement guérit, et vous ?"
2020-05-28 10:33:21,f-u-whales,"Yen a des beaux specimens dans ce sub, putain de chauvinisme périmé qui vous fait encore croire que vous avez des institutions qui prennent soin de vous, nique la police, évitez la à tout prix"
2020-05-22 08:22:53,[deleted],"Ouais nan mais c'est plus possible  
Nique la police

Vous etes tous des fils de pute, sans exception."
2020-05-03 09:03:44,Hankey01,"Compte tenu du contexte, quand on lit ça : 

“À partir de 15 heures, une cinquantaine de militants avec banderoles et masques ont commencé à arriver devant le cinéma le Méliès. Ils brandissaient des affichettes qui indiquaient : « Etat d'urgence sanitaire, droit des travailleu.r.ses.s attaqués. Ne laissons pas faire ». Ils ont été nassés par la police qui a ensuite commencé à les verbaliser.”


On peut vraiment se dire “macronavirus, ACAB, nique la police” toussa toussa ?"
2020-05-02 14:39:05,AlbinosRa,nique la police !!!
2020-04-29 19:37:51,AnarchyinGroland,"&gt;Le procureur, concrètement, il te met en garde à vue et il te défère.

En faisant des thalassos trés relaxantes aux flics qui t'ont tabassé le procureur légalise le tabassage.

le policier et la bavure c'est le dernier maillon d'une chaine d'abus encouragé par le prefet, excusé par les médias et les politiques et finalement non-lieu-isé par la justice.

La violence policière c'est un écosystème.

C'est presque triste pour les flics qui ont toute la vindicte populaire alors que la responsabilité de ne pas sanctionner leur abus est bien pire au final.

Puisqu'elle explique au monde qu'à tete reposé, hors du feu de l'action et en y réfléchissant bien, noyer des gens les eborgner c'est LEGAL. Meme si ya des tomes et des tomes de livre qui disent le contraire.

La justice nique sa mere. Au moins la Police ils peuvent dire qu'ils ont réagit en général en situation de crise avec peu de temps pour décider. le procureur lui il décide de blanchir des tortionnaires dans un bureau.

Un chiffre, un seul. Aux USA 60% des plaintes pour abus visent 9% des flics...."
2020-04-03 10:15:07,bunnybunsarecute,"J'ai trouvé deux paquets de farine bio sur l'étagère du dessus au carrouf chez moi. 2,40 le kilo, ça m'a fait pleurer, mais j'ai pris les deux parce que nique la police."
2020-04-01 07:33:20,Chibraltar_,nique la police
2020-03-29 20:53:57,UltraChilly,"C'est un baguette processionnaire ça, elle voyage entre les boulangeries et ramasse des graines sur le chemin, c'est comme ça qu'on obtient les baguettes aux graines.

(ça ou alors c'est le fameux mec qui s'est choppé une amende parce qu'il avait acheté qu'une baguette, le lendemain il en a acheté deux et a jeté la seconde par terre en criant ""nique la police"")"
2020-03-11 15:03:29,anthomon,"Je partage ton sentiment, et je comprends bien la défiance de pas mal de personnes vis a vis de la police, seulement on ne peut, par définition, pas avoir de chiffres concernant les bavures policières et les crimes/délits impunis.

Le soucis, c’est qu’au milieu tu as des citoyens a peu près respectueux des lois (on a tous piqué un carambar ou grillé un stop un jour) qui, eux, sont les victimes dans l’histoire.

D’un côté tu as la police, proche du pouvoir judiciaire, soutenus par des syndicats et le ministère de l’intérieur, qui peuvent facilement avoir des infos sur leur cas, des éclaircissements sur les lois.

De l’autre, des types dont le métier est de faire la nique au système, habitués au GAV, au coups, a l’intimidation des premiers, qui la plupart du temps face a une simple accusation sans flagrant délit, sans adn, empreintes, preuve vidéo ou témoignages multiples, sauront quoi dire ou ne pas dire, ils connaissent la loi mieux qu’un type lambda et auront plus de chance que lui de s’en tirer face a un juge (ça plus les avocats).

J’ai connu des gens qui avaient séquestré et maltraité un mec pendant deux jours dans une cave de garges les gonesse pour une histoire de shit et balance.
Pas un n’a fait un jour de prison (leur activité professionnelle leur a permis de se payer un bon avocat).

Une autre histoire, une connaissance est victime de tentative de car jacking, il se défend et met un des deux agresseurs KO, le second s’enfuit; pour lui l’histoire s’arrête la et il rentre a la maison, le lendemain c’est Gilbert qui vient frapper a sa porte et il finit en garde a vue plus jugement pour coups et blessures.

L’injustice prend un tas de formes très variées. Effectivement la police devrait être irréprochable, après quand tu vois comment la sélection est faite, pas de suivi psychologique, pas d’entraînement au tir régulier (une centaine de cartouches par an en gros, je suis sur que bien des tireurs en usent plus par session), il faut pousser le questionnement sur le recrutement, les décisions politiques.

Mais que les choses soient claires, ça ne dédouane pas les policiers qui se rendent coupables d’agissements comme on en voit au quotidien, notamment depuis le debut du mouvement des gilets jaunes.

Edit : bordel les downvoteurs anonymes, venez discuter si vous n’êtes pas d’accord, si vraiment vous avez quelques chose a dire. Incroyable..."
2020-03-03 10:09:06,compressandequalize,"Fais pas genre, j'suis un rebeu de banlieue et je sais très bien que tu parles de moi quand tu fais des commentaires comme celui-la, rien à foutre que tu sois berbère, ça justifie rien du tout.

Je dis juste que c'est extremement lache de mettre les fautes du capitalisme qui encouragent l'esclavage sur des populations vulnérables (ouais même si on nique la police et qu'on rackette à la récré) qui essaient de se l'approprier comme faire se peut puisque devine quoi, on voit tous les mêmes pubs à la télé.

T'as juste une obsession malsaine avec l'islam et tu cherches à glisser le sujet la ou il n y a aucun rapport."
2020-02-19 16:09:38,Polewix,"&gt; Les stagiaires ont la main lourde
Les excès de zèle viendraient principalement de la « nouvelle génération » de policiers. En effet, le centre de rétention partage son site avec le centre régional de formation de la police – anciennement l’école nationale de la police de Paris. Il accueille beaucoup de fonctionnaires en formation ou des jeunes tout juste sortis d’école.

&gt; Dans la bouche de plusieurs retenus, ce sont ces « jeunes », « les stagiaires », qui leur font « la misère ». Dans la salle des coffres et ailleurs. « Ils nous insultent tout le temps. Des : “Nique ta mère”, “Fils de pute”… Ce n’est pas normal », s’indigne Yousef. « Avec les gradés, on peut parler, il n’y a pas de problème. Mais ils se mettent en retrait et permettent aux jeunes de faire tout ce qu’ils veulent », continue-t-il. « Les stagiaires se forment sur les étrangers, ils se font la main sur les plus faibles. On les reconnaît avec leurs épaulettes vertes », observe Bacar.

Elle est jolie la jeunesse."
2020-02-08 18:21:46,ENERGODAR,nique la police
2020-02-04 22:37:06,Jean-Tardigrade,"&gt; ""un frontiste"" de 84 ans, qui n'était plus membre du RN et a été reconnu comme déséquilibré. Et ce n'est pas un attentat, d'ailleurs le parquet antiterroriste n'a pas été saisi.

Un déséquilibré qui comme par hasard commet un acte un accord avec les opinions de son parti qu'il a prétendument quitté... On nous prend vraiment pour des cons.

&gt; D'ailleurs la religion qui subit le plus de persécutions dans le monde c'est le christianisme, pas l'islam.

C'est un concours ? Je m'en branle de savoir qui est le plus persécuté. J'ai juste une position cohérente et très claire sur la question initiale de laquelle tu dérives : toute personne en France doit être libre d'exprimer et de pratiquer ses convictions religieuses. Peu importe que ça soit Mila (nique ses agresseurs et ses harceleurs) ou les musulmans (nique Zemmour et ses promoteurs), ou n'importe qui d'autre. C'est clair, net, précis. Ça devrait faire consensus. Mais non, ça prend -12 de basvotes sur airfrance et ya des types comme toi qui viennent me parler d’œillères. 

Et autres points, les fachos qui infiltrent la police, on voit se que ça donne dans les manifs depuis plus d'un an."
2020-01-18 18:10:28,Tyeutyeu,Nique la police ?
2020-01-10 19:22:34,Analbator,"&gt; je ne comprends pas les cas où ça empire les choses. Mais ça mérite tout de même d'être étudié.

Dans ton premier lien ils en parlent effectivement, et en fouillant j'ai trouvé ca :

""Police body-worn cameras were also associated with a statistically significant increase in assaults against officers. The rate of assaults against officers per 1,000 arrests was 14 percent higher when cameras were present."" ([source, dans ""Evaluation Outcomes""](https://www.crimesolutions.gov/ProgramDetails.aspx?ID=605))

Dans la méthodologie du même document : ""Assaults against police officers were self-reported based on routine reporting requirements.""

Soit c'est les aléas des statistiques où en prenant un cliché d'un moment donné tu risques d'avoir des variations qui n'ont logiquement rien à foutre là, soit [comme en France](https://www.lefigaro.fr/actualite-france/2014/01/18/01016-20140118ARTFIG00351-des-policiers-abusent-des-plaintes-pour-outrage-a-agent.php) ils sont tombé sur un ou plusieurs spécialistes de l'outrage à agent qui ont niqué les stats."
2020-01-10 15:48:00,er3tic,"Effectivement, j'avais lu beaucoup de choses à ce sujet il y a quelques mois parce qu'ils en parlaient beaucoup aux US, j'ai retrouvé rapidement l'article, mais c'est peut être pas le plus concluant.

[Ici](https://nij.ojp.gov/topics/articles/research-body-worn-cameras-and-law-enforcement), il y a plus de détails :

 

&gt;In Birmingham, UK, evaluators found that deploying body-worn cameras resulted in a statistically significant reduction in citizen injury, but no statistically significant reduction in officer use of force or injury. Read the program profile [Police Body-Worn Cameras (Birmingham South, UK)](https://www.crimesolutions.gov/ProgramDetails.aspx?ID=611).  
&gt;  
&gt;In Rialto, CA, evaluators found a statistically significant reduction in police use-of-force but no significant difference in citizen complaints. Read the program profile [Police Body-Worn Cameras (Rialto, Calif.)](https://www.crimesolutions.gov/ProgramDetails.aspx?ID=499).  
&gt;  
&gt;In Las Vegas, Nevada, and evaluation of the Metropolitan Police Department’s use of body-worn cameras revealed that the use of body-worn cameras resulted in a statistically significant reduction in both complaints and use of force. Read the program profile [Body-Worn Cameras (Las Vegas Metropolitan Police Department](https://www.crimesolutions.gov/ProgramDetails.aspx?ID=640).

Ils donnent aussi des exemples où la situation n'a pas changé. Par contre, je ne comprends pas les cas où ça empire les choses. Mais ça mérite tout de même d'être étudié.

&amp;#x200B;

&gt; pas de caméra / caméra pas allumée / Roger il a niqué la bande en la mettant dans le magnétoscope c'est ballot / Le fichier a été supprimé par erreur / Y'a rien à redire l'IGPN a regardé la vidéo croyez-nous sur parole, vous n'avez pas d'autre choix de toute façon. 

C'est sûr que ça arrivera si les moyens et le droit ne suivent pas derrière. Si on fournit une caméra pour 3 flics avec 20 min d'autonomie ou que la justice ne puisse pas avoir accès aux images,  l'impact sera limité. On est toujours dans le même débat que celui de la transparence de la vie politique, si tout le monde ne joue pas le jeu, c'est que les principaux concernés ont quelque chose à cacher.

C'est surtout le contexte actuel et le manque de confiance des citoyens envers la police qui me pousse à dire que les caméras seraient un bon de moyen de rétablir cette confiance. D'un côté, les policiers acceptent d'être surveillé pour prouver qu'ils font leur boulot correctement (techniquement, ça ne devrait rien changer pour eux), de l'autre, les citoyens arrêtent de crier à la bavure dès qu'il y a contact avec un policer."
2019-12-20 08:35:33,tsukihi3,"Ses applaudissements se traduisent par ""nique la police"" en morse !"
2019-12-10 10:59:14,Ar-Sakalthor,"C'est sur que les Gilets Jaunes sont très adeptes des manifs pacifiques, toutes les grèves et toutes les manifs d'hier c'était sans doute des sit-in?

Ou est-ce qu'on parle du fait que la haine du flic est devenu une composante intégrale de l'identité française depuis près de 20 ans? Que depuis les années Chirac ""nique la police"" est un message populaire accepté? Que les cas isolés de violence policière (qui sont minoritaire face à la violence *sur* les FDO) sont instrumentalisés depuis les émeutes d'il y a 4 mandats comme arguments de comm' pour délégitimer chaque Président qui passe à l'Elysée?

Edit : Venez à moi les downvoteurs, vous confirmez le biais anti-flic qui fait que la profession policière a un des plus hauts taux de suicide en France depuis plus de 10 ans, j'espère que vous êtes fiers :)"
2019-09-20 12:05:58,CapriiiCestFiniiiii,"Nique la police

\**fait la gueule\**"
