date,author,text
2020-06-10 00:08:57,ThoseWhoLikeSpoons,"Le livre de Passeron explique en gros comment la sociologie vogue constamment entre l'histoire et la statistique. La statistique c'est l'illusion scientifique de la généralisation à partir de données, mais ces données sont toujours irrémédiablement liées au contexte dans lesquelles elles ont été produites. C'est un peu ça le cœur de la sociologie : c'est impossible de se séparer du contexte social et historique dans lequel les données, concepts et analyses ont été créées, même si l'effort de montée en généralité est essentiel à la discipline au risque de quoi on dit des banalités.

Moi je pense que l'écart entre la situation française et américaine est si grand que la comparaison ne fait pas sens. On peut me critiquer, mais faut me montrer pourquoi : en l’occurrence, *que ce soit historiquement ou via l'étude de données statistiques*, on a affaire à deux pays totalement différents et ce sentiment est d'ailleurs présent dans les écrits de sociologues ou écrivains américain venus en France : Peter Baldwin, évidemment, mais Ta-Nehisi Coates plus récemment disent tous deux ne pas se sentir ""noirs"" en France contrairement aux US.

Sur le colonialisme je suis totalement d'accord qu'il ait un rôle essentiel, mais plutôt dans les colonies... Pour l'essentiel de son histoire récente, la France a été une puissance coloniale mais en France métropolitaine il n'y avait que peu de colonisés et l'existence de colonie n'a pas fondamentalement travaillé les institutions en métropole comme ce fut le cas aux US. Cela me semble encore une fois une simple évidence.

Pour finir, il y a une question qui me vient à la lecture de ta réponse : c'est celle de la légitimité des souffrances ressenties. Tu demandes en effet si, malgré les différences, il n'y a pas tout de même des souffrances équivalentes. Là je pense cela ne relève pas strictement la comparaison raisonnée de deux situations particulières mais d'une dynamique plus complexe qui met en jeu les identités des individus participant à la discussion et donc aussi la narration que les individus produisent de leurs propres expériences, la manière avec laquelle ils se recréent dans le discours. Pour le dire autrement, vivre une inégalité est une expérience difficile et considérer que cette inégalité est le fruit du privilège d'autrui est une manière de ne pas s'auto déprécier comme c'est le cas de nombreuses personnes en situations de fragilité. De ce point de vue, les États-Unis offrent au monde une grammaire commune : quand Camélia Jordana chante un chant du Black Panther Party, elle tente de donner sens à des expériences particulière (la violence policière bien réelle) en s'appuyant sur des symboles qui sont américains, peut-être parce que la France n'a pas ce genre de symboles ou peut être parce qu'il y a un défaut dans la transmission qui fait que les combats et symboles français ont été oubliés et ont laissé place à l'imaginaire américain (c'est mon point de vue).

*"" Il y a enfin une étrange logique de dénoncer les personnes qui cherchent  à trouver une dynamique de groupe pour répondre à des souffrances  semblant les toucher plus fortement. Ces problèmes découlent de  préconçus attribués à leur origine sociale perçue. Pourtant le discours  qui délégitime l'égalité des français de part leurs origines court dans  la société comme de l'histoire et imprègne la politique de plus en plus  fortement ces dernières années. ""*

Ce qui est étrange c'est de considérer comme étrange la critique de ce type de politique. Que les individus cherchent à répondre à des souffrances c'est très bien, cela ne pose problème à personne : mais ce qui est en jeu c'est tout un imaginaire racialiste qui voit la société en ""communautés"" raciales et géographiques plus ou moins imperméables les unes aux autres. C'est bien ce qui se cache derrière la notion de privilège. Derrière cette grammaire on devine le peuple de petits propriétaires à l'anglo-saxonne, chacun chez soi avec ses pratiques, ses préférences, sa ""communauté"", et qui se satisfait tout à fait de la mort du politique tant que tout va bien c'est à dire tant que personne d'extérieur à la communauté ne vient perturber son fonctionnement. La notion de privilège permet de délégitimer toute critique extérieure à la communauté, et ainsi de préserver les équilibres de pouvoir qui existent en son sein : si t'es blanc t'as rien à dire parce que ce sont tes privilèges qui parlent ; si t'es pas blanc, alors t'es très certainement ""bounty"", ""nègre de maison"" ou assimilé. C'est pour cela que ce type de discours est toujours moraliste : comme vous le faites en qualifiant ""d'étrange"" toute position critique vis à vis de ce concept, il s'agit de créer un doute sur la crédibilité du contradicteur plutôt que de discuter sur le fond, argument contre argument."
2020-06-09 18:48:59,jeyreymii,"Effectivement. Et pour la majorité d'entre nous l'avortement est normal alors qu'à l'époque c'était une monstruosité... Tout evolu

D'ailleurs, le mot negre n'était pas forcément raciste a l'époque, alors qu'aujourd'hui oui"
2020-06-08 19:54:15,roulegalette,"La cinquante de ""nègre"" lâché dans le film aussi."
2020-06-07 19:58:18,darthchebreg,Ils seront juste privés de tête de Nègre
2020-06-06 17:05:27,LeFricadelle,"Anne Rosencher est directrice déléguée de la rédaction de L'Express ©L'Express


Notre vieux modèle avait ses défauts, mais il est paradoxal qu'on lui substitue fièrement un paradigme obsédé par la race qui a conduit à bien pire, comme l'actualité américaine ne cesse de le démontrer.
Nous y sommes, donc : au crépuscule d'un vieux modèle. Il faut lui dire au revoir et ça n'est pas de gaîté de coeur. Car c'est un fait que l'actualité nous dévoile : nous sommes devenus des Américains comme les autres, des obsédés de la race et de l'identité. Je ne parle pas du débat sur la police, des questionnements légitimes sur son degré de violence ou sur l'importance d'un racisme qui y sévit : je sais qu'il y a beaucoup à dire, beaucoup à débattre et à corriger. Je parle de la ""façon de voir"" qui s'y engouffre presque en contrebande, et qui montre, à la faveur des slogans et des termes employés et des arguments servis dans la querelle publique qu'elle a déjà beaucoup progressé.  


Cette ""façon de voir"", c'est le multiculturalisme à l'anglo-saxonne qui dans les faits, déjà, s'est imposé dans beaucoup de nos villes. On exalte le ""vivre-ensemble"" ? On vit séparés ! C'est de plus en plus chacun sa culture, ses rites, ses coutumes, et ses revendications. L'idée de l'universalisme, l'idée qu ""en République, le citoyen est l'homme sans étiquette"" - selon la formule de Régis Debray - appartient au passé. Elle s'en va avec la génération qui vient, qui parle avec des concepts importés des facs américaines - ""privilège blanc"", ""racisés"" ""intersectionnalité"" - et qui découpe la société en identités blessées. 


**Un modèle où les blancs - majoritaires - ont fini par voter avec leur couleur de peau**


Oh, je crois à la sincérité de beaucoup de ses militants, et à la générosité de la plupart des batteurs de pavés. Je vois ce que leur combat peut avoir d'émouvant. Mais je me permets de dire avec respect : ils signent le crépuscule d'un modèle qui n'était pas parfait, certes, mais qui a conduit au plus grand taux de mariage mixte au monde. Ils proclament l'amour de la différence, et ils préparent le séparatisme. Ils sont la bascule, le ""point doré de périr"" comme écrit Paul Valéry à propos du coucher de soleil. Ils croient se battre contre l'obscurantisme, mais je pense qu'ils annoncent la nuit : le tribal, la défiance, et les rappels à l'ordre raciaux - ainsi, certains traitent-ils désormais les Français noirs ou arabes qui entendent encore défendre l'universalisme ""d'arabe de service"", de ""collabeurs"", ou de ""nègre de maison""....bref de traîtres à leurs intérêts de race. J'ai pour eux une fraternité sans limite

Le vieux modèle républicain avait ses défauts, ses contraintes, oui, bien sûr, mais c'était le nôtre. Au reste, il est assez paradoxal et cruel qu'on prétende aujourd'hui lui substituer fièrement un paradigme qui a conduit à bien pire, ce que l'actualité américaine ne cesse de nous démontrer. Un modèle où tout le monde, tout le temps, est renvoyé à sa race, à son identité, et où les Blancs - majoritaires - ont fini par voter avec leur couleur de peau. Oui, vraiment. Sans esprit de chicanerie ou d'anathème. Permettez juste que je n'applaudisse pas. 

je sais pas si j'ai copié tout l'article, mais je crois que c'est tout - un résumé pour indiquer qu'en effet, au delà de l'américanisation apparente de la société française, on traite désormais nos problèmes sous un prisme ethnique (pour pas dire raciale, histoire de) et non sociale, autant dire que l'on est dans une sacrée merde

/u/JoLeMaxi"
2020-06-05 15:16:05,people-are-very-dum,"&gt; Je vois juste pas le racisme quand un noir en traite un autre de negre de maison.

Certains seraient libres de penser que seules les plus grosses merdes humaines oseraient sortir une immondice pareille."
2020-06-05 10:40:56,FleurOuAne,"Je vous promets que je suis pas de mauvaise foi. Je vois juste pas le racisme quand un noir en traite un autre de negre de maison.

Je trouve l'insulte débile parce qu'il faut des noirs dans la police. Juste la rhétorique dénonçant les militants politique anti racistes comme étant ""en fait"" les vrai racistes, c'est juste de la mauvaise foi."
2020-06-05 01:17:31,nordelaire,"Attention la personne interviewé sur LCI est Abdoulaye Kanté, un policier actif sur twitter qui racontait se faire souvent insulter de nègre de maison sur les réseaux sociaux, ce n'est pas le même policier qui se fait insulter pendant la manif."
2020-06-04 23:39:06,Eet-Fuk_,"Putain ce concentré d'incel sur le podcast d'Arte c'est ouf. Ils en sont a espérer la fameuse guerre civile et raciale pour que les ""putes à nègre"" se rendent compte de leur erreur d'avoir fréquenté des noirs/maghrébins et les supplie de les reprendre, eux les forts avec les armes :)

Pathétique, mais d'une puissance."
2020-06-04 18:46:38,Fdurke,"Je justifie quelle affirmation ? Au contraire je réfute celle de racisme systémique. 

&gt;tu inventes des conditions farfelues q

Lesquelles ? Celles qui font qu'on puisse réellement parler d'un système et pas juste celles que vous sortez de nulle part pour justifier vos préjugés idéologiques ?

&gt;« Olala les flics ne se sentent pas libres de pas dire « bougnoule » ou « nègre » devant une caméra, voilà qui réfute totalement l'hypothèse d'un racisme systémique gangrenant l'institution policière ! »

Oui le fait que les agents de cette institution craignent de se faire sanctionner par cette même institution pour leur racisme tend à monter qu'effectivement celle-ci lutte contre racisme. Ce qui contredirait que cette même institution soit systémiquement raciste...

Machin me répond ""culture d'entreprise"" (un ensemble de connaissances, de valeurs et de comportements qui facilitent le fonctionnement d’une entreprise en étant partagé par la plupart de ses membres.) pour ""contredire"" mon propos, donc on aurait une institution dont la valeur commune de ses membres est le racisme mais qui pourtant lutterait institutionnellement contre ce même racisme, genre un KKK progressiste ?

La tautologie n'a jamais fait un argumentaire sérieux."
2020-06-04 18:24:23,SombreConnard,"Il a été traité de ""nègre de maison"", il le raconte lui même dans une interview sur lci qui passait de temps en temps aujourd'hui. Le ""vendu"" n'est qu'un tout petit extrait de la scène."
2020-06-04 17:47:24,gromfe,"Et encore, il peut s'estimer heureux. D'habitude, les Français noirs ou arabes, intégrés, respectés et qui ont réussi leur vie sans suivre des cours de victimisation a l'Américaine pour justifier tous leurs échecs et exiger que les autres rasent gratis pour eux ont droit aux ""bountys"", ""nègre de maison"" et autres ""arabe de service""."
2020-06-04 15:50:38,Fdurke,"On marche sur la tête. ""Les arabes"" en France ne sont pas ""un groupe"", il faut jamais avoir habité en banlieue pour dire ça, pas plus que ""les noirs"" existent en France. 

Donc on est au niveau des ""vendu"" ""traitres"" et ""nègre de maison"" adressé aux policiers non blancs."
2020-06-04 13:30:39,Ceruleanknight1,"Lorsque j'avais 19 ans je suis allé dans une école d'adjoint de sécurité. J'ai eu des soucis là-bas car le chef de section, un élève de 19 ans aussi qui venait de la frontière Alsacienne était super raciste. Le mec avait tout fait pour m'ennuyer et mettre dans le pétrin en faisant des blagues à ses amis sur mes origines jusqu'à des insultes sur mes origines. J'ai un jour été convoqué dans le bureau du BCP à cause de lui et j'ai expliqué qu'il avait des propos racistes et que ses motifs étaient raciste.

Aucune enquête n'a été faite pour savoir ce qu'il s'était passé, et vu qu'il y avait un vietnamien dans ma section ils ont dit que le mec n'était pas raciste car sinon il le serai envers tout étranger. 
Me souviens encore des dires de ce mec et je peux vous dire qu'appeler le père d'un futur collègue ""une merde nègre"" est bien raciste..

A la fin ils m'ont mis à la porte car ce jeune homme disait que je n'avais pas de respect pour l'uniforme comme ""raison"" pour excuser son comportement, et vu qu'il était mon chef de section il était vu comme mon ""Supérieur"" et que de ce fait il avait plus de crédibilité... un élève comme je l'étais, désigné au hasard (ou peut-être pistonné, allez savoir..)

 J'ai 34 maintenant et je suis désolé de voir que ça ne change pas, mais quand je repense à cette époque je me dis que c'est bien la mentalité, et le pire c'est qu'après ils se cachent derrière un sois disant ""code de déontologie"" ... la bonne blague."
2020-06-04 12:17:32,jo726,"&gt; « Vu que c’est les Juifs et les gauchistes qui dirigent ce pays, on fait en sorte que la fille aille vers le bougnoule ou le nègre. En Angleterre ou en Allemagne, c’est pas comme ça, t’éduques ta fille pour qu’elle continue dans la race aryenne. »

Il s'agit sans doute de l'intellectuel de la bande, qui a même des notions de géopolitique.

(Il faudrait lui dire qu'en Angleterre, les policières musulmanes peuvent mettre un hijab avec leur uniforme.)"
2020-06-04 12:06:17,kisifi,"&gt; Alors qu'ici on parle de correspondance et discussions hors public et hors travail.

Argument recevable mais en l’occurrence ça n'est pas hors travail. C'est pareil, ca se trouve facilement sur internet. A condition d'avoir envie de chercher plutôt que d'avoir envie d'excuser l'institution. 

&gt;Dans les messages, on constate également que les fonctionnaires mis en cause commentent, en direct des salles d’audience, des procès se tenant sous leurs yeux : « Le publique (sic) = des nègres, la partie civile = des nègres, l’accusé = un nègre », écrit l’un d’eux à ses collègues.

https://actu.fr/normandie/rouen_76540/racisme-sexisme-homophobie-policier-rouen-depose-plainte-contre-six-collegues_30857245.html"
2020-06-04 10:10:42,Fdurke,"""Nègre de maison"", ""arabe de service"", ""vendu"", ""traitre"", des deux cotés malheureusement les racistes ont la vie dur."
2020-06-04 10:01:42,PM_ME_WITTY_USERNAME,"&gt;Parmi les dizaines de messages écoutés, certains portent sur les personnes dont les fonctionnaires ont la charge, au sein du Palais de justice. Les protagonistes d’un procès d’assises sont traités de « gros nègre de merde » et de « gros bougnoule », les interpellés dans les geôles de « putains de manouches, gitans et autres finis à la pisse nés dans une caravane ». Mais régulièrement, ces policiers se plaignent que leurs opinions soient considérées comme racistes. 


Cet article est incroyable"
2020-06-04 09:23:07,Kemoule,"# ""Arabo-négroïde"" ""pute à nègre""

C'est vrai que le vocabulaire fleuri de la police témoigne, déjà, que la police a bon goût en matière de poésie et, aussi, qu'elle a un sens de l'humour très fin. Sérieusement dire que la racisme ou discrimination est sanctionné dans la police c'est se foutre ouvertement de notre gueule."
2020-06-04 08:03:06,Vahron,"&gt; Parmi les dizaines de messages écoutés, certains portent sur les personnes dont les fonctionnaires ont la charge, au sein du Palais de justice. Les protagonistes d’un procès d’assises sont traités de « gros nègre de merde » et de « gros bougnoule », les interpellés dans les geôles de « putains de manouches, gitans et autres finis à la pisse nés dans une caravane ». **Mais régulièrement, ces policiers se plaignent que leurs opinions soient considérées comme racistes.**

On croirait un sketch, c'est du grand délire."
2020-06-04 08:02:52,obvious_freud,"&gt; « De toute façon, les gonzesses ne veulent pas de mec bien, elles prennent le nègre qui les saute et puis qui les lâche après. »
(...)
&gt; Avec une certaine constance, ces policiers s’en prennent aux « filles qui aiment bien les bâtards » plutôt que « les mâles blancs »

Tout l'article est affligeant mais j'avoue j'ai bien rigolé avec le passage où les mecs littéralement confits dans leur haine raciste et leur violence se demandent ""mais pourquoi les filles ne veulent pas d'un mec bien comme nous"" ? Quel mystère..."
2020-06-04 07:22:09,Folivao,"« Je suis obligé de rester un minimum correct, parce que je suis flic »

Un autre membre du groupe, Thibault D., évoque quant à lui une chaîne YouTube où il aurait posté des vidéos sur les armes et le survivalisme, s’étonnant qu’elles aient été supprimées par la plateforme pour « incitation à la violence ». Ses collègues lui conseillent alors de passer par d’autres fournisseurs, mais Thibault D. estime que « la monétisation » n’y est pas aussi intéressante que sur YouTube. Et tranche la question : « De toute façon, je peux pas dire ce que je veux, je suis obligé de rester un minimum correct, tout simplement parce que je suis flic. Et que le jour où la hiérarchie tombe là-dessus, si elle est pas déjà tombée là-dessus, je veux qu’on puisse rien me reprocher d’illégal ou d’amoral, qu’on puisse pas me sanctionner. »

Parmi les dizaines de messages écoutés, certains portent sur les personnes dont les fonctionnaires ont la charge, au sein du Palais de justice. Les protagonistes d’un procès d’assises sont traités de « gros nègre de merde » et de « gros bougnoule », les interpellés dans les geôles de « putains de manouches, gitans et autres finis à la pisse nés dans une caravane ». Mais régulièrement, ces policiers se plaignent que leurs opinions soient considérées comme racistes.

Fin décembre, certains membres du groupe reçoivent une convocation, des mains de leur commissaire. S’ils soupçonnent que leurs propos sur WhatsApp en sont la cause, ils continuent tout de même à en discuter. « Les patrons ils cassent vraiment les couilles, toujours à chercher la petite bête pour te niquer la gueule », analyse l’un d’entre eux. Tout en insistant sur le fait que « c’est privé », ils disent avoir commencé à supprimer leurs échanges. Dans le volet disciplinaire de l’enquête, ils ont été auditionnés le 6 janvier pour « manquements à la déontologie ». 

Alex, le policier qui a porté plainte, se souvient d’avoir été « choqué » par le contenu des messages. « Ça pousse à la folie, je n’en dormais pas. Je vis tout seul. J’en ai parlé à mon frère, à des amis, mais c’était dur. J’ai dû prendre sur moi et décider d’avancer. » « Ces propos sont au-delà du supportable », complète son avocate Yaël Godefroy, « ébahie par la violence » des termes employés. « Mon client n’a même pas pu les lire en totalité. Il m’a demandé d’en prendre connaissance. »

« Pendant une semaine, j’étais dans les mêmes locaux que les personnes que j’avais dénoncées mais elles ne le savaient pas », rappelle Alex. « Les fêtes de Noël, c’était une horreur. » Au retour des vacances, Alex apprend qu’il change de service, pour rejoindre une patrouille anti-délinquance. « Cette affectation m’a été imposée, mais je ne vais pas me plaindre. C’est un domaine qui me plaît. Ma hiérarchie est attentive et proche de ses hommes. Personne ne me parle de cette affaire, et j’évite aussi d’en parler, mais j’ai reçu des marques de soutien. »

Tout au long de sa carrière, débutée en 1999, Alex dit avoir été dérangé par certains propos. S’il a connu « des années magnifiques » en banlieue parisienne, jusqu’en 2008, Alex se souvient aussi des « blagues racistes », « petites réflexions » et raccourcis connotés de quelques collègues. « En patrouille par exemple, s’ils voyaient une voiture occupée par des gens de couleur, ils disaient : “Ça, c’est une voiture de bâtards. Mais toi t’es pas comme eux. T’as choisi d’être comme nous.” »

Le policier a constaté un changement en arrivant à Rouen. « Il y a moins de collègues antillais et maghrébins, moins de fonctionnaires noirs. On est jugés tout de suite sur notre apparence. Entourés de Blancs, ils ont moins de mal à se lâcher. » Par des collègues, Alex a appris que certains le surnommaient « le Noir » ou « le négro » dans son dos. Tout comme un huissier du tribunal, ancien fonctionnaire de police. « Je ne veux pas me faire passer pour une victime, dire que je n’ai rien à me reprocher ou que je suis le meilleur fonctionnaire du monde », poursuit Alex. « J’ai sans doute réagi en étant trop agressif, je ne montrais pas l’exemple dans la manière de me défendre. Mais j’ai fait remonter l’info, et il ne s’est rien passé du tout. »

Il estime avoir choisi, cette fois-ci, une voie plus adaptée : un rapport complet à sa hiérarchie et un dépôt de plainte. Et espère, en conséquence, que ses démarches ne resteront pas sans suite. « Mon client a été courageux, son collègue qui lui a prêté son téléphone aussi », résume Yaël Godefroy. « Il souhaite que cela dépasse son cas personnel, qu’il y ait un débat sur le racisme dans les institutions. En évitant deux écueils : la stigmatisation de la police d’un côté, le discours sur les “brebis galeuses” de l’autre. »

Au Sénat, ce mercredi, le ministre de l’intérieur a promis que « chaque faute, chaque excès, chaque mot, y compris des expressions racistes », fera l’objet « d’une enquête, d’une décision, d’une sanction ». 



**Boite Noire :**




Pour réaliser cet article, Mediapart et Arte Radio ont eu accès à des dizaines d’enregistrements de conversations WhatsApp qui se sont tenues sur le groupe privé.

Mediapart a mené deux entretiens avec Alex, le policier qui a dénoncé ses collègues, en février et en mai 2020, en présence de son avocate Yaël Godefroy. Alex n’a pas souhaité que son nom de famille apparaisse dans l’article.

Le procureur de Rouen, Pascal Prache, et le secrétariat général de son parquet ont été contactés par mail mardi 2 juin et mercredi 3 juin.

Gilles C., l’un des policiers cités dans l’article, a été contacté par mail le mardi 2 juin. Mediapart lui a proposé de s’exprimer sous plusieurs formes : répondre par écrit aux questions envoyées, passer par un entretien téléphonique, fournir les coordonnées de son avocat et/ou des avocats de ses collègues. Il n’a pas répondu."
