date,author,text
2022-12-16 10:00:17,Folivao,"&gt; J’ai besoin de savoir la daily routine de ce genre de type

""Réveil à 18h88, je prends ma douche, ainsi qu'un petit déj rapide (une tête de nègre, un bol de banania et ça suffit). J'enfile mon uniforme Hugo Boss et ma doudoune Helly Hansen et je prends ma batte de baseball pour aller casser de l'arabe"""
2022-12-12 15:46:48,ThePenix,"Certain pourrait dire la même chose pour le mot ""negre"", qui vient du latin : noir. Le mot n'est pas explicitement negatif mais il l'est devenu, alors tu peux te battre contre ça si tu veux, et je pense que pas grand monde serait choqué par quelqu'un qui dirait simplement, la personne noir, ou à la peau noir, mais un simple ""le noir"" eh, c'est limite. C'est pas le mot, c'est comment il est perçu, et dans ce combat c'est une histoire de culture de groupe, tout seul tu peux tenter mais ça va pas faire grand chose."
2022-12-12 11:48:57,joshlefrench,"Tu paraît tellement sur de toi sur ta façon de bien t'exprimer que ca débloque tes interlocuteurs que je pensais que tu faisais bien attention...  
Et je t'assure que le mot white je l'ai entendu, je n'invente pas du tout.  
Pour faire court ca me saoul de d'avoir prendre ce genre de pincettes, je dis pas que nègre ca passe, évident non, mais franchement mes gens qui casse couilles avec ce genre de termes bateau, noir, blanc, black, personnes de couleur... Pfff... Tant que c'est pas pour faire des classements de valeur qu'est-ce qu'on en branle !"
2022-12-12 10:56:37,iserois,"les mots ... ethymologiquement nègre n'a rien de péjoratif, c'est l'environnement qui a pollué son usage ."
2022-12-09 18:02:29,NoMansCat,"Ce qui me gêne plus c’est qu’on a supprimé les têtes de nègre, ya bon banania, Papous, pastilles de réglisse en forme de visages africains et qu’avec ça on s’estime quitte et se permet de regarder de haut les générations précédentes en les traitant de sales racistes.
Alors que fondamentalement j’ai l’impression que la population n’est pas moins raciste.  
Je ne dis pas qu’il ne fallait pas supprimer les dénominations en question mais s’en contenter en se sentant supérieurs c’est un peu léger."
2022-12-09 15:34:58,yet_another_no_name,"Ton lien montre pourtant bien que ce n'était pas des ""têtes de nègre"" (qui ~~est~~ était une pâtisserie qui existait avant haribo) mais des ""têtes nègres"". Un mot en moins c'est pas pareil."
2022-12-09 10:45:30,SupermanLeRetour,"Ah je connaissais pas cette version. Si tu tapes tête de nègre sur Google tu tomberas en premier sur les boules choco que j'ai cité, je pense que c'est un peu plus connu que les trucs Haribo."
2022-12-09 08:34:52,WhistlingDead,"Nous c'était des meringues au chocolat qu'on appelait ""tête de nègre"". Je ne savais pas ce que c'était, c'était le seul contexte où j'avais entendu ce mot. On n'en mangeait que quand un ami de mes parents venait à la maison, il les achetait à la boulangerie avant de venir.

Un jour il a piqué une crise parce que la boulangère lui avait dit qu'on appelait ça des meringues au chocolat désormais. C'était fin années 90, début 2000. 

C'était le type qui dit que le wokisme a tout pourri, mais 20 ans avant."
2022-12-09 08:28:07,SupermanLeRetour,"&gt; Je crois que dans le même genre il y avait des bonbons au réglisse qui s’appelaient tête de n*gre. Pareil, retires de la vente sans fanfare

Les têtes de nègre ont été renommés [tête au chocolat](https://fr.wikipedia.org/wiki/T%C3%AAte_au_chocolat) (pour des raisons évidentes) mais n'ont pas disparu, je suis sûr que tu peux en trouver au marché de Noël local (en tout cas à Nantes tu en trouveras). Il n'y a pas de réglisse dedans par contre."
2022-12-08 15:11:36,raadis,"J'ai edit pour préciser que c'est plus aux USA que en europe mais bon ça a aussi existé en France même si c'est moins connu comme la pièce ""Malikoko, roi nègre"" ou un homme blan,c jouaitn un roi noir cannibale. 

&gt;C'est intéressant ça, tu parles de classisme. Est-ce qu'il faut être pauvre pour jouer un pauvre ? C'est une vraie question.

Comme pour le reste pas  besoin d'être d'une classe sociale populaire pour le jouer techniquement.  Cela dit c'est pas top si cette classe n'a pas du tout accès aux rôle et que des personne de classe sociale aisée joue à leur place tout le temps."
2022-12-07 16:09:04,BABARRvindieu,"2 choses :  
 \- oui, les ancien sont plus raciste.  
 \- par contre, l'utilisation de ""negre"" c'est une autre histoire, c'est plus generationel, comme on utilise/utilisait  ""black"" de nos jour. Et je pense que d'ici 30 ans utiliser ""black"" sera tres mal vu.  
D'ailleurs aux US il y a 1 siecle, c'etait + pejoratif d'utiliser ""black"" plutot que ""niggger"""
2022-12-01 13:01:27,morinl,"""Pour l'enseignant et cinéaste français François Fronty, Les statues meurent aussi est plus un essai filmique qu'un film documentaire. « Mais c’est aussi un film sur les ravages du colonialisme en Afrique et la lutte des classes. Un film qui explique et nous fait ressentir comment la beauté et le mystère de ce que l’on appelait à l’époque art nègre a été avili. On y voit vivre et mourir des objets sacrés. La leçon est universelle, elle vaut pour tous les arts, toutes les cultures.""

Cf Wikipedia"
2022-11-30 14:56:45,Maccullenj,"Je vais présenter la chose différemment.  
Tu utilises droitardés comme d'autres utilisent pédale ou nègre. C'est du même niveau argumentaire, un terme infamant pour stigmatiser facilement un groupe dont tu prétends qu'il existe.  

Les néologismes récents comme celui-ci remplissent plusieurs fonctions :  
- Ils participent d'un sociolecte politique, et agissent comme signes de reconnaissance (Si tu l'utilises et que je l'utilise, alors on sait qu'on pense pareil)  
- Ils stigmatisent un groupe cible sans avoir à rentrer dans le détail de ce qui lui est reproché (un rôle assez ironique quand on parle de pensée politique, puisqu'il permet de s'en passer)  
- Ils n'ont pas le bagage sémantique qu'ont les insultes traditionnelles mentionnées plus haut (et on peut donc l'utiliser à la légère), mais...
- Haha y a un gros mot ! (et donc on est edgy)

Sauf que tes droitardés ne sont pas un groupe cohérent. Entre le suiveur qui se pense gaulliste et vote en automatique pour une droite conservatrice tradi, et le nazillon bas du front, il y a un monde, et les foutre dans le même sac n'est pas honnête.

Quant au wokisme, j'ai quand même un problème avec l'image que tu en donnes. Comment ce truc peut-il être à la fois le degré 0 de la pensée politique, et malgré tout une idéologie suffisamment attractive pour attirer à ce point l'électorat de gauche ?"
2022-11-21 08:44:38,Bandolinho2,"**Les injustices ne s’arrêtent pas à l’entrée des stades**

L’histoire de l’équipe de France elle-même est intimement liée à l’histoire politique du pays. Emmanuel Macron connaît-il Larbi Benbarek, cet immigré marocain naturalisé, prodige du football, qui chanta la Marseillaise à pleins poumons face à un public qui l’avait pris pour cible, en 1938, lors d’un déplacement des Bleus en Italie mussolinienne ?

Aurait-il dit à Mustapha Zitouni et Rachid Mekhloufi de ne pas « politiser le sport » lorsqu’ils ont quitté, en 1958, l’équipe de France pour rejoindre la sélection clandestine du FLN algérien et soutenir la lutte indépendantiste dans leur pays ? N’a-t-il pas vu quelque chose de politique dans le parcours des trois plus grands génies de l’histoire des Bleus ; Raymond Kopa, le fils d’un mineur polonais du Nord, Michel Platini, l’enfant d’immigrés italiens de Lorraine, et Zinedine Zidane, fils d’un ouvrier algérien arrivé en Seine-Saint-Denis puis à Marseille ?

L’énumération des exemples devient vertigineuse si on élargit la focale au sport mondial. En 1968, les athlètes afro-américains Tommie Smith et John Carlos ont levé le poing sur le podium des Jeux olympiques pour dire l’urgence de construire une société américaine plus égalitaire. L’année précédente, le boxeur Mohamed Ali refusait de participer à la guerre du Vietnam, arguant qu’« aucun Vietcong ne \[l’avait\] jamais traité de nègre ». Et, ces dernières années, les basketteurs de la NBA ont posé le genou, levé le poing et boycotté des rencontres face aux violences policières et aux discriminations raciales qui traversent encore les États-Unis.

Non, pour ces sportifs, « politiser le sport » n’a pas été une « très mauvaise idée ». Avec leur force de frappe économique et médiatique, les basketteurs américains ont mis une lumière sans précédent sur le mouvement pour l’égalité raciale. Politiser le sport, c’est se servir du rayonnement des grandes compétitions pour alerter, pour s’indigner, pour passer des messages que la société rechigne parfois à entendre. Politiser le sport, c’est montrer que les injustices et les discriminations, et avec elles la violence qu’elles charrient, ne s’arrêtent pas comme par magie à l’entrée des stades et des gymnases.

Emmanuel Macron sait sûrement tout cela. Il a peut-être simplement cru avoir trouvé la parade ingénieuse aux questions que pose invariablement son mutisme sur les conditions d’organisation de ce Mondial. À sa décharge, son inconfort est compréhensible : depuis 2017, le chef de l’État n’hésite pas à promouvoir à l’international les valeurs de la France, son attachement aux droits humains et son « Make Planet Great Again ». Voilà que le Mondial qatari vient heurter ce fragile château de cartes."
2022-11-16 10:45:02,LlordB,"Pour le coup, en français, on fait pas vraiment de différence entre nègre et négro, les deux sont extrêmement vulgaires et péjoratifs.

Ceci dit, le mot nègre peut avoir une deuxième définition: Si un auteur publie un livre en son nom, mais qu'il n'en a pas écrit l'intégralité (voire rien du tout) alors le ou les auteurs ayant participés sans être nommés sont appelés des nègres. Pas la moindre idée d'où ça vient et si ça avait un fondement péjoratif à l'origine.

Pour ce qui est du livre, je n'ai pas de réponse à apporter, je ne l'ai pas lu, donc je ne sais pas dans quel contexte et pourquoi on retrouve l'utilisation de ce mot."
2022-11-15 16:21:07,FeistyFlight6547,Ta question est très provocatrice. Sincèrement. Comme si tu ne savais pas la définition du mot « negre »
2022-11-15 13:10:48,amerkanische_Frosch,"On peut aider le pauvre anglo-saxon (USA) que je suis sur l'utilisation exacte de ce terme de nos jours?

Avant que ""African American"" ou ""Afro-Américan"" soit devenu le norme aux Etats-Unis, et avant le mouvement ""Black Power"", on utilisait aux USA le terme ""Negro"" (avec ""n"" majuscule) pour désigner de manière polie une personne de couleur (d'ailleurs, au temps des célèbres discours de Martin Luther King, tel ""I have a dream"", il utilisait cette expression).  Le terme (très) pejoratif était bien sûr ""nigger"" (qui continue d'ailleurs être LE mot à ne pas utiliser en anglais, de tel sort que si on veut même en critiquer l'utilisation, il faut l'appeler ""the N word"" plutôt que de le prononcer).

Or, si je comprends bien, à l'époque où le livre en question est sorti, il s'appelait en anglais ""Ten Little Niggers"", mais en anglais britannique l'expression, même s'il était vulgaire, n'était pas aussi pejorative qu'en anglais américain, et justement aux USA on avait tendance à vendre le livre sous le titre ""Ten Little Indians"" ou même ""And Then There Were None"", justement le mot ""nigger"" en anglais USA était mal vu.

Toujours d'après ce que je comprends (mais peut-être ai-je tort?), le mot pejoratif de nos jours pour désigner un Noir est ""négro"" (comble d'ironie vu que c'était le terme poli autrefois en anglais USA).  Qu'en est-il du mot ""nègre""?  Est-il / était-il à l'époque de la sortie du livre un terme simplement vulgaire ou est-il/était-il également un terme vraiment pejoratif?

Merci d'avance!"
2022-11-15 09:38:55,boucledor,"En 2010, l’attribution de la compétition à la monarchie gazière s’est-elle jouée au cours d’un  
déjeuner à l’Elysée ? La justice française suspecte un pacte corruptif qui aurait pu donner  
lieu à des renvois d’ascenseur.  
C’est un discours qui a marqué les esprits. Pour sa première intervention depuis sa défaite  
face à François Hollande, Nicolas Sarkozy a choisi la capitale du Qatar. Le 11 décembre  
2012, le désormais ex-président de la République plastronne à la tribune du Doha Goals, un  
forum sur le sport financé par la Qatar National Bank et organisé par l’homme d’affaires  
Richard Attias, mari de son ex-épouse, Cécilia. Barbe de trois jours, il prononce une vibrante  
ode à la petite monarchie gazière de 11 500 kilomètres carrés et de 2,4 millions d’habitants,  
dirigée alors par son ami l’émir Hamad Ben Khalifa Al Thani.  
Nicolas Sarkozy l’assure : il a « soutenu » le choix de la Fédération internationale de football  
(FIFA) d’attribuer la Coupe du monde de football 2022 (organisée du 20 novembre au 18  
décembre) au Qatar, le 2 décembre 2010. Sous les yeux du patron de la FIFA, Sepp Blatter,  
et de l’émir, il célèbre ce « choix stratégique et politique majeur » et ce « rééquilibrage » en  
faveur « d’un pays musulman qui organise pour la première fois un événement de cette  
importance ».  
Une décennie après ce discours, le rôle de Nicolas Sarkozy – qui n’a pas répondu aux  
sollicitations du Monde – est au cœur des soupçons de la justice française, dans le cadre de  
l’information judiciaire ouverte, en 2019, par le Parquet national financier (PNF) pour «  
corruption active et passive », « blanchiment » et « recel » concernant l’attribution  
controversée (14 voix contre 8 pour les Etats-Unis) du Mondial 2022 au Qatar.  
A ce stade de l’enquête, l’ex-président de la République n’a cependant pas été entendu par  
les deux juges chargés de cette affaire tentaculaire – Serge Tournaire, qui l’a déjà mis en  
examen dans l’affaire Bygmalion, et Virginie Tilmont. Mais de nombreux éléments du dossier  
pénal, véritable plongée dans une opération de lobbying d’Etat, dont Le Monde a pris  
connaissance, montrent que M. Sarkozy s’est personnellement impliqué pour favoriser la  
victoire dans les urnes du Qatar, un pays avec lequel il a tissé des liens étroits, tout en  
bénéficiant, à l’instar de son entourage, des largesses de l’émirat.  
« Il faut se réjouir de l’avancée de l’enquête qui a pu mettre sur la table de nombreuses  
questions relatives au rôle exact de M. Sarkozy dans ce dossier, d’autant plus importantes  
en raison du secteur sportif de plus en plus marqué par la corruption ainsi que de son statut  
de président de la République de l’époque, et du devoir d’exemplarité qui devrait lui être  
attaché », déclare Jean-Baptiste Soufron, avocat d’Anticor, partie civile dans ce dossier.  
Des liens France-Qatar déjà solides  
Durant son enquête préliminaire (2016-2019), le PNF a suivi la piste d’un pacte corruptif,  
d’un « deal gagnant-gagnant », qui aurait été scellé lors d’un déjeuner organisé à l’Elysée, le  
23 novembre 2010. « Etape décisive dans le processus d’attribution du Mondial » pour les  
enquêteurs, cette réunion a été tenue en présence de M. Sarkozy, de l’actuel émir (et alors  
prince héritier) du Qatar, Tamim Al Thani, de son premier ministre, Hamad Ben Jassem (dit «

HBJ »), du président français de l’Union des associations européennes de football (UEFA),  
Michel Platini, du secrétaire général de l’Elysée, Claude Guéant, et de la conseillère aux  
sports du président de la République, Sophie Dion. Le PNF soupçonne cette dernière d’avoir  
« tenu une place centrale dans la préparation et l’organisation » de ce déjeuner.  
Ces agapes ont eu lieu six mois avant le rachat du Paris-Saint-Germain (PSG), au  
printemps 2011, par le fonds Qatar Sports Investments (QSI), et dix-huit mois avant  
l’augmentation de la participation (à 12,8 %) du fonds Qatar Holding LLC dans le capital du  
groupe Lagardère et le lancement en France de la chaîne qatarie BeIN Sports, détentrice  
alors des droits télévisés de la Ligue 1 et des compétitions européennes.  
A son arrivée au pouvoir, en mai 2007, Nicolas Sarkozy s’attache à renforcer des liens déjà  
solides avec le Qatar. Désireux de mieux exister à l’international face à l’Arabie saoudite  
voisine, le richissime émirat a lancé une politique de séduction auprès des dirigeants  
français. En tant que ministre de l’intérieur, Nicolas Sarkozy a développé des liens  
personnels avec l’émir et son premier ministre, « HBJ ».  
Après l’accession à l’Elysée de Nicolas Sarkozy, le cheikh Hamad Ben Khalifa Al Thani est  
le premier dirigeant à lui rendre visite, dès le 30 mai 2007. Un déjeuner fructueux, après  
lequel la présidence peut annoncer la vente au Qatar de 80 Airbus A350, pour 16 milliards  
de dollars. L’émir va également assurer le soutien financier de la France – « un geste  
humanitaire d’un Etat ami », selon M. Sarkozy – pour la libération des infirmières bulgares  
otages de la Libye du colonel Kadhafi.  
En janvier 2008, c’est au tour de Nicolas Sarkozy de s’envoler pour une visite officielle à  
Doha. Il y annonce une convention fiscale entre les deux pays, qui exonère d’impôts sur la  
plus-value les Qataris qui investissent en France. Ces derniers ne s’en privent pas. Après  
s’être offert, en 2008, le célèbre prix hippique de l’Arc de triomphe, le Qatar lorgne  
également l’immobilier de luxe. En août 2009, le premier ministre qatari dîne en privé avec  
Nicolas Sarkozy au cap Nègre, où la famille de son épouse, Carla Bruni, possède une  
propriété.  
Le 9 septembre 2009, Nicolas Galey, conseiller diplomatique à l’Elysée, résume dans une  
note, versée au dossier d’instruction, les contrats remportés par des entreprises françaises  
auprès du Qatar – « Airbus, GDF-Suez, Vinci » – ainsi que les « marchés à l’étude » – «  
Areva, Alstom (...), Vinci (...) et la vente matériel militaire : remplacement des douze Mirage  
2000-5 par des Rafale, hélicoptères Tigre, système anti-missiles à longue portée Aster 30 ».  
Les fonds qataris semblent inépuisables."
2022-11-15 07:57:41,Live-Pea4636,"Il va falloir revenir sur le mot nègre. Ce n'est pas un terme méprisant ni insultant, pas plus que les mots tels que petit, grand, blanc, indien, blond, gaucher et autres termes descriptifs. Ce n'est pas parce que les arriérés d'extrème-droite l'ont annexé pour en faire une insulte qu'on peut mépriser tout un continent mal connu où ont prospéré des peuples, des civilisations, des royaumes et empires, des traditions et des arts qui nous influencent profondément. Il est plus que temps de se réapproprier ce mot et tout ce qu'il représente dans l'histoire de l'humanité."
2022-11-15 00:39:30,KodjoSuprem,En mangeant une tête de nègre
2022-11-14 21:22:22,Automatic-Antelope-2,"En ecoutant ""Le petit nègre"" de Debussy"
2022-11-14 20:40:25,Sprudlidoo,"Monsieur Dany Leferrière!  Il a aussi écrit, ""Cette grenade dans la main du jeune nègre est-elle une arme ou un fruit""  il a le sens de la formule..."
2022-11-14 20:05:11,MyerSkoog,"Planque le derrière une couverture de ""Comment faire l'amour avec un nègre sans se fatiguer""

C'est un vrai livre (antiraciste), par un auteur haïtien"
2022-11-14 19:42:47,BeeMyQueen,"Ça vient du poème que les personnages trouvent dans la maison. A chaque ligne, il explique la mort d'un negre (indien en anglais pour info) qui correspond à la mort d'un des personnages."
2022-11-05 12:46:55,anyatrans,"On sait pas trop. Il es soit vivant mais il bouge pas trop soit il est empaillé et ils lui ont mis un truc comme les poupées parlantes. Il sait dire ''arabe, nègre et rouquin''"
2022-10-29 12:21:18,Rc72,"Tú vas encore prétendre que la musique nègre est de la culture, toi!

(/s, juste au cas où)."
2022-10-28 13:36:10,chatdecheshire,"Je ne vois pas en quoi le mot ""arabe"" est raciste. Ce serait ""nègre de maison"" je comprendrais, mais là non. Peux-tu m'expliquer en quoi le terme ""arabe"" est raciste ?"
2022-10-28 09:19:01,mwaaah,"Le ""nègre"" en général est vendu au plus offrant, l'insulte du ""nègre de maison"" (c'est ce dont je parlais au dessus comme ""oncle tom"") vient en particulier du fait qu'il se met volontairement du côté des oppresseurs (ceux qui possèdes les esclaves) contre ses confrères. Arabe de service je le vois de la même façon, le problème est qu'il se mette volontairement au service des oppresseurs.

[Cf. wikipédia](https://fr.wiktionary.org/wiki/n%C3%A8gre_de_maison) : personne noire aux idées qui sont en opposition supposée au bien-être de leur communauté ou qui légitime les positions des groupes dominants. 

C'est pas le fait d'être un esclave ou vendu au plus offrant qui est visé mais le fait de se mettre en opposition à sa communauté ou au service de groupes qui oppressent cette communauté (du point de vue de la personne qui émet l'injure du moins). Donc oui ça a tout à voir avec ""être au service de"" mais au service de quoi (la police, pas directement l'état) a aussi une importance."
2022-10-28 08:55:12,Keyenn,"Mais whatttttt. T'es complètement perdu, mon pauvre. Arabe de service, non, effectivement, ça n'a absolument aucun rapport avec le ""service de l'état"", et tout a voir avec le ""être au service de"", a savoir, le serviteur, l'esclave. C'est quand même chaud de comprendre tout de travers. Arabe de service, la signification, c'est littéralement l'arabe qui se serait vendu au plus offrant, comme le ""negre de maison""."
2022-10-27 22:55:16,MlleLane,"C'est clairement un ad hominem. Il l'utilise pour la disqualifier *elle* en tant que porte-parole, plutôt que d'attaquer ses paroles (pourtant y avait matière)

A titre perso, je ne penses pas que ca mérite un procès même si je méprise la rhétorique ADS/nègre de maison/francisé/bounty/banane/noix de coco. Mais comme ca a été porté au tribunal, j'espère bien que celui-ci ne va pas valider cette rhétorique. Tant pis pour Bouhafs."
2022-10-23 10:53:12,loulan,"Quand j'étais petit on appelait ça des congolais, mais peut-être que ça a été renommé comme les têtes de nègre."
2022-10-15 14:44:04,Malubule,"Take your favorite/best patisserie and give it's name to your shop for example ""La tête de Nègre"" or ""Le cul de none"" or ""Chinois""."
