date,author,text
2020-11-26 19:26:06,Y_Sam,"&gt;J'essaie de comprendre pourquoi trois flics qui passent dans la rue rentrent tabasser un mec sans sommation et apparemment sans raison  
  
Pour la même raison qu'ils violent son domicile, usent d'une force disproportionnée, le traitent de ""sale nègre"", mentent effrontément dans le procès verbal et annulent courageusement leur témoignage  quand ils apprennent qu'il y avait une vidéosurveillance...  
  
Parce qu'ils ont commis un crime, qu'ils sont des racistes minables et qu'ils sont habitués à ne jamais rendre de comptes pour leurs actions.  
  
L'autre mec ? Il est la victime de tout ça, ça devrait te suffire, mais apparemment une police de fachos bas du front couvert par leur syndicat et leur ministère c'est pas un bon contexte, il leur faut une raison supplémentaire.  
  
Donc oui ça a tout à voir avec ton propos, puisque tu évites le problème pour parler d'autre chose : la victime."
2020-11-26 17:45:17,Redhot332,"Pour les renforts, ça dépend quand même pas mal de l'appel de renfort. Si c'était un truc ""à l'aide, on est attaqué, individus armés et violents"", ça peut expliquer leur réaction - ça n'excuse pas les coups au sol derrière, mais la sanction sera sûrement moins violente. Si l'appel à l'aide c'était ""y'a un nègre qui se laisse pas faire, venez nous aider"", la oui sanction lourde pour tous (ou en tout cas tout ceux qui mettent des coups)."
2020-11-26 13:41:09,Lilpims,Ils avaient clairment envie de se taper un  nègre. C'est évident vu à la vitesse à laquelle ils sont descendu. C'était une ratonnade. Utilisont les mots qui gênent.
2020-11-26 12:03:00,sifloo,"Je dirais qu'ils avaient juste envie de tabasser du ""sale nègre"" (selon leurs propos). A partir du moment ou ils ont été repoussés, entre leurs egos blésé et la panic de ""merde on a peut être fait une boulette"" ils se sont mis à inventer une histoire en espérant s'en sortir (un peu comme un gamin qui cherche une histoire pour se dédouaner après une bêtise).

Malheureusement pour eux il y avait une caméra de vidéo surveillance qui les mets dans la merde. A noter que leurs mensonges seraient surement passés sans la caméra de vidéo surveillance."
2020-11-26 10:46:25,PsyX99,"L'article dit que c'est pour nuire à la police qu'on a pas le droit de les diffuser. Donc si je la diffusais sur une plateforme d'extrême droite en disant ""ouai ils l'ont bien eu le nègre"" je pourrais diffuser la vidéo, car je veux féliciter le bon travail de la police.

L'art de contourner la loi :)"
2020-11-26 10:45:59,MlleLane,"J'ai voulu faire un résumé factuel et neutre pour que les gens puissent prendre connaissance des faits et regarder la vidéo (qui est beaucoup plus violente), voici la séquence émotion:

- tout au long, les policiers traitaient Michel de ""sale nègre""

- tout au long, Michel essayait d'ouvrir le dialogue, de comprendre ce qui lui arrivait, de démontrer sa coopération

- la présence de caméra à l'intérieur du studio, et les voisins qui ont filmé sont la seule raison pour laquelle Michel a échappé aux poursuites

- La présence de personnes qui filment est la seule chose qui a fait s'arrêter la ratonnade

- ""6 jours d'ITT"" euphémisent de nombreuses blessures, dont une déchirure au tendon, le crâne ouvert qui a nécessité 2 agraphes.

- Il n'a pu voir les médecins qu'après 48h de GAV

- Une vingtaine (au moins) de policiers sont sur vidéo à tabasser le producteur et les jeunes dans la rue devant le studio, mais la préf ""n'a pas de trace de l'intervention"" et seul les 3 flics qui sont rentrés par effraction sont sous enquête IGPN

- En voyant ca, la première chose qui vient à l'esprit à juste titre c'est ""il veulent empêcher de filmer ca avec l'article 24"", mais je voudrais partager un instant d'horreur avec vous en soulignant le fait que les policiers ont dégainé leurs armes, et rappeler que dans la loi de sécurité globale, il y avait aussi un amendement visant ""à créer une présomption de légitime défense en cas d’usage d’une arme par un membre des forces de l’ordre"".

Il a heureusement été rejeté, mais je trouve que l'ampleur de ce qu'ils essaient de faire passer sous la loi sécurité globale est sous-estimé à cause du focus des journalistes sur la liberté de filmer.

Regardez la vidéo, vraiment, rien de ce que je peux écrire ne permet de retranscrire la violence des faits; j'ai voulu faire un résumé parce que je sais que je clique rarement sur les liens de réseaux sociaux, et que je n'aurai pas eu conscience de la gravité de l'histoire si je n'étais pas tombé sur cette vidéo sur mon propre fil twitter.

Je sais aussi que beaucoup ne visionneront pas jusqu'au bout sans incitation; sur le fil twitter, il y a des commentaires du genre ""Si c'est vrai c'est grave. Mais n'importe qui peut mettre un costume de policier et taper quelqu'un c'est pas forcément ce qu'il s'est passé"". Sur ce fil même, en réponse à mon commentaire:

&gt;En même temps Michel aurait pu ne pas fuir, obtempérer et ne pas se débattre. Je vois pas le problème a maîtriser un suspect aussi grand et fort avec des coups, surtout si il fuit et si il se débat violemment. Et si il est fou ? Si il va chercher une arme ? Si il fuit pour masquer quelque chose qu'il avait sur lui ?

C'est insupportable."
2020-11-26 10:11:08,alvy-singer,"Tu peux même ajouter les insultes racistes, ""sale nègre""..."
2020-11-26 10:09:58,rafalemurian,Michel est noir aussi et assure s'être fait traiter de sale nègre.
2020-11-26 09:46:34,[deleted],"C'est simple, il se sont placé en tant que victime.

""On passait par là totalement innocemment quand tout à coup ce ~~sale nègre~~ méchant chocobon nous a traîné de force dans son local avant d'essayer de prendre nos armes (oui, des 3 flics) en plus il a des renforts! ramenez-vous pour la baston svp.""

Je satire sur la forme, mais le fond est correct: D'après eux il les aurait agressé tout les trois et tenté de prendre leurs armes.

Après honnêtement vu avec quelle facilité déconcertante leurs copains se sont mis à taper sur les civils ces pourris attendaient que ça. Il a malheureusement juste fallu qu'ils soient filmés pour gâcher leurs plaisir."
2020-11-25 07:58:42,squiksquik,"Eh oui c'est pratique ! Tu dis que les blancs n'ont pas le droit de participer à la conversation, et quand c'est un noir  qui n'est pas d'accord avec toi, tu dis qu'il est blanc aussi. Comme ça pas besoin de se casser le cul à se remettre en question !

Voir aussi : nègre de maison, uncle Tom, ex-black (j'ai découvert récemment celui-là), Oreo, arabe de service (OK pas pour les noirs mais on est dedans :p), et sûrement plein que j'oublie ou que je connais pas :)

*Evidemment les asiatiques ne comptent carrément pas comme étant ""racisés"" pour certains - et on ne parlera pas des juifs non plus, là ça risque de fâcher."
2020-11-24 10:22:06,paris_forever_75,"&gt; «Comme ailleurs, plus vous montez en grade et en diplôme, moins vous votez à l’extrême droite, constate-t-il. Si 67 % ou 68 % des policiers de la base votent Le Pen, cela tombe à 35 % ou 40 % chez les officiers de police judiciaire.

Alors j'ai fait une réunion avec un copain de collège/lycée quand j'ai déménagé dans la même ville que lui. Après le lycée j'ai fais une école dans un coin de France, lui la fac puis l'école d epolice dans un autre coin de la France, ça faisait genre 15 ans qu'on s'était pas vu. 

J'arrive au bar, il est OPJ et je rencontre ses deux potes qui le sont aussi. Au moment de me présenter, j'ai eu le droit en trois minutes à un ""t'es un sale juif?"" quand j'ai mentionné travailler dans la finance, puis j'ai entendu des mots comme ""nègre"" et ""bougnoules"" toute la soirée.

On parle d'OPJ de 45 ans là, pas du débile de base qui sort de l'école de police."
2020-11-21 13:11:17,Pochel,"Ah, c'est bien vu. Ça pourrait être un moyen de contourner le truc ! Je propose que tout les youtubeurs disent ''negre'' et postent des nus dans leur prochaine vidéo, on verra ce que ça fait"
2020-11-19 09:40:28,sphks,"https://fr.m.wiktionary.org/wiki/noir_comme_dans_le_trou_du_cul_d’un_nègre

https://fr.m.wiktionary.org/wiki/noir_comme_dans_un_four

https://fr.m.wiktionary.org/wiki/noir_comme_dans_la_gueule_du_loup"
2020-11-19 00:18:08,yadoya,"""On y voit comme dans le trou du cul d'un nègre ici !""

Mon tonton."
2020-11-18 16:28:40,RudySanchez-G,[https://fr.wiktionary.org/wiki/noir\_comme\_dans\_le\_trou\_du\_cul\_d'un\_nègre](https://fr.wiktionary.org/wiki/noir_comme_dans_le_trou_du_cul_d%E2%80%99un_n%C3%A8gre) ?
2020-11-16 07:30:07,Zamiotov,"Il n'y a pas de point d'équilibre à trouver, il y a simplement les délires de la bien-pensance (coucou Evergreen) et ce que dit la loi. On a le droit d'employer le mot nègre, surtout dans un contexte pédagogique, mais on n'a pas le droit de menacer quelqu'un de mort, surtout dans un contexte de meurtres par la même idéologie.

Je suis en partie d'accord à propos de Twitter, bien que comme souvent le problème ne soit pas l'outil mais l'utilisateur."
2020-11-16 07:18:44,[deleted],"Il y'a quelques temps j'aurais à fond été derrière ce sentiment.

Mais il y'a eu quelques exemples de ""réponses impitoyables"" vraiment discutables, comme cette enseignante au Canada qui a été suspendue pour avoir discuté du mot ""nègre"" dans un contexte académique.

Du coup je ne sais plus. Bien sûr les menaces de mort doivent être punies, mais ça va être super difficile de trouver le point d'équilibre entre ce que l'on devrait sévèrement punir et ce qui relève de sanctions moindres ou tout simplement de la liberté d'expression.

Surtout qu'en disant ""la justice tranchera"", le problème du tribunal populaire demeure. Si quelqu'un s'est fait lyncher en ligne mais est relaxé/blanchi plus tard, le mal est fait et à tous les coups les conséquences - renvoi, perte du boulot, etc... - ne peuvent plus être réparées.

Très honnêtement, je pense que la solution la plus simple et la plus mesurée à ce problème serait de larguer une bombe atomique sur les serveurs de Twitter et de décréter une peine de mort automatique pour quiconque essaierait de remettre cet étron du web en marche."
2020-11-14 16:22:59,smurlikon,"&gt; C'est le même cycle qui se répète sans fin aux US depuis Kennedy. Ils élisent un mec de centre un tant soit peu libéral qui veut apporter de modestes réformes ce qui fait s'enflammer la droite qui elle fera élire un gros réac conservateur. 

Les Républicains carburent au racisme des blancs; ils font mousser la haine des «méchants Démocrates qui vont vous taxer pour payer pour [ceci ou celà] d’un sale nègre paresseux», et ça marche.

Les Amerloks sont profondément racistes."
2020-11-11 11:55:38,LordHandQyburn,Ca m’etonnerai que tu recoi des « sale nègre » ou autre donc non ce n’est pas comparable
2020-11-11 11:31:04,SchwartzNauheimer,"&gt; une covidiote m'a appelé ""sale nègre""

&gt; ça ne t'es pas arrivé parce que tu es noir

Belle logique, merci."
2020-11-09 13:11:13,Rikube,"Yoann explique la vie à réalisé ça pour toutes les élections de sa la 5eme république sur sa page Facebook, ça mérite d'aller y jeter un œil même si on n'adhère pas à ses idées.

D'ailleurs les élections de 74 et de 81 auraient permis au candidat qui a perdu au second tour de gagner avec ce modèle.

[Facile à lire](https://www.facebook.com/YoannNegreExpliqueLaVie/posts/3541065429264811)

[Avec une légende](https://www.facebook.com/YoannNegreExpliqueLaVie/posts/3541107765927244)"
2020-11-06 22:51:33,[deleted],"Autre détail intéressant, les guillemets à ""question nègre"", qu'on ne retrouve pas dans la version anglaise où c'est juste *Negro question*. Comme si l'idée même d'un problème inhérent aux noirs laissait les Français plus sceptiques que les Etatsuniens."
2020-11-06 14:50:28,sitarane,"*""Ils ont élevé récemment des véhémentes protestations contre une gravure de la vie parisienne intitulée ""l'enfant du dessert"" représentant une femme en cabinet particulier avec un nègre.""*

La gravure en question: https://i.pinimg.com/originals/2f/4e/ac/2f4eac9a04180c45219f932ce49db33f.png"
2020-11-06 12:07:13,Frolafofo,"La violence des mots ""question nègre"", répété plusieurs fois..."
2020-11-05 10:46:08,Delphine_Talaron,"Quand tu discutes sur des reddits de Musulmans ( r/islam, r/tunisia, r/izlam ou autres), tu vois que :

1 - les musulmans qui vivent en Europe (edit : et qui traînent sur ces sous) n'ont majoritairement aucune intention de s'assimiler, ni même de s'intégrer. Ceux qui font des efforts en ce sens (restreindre sa religion à la sphère privée, changer de nom...) sont systématiquement insultés ou dénigrés. Ils ont même leur propre version du ""nègre de maison"" pour qualifier les musulmans un peu trop assimilés, mais je me rappelle plus du terme.

2 - ils sont clairement dans une logique revancharde. L'Occident a colonisé, donc on doit fermer notre gueule et accepter leurs demandes car ce n'est que justice. Il y a un côté victimaire, et une logique de conflit qui nous échappe totalement. Genre la France, c'est dans leur esprit à peine mieux que l'Allemagne nazie.

3 - Ils font semblant de ne pas comprendre ce que l'Occident propose. Leur discours, en gros, c'est ""vous prétendez offrir la liberté, mais vous m'interdisez de porter la burka et de pratiquer la shariah, hypocrites !""."
2020-11-02 19:00:11,Matad_or,"**L’autocensure, mal du siècle**

Des médias au monde de l’enseignement, la servitude volontaire a le vent en poupe. De peur d’essuyer des injures, voire des violences, les individus évitent de plus en plus de donner leur opinion.

On l’a répété pendant longtemps, on en était persuadé : l’autocensure correspondait à une excentricité nord-américaine, la France en serait épargnée. Le pays de Voltaire ne pouvait importer sur ses terres une bien-pensance anglo-saxonne, une idéologie diversitaire à cran refusant le débat démocratique. Pourtant, ce qui devait être une exception culturelle états-unienne est devenu un résidu culturel français.

Si la parole doit officiellement être « libérée », cette liberté se révèle particulièrement encadrée. Et toute la difficulté du gouvernement, au travail pour pondre une loi contre la haine en ligne, consiste à légiférer pour protéger les citoyens du cyberacharnement sans entamer leur liberté d’expression. Un vrai travail d’équilibriste. Au-delà de ces situations extrêmes, le risque existe d’inciter toute personne à garder pour soi son avis sur un des sujets dont la liste ne cesse de s’allonger (lire l’encadré, p. 55). Depuis peu, il peut aussi être nécessaire de ne pas nommer les réalités biologiques, par exemple. Ainsi, les sexes ne seraient que des constructions sociales, et remettre en question la théorie du genre expose à une accusation de transphobie. Les évidences d’hier deviennent donc les délits d’aujourd’hui.

**L’école de la censure**

Le monde de l’enseignement n’échappe pas à l’autocensure. En histoire et en science de la vie et de la Terre, notamment, des professeurs font l’impasse sur certaines parties du programme pour éviter toute contestation. Déjà, en 2004, le rapport Obin indiquait que le chapitre relatif à la reproduction n’était pas toujours abordé au collège, les enseignants craignant l’opposition des élèves ou même des parents. Selon une étude de l’Ifop, près de 40 % des enseignants déclarent s’autocensurer pour ne pas avoir d’incident avec les élèves. Et dans les réseaux d’éducation prioritaire (anciennement ZEP), ils sont plus de 50 %.

L’assassinat du professeur d’histoire-géographie Samuel Paty, décapité pour avoir montré à ses élèves des caricatures de Mahomet, ne fait qu’aggraver la situation. Pour Iannis Roder, professeur d’histoire-géographie en Seine-Saint-Denis et directeur de l’observatoire de l’éducation de la Fondation Jean-Jaurès, l’autocensure dans les cours a de beaux jours devant elle : « C’était déjà le cas dans certains espaces, et je pense que ce sera encore plus le cas désormais. »

Et les politiques ne contribuent pas toujours à améliorer ce climat, tant s’en faut… Après avoir insulté l’islam sur les réseaux sociaux en janvier dernier, la jeune Mila avait été victime de nombreuses menaces de mort, ce qui l’obligea à quitter son établissement. Elle est désormais scolarisée dans un internat hors contrat. Nicole Belloubet, alors la ministre de la Justice, avait condamné les propos de Mila, considérant que « l’insulte à la religion [était] évidemment une atteinte à la liberté de conscience » avant de se raviser.

**Tous coupables**

L’attentat visant Charlie Hebdo aurait pu porter un coup à l’autocensure, il n’en a rien été. Le sursaut n’a pas eu lieu. En particulier sur le sujet des caricatures de Mahomet. Crainte de réactions violentes, soumission à l’accusation de « stigmatisation » des populations « discriminées », peur du qu’en-dira-t-on… les médias eux-mêmes ne sont pas à l’aise avec la liberté d’expression et préfèrent souvent épouser le récit proposé par l’idéologie diversitaire. Selon un sondage Ifop pour Charlie Hebdo réalisé en août, 45 % des personnes interrogées considèrent que la liberté d’expression en France a diminué dans les médias depuis l’attentat contre le journal en 2015.

Près d’un tiers des personnes interrogées estime que les journaux ont eu tort de publier les caricatures du prophète Mahomet car cela constituerait une provocation inutile. Et le chiffre grimpe à 69 % chez les personnes se déclarant musulmanes. Avec l’intimidation numérique notamment, le contrôle ne vient pas du pouvoir mais des citoyens eux-mêmes. À l’époque de l’autosurveillance, les réseaux sociaux se font les gardiens d’une nouvelle forme de contrôle social à l’aune de la société inclusive.

Désormais, tous les domaines de la société apparaissent concernés par la surveillance généralisée. Conséquence de ce nouveau régime, le citoyen lambda, dernier gardien de la parole ordinaire, est touché. Dans la sphère privée, le risque encouru est de se retrouver isolé socialement pour avoir tenu des propos dits minoritaires, c’est-à-dire opposés au discours communément admis. Face aux autoentrepreneurs de la censure, deux possibilités : choisir de se taire ou parler pour ne rien dire.

Pour avoir refusé cette servitude volontaire, la rédaction de Charlie Hebdo a payé le prix fort. « Cette liberté, vitale et indissociable de notre démocratie, est en train de devenir un produit de luxe, comme le sont les voitures de sport ou les rivières de diamants de la place Vendôme, et dont seuls les médias fortunés pourront jouir à l’avenir » regrettait Riss, dans Charlie Hebdo. Cinq ans après l’attentat, le directeur de la rédaction du journal satirique résume : « Vivre est une chance, mais vivre libre est devenu un luxe. » Voltaire, au secours !

**Violences idéologiques outre-Atlantique**

Au Canada, une étape supérieure a été franchie dernièrement. En effet, la direction de l’université d’Ottawa a décidé de suspendre un temps l’un de ses professeurs. Lors d’un cours sur l’art et les mots sensibles, Verushka Lieutenant-Duval a commis l’impardonnable au royaume des minorités opprimées, elle a prononcé le terme de « nègre ». À la suite du cours, une étudiante lui écrit pour lui signaler son malaise. Le professeur envoie alors un message d’excuses à l’ensemble des étudiants et propose même un débat au prochain cours. Une provocation, la machine est lancée. Les menaces à son endroit se multiplient, son adresse est publiée en ligne. Même sanction pour ses soutiens : les 34 signataires d’une lettre de soutien ont été victimes d’une campagne d’intimidation, jusqu’à craindre des violences physiques. Le recteur de l’université, Jacques Frémont, a quant à lui dénoncé le « racisme systémique » touchant les minorités : « Les membres des groupes dominants n’ont tout simplement pas la légitimité pour décider ce qui constitue une micro-agression. » Depuis cette affaire, Verushka Lieutenant-Duval vit dans la peur.

Par Rachel Binhas"
2020-11-01 10:38:51,SuperBeauGosse974,"Dans ce cas j'ai le droit d'appeler un homme noir ""nègre"", vu qu'étymologiquement parlant ça veut dire noir et qu'un mot ne peut pas être raciste en tant que tel. Les mots ont une portée qu'on le veuille ou non."
2020-10-31 21:06:18,MonsieurFred,"Au Québec et sûrement dans le reste du Canada, Ca fait 2 semaines qu’on se tape des débats sur le mot “negre” à cause d’intimidation de la “bien pensance” qui veulent interdire son utilisation même en milieu universitaire. Donc, c’est pas une blague... enfin toute la polémique est une blague, mais je ne crois pas que c’en soit une dans la bouche du gars."
2020-10-31 08:23:55,AzuNetia,"Prof : par exemple le mot nègre a une connotation raciste et par extension à l'esclavagisme

Les americains : Au bûcher ! Elle a dit nègre ! Qu'on la vire et qu'on la persécute !"
2020-10-29 15:54:13,Folivao,"&gt; j'en ai marre de ne voir plus qu'un sujet ici, et sous un angle haineux

&gt; Ceux qui font de la pâtisserie, revenez nous montrer vos tartes !

J'ai justement une nouvelle recette de tête-de-nègre 

^^^^/s"
2020-10-28 12:01:54,blimblamped,"Et si c'était une photo de Barack Obama, avec un nez et des lèvres exagérées.. avec une posture de singe et une caption qui lisait ""Nègre Con"" ou ""Dumb Nigger"". Est-ce que ca serait toujours une question de liberté d'expression sans conséquences?"
2020-10-27 17:25:12,Rom21,"Le problème, c'est que l'on est arrivé dans une société qui est ""choquée"" de tout, tout le temps.

Ca ne m'étonne même pas que certains trouvent que les caricatures ne doivent pas être montrées, même s'ils ne sont pas musulmans, ce sont les mêmes qui réclament des safespaces, qui s'offusquent du film Mignonne ou qui ne supportent pas de voir le mot ""nègre"" écrit mais si c'est pour expliquer qu'il faut le bannir du vocabulaire."
2020-10-27 16:03:53,MonsieurFred,"Y a tout de même un petit relan de *je ne sais quoi* dans le discours de l’article. Je méprise l’anti-racisme debile qui voit du racisme partout, qui coupe tout débat en insultant l’autre de raciste, ou qui veut [interdire l’utilisation de mot à une catégorie de la population](https://information.tv5monde.com/info/canada-polemique-autour-de-l-utilisation-du-mot-negre-380630). Mais j’ai quand même un malaise en lisant l’entrevue."
2020-10-22 18:38:23,Low_discrepancy,"&gt; Et dans ton exemple d Euclide , c est peut être parce que sa découverte ne remettait pas en cause les éléments présents dans les texte sacré de l époque. 


Euh quoi? Mec tu te la pète sur tes illumines mais tu ne comprends pas un argument scientifique.

C'est pas une hypothèse falsifiable ca. Euclide il souhaite quels textes sacrés ? 


Sinon allons dans le champ de tes illustrés illuminés qui juraient sur Lamarck. Les scientifiques français ont été bloqué très longtemps a suivre des courants idéologiques en biologie. Ca on l'oublie ?

On oublie l'illustre illuminé cuvier qui sort:


&gt; La race nègre est confinée au midi de l’Atlas, son teint est noir, ses cheveux crépus, son crâne comprimé et son nez écrasé; son museau saillant et ses grosses lèvres la rapprochent manifestement des singes: les peuplades qui la composent sont toujours restées barbares


Tu souffres d'un affreux bias de survie. 

Toutes les théories pourries et immondes sorties par les illuminés ont les a oublié. 

Ce qui a réussi, on va tous les mettre sur le dos des illuminés. C'est assez ridicule.."
2020-10-22 08:55:36,ak_miller,"Boniface est une sombre merde.

De 1, je trouve fort de café de faire de Chalghoumi un ""native informant"" (version polie de ""l'arabe de service"" ou du ""nègre de maison""). Les gars se plaignent à longueur de temps qu'on présente pas assez de musulmans modérés, qu'on met en avant que les extrémistes, et quand les médias mettent en avant un mec qui dit des trucs pacifistes, ils le rejetent. Bien la logique.

De 2, allez donc faire un tour sur [le second article](http://leplus.nouvelobs.com/contribution/730185-l-imam-chalghoumi-top-mediatique-flop-societal.html) lié dans celui proposé:

&gt;Il a fait récemment [un voyage en d’Israël](http://tempsreel.nouvelobs.com/monde/20121111.OBS8932/des-imams-en-route-vers-jerusalem-notre-mission-c-est-la-paix.html)  (à l’invitation des autorités israéliennes) qui, par un malencontreux  hasard, est survenu au moment du bombardement de Gaza sur lequel  Chalghoumi s’est peu exprimé. Car s’il n’est pas le seul à souhaiter la  paix, y compris parmi les musulmans français, il est l’un des rares à  donner un satisfecit à Israël et à approuver la politique israélienne.  C’est donc justement ce qui en fait l’originalité et le prix médiatique.  
&gt;  
&gt;Il n’a [105 mentions ""j’aime""](https://fr-fr.facebook.com/imam.hassen.chalghoumi.officiel)  sur Facebook ; pour quelqu’un qui se présente comme ""président de la  Conférence des Imams de France"", ça ne fait pas beaucoup. Par  comparaison, le rappeur du Havre Médine, qui s’exprime aussi pour la  paix au Proche-Orient, **mais sans renier son d’identité musulmane**

Ca veut dire quoi ca Pascal ? On peut pas être musulman et ne pas s'opposer frontalement à Israël ? C'est toi qui donne le tampon ""bon"" ou ""mauvais"" musulman ?"
