date,author,text
2021-10-26 07:43:51,jib60,"
&gt;N'importe qui peut revendiquer de sentir blessé par tel propos ou actions. Ne prendre en compte que la personne prétendument visée ne mène nul part. Sinon, je pourrais parfaitement dire que les gens qui ne se déguisent pas me choquent. 

Donc ce que tu dis c'est essentiellement que ne crois pas que les personnes noirs puissent se sentir offensé par les représentations de blackface. Je pense qu'on peut essayer d'avoir un débat de bonne foi. Sauf si tu penses vraiment qu'il y a un passé raciste derrière les gens qui ne se griment pas en noir, je vois pas en quoi cette hypothèse est pertinente.  Et il ne s'agit pas de prendre en compte ""que"" le point de vue des personnes visée, mais tout simplement de le prendre en compte. Jusque là tu ne prends en compte que le point de vue blanc et dis essentiellement que celui des noir n'a aucune importance. 


&gt;""Nègre"" a toujours porté une connotation péjorative. Il n'existe pas beaucoup de cas où on peut l'utiliser sans chercher à insulter. 

On est à deux doigts d'y arriver. Nègre était jusqu'à il y a moins de 100 ans le terme générique pour parler des noirs. Sauf qu'on a compris que ça renvoyait a tout un passé raciste et aujourd'hui ça ne viendrait à l'esprit de personne de désigner une personne noir ainsi. Je vois pas bien la différence avec le blackface.  


&gt;C'est le droit à la caricature. Comme on se mec des campagnards, des bcbg, des juifs (même si la aussi ça passe mal), des catholiques (là par contre, c'est open bar), des handicapés, etc. 

&gt;Vous n'avez pas le monopole des moqués. C'est ça aussi vivre en société. Accepter parfois un regard caricatural et peu flatteur.

Avant ton argument c'est que c'était pas pour se moquer et que c'était pas une insulte raciste raciste. Je te parles de gens qui se colorient en noir, qui se mettent des os dans le nez et qui sont évidemment raciste, mais c'est acceptable car c'est le droit à la moquerie. Ce que tu soutiens essentiellement c'est que c'est normal d'être raciste."
2021-10-25 22:14:52,manuco75,"&gt; Tu dis ça comme si le point de vue des personne visées, ou qui se sentent visées n'avait aucune espèce d'importance. 

N'importe qui peut revendiquer de sentir blessé par tel propos ou actions. Ne prendre en compte que la personne prétendument visée ne mène nul part. Sinon, je pourrais parfaitement dire que les gens qui ne se déguisent pas me choquent. 

&gt; Mais ça sert a rien et ça blesse autrui, pourquoi tu continues ? 

Ça ne sert pas à rien, déjà. Ça permet de communiquer sur le rôle endossé. Et ça ne blesse pas ""autrui"". Ça blesse potentiellement certaines personnes. Pour une raison d'autant discutable que la pratique existait préalablement sans porter une quelconque connotation négative. 

&gt; Tu dirais ""nègre"" pour désigner les noirs sous prétexte que tu n'as pas l'intention d'insulter qui que ce soit ?  

""Nègre"" a toujours porté une connotation péjorative. Il n'existe pas beaucoup de cas où on peut l'utiliser sans chercher à insulter. 

&gt; Le lendemain tu lui marche encore sur le pied. Et le surlendemain aussi, sans jamais faire un effort pour l'éviter.

Marcher sur les pieds de quelqu'un n'est pas une habitude de communication ou une habitude culturelle très répandue. C'est au contraire plutôt mal vu par à peu près tout le monde. A partir de là, la comparaison est foireuse.

Tu omets le côté culturel et enraciné dans la société de se déguiser et de se faire passer pour un autre plus ou moins caricaturalement. 

&gt; Sans compter qu'il y a des cas où le but est effectivement de se grimer en noir pour se moquer

C'est le droit à la caricature. Comme on se mec des campagnards, des bcbg, des juifs (même si la aussi ça passe mal), des catholiques (là par contre, c'est open bar), des handicapés, etc. 

Vous n'avez pas le monopole des moqués. C'est ça aussi vivre en société. Accepter parfois un regard caricatural et peu flatteur."
2021-10-25 21:54:57,jib60,"Je ne dis pas que ça doit être réaliste...

Tu dis ça comme si le point de vue des personne visées, ou qui se sentent visées n'avait aucune espèce d'importance. J'ai bien compris que c'était pas l'intention. Mais ça sert a rien et ça blesse autrui, pourquoi tu continues ? 

Tu dirais ""nègre"" pour désigner les noirs sous prétexte que tu n'as pas l'intention d'insulter qui que ce soit ?  

Considère ça, tu marches sur les pieds de quelqu'un. Tu n'as pas fait exprès. Pas grave. Tu lui dis simplement ""je n'ai pas fait exprès""

Le lendemain tu lui marche encore sur le pied. Et le surlendemain aussi, sans jamais faire un effort pour l'éviter. Tu peux dévier légèrement, mais tu ne le fais pas, parce que tu n'as pas l'intention de faire mal donc c'est totalement normal de piétiner tous les matin cette personne.

Sans compter qu'il y a des cas où le but est effectivement de se grimer en noir pour se moquer et qu'on entend exactement les mêmes arguments. Par exemple il y avait eu les employés d'une startup nation a la con ( ""slip français"" ) qui se filmaient grimés en noirs pour une soirée déguisée et l'argument c'était encore ""ça fait de mal à personne"". Pareil pour ""la nuit des noirs"" a Dunkerque. 

Donc y a surtout un refus d'accorder son empathie aux personnes noires sous prétexte qu'en tant que personne blanche, cela ne te vexe pas."
2021-10-25 14:49:08,kokolatex,Cette enseigne a été déboulonnée de la place de la contrescarpe à Paris https://fr.m.wikipedia.org/wiki/Au_Nègre_joyeux
2021-10-22 22:35:59,Chibraltar_,*on préfère dire prête-plume que nègre maintenant*
2021-10-22 18:28:38,CritterThatIs,"&gt; Le stupéfiant retour en grâce de la race.

Dont le concept même a été inventé, développé, et affiné afin de justifier l'esclavagisme de masse, rappelons-le.

&gt; Claude Lévi-Strauss aurait-il cautionné cette pirouette consistant à faire d’une religion une race

La notion de race est déjà une acrobatie, créée à partir de la couleur de peau, donc pourquoi pas une religion après tout ?

&gt; Si le Blanc et le Noir ne peuvent plus se mettre dans la peau l’un de l’autre, si on ne peut plus s’identifier à son semblable humain, comment imaginer les prémices d’une empathie, d’une lutte contre le racisme ?

Parce que certains blancs, riches, possesseurs de corps et de terre (après avoir commencé à en évincer ceux qui y vivaient déjà) ont créé le noir afin que les autres blancs, peu riches, non-possesseurs les protègent face à l'ennemi commun, créé par son exploitation, par sa captivité, par sa torture. On peut plus ou moins voir le même procédé à l'oeuvre maintenant en France. En disant l'islam une culture (bien sûr homogène, tout comme la 'race' 'négroïde' a pu l'être), en lui adossant des caractéristiques physiques (il n'est pas étonnant que les membres du Bastion Social aient tabassé un mec sans origine du Maghreb, mais avec une barbe fournie, dans ma ville il y a quelques étés de cela), et en qualifiant cette race nouvellement créée de moins développée, moins progressiste.

&gt; En 1924, le jeune naturaliste Julian Sorell Huxley résumait ainsi dans le Spectator les observations faites lors de son voyage dans le sud des États-Unis: « L’esprit du Nègre est aussi différent de l’esprit du Blanc que le corps du Nègre est différent du corps du Blanc. » Ces propos, qu’on pensait disqualifiés, pourraient être repris quasi à l’identique par le nouvel antiracisme décolonial woke qui veut redéfinir notre imaginaire politique autour des races.

Que la race soit une construction sociale de A à Z ne veut pas dire qu'elle n'a pas eu d'effet dans les corps, dans les cultures qu'elle a créé. La monnaie est tout autant une construction sociale, ça ne veut en aucun cas dire qu'elle n'a aucun effet constatable sur les êtres humains. Donc oui, maintenant que la race a été créée, et que ses effets sont encore et toujours ressentis, il est tout à fait normal qu'elle soit un enjeu politique.

&gt; Un mécontentement largement exploité par une droite trumpo-populiste dans une forme olympique.

N'importe quoi. Trump était dans la lignée idéologique directe des ""pères fondateurs"" de la nation américaine.

Enfin bref, un bel article de merde.

^S^t^u^p^é^f^i^a^n^t^, ^m^o^n ^g^r^o^s ^c^u^l ^d^e ^n^è^g^r^e^, ^o^u^i^."
2021-10-22 15:23:00,Little_Canard,"J'avoue ça m'intéresserait d'avoir le témoignage d'un nègre, parce que t'écris pour quelqu'un, si le livre est nul on doit probablement te le reprocher, si le livre est bien tu n'en touches pas les bénéfices. A moins qu'il n'y ai une participation aux bénéfices mais ça m'étonnerait. Quoique c'est peut être mieux dans le cas de l'article.

Je me demande aussi combien ça paye de rédiger un bouquin entier, est-ce que le prête-nom mais aussi la main à la pâte ?"
2021-10-22 09:13:58,Ap-hr-ostasis,"Les autres ont donné d'excellentes suggestions même si j'imagine que l'idée de les suivre doit de faire peur, ce qui est compréhensible. Tu es actuellement dans un environnement et dans une relation de travail qui donne tous les droits à ton DT d'abuser de ta bonne volonté. C'est pourtant un état de fait irrégulier, illégitime. Je voudrais juste rajouter une chose: il est rare que les travers d'un scientifique ne soient pas connus de la communauté, quand bien même ce sont des choses dont on parle peu dans son milieu immédiat. Si c'est un con, ça se sait. D'ailleurs, le personnage du ""négrier"" (au sens du nègre, prête-plume) aux 856 publications par an dont la carrière est portée par une horde de précaires (thésards, ingénieurs CDD dans le cas des sciences dures, post-docs) est bien connu et suscite souvent le mépris (ou la jalousie...), peut-être justement auprès de ceux avec qui tu te sentirais mieux pour travailler. Je dis tout ça pour te faire relativiser l'importance de ce DT, grand ponte ou non, et de ses bonnes grâces. Je dis ça aussi pour que tu comprennes l'importance de ta place: c'est toi qui produis, lui qui a besoin de tes papiers pour y greffer son nom. Face à quelqu'un d'équilibré, on s'attendrait à du respect de sa part. Le fait qu'il n'en aie pas ne te diminue cependant en rien.

Concernant ta première question: devrais-tu arrêter la thèse? Je rejoins ceux qui t'ont conseillé (vivement!) un arêt maladie, puisque c'est le moyen le plus simple à ta disposition pour prendre un peu de distance. Je rejoins aussi l'idée que tu as besoin de temps pour bien réfléchir à cette question, en plus de te reposer. Cependant, comme ça de l'extérieur, j'aurais tendance à dire que tu es passionnée de ton sujet et que même ton DT n'a pas réussi à t'en dégoûter. Par ailleurs, tu n'en es qu'à un an de thèse et, là où d'autres en sont encore à bien cerner leur sujet (du moins en sciences dures, je ne connais pas bien les sciences humaines) voire ne le cerneront jamais (véridique: question d'un membre de jury ""et donc cette modélisation, ça pourrait correspondre à quelles applications, concrètement?""; réponse: ""euhh..."" en fin de deuxième année d'une thèse appliquée maths/physique), tu as déjà publié et participé à des conférences. Scientifiquement, ta thèse semble bien se porter et il te reste encore les 2/3 à faire. Si tu changes de directeur de thèse maintenant ou bientôt, je doute que ça te porte préjudice de ce point-de-vue là. 

En tout cas courage et trouve du repos, j'espère que tu trouveras moyen de te sortir de cette situation en en gardant le meilleur (ton élan pour le sujet!)."
2021-10-21 13:16:26,Moustari,"Alors autour de ces sujets des écrivains en ont brillamment traité. C'est une thématique tout a fait colonial et très  bien étudié.

""L'Amant"", de Marguerite Duras.

""Comment faire l'amour a un negre sans se fatiguer"", de Dany La Ferrière. 

Bien sûr, d'un point de vue analyse littéraire Edward Saïd en parle très bien dans ""L'orientalisme"". Mais ça se lit moins bien que ces deux romans susnommés."
2021-10-12 09:35:27,LeFrenchCrapaud,"D’ailleurs on cite toujours Tintin au Congo pour ses phrases en petit nègre, mais on parle bien moi de Tintin chez les soviets qui est d’un anticommunisme primaire et violent."
2021-09-30 17:29:13,FrenchBirder,Le 3eme petit nègre. Il était sympa.
2021-09-29 14:27:50,CerberusXt,"&gt; Si je parle de ces deux choses en particulier c'est bien pour en exclure le reste et donc démontrer qu'il ne faisait pas un rapprochement global.

Exclure le reste pour prétendre à du ""les deux camps c'est pareil"" est exactement le problème. Ça me fait plaisir de voir que tu es conscient de la mauvaise foi volontaire nécessaire pour tenir la comparaison.

&gt; Non mais l'argument sociologisant est inopérant dans la mesure où dans la pratique cette théorisation se transforme dans une appréciation racialiste de la réalité et des individus, créant de facto une forme de racisme tout ce qu'il y a de plus traditionnel.

Tu décris la politique de l'autruche. Difficile de lutter contre le racisme sans le nommer (ce qui est peut être le but de ne pas vouloir que les choses soient nommée finalement).

&gt; Au moins on accordera au bien mal nommé centrisme éclairé de ne pas avoir pour habitude politique d'aller traiter ses opposants d'arabe de service, de nègre de maison ou de les déshumaniser en les parodiant en esclaves ou et en animaux.

Le centriste éclairé est plus intéressé par l'apparence de civilité, le faux calme et le ton des échanges que par le fond des propos oui. MLK à écrit toute une lettre à votre propos."
2021-09-28 22:18:17,MlleLane,"&gt;À première vue, je n'aurais pas dit que traiter quelqu'un ""d'arabe de service"" (ou aussi de ""nègre de maison"" ou ""bounty"") soit raciste.

Tu t'es jamais fait appelé aucune de ces choses alors."
2021-09-28 20:33:26,capquintal,"&gt;À première vue, je n'aurais pas dit que traiter quelqu'un ""d'arabe de service"" (ou aussi de ""nègre de maison"" ou ""bounty"") soit raciste. En effet, on pourrait se dire qu'on attaque ici les agissements et la fonction de la personne, et pas vraiment son identité ou sa personne.

T'utiliserai nègre de maison ou arabe de service pour une personne blanche ? Non. C'est que c'est une insulte intrinsèquement liée à l'ethnie de la personne qui la subit, c'est une insulte raciste. Tout le branlenrond de la ""gauche"" woke n'y changera rien ."
2021-09-28 15:44:35,Ailothaen,"À première vue, je n'aurais pas dit que traiter quelqu'un ""d'arabe de service"" (ou aussi de ""nègre de maison"" ou ""bounty"") soit raciste. En effet, on pourrait se dire qu'on attaque ici les agissements et la fonction de la personne, et pas vraiment son identité ou sa personne.

Cependant, là où je trouve que ce genre de propos sont dangereux, c'est qu'intrinsèquement, ils veulent dire qu'il est déshonorant pour un noir ou un arabe de faire partie de la police, car selon cette idée, la police serait là pour taper sur les arabes et les noirs, et ce serait donc une forme de trahison. En filigrane, cela veut donc dire qu'on voit ""la police"" et ""les noirs et les arabes"" comme deux camps opposés qui voient l'autre en ennemi. Et comme la police représente directement la nation et l'État... il y a donc un potentiel de dérapage très dangereux.

L'avocat de Linda Kebbab le rappelle d'ailleurs très bien :

&gt;« La stratégie c’est de tout faire pour que les jeunes d’origine étrangère ne rentrent pas dans l’universalisme républicain. On leur fait croire que s’ils réussissent ce sont des larbins et sinon, c’est de la faute au système. Vous vous rendez compte d’où on va ? »

Si le caractère raciste de ""arabe de service"" peut être débattu, il y a clairement quelque chose de politique derrière."
2021-09-28 14:10:47,Gnarkificateur,"Un noir qui traite un autre noir de nègre de maison, c'est aussi une injure à caractère racial oui."
2021-09-26 18:01:46,UltraChilly,"Hold your fucking horses everyone, read the fucking thing, he didn't say ""nègre"", he said the very American N-word, as a provocative joke, that's a lame joke and he's kind of an asshole for saying it but can we take a minute to appreciate the context here? The guy is friendly and invites his black neighbors over regularly and makes them food, does it really sound like he's literally Hitler? I think he's just a moron trying to be funny, the best course of action here is probably to try and explain how hurtful it is to people from the States. Because no, that word does absolutely not have the same weight here, most people don't even know the difference with the ""ga"" version or who is ""allowed"" to use it. A lot of people will find it funny to use it to offend someone because they're not fully aware of the trauma behind it or don't care.   
  
Now OP, your neighbor is an insensitive and/or uneducated moron, but does that mean he should lose his job or serve jail time over this? There are two courses of action here:  
- try and explain that's absolutely not funny and very hurtful  
- avoid the guy  
  
Whatever choice you make, if that makes him become ever so slightly aggressive towards you, then yes, go to the police. 

But don't try to punish someone according to a code of conduct or values that have no meaning here, he probably has no idea how massively fucked up what he did even was."
2021-09-26 17:28:23,jojo_la_truite2,"Holy moly, what a world we live in that people cannot even write the word they want to... Was it Nigger ? nègre ? noir ? What are you even affraid of ?

You can use the words, it's all a matter of context... Words aren't racist, the intent you put with them might be though. 

Back to Rudolf, he seems like an asshole to me. Doing so with his daughter, you don't really have a say in how he raises and educates his children. Just like you wouldn't want people to tell you how to raise and educate yours. However, doing so with other people's children, I would definitly talk to the father/mother so _they_ have a word with him if they consider this off limits. As well as stopping him (or at least try) with other people's children.

So basically, some people invite you to private parties, some of them making more or less racist remark(s) and/or behave in a more or less racist way, and you want to report them to police and have them lose their job ?

Damn I am happy not to live in the US. Not that I am racist or anything, but when the next offending thing will be to not believe in god, I might gonna have some trouble. The rule to me is pretty much the same as with anyone. Do not tell me how to live my life (be it religious/vegan/whatnot), and I will reciprocate. 2nd rule, don't be an ass."
2021-09-26 17:16:20,dogmaticidiot,"The word nègre is not as unforgivable as the n word in the USA because it can be used as an adjective in literary contexts however if you use it to speak about someone it’s a clear dog whistle.    
I will add that filming him would likely not have cost him his job. If you are a public person, holding an official position yes such a video would destroy your career but since he’s working as a cook in a local restaurant it is very unlikely that the owner would have fired him as it is also very unlikely that customers would run him out of business because one of his employees was filmed saying the word nègre.   
About calling the police : at the very best you could consider what he said as « incitation to racial hatred » but that crime is only punished if it’s said in public. In your situation the police would inform social services who could investigate the situation on the basis that it is not an healthy environment for a child but that incident alone would not justify to take the baby away from him."
2021-09-26 17:02:17,LePetitMontagnard,"He's a MAJOR asshole! The word ""nègre"", derived from Spanish, is now only used by writers, historians or teachers in a historical context. Directly referring to a black individual of today as a ""nègre"" outside of said context is definitely racist. Not sure it is illegal *per se*, but it is totally unwelcome and shocking. Staying away from this ""beauf"" is the best you can do."
2021-09-26 16:54:38,foutreardent,"&gt;At first he was teaching her little tricks with her fingers, then he took his baby's hand, pointed it towards my boyfriend, and started teaching the baby to say ""N\*\*\*\*\*"".

Did he say ""nègre"" ? That's a strange thing to say, even for a racist these days. Rudolf seems mentally retarded.

Also your story seems weird."
2021-09-26 16:50:31,Obscure-Clarte,"Rudolf is a beauf and an asshole. ""Nègre"" was pretty common use in the 50s / 60s (you can find the word in books, without much of an afterthought). Nowadays, I think it's pretty offensive and it would definitely raise eyebrows, even in traditionnal right wing families. 
Even ""black"" (in English) is weird to me - you don't have to say the word in English like it's uncomfortable. ""Noir"" is fine."
2021-09-26 11:47:34,Poglosaurus,"Le livre en question était une commande de Pétain (je crois même qu'au départ De Gaulle devait être son nègre pour un livre qui devait lui permettre de devenir académicien), lui et De Gaulle se sont brouillés pendant son écriture et Pétain a voulu le faire finir par un autre mais De Gaulle l'a empêché. De Gaulle a fini par revenir sur les corrections et les passages écrit par Pétain et a plusieurs années plus tard fait publier le livre... Que Pétain a fait corriger par l'éditeur en ajoutant entre autre la préface."
2021-09-26 07:03:11,ph4lopy,mais elle sort de leur trou du cul cette definition elle est débile. C'est le dictionnaire qui compte quoi qu'en disent des illettrés qui pensent que critiquer un noir ou dire nègre c'est raciste inhéremment (cf le bon asterix).
2021-09-23 19:33:00,Celeste_0211,Hâte de pouvoir faire une chanson louant les français pendant la guerre d'Algérie ou de peindre un tableau représentant le bon petit nègre à genoux devant un soldat français. Tu penses qu'ils le prendront comment si je dis que c'est de l'art ? /s
2021-09-22 07:19:05,Brolef,"Ah la belle époque où on pouvait aller se balader sur le champs de mars pour aller observer des êtres humains dans des enclos, sensés reproduire leurs habitats et leurs lieux de vie. Quelques 400 indigènes d'Afrique et d'Asie ainsi mis en scène, pour le rayonnement de la France ! Il est pas beau notre majestueux passé colonial ?

https://www.sudouest.fr/redaction/le-cercle-sud-ouest-des-idees/le-village-negre-intolerable-zoo-humain-de-paris-3112117.php"
2021-09-15 11:37:13,Folivao,"&gt; ya un imprimeur, surement un relecteur, voir un nègre qui à pondu sa merde.

L'imprimeur ne relit rien, il imprime ce qu'on lui demande.

En revanche il y a, à minima, un éditeur qui a lu le bouquin (mais bon, pas son boulot de regarder les petites coquilles et il n'a de toute façon pas le temps) et un correcteur."
2021-09-15 10:08:35,BenzMars,"C'est naze ce titre, je m'en fous de Z, mais bon le mec à pas édité son livre tout seul dans sa cave avec ses petites mains de pu\*\*...  
ya un imprimeur, surement un relecteur, voir un nègre qui à pondu sa merde.  
Et puis une coquille dans un bouquin, c'est pas ce qui manque.    
J'y vois encore un moyen de parler de lui, de faire sa promo de façon grossièrement déguisée que cela soit par le *Quotidien*, *Ouest-France* qui reprend et ça fini sur *Reddit*.... pitié !"
2021-09-13 10:44:25,CognitiveBirch,Quelqu'un a fait bouffer les mails de Schiappa à un bot qui a pondu cet étron en retour et est ainsi devenu le nègre de la ministre de la citoyenneté
2021-09-13 09:33:54,ZoeLaMort,"Quoi? ""Nègre""? ""Bougnoule""? Mais ça va pas la tête? Les policiers ne diraient jamais ça, pas à notre époque enfin! Ce genre racisme-là, ça existe plus du tout du tout voyons, c’est de l’histoire ancienne!

[… Bamboula par contre, ça reste encore à peu près convenable.](https://youtu.be/xwISEISySRw)"
2021-09-11 16:55:54,Maephia,"On a des gros problèmes ici avec ça au Québec avec le mot ""nègre"" il a été mentionné dans quelques classes dans plusieurs contextes, souvent pour parler du livre ""Nègres blancs d'Amérique"" qui est un récit écrit dans une prison américaine par un journaliste membre du FLQ (Front de Libération du Québec), un mouvement terroriste, souverainiste et socialiste. Le texte parle des différentes classes sociales au Québec et des dynamiques entres elles. L'auteur compare les noirs des EUA modernes (années 50-60) aux Québecois qui vivaient encore sous une élite anglophone, d'où le titre.


Mais voilà, on peu pas parler du livre parce que le titre il fait peur."
2021-09-05 04:10:46,[deleted],"Quand bien même cela serait le cas ça n’en ferait pas un bonne raison pour parler de « nègre ». 

D’ailleurs l’article précise bien qu’il s’agit également de sexisme (« pute à kebab »), anti sémitisme et homophobie (« pédé »)  - penses tu que les femmes/gays/juifs sont surreprésentés dans les stats de la délinquance de leur zone d’exercice ? Sacré quartier!"
