date,author,text
2017-09-08 08:35:27,olympe_d_G,"**Des préjugés aux origines multiples **

Mais la colonisation n'explique évidemment pas tout. « Attention, on ne peut pas considérer qu'elle est la seule origine des stéréotypes. Cela voudrait dire que, depuis, les sociétés sont restées figées dans leurs représentations », estime le sociologue Smaïn Laacher. Certains stéréotypes découlent de vagues d'immigration plus récentes ou à d'événements politiques, comme les représentations actuelles des Européens de l'Est. 
Si les préjugés ont des origines multiples, ils se ratachent à une histoire particulière : les stéréotypes français sont différents de ceux des autres pays européens, note l'anthropologue américain John Bowen, spécialiste de l'islam en France et en Europe. « *L'image de l'Arabe qui coupe la gorge de son mouton est liée à l'histoire violente en Algérie française ,* remarque-t-il. *Elle existe surtout en France et elle continue de façonner la vision des musulmans dans ce pays . Au Royaume-Uni, les immigrés du sous-continent indien sont stéréotypés comme des travailleurs très tournés vers leur famille, plutôt que comme des musulmans. La notion même de musulmans y est récente, alors qu'on parlait déjà de Français musulmans pendant la colonisation du Maghreb.*» 

Ces images très présentes dans l'iconographie de l'époque coloniale ont su persister dans le temps. L'insulte raciste « bamboula », forgée au XIXe siècle pour moquer le mode de vie des Africains, a ainsi été employée en février par un syndicaliste policier à une heure de grande écoute après le viol du jeune Théo à Aulnay-sous-Bois : « *""Bamboula"", ça ne doit pas se dire mais ça reste à peu près convenable* », avait-il avancé. Difficile de ne pas voir les similitudes entre les stéréotypes d'aujourd'hui et la colonisation d'hier, estime Nacira Guénif-Souilamas. « *Ces images puisent dans notre histoire collective. Or, si la France est devenue multiculturelle, cela n'a pas été résolu du point de vue du roman national*. » 

C'est dans le rapport à l'islam et aux musulmans que les réflexes nés de la colonisation demeurent plus vivaces dans l'Hexagone que dans d'autres pays européens, soulignent les chercheurs étrangers. « *En France, les musulmans sont toujours traités comme des éléments étrangers à la France*, affirme John Bowen. *On continue de faire le tri entre les bons et les mauvais Arabes, une différence qui était déjà utilisée par les colonisateurs. Et de considérer que plus on est musulman pratiquant, moins on est intégré. Or, on peut être pleinement français et totalement pratiquant*. » 

**Les riches aussi**

Cette mémoire collective a bien sûr une traduction politique. L'électorat du Front national est celui qui a - de très loin - le plus de préjugés. Dans *Le Mythe de la dédiabolisation du FN ( La Vie des idées*, juin 2015), la politiste Nonna Mayer souligne que, pour 45 % des sympathisants du FN, l'expression « *sale Arabe* » n'est pas condamnable (contre 17 % pour l'ensemble des Français). 

Sur l'islam, les écarts sont plus forts encore : 73 % des sympathisants du FN pensent que les musulmans « *ne sont pas des Français comme les autres* », contre 25 % des Français, et 76 % ont une image « *négative* » de la religion musulmane, contre 34 % des Français. « *Ces stéréotypes figent l'individu et consolident l'idée qu'il serait le dépositaire de certains traits*, analyse Nacira Guénif. *Il est toujours renvoyé à quelque chose d'unificateur qui le réduit à une seule identité*. » 

Si ces stéréotypes sont graves, c'est parce qu'ils « *expliquent en partie la reproduction des inégalité* » , considère Mirna Safi. « *Attention, important pour la sélection des locataires : nationalité française obligatoire, pas de Noirs* » , précisait ainsi sans détours, en décembre 2016, une fiche interne d'une agence immobilière Laforêt. « *Les discriminations sur le marché du logement reposent largement sur des stéréotypes sur les modèles familiaux*, note Mirna Safi, qui a participé à l'enquête « Trajectoires et origines », l'étude la plus aboutie à ce jour sur les immigrés en France. *L'image de la famille africaine nombreuse et bruyante est très forte. Cela bloque fortement l'accès au logement de ces populations*. » 

Comment prouver que le stéréotype ethnique produit de la discrimination ? Une équipe de chercheurs du CNRS a mené un testing sur l'accès au logement des Français d'origine maghrébine. Ils ont répondu à des centaines d'annonces immobilières en présentant des dossiers similaires - exceptés les noms. « *Deux de nos individus fictifs signalent par leur patronyme une origine française, les deux autres suggèrent une origine maghrébine*, explique l'économiste Yannick L'Horty. *Dans chaque cas, l'un des deux indique qu'il est fonctionnaire, signe rassurant de stabilité financière*. » Le résultat est sans appel : obtenir une visite avec un nom maghrébin est deux à trois fois plus difficile qu'avec un nom « hexagonal » - et le fait d'être fonctionnaire n'y change presque rien. 

Il en est de même sur le marché du travail : les testings menées par des associations antiracistes ou des chercheurs indiquent que l'on a 30 % de chances en moins d'être convoqué à un entretien d'embauche si l'on porte un nom maghrébin ou africain. « *Le profil le plus pénalisé est souvent la femme sénégalaise ou malienne, puis viennent les Maghrébins, les Asiatiques et enfin les noms à consonance française* , observe Yannick L'Horty. *Dans beaucoup de cas, les discriminations se font ""à l'insu"" des recruteurs : ils ne font pas des choix racistes ou sexistes en pleine conscience, ils mettent en route des réflexes cognitifs bien ancrés*. » 

Ces clichés raciaux ont également des conséquences dans la manière dont la justice et la police traitent les descendants d'immigrés - surtout lorsqu'ils appartiennent à certaines « minorités ». Les chercheurs du CNRS Fabien Jobard et René Lévy ont ainsi montré en 2009 qu'un jeune homme arabe ou noir avait six à sept fois plus de chances d'être contrôlé par la police dans le métro parisien qu'un jeune homme blanc. « *Les jeunes Arabes ou les jeunes Noirs sont souvent présentés comme ensauvagés et habités par leur nature*, commente Nacira Guénif-Souilamas. *Il faudrait donc les civiliser, les contrôler*. » 
"
2017-01-03 08:17:10,TunaRienPourToi,"C'est bien beau de dire que c'est les immigrés qui doivent s'adapter quand même quand ils le font,  ils ne sont toujours pas ""français""  aux yeux des autres... 
Et si tu gardes quelques attaches au pays,  aussi ténues que partir en vacances dans ta famille,  c'est pire : 

Mon ex copain,  franco tunisien (double nationalité parce que ça va plus vite à l'aéroport quand tu part t'en vacances m'a t-il dit à l'époque),  né en Lozère. Aussi français que vous et moi,  athé et tout. 

Ici c'était un maghrébin,  un melon comme on les appelles parfois dans le sud. Et là bas,  quand il partait en vacances,  c'était le sale français ""qui a la belle vie dans le pays riche""  (je caricature pas beaucoup... ) 

Y'a de quoi devenir un peu dingue,  quand même. "
2016-05-03 09:30:10,afrofagne,"A la médiathèque à côté de mon lycée, je bossais tranquillement quand un idiot en survèt (qui était visiblement là pour faire chier le monde) s'installe en bout de table, en face de moi. Naturellement, je l'observe. 

Après un moment il me lance, texto, ""Kestu'm'rgard sale bougnoule ??"".

J'ai honnêtement rien trouvé à lui répondre, surtout parce que je viens d'une famille d'agriculteurs ardennais et que je suis aussi maghrébin qu'une tranche de jambon fumé.  "
2016-02-03 04:58:16,Chepamec,"- *Est-ce que vous pensez que l'immigration est un enrichissement pour la France ?*


""Euh... non pas vraiment""


- *PRÉJUGÉ ! Est-ce que vous vous êtes déjà fait agressé ou insulté par un Maghrébin ?*


""Ben, justement, oui..""


- *PRÉJUGÉ ! ! Est-ce que les Juifs sont généralement plus riches et intelligents que la moyenne de la population ?*


""C'est difficile de savoir en France mais aux US où il y a ce genre de statistiques, ils ont effectivement le plus gros QI et le plus haut revenu moyen comparé à tous les autres groupes ethniques.""


- *PRÉJUGÉS ! ! ! Sale antisémite, comment oses-tu dire quelque chose d'aussi horrible contre les Juifs ?*


Sérieusement cette étude n'a absolument aucun sens..."
2015-06-25 12:06:05,ScalSaver,"&gt; J'avais tort d'insinuer que ces violences avaient un rapport direct avec l'origine des conducteurs de taxi.

Pas dans le sens où c'est ce que tu penses. T'imagines ne pas avoir eu cette conversation ?

&gt;le fait de casser des voitures, en groupe.

Y'a eu une voiture qui a brulée il y a quelque mois dans un quartier qui sert de ghetto maghrébin, dans la ville où je vis. J'ai demandé ce qui c'était passé à un peut tout le monde.

Mes conclusions sont que c'est quelqu'un d'autre qui l'a fait pour détériorer encore l'image du quartier. J'y vais de temps en temps. les gens sont désœuvrés mais humains. Certains jeunes trainent et trafiquent parce que leurs parent travaillent toute la journée. Y'a un centre social et une mosquée où la plupart de la vie s'organise. Ça va pas si mal.

&gt; C'est de cette attitude que je parle sans discernement

Tu en fais preuve maintenant. C'est tout ce que je demande de ta part. =)

Je cherche pas à te ""guérir"" ou que sais-je. Tu n'est pas malade. Tu as seulement peur. 

&gt;J'aimerais bien avoir confiance quand je monte dans le RER et qu'il y a un groupe de racailles à la recherche d'une proie facile. 

Me dis pas que tu es une proie facile. J'ai jamais eu affaire à des racailles de ce genre. C'est facile de faire la leçon quand on est bien assis derriere son clavier.

Ce serait à toi de me parler de ton experience. Je suis venu pour écouter aussi.

&gt;Je me fais traiter de sale blanc, on me casse la gueule et on me vole mes affaires. Excusez-moi si mon vécu a débordé dans ce topic sur la violence des taxi-men.

T'excuse pas. Pourquoi on devrait donner une couleur à la violence ?

La seule couleur qu'elle a c'est le rouge vermillion du sang versé, Le même que celui de notre drapeau national, rappelle-toi.

Le même qui coule dans les veines de toutes les personnes que j'ai pu rencontrer.

C'est une douleur et une colère qui s'exprime. J'ai beau être jeune, j'ai eu mon lot, moi aussi. 

Maintenant, j'espère seulement que l'on se sert les coudes pour construire des maisons ou faire visiter des musées à des enfants. Pas retourner des voitures.


"
