date,author,text
2021-09-13 21:56:23,PrestyA,"Je mets en place une retraite par capitalisation, je supprime les trêves hivernales et autres conneries qui empêchent les locataires de se faire expulser quand ils payent pas leurs loyers, je crée plein de places de prison, je dépénalise les drogues et légalise le cannabis en le taxant fortement, je triple les taxes sur le tabac et je les double sur l’alcool, je libéralise le marché de l’emploi (terminé les préavis de 3 mois et tout ce qui freine les licenciements et par conséquents les embauches), je supprime le smic, je donne un salaire universel à chacun (genre 800€) mais je supprime toutes les aides sociales qui existent (terminé les allocations, les APL, le chômage etc). 

Je crée les États Unis d’Europe sur le modèle américain (état fédéral).

Bonus en tant que président de l’Europe : Je supprimerai l’accès aux réseaux sociaux américains et chinois afin que l’on développe les nôtres et que les données des millions d’européens viennent alimenter les futurs géants européen de l’IT. 


Bref, pas sûr que vous voteriez pour moi quoi :)"
2021-03-20 00:29:55,skaenda044,"C'est courrant, la chine s'en prends toujours aux petits noms et n'ose pas attaquer les gouvernements occidentaux de front. Elle envoit des lettres de menaces aux chercheurs, et y parait militaires.

Par contre, si le gouv commence à déclarer ""persona non grata"" et expulser du personnel chinois de l'embassade hors du pays (chaque fois qu'ils font ca), ils vont vite comprendre."
2020-12-13 11:44:01,Fdurke,"&gt; C'est bien la France qui, en 1918, a mis en place des commissions de triage pour expulser les alsaciens sur critères d'origine, donc sur critères ethniques. 130 000 personnes ont étés expulsées ainsi. Alors qu'en 1871, la population avait la possibilité de choisir de rester en Alsace ou d'opter pour la France.

Pourtant il me semble qu'on en avait déjà discuté et que ton lien ne dit pas ça du tout,les expulsions concernent les allemands. L'épuraiton des services publics concernent des alsaciens pro allemands mais qui n'ont pas été virés du pays (sauf s'ils ont décidé de partir). 

*L’expulsion des Allemands. L’épuration, qui débute dès novembre 1918, frappe en premier lieu les représentants du pouvoir impérial et du pouvoir militaire : fonctionnaires d’Empire, responsables des administrations impériales, membres des bureaux militaires, universitaires, mais aussi employés et ouvriers, qui sont contraints de quitter l’Alsace-Lorraine. Ces expulsions ont souvent lieu dans des conditions pénibles, à tel point qu’Alexandre Millerand prend le 11 mai un arrêté qui crée les commissions spéciales d’examen.*

Et tu ne peux pas ignorer sciemment la réalité historique toi qui prétend t'y rattacher...

&gt;Et pourtant, pendant la période 1871-1918 les alsaciens avaient leur constitution et leur parlement (le Landtag), ce qu'ils n'ont jamais eu sous la domination française.

&gt;Nous avons au mieux eu une région administrative avec des pouvoir biens délimités, et cette région a été dissoute en totale contradiction avec les souhaits des alsaciens. Les départements alsaciens (dont la future CEA) ont des pouvoirs encore plus réduits.

https://fr.wikipedia.org/wiki/Eug%C3%A9nie_de_Montijo#Lettre_du_roi_de_Prusse_Guillaume_Ier Aucune considération ethnique dans la demande Allemande en 1871.

les représentants Alsaciens en 1871 parlent de quoi ? Du droit imprescriptible des Alsaciens et des Lorrains à rester membres de la nation française. http://www2.assemblee-nationale.fr/decouvrir-l-assemblee/histoire/1914-1918/les-deputes-protestataires-d-alsace-lorraine#node_4345 ce qui leur sera nié par l'occupant. De l'interdiction du français, de l'Alsacien, aux migrations encouragées des allemands dans la région.

Non, le Land d'Alsace ne verra le jour qu'en 1918 avant, l'administration est contrôlée par l'Armée Impériale. Les alsaciens n'avait pas le même statut que les allemands et avait une citoyenneté spécifique, avec moins de droits en terme de mouvement, d'accès aux fonctions publiques, de prises en compte de leur vote, de pouvoir de leur représentants dans les organes locaux etc...

Toute les décisions des assemblées locales étaient soumises à l'approbation de l'Armée Impériale Allemande (cf. affaire Saverne)

Dans le Reichsland les Alsaciens n'avaient pas un parlement élu mais une chambre consultative nommée par l'Empereur et issue des assemblées consultatives locales, son rôle a été augmenté au fur et à mesure, mais ses décisions restaient soumise au Bundesrat/à son gouverneur. [Ils étaient représentés au Reichstag](http://www2.assemblee-nationale.fr/decouvrir-l-assemblee/histoire/1914-1918/les-deputes-protestataires-d-alsace-lorraine#node_4345) et ils étaient gouverné par un gouverneur représentant les États allemands de l'Empire qui ""possédaient"" l'A/L.

Le Land complet a été mis en place en 1918 et n'a jamais vu le jour, notons qu'avant ça dès 1916 Guillaume voulait rattacher l'A/L à la Bavière car il trouvait la population trop pro-française et qu'il voulait ""germaniser"" les Alsaciens perçus comme français. 

&gt;Je tiens par ailleurs à souligner le fait que la France à procédé à la destruction de la langue et culture alsacienne par la francisation forcée. C'est aujourd'hui le genre de chose que l'on reproche aux chinois dans leur traitement des Ouighours et Tibétains.

Pourtant tout ça existe encore la langue comme la culture et les Allemands ayant cherché à germaniser les alsaciens il fallait bien corriger ça et assurer une intégration complète dans la République. 

Bref comme avant incapable de t'en tenir aux faits historiques tu fais  du révisionnisme/négationnisme même."
2020-10-18 06:07:31,HistoireGeo,"Puisqu'il est question d'histoire-géo...

Je rigole des commentaires des gens qui croient au ""consensus républicain"" (grosso modo, 80% de /r/france a part quelques fachos suffisamment discrets pour ne pas se faire bannir, et quelques anarcho-communistes).

Il n'y a pas d'exemple dans l'histoire de cohabitation pacifique avec une population musulmane. C'est peut-être triste, mais c'est comme ça.

Il est gentil Macron avec son ""Islam de France"" mais je le vois mal imposer une troisième vision de l'Islam après celle des sunnites et des chiites.

Les indiens n'ont-ils pas pensé a faire un ""Islam de l'Inde"" avant la partition avec le Pakistan ?

Les bouddhistes birmans n'ont-ils pas pensé a faire un ""Islam de Birmanie"" avant de choisir d'expulser les rohingyas, et de pratiquer l’épuration ethnique ?

Les chinois qui exercent un génocide cultural envers les ouighours, n'ont-ils pas pensé a tenter de faire un ""Islam de Chine"" ?

Quid des serbes ?

Peut-être que ces gens-la sont simplement des ""méchants"" et pas des ""gentils"" comme nous ? Et qu'en fait il suffit de faire : de la pédagogie (comme le faisait sans doute ce professeur) ? De la ""dé-radicalisation"" ?

Je pense qu'il faudra faire un choix entre l'islamisation, ou la République qui se salit les mains. Je ne sais pas ce qui est mieux.

Notez que je dis bien : ""la République qui se salit les mains"". Je ne parle pas nécessairement de changer de modèle pour le fascisme, etc.

D'ailleurs, la république a su bien se salir les mains par le passé, pour imposer son modèle."
2020-08-10 10:15:42,SurefootTM,"&gt; J'ai lu et le PCC ne coche pas la moitié des cases. La version fantasmé dans ta tête, peut-être, mais clairement pas la réalité si tu prends un peu de temps pour l'étudier. T'as déjà parlé à des Chinois dans ta vie ?

Oui. J'ai passé plusieurs années en Chine. T'es à côté de la plaque. Renseigne toi un peu mieux. Je répète et j'insiste, ils sont en plein dans le mille pour chacun des points mentionnés par Umberto Eco.

&gt; Je prends juste un exemple parmi d'autre: ""le rejet de la science"".

Relis bien ce qu'explique Umberto Eco. T'es complètement hors sujet.

&gt; Mais je pense que sa liste est de toute manière nulle. 

C'est un des plus grands penseurs et écrivains contemporains. De plus lui, a vécu le fascisme, en direct. Il sait précisément ce que c'est. Je lui fais plus confiance à lui qu'à LeKaiWen sur Reddit.

&gt; T'as pas beaucoup recherché le sujet. 

Si, justement. Et toi ?

&gt; les patrons, pour détruire le mouvement des travailleurs qui faisait obstacle à leurs affaires, en arrivait à employer des milices de délinquants pour attaquer physiquement les sindicalistes et autres, et sponsoriser l'élection de leaders forts qui écraseraient des mouvements de travailleurs

C'est marrant, c'est précisément la méthode employée en Chine. Souvent avec l'appui des Triades. Plus récemment c'est les expulsions forcées pour vendre des terrains à des investisseurs immobiliers, eux aussi liés à la mafia, et en bonne partie au PCC (qui a plus d'une fois démontré son alliance totale avec les Triades, notamment via leur implication à HK), le tout appuyé par des casseurs de genoux.

Mais peut être tu seras capable de m'expliquer pourquoi alors éclatent de nombreuses manifestations, intensément réprimées, dans les parties du pays soumises à ce genre de pratique (les gens ne sont pas toujours super contents de se faire expulser contre une somme misérable)."
2020-07-29 14:10:42,dClauzel,"Les appareils (autre que les no-name chinois) sont conçus pour avoir un ventilateur suffisamment puissant afin d'expulser l'air chaud au travers de ces coudes. Bonus : aussi, l'air chaud monte, donc la physique nous donne un coup de main."
2020-07-18 07:44:13,Jacob_XII,"Le Nigeria entre autres pays d'Afrique. Je me souviens avoir que l'Afrique avait expulser plus de 200 émigrés Chinois de leur territoires, non déclarés, y compris sur des postes gouvernementaux. Bien sûr, ces Chinois n'était pas là pour faire du bénévolat..."
2019-08-28 13:56:33,wisi_eu,"Ah pardon, pas réalisé. Voici, petit chenapan. Je rappelle qu'on peut s'abonner en ligne pour 1,90€/mois au Monde Diplomatique... c'est tout. 

&gt;*Un gouvernement de gauche… mais pas trop*

&gt;**La face cachée du miracle portugais**

&gt;Souvent loué pour avoir tenu tête à la Commission européenne et relancé le pouvoir d’achat, le gouvernement portugais est désormais à la peine. Plusieurs mouvements sociaux agitent le pays, telle la grève des chauffeurs routiers pour de meilleurs salaires. En plein été, le premier ministre a même dû réquisitionner des camions pour alimenter les stations-service. Les luttes contre la précarité et pour une hausse du pouvoir d’achat concernent les salariés du public comme du privé.

&gt;Qu’est-ce que nous voulons ? Des maisons pour tous ! », scandent en boucle une cinquantaine de personnes devant l’édifice grisâtre du ministère du logement. En ce matin du 4 juin 2019, les militants de Stop Despejos (« Non aux expulsions ») et une poignée de familles lisboètes menacées d’expulsion ne décolèrent pas.

&gt;Quelques jours auparavant, Mme Maria Nazaré Jorge, 83 ans, qui habitait en plein centre-ville de Lisbonne, a été délogée par dix policiers. « Elle vivait depuis quarante ans dans cet appartement. Le contrat de location était au nom de sa tante, qui est morte il y a peu, raconte Mme Sandra P., de Stop Despejos. Son loyer était de 200 euros par mois. Comme les prix de l’immobilier explosent au cœur de la capitale, le propriétaire en a profité pour l’expulser. » Durant près d’une heure, les membres du collectif manifestent en brandissant des pancartes qui proclament « Il y a une crise de l’habitat » ou « Non à la spéculation immobilière », avant qu’une petite délégation soit autorisée à entrer dans le bâtiment. La cheffe du cabinet ministériel déclare laconiquement : « Maria Nazaré Jorge est logée provisoirement jusqu’à ce qu’une solution définitive soit trouvée. » « Depuis son expulsion, elle déprime et a perdu tous ses repères, rapporte Mme Sandra P. Elle vit isolée dans les hauteurs de Castelo, le quartier le plus touristique de la ville, où le seul moyen de transport public, le célèbre tramway 28, est pris d’assaut par les vacanciers… »

&gt;En 2012, le gouvernement de centre-droite de M. Pedro Passos Coelho (2011-2015) a modifié la loi sur les locations en faveur des propriétaires, facilitant l’augmentation du loyer à la fin d’un bail et l’expulsion des occupants en cas de rénovation des lieux. Asphyxié par la crise de la dette depuis 2008, le Portugal est tombé en 2011 dans les rets de la « troïka », l’alliance du Fonds monétaire international, de la Banque centrale européenne et de la Commission européenne. Celle-ci lui a imposé la dérégulation du marché immobilier et le développement de l’offre touristique comme conditions à l’octroi de son aide de 78 milliards d’euros. Lisbonne s’est employée dès lors à doper son « attractivité fiscale », de façon à stimuler l’immobilier. Créés en 2012, les « visas en or », titres de séjour de cinq ans accordés aux étrangers qui achètent des biens immobiliers à plus de 500 000 euros, ont permis d’injecter en six ans 4 milliards d’euros de capitaux dans le secteur. À cela s’ajoute le statut de résident non habituel (RNH), garantie d’un régime fiscal avantageux pour les retraités européens qui s’installent au Portugal et qui y acquièrent un logement.

&gt;« Une autre loi, celle de 2014 qui réglemente les locations de type Airbnb, permet aux propriétaires de gagner 3 000 euros par mois en louant à des touristes un bien qu’ils loueraient 300 euros à un Portugais, ajoute Luís Mendes, géographe et membre de Morar em Lisboa (« Habiter à Lisbonne »), plate-forme d’une quarantaine d’associations pour le droit au logement. Dans certains quartiers du centre, plus d’un logement sur deux est loué via Airbnb. Cette libéralisation du marché locatif conduit à l’expulsion d’une à trois familles chaque jour. Même les classes moyennes ont désormais du mal à se loger ! » Avec une augmentation des locations touristiques de 3 000 % en une décennie, Lisbonne est, depuis fin 2018, la ville européenne qui compte le plus de résidences Airbnb par habitant, devant Barcelone et Paris. Or, « en quatre ans, le gouvernement de gauche a très peu agi face à cette panoplie de mesures néolibérales qui favorisent la financiarisation de l’habitat », déclare Mendes.

&gt;*Exonérations fiscales pour les riches expatriés*

&gt;En novembre 2015, le gouvernement du premier ministre socialiste António Costa arrive au pouvoir en affichant la volonté d’atténuer les mesures d’austérité prescrites par la « troïka ». Appuyé au Parlement par le Bloc de gauche, le Parti communiste portugais (PCP) et les écologistes grâce à des accords bipartites — une coalition surnommée la geringonça, le « bidule » —, l’exécutif a mis en œuvre une politique de relance du pouvoir d’achat, tout en œuvrant au redressement des comptes publics. Il a ainsi revalorisé les retraites les plus modestes, augmenté le salaire minimum — gelé à 485 euros brut mensuels (sur quatorze mois) jusqu’en 2014, il est passé à 600 euros en 2019 — ou encore élargi les minima sociaux (1).

&gt;Et les résultats sont édifiants. En juin 2017, le Portugal est sorti de la procédure pour déficit excessif dans laquelle il se trouvait depuis 2009. Le taux de chômage a fondu, passant de 12 % fin 2015 à 6,3 % en 2019, et le gouvernement table sur un déficit public proche de zéro pour 2019, alors qu’il s’établissait encore à 4,4 % du produit intérieur brut (PIB) en 2015 : une première depuis le retour de la démocratie en 1974. La croissance « culmine » dès 2017 à 2,8 %, un record depuis dix-sept ans.

&gt;Du New York Times au Monde, du Figaro Économie au Financial Times, la presse salue le « miracle économique portugais ». Quant à la gauche européenne, elle applaudit cet attelage singulier mené par M. Costa, qui a su tourner le dos au dogme de l’austérité imposé par Bruxelles. Pendant la campagne présidentielle française de 2017, le candidat socialiste Benoît Hamon va ainsi rencontrer M. Costa à Lisbonne. De son côté, M. Jean-Luc Mélenchon (La France insoumise) se réfère au « modèle portugais » pour promouvoir son programme électoral.

&gt;Ce succès s’est traduit par de bons résultats aux dernières élections européennes en dépit d’une forte abstention. Secrétaire d’État adjoint aux affaires parlementaires, le socialiste Duarte Cordeiro se réjouit du score de son parti. Installé dans un fauteuil de son élégant bureau en plein cœur de l’Assemblée de la République, il souligne : « À quelques mois des législatives d’octobre, nous avons remporté le scrutin avec 33,4 % des voix. Nous n’envoyons plus huit, mais neuf députés socialistes au Parlement européen. C’est le signal d’un large soutien populaire à la logique actuelle du Parti socialiste [PS] et des partis qui appuient le gouvernement. »

&gt;Néanmoins, le PS portugais semble s’accommoder sans trop de difficultés des mesures néolibérales de ses prédécesseurs. Comme celle incitant les propriétaires à louer aux touristes plutôt qu’aux habitants, ou les exonérations fiscales visant à attirer les investisseurs chinois et russes. « Les visas en or et le statut de RNH sont deux sujets sur lesquels le gouvernement n’a pas reformulé sa politique, admet M. Cordeiro. Mais nous sommes disposés à y réfléchir, probablement au cours d’une législature future. »


&gt;Vraiment ? En janvier 2019, M. Costa a inauguré un régime de société immobilière inspiré des Real Estate Investment Trust, un modèle permettant de transformer l’investissement immobilier en investissement financier grâce à une fiscalité avantageuse. En outre, dans la même logique que le statut de RNH, le gouvernement offre depuis juillet 2019 une réduction de 50 % de l’impôt sur le revenu pendant cinq ans à tout Portugais qui, expatrié durant la période d’austérité, rentrera prochainement au pays. Entre 2010 et 2015, au plus fort de la cure d’austérité, 500 000 personnes, soit 5 % de la population, ont en effet émigré. L’objectif de cette mesure : encourager fiscalement les jeunes diplômés les plus fortunés à venir investir au Portugal. Une aubaine à laquelle ne peuvent prétendre ceux qui n’ont pas eu les moyens de s’exiler durant les années qui ont suivi la crise.

&gt;Au lendemain de l’action de Stop Despejos, Morar em Lisboa organise un débat au sujet du récent encadrement des locations Airbnb par la mairie. Dans une petite salle feutrée, à deux pas du Musée du fado, en contrebas du quartier de l’Alfama, les discussions enflammées s’éternisent jusqu’à la tombée de la nuit. Mme Lurdes Pinheiro, de l’association de quartier, fulmine : « L’Alfama est en train de devenir un parc d’attractions. Toutes les interventions urbanistiques de la municipalité sont dirigées vers les touristes et non vers les Lisboètes. C’est une barbarie architecturale qui détruit notre patrimoine ! »

&gt;À quelques ruelles de là, la municipalité socialiste a récemment cédé le palais Santa Helena, une antique bâtisse du XVIe siècle, à Stone Capital, l’un des principaux promoteurs immobiliers de la ville. Les deux frères à la tête de ce groupe privé, les Français Arthur et Geoffroy Moreno, l’ont transformé en appartements de luxe. « De l’autre côté de la colline de l’Alfama, Stone Capital a privatisé une ancienne cour arborée considérée comme un poumon vert du quartier de Graça, signale Mme Ana Jara, architecte et conseillère municipale d’opposition (PCP). Son projet est de bâtir une résidence fermée de luxe, sans consultation publique ni étude environnementale. »"
