date,author,text
2022-11-27 16:23:51,keepthepace,"On peut aider?

-------------------------

Ah, et au fait, oui, on peut aider d'une façon qui ne prend pas plus de 5 minutes de notre temps: les Chinois en France peuvent être ciblés par les autorités chinoises [grâce à des postes de police clandestin surveillant les expats](https://old.reddit.com/r/france/comments/ygqgqj/pourquoi_la_chine_installetelle_des_postes_de/). C'est illégal, ils serait totalement légitime de les expulser.

N'hésitez pas à [interpeller votre député](https://www2.assemblee-nationale.fr/recherche-localisee/formulaire) sur cette question. Je pense que c'est une question qui peut dépasser les clivages gauche-droite et sauver des vies."
2022-08-18 08:54:10,Bandolinho2,"**Délai d’expulsion accordé à Montreuil pour des femmes exilées : « Une victoire pour se battre pour un droit au logement »**  
**Le tribunal de proximité de Montreuil  a accordé un délai de deux mois et quinze jours avant leur expulsion aux cent vingt personnes exilées – pour la plupart des femmes, dont certaines enceintes – ayant trouvé refuge dans des bureaux vides depuis juin.**

**À Montreuil (Seine-Saint-Denis)**, les cent vingt personnes exilées - dont beaucoup d’enfants et de femmes enceintes - ayant trouvé refuge dans des bureaux depuis juin et depuis menacées d’expulsion imminente, vont bénéficier de la part de la justice d’un délai de deux mois avant l’expulsion, auquel la juge a ajouté 15 jours supplémentaires. Les quarante personnes défendues lors d’une audience le 9 août par l’avocate Hanna Rajbenbach sont tout de même condamnées à payer à la propriétaire des lieux mille euros par mois d’occupation.  
  
« C’est une victoire qui va leur permettre d’avoir la force matérielle et morale de continuer à se battre pour avoir un droit au logement et rester à l’abri des dangers qu’elles encourent à la rue », a réagi  l’avocate des familles interrogée par Mediapart. Elle regrette néanmoins que la juge ait refusé de leur octroyer un délai de grâce : « C’est un délai supplémentaire qui peut aller de trois mois à trois ans et qui prend en compte les situations particulières des occupants que la justice qualifie de sans droit ni titre. »  
  
Mariam, une des femmes vivant sur place, écrit à Mediapart : « Nous sommes soulagées de cette décision, nous imaginions déjà retourner dans la rue avec nos enfants. Nous allons continuer à chercher une solution vraiment durable pour nos familles. »  
  
***Nous republions notre article initialement publié le 9 août 2022.***  
  
\*  
  
Elle tient une banderole « Des logements durables, pas des expulsions » d’une main et s’occupe de la poussette d’une autre femme de l’autre main. Face au tribunal de proximité de Montreuil (Seine-saint-Denis), Salimata est épuisée de ne toujours pas avoir de solution de logement pérenne, comme les cent vingt autres personnes exilées qui ont trouvé refuge dans des bureaux à Montreuil, rue Gambetta, depuis juin.  
  
Salimata est vice-présidente du Collectif Pasteur, ces personnes exilées qui se sont rencontrées après avoir vécu dans la rue, puis sous des tentes fournies par l’association Utopia 56. Ces couples, femmes célibataires et enfants exilé·es ont d’abord habité rue Pasteur dans un restaurant chinois laissé à l’abandon depuis plusieurs années, avant que la mairie décide par un arrêté de les en expulser.  
  
En ce mardi 9 août, une quarantaine de ces personnes se sont déplacées pour venir entendre leur avocate Hanna Rajbenbach demander un délai à leur expulsion de ce nouveau lieu de refuge.  
  
Mariam, 32 ans, enceinte de huit mois de son premier enfant, n’a pas réussi à dormir hier soir : « Parce que j’y pense trop… Je veux juste un coin pour rester, pour vivre, et là-bas, c’est mieux que dehors », explique-t-elle. Arrivée en 2021 en France de Côte d’Ivoire, elle a passé plusieurs mois dans la rue."
2022-05-24 11:27:28,gotchock,"Et pourtant, tous les expatriés vivant en Chine ou dans des dictatures acceptent bien l'absence de droits de l'homme ou la pratique de la torture par le simple fait de vivre en Chine.

Ils l'acceptent car ils pensent que ça ne pourrait pas leur arriver, car ils savent avoir une sorte de protection diplomatique au dessus de leur tête qui les fera en expulser avant d'avoir à se soumettre à ces règles, tant qu'ils respectent les règles ""générales"" de leur propre pays.

Mais le jour où ils découvrent qu'en Chine Covid, tout le monde est logé à la même enseigne, c'est le drame et une raison de manifester.

Ton argument comme quoi c'est des valeurs universelles, c'est encore une fois un argument très ""blanc"". L'interprétation qui en est faite par le régime chinois est par exemple de limiter les morts du covid même si cela doit entraver la liberté de circuler, ce qu'ils font avec sensiblement plus de succès que les occidentaux jusque là. Perso je trouve que c'est débile et liberticide, comme toi hein, mais clairement c'est discutable si tu te places dans le référentiel de moralité différent en culture chinoise.

Donc encore une fois, t'es pas un connard parceque tu défends des valeurs, c'est juste que c'est pas à toi de le faire, pas ici."
2022-04-15 21:43:26,en43rs,"Pourquoi les Juifs ont ils une histoire qui n'est faite que de persécutions ? Pas pour des raisons religieuses en soit, ou des raisons économiques (mêmes si les deux ressortent souvent), mais parce que les Juifs sont un cas extrêmement rare dans l'histoire de l'humanité (pas unique, mais assez rare): ils sont une éternelle minorité. Les diasporas c'est pas nouveau, les minorités non plus. Mais dans la très majorité, ces groupes ont un pays, un chez eux, une région où ils sont la majorité. Les Chinois en Asie, les Allemands en Europe de l'est avant 45, les diasporas polonaises, etc. tous ces groupes étaient/sont des minorités, parfois oppressées ou utilisées... mais elles ont un ""chez eux"" où revenir, ou tout du moins un pays (lointain) qui peut les soutenir. Historiquement si en Asie du Sud Est ont était violent contre les commerçants chinois l'empereur était pas content par exemple. 

Mais les Juifs n'ont pas ça. Depuis 2500 ans ils sont une diaspora, et depuis près de 2000 ans ils n'ont plus un pays pour les soutenir/retourner. Ils sont partout en minorité, personnes pour les défendre et donc ils sont exploités. Par les gouvernements( on fait d'eux des collecteurs d'impôts ou des prêteurs sur gage au Moyen Age pour que l'hostilité du peuple soit contre eux) ou les populations (ils sont les boucs émissaires idéals). C'est ce statut d'éternelle minorité qu'on dit ""apatride"" qui explique leurs millénaires de persécution. Si un pays veut expulser les juifs, confisquer leur argent, les convertir de force, discriminer contre eux légalement (ce que toute l'Europe fait plus ou moins au Moyen Âge), ben il ne se passe rien. Aucun pays ne vient à leur secours (ou c'est très rare, genre le pape fait un discours et demande d'arrêter). Alors que quand la France maltraite sa communauté protestante au XVIIe en l'expulsant avec la révocation de l'édit de Nantes, c'est un scandale international."
2022-04-06 23:12:39,perplexcity_,"&gt;Vazy gros malin lis le titre du thread et lis la conversation dans laquelle tu t'incrustes, et ensuite, mode expert, explique nous en quoi l'otan est responsable des tensions SANS reprendre la communication du Kremlin, je regarde tes 3 neurones s'activer.

Y'a des efforts la. Mais t'as toujours pas compris. Tu vois avant reponsabilité j'ai mis ""quelconque"". Donc ça sous entend qu'on peut imputer une PARTIE de la responsabilité de la montée des tensions. Parce qu'évidemment ils sont pas tout seuls dans l'histoire. Mais tu n'as toujours pas compris ça, et tu crois que je dis que l'OTAN est le seul responsable. Il suffisait pourtant de lire mon message. Tout les mots de mon message. Mais c'est trop dur apparemment. 

Et puis c'est quoi cette question ? C'est un scrabble mot compte triple ? ""Prouve moi que l'OTAN à fait un truc de mal sans dire la même chose que le Kremlin"". Si le Kremlin dit ""OTAN"" dans une déclaration j'ai perdu ? J'ai repris leur communication ? Et toi quand est-ce que tu ""prouves"" quoi que ce soi ? Parce qu'a part sortir des citations vieilles de 8 ans pour dire ""célafotalotan mdrxD"" tu dis pas grand chose hein.

Et je ne reprends pas la communication du Kremlin, je reprends la communication d'experts géopolitiques sérieux comme Kissinger, Brzezinski (deux atlantistes convaincus, bizarre non ?), ou encore Védrine et Boniface via l'IRIS en France.

&amp;#x200B;

&gt;""Le Dalaï Lama a pour objectif de rétablir un régime théocratique, d’y imposer la charia bouddhiste et d’en expulser cent millions  de Chinois qui y vivent et y travaillent ?""

Mdr mais on parle de la Russie et de l'Ukraine, tu me sors le Dalaï Lama ? T'es sérieux la ?

Je connais pas bien le sujet mais il me semble que le Tibet à vécu une théocratie avec [les bouddhistes au pouvoir pendant 300 ans jusqu'à la fin des années 50](https://fr.wikipedia.org/wiki/Th%C3%A9ocratie_tib%C3%A9taine). Je vois pas en quoi c'est déconnant de s'inquièter d'un possible retour au pouvoir des religieux. [Surtout vu ce qu'ils font dans les pays pas loin](https://fr.wikipedia.org/wiki/Pers%C3%A9cution_des_musulmans_en_Birmanie). Les théocraties c'est jamais bon et faut surtout pas faire l'erreur de prendre les bouddhistes pour des bisounours.  


Mais si tu veux savoir où est la nuance, elle est dans le fait de pouvoir s'inquiéter de ça tout en condamnant des agissements chinois. Comme [JLM l'a fait a plusieurs reprises](https://twitter.com/jlmelenchon/status/1484621155390697473?lang=fr). C'est ça la nuance, c'est ne pas être manichéen et parce qu'on s'inquiète d'un possible retour à une théocratie au Tibet, ça ne veut pas dire qu'on est pro chinois et qu'on ne peut pas condamner leur saloperies.

&amp;#x200B;

&gt;Et ca vaut bien la peine de s'ériger comme force antifasciste pour se coucher comme une merde dès qu'un vrai fasciste avec un vrai pouvoir de nuisance se pointe, mais muh manichéisme hein, elle est ou la nuance quand t'as des preuves de viols de masse de gamines? explique moi.

Bah les massacres et les viols et la guerre ont été très clairement condamnés par LFI. Je ne vois aucun rapport avec la montée des tensions avant la guerre par contre. Mais la nuance c'est d'avoir un regard objectif sur la situation d'avant l'invasion pour pouvoir la comprendre. Sinon on reste dans l'émotion et dans le campisme, c'est trop facile. Dès qu'on émet le moindre doute sur la politique de l'OTAN on est pro russe. Mais alors quoi l'OTAN est parfait ? Il ne commet jamais d'erreur ? C'est un peu facile non ? 

Et si on étend cette logique on peut aller loin. Si je dis que Hiroshima et Nagasaki c'était ptet pas nécéssaire et même un peu dégueulasse, je cautionne les viols de l'armée japonaise ? C'est absurde.

Mélenchon a condamné des centaines de fois l'invasion Russe et les exactions russes. D'ailleurs il propose même qu'on envoie des casques bleus pour protéger les sites nucléaires afin d'éviter une possible catastrophe. Il propose d'en faire PLUS que l'OTAN. Qui a contribué à la montée des tensions et maintenant chie dans son froc et laisse les Ukrainiens dans leur merde. Et c'est Mélenchon qui ""se couche"" ? C'est fou d'avoir des oeillères à ce point."
2022-04-05 17:56:29,La_ferme_des_animaux,"&gt;T'es incroyable, c'est exactement ce que je te reproche, et tu le fais, sans ironie, dans la première phrase de ton post. Bordel t'as lu mon message ? Relis bien les mots ""quelconque responsabilité"" ""situation de tension PRECEDANT l'invasion"". Tu comprends la ou faut que je te fasse un dessin ? La franchement je m'interroge : t'es con ou malhonnête ?

Vazy gros malin lis le titre du thread et lis la conversation dans laquelle tu t'incrustes, et ensuite, mode expert, explique nous en quoi l'otan est responsable des tensions SANS reprendre la communication du Kremlin, je regarde tes 3 neurones s'activer.

&amp;#x200B;

&gt;Non mais en fait je pense que c'est juste un manque de compréhension basique de la langue française. Ou alors c'est des mathématiques ? Tu es développeur peut-être ? Tu sais que dans la vie réelle, une situation n'est pas juste 1 ou 0 ? Pas juste true ou false ? Elle peut aussi être nuancée. Comme les idées. Et c'est la que c'est formidable : on peut condamner deux choses à la fois !!!! Deux camps à la fois !! Et tout ça sans les mettre au même niveau !! Il suffit juste d'activer plus de 2 neurones et les possibilités sont infinies : ça s'appelle la nuance.

Elle est ou la nuance de mélenchon quand il dit ""Le Dalaï Lama a pour objectif de rétablir un régime théocratique, d’y imposer la charia bouddhiste et d’en expulser cent millions  de Chinois qui y vivent et y travaillent ?""

On dirait le discours d'un vieux nostalgique des colonies françaises.

Et des citations bien suintantes de lui j'en ai un stock me chauffe pas, suffit de lire son blog.

&amp;#x200B;

&gt;Par ailleurs je t'ai pas si t'as regardé ou entendu Mélenchon dire qu'il veut être non aligné

Ah oui la rengaine du non alignement on la connait, pourquoi mourir pour danzig etc etc.

Et ca vaut bien la peine de s'ériger comme force antifasciste pour se coucher comme une merde dès qu'un vrai fasciste avec un vrai pouvoir de nuisance se pointe, mais muh manichéisme hein, elle est ou la nuance quand t'as des preuves de viols de masse de gamines? explique moi."
2022-03-25 11:01:44,SowetoNecklace,"**Juristes, médecins, créateurs d’entreprise…, le 24 février, la vie de ces Russes a basculé. Hostiles à l’« opération militaire spéciale » de leur président en Ukraine, inquiets de l’effondrement économique qui vient, terrifiés de voir se refermer le « rideau de fer », ils ont fait leurs valises et quitté leur pays.**

Ioulia T. appartient à une génération de Russes qui pensait en avoir fini avec les soubresauts de l’histoire. Une génération devenue adulte dans les féroces années 1990, assez raisonnable pour se tenir à distance de la politique. De toute sa vie, la juriste de 44 ans n’aura participé qu’à un seul mouvement de protestation, en 2011-2012, contre les fraudes aux élections législatives et à la présidentielle. Époque joyeuse durant laquelle des centaines de milliers de personnes ont cru à un changement possible et communié sur les places des grandes villes.

Las, le changement n’est pas venu. Seuls les plus motivés ont poursuivi le combat, souvent dans le sillage d’Alexeï Navalny, l’étoile montante de ce mouvement de 2011-2012. Quand l’opposant a été empoisonné, en août 2020, puis emprisonné, six mois plus tard, à Moscou, Ioulia et son mari, Vladislav, 47 ans, sont restés chez eux, dégoûtés, certes, mais pas assez pour affronter la machine policière et judiciaire. *« Je ne suis pas une fille des barricades »*, résume dans un sourire la jeune femme aux cheveux courts soigneusement coupés.

**Derrière eux, une « vie confortable »**

De fait, le couple a choisi un autre chemin, ce que Ioulia appelle *« une vie confortable »* : bel appartement dans une banlieue résidentielle, voiture allemande, voyages à l’étranger, bouteilles de vin dégustées avec les amis… et l’aboutissement d’une vie, cette société de conseil juridique que Ioulia et Vladislav ont montée ensemble. Tout ne leur convenait pas, y compris dans leur domaine d’activité – *« Même en droit fiscal ou des affaires, il n’y a pas d’État de droit, que des juges serviles »*, tranche Ioulia –, mais pour le reste, le choix était rationnel : *« Si tu ne disais rien publiquement, objectivement la vie était très supportable, agréable, même. »*

Elle ne l’est plus. Un certain 24 février à l’aube, quand leur président a annoncé le lancement d’une « opération militaire spéciale » contre le voisin ukrainien, ce monde s’est écroulé. Ce sont d’abord les tripes qui ont parlé : *« J’ai ressenti immédiatement, physiquement, l’horreur et l’absurde… C’est devenu impossible pour moi de respirer dans ce pays. »*

Au fil des jours et des larmes versées sur les villes ukrainiennes, d’autres questions se sont ajoutées au choc, tout aussi angoissantes : et si Vladislav, formé dans un institut militaire, était mobilisé par l’armée ? Et si le confort patiemment construit s’écroulait ? Et si nous n’étions plus en sécurité ? *« Même si la guerre s’arrêtait demain*, pense Ioulia, *ce pays est perdu pour des années, peut-être des décennies. La dégringolade économique, on la sent déjà, et elle ne peut que s’intensifier. La répression aussi, une simple pancarte “pour la paix” conduit en prison. »*

**Des « traîtres » aux yeux de Vladimir Poutine**

Ioulia et Vladislav ont fait leur choix, celui du départ. A 40 ans passés, sans diplôme à faire valoir à l’étranger, avec un niveau d’anglais limité, sans personne qui les attende… *« Ce n’est pas une émigration, c’est une fuite »*, reconnaît Ioulia. Tant pis pour leur amour de la langue russe et de l’hiver à Moscou. Tant pis pour les amis, qui sont d’ailleurs nombreux à avoir fait le même choix. Les plans sont encore flous : ce sera un pays francophone ou anglophone, et un départ de zéro. A moins que Ioulia veuille à dessein rester vague, elle qui demande que l’on masque son nom de famille.

La fuite des Russes est moins dramatique et massive que celle des Ukrainiens s’échappant devant les blindés de « l’opération militaire spéciale » russe, mais elle n’en est pas moins remarquable. Les chiffres sont difficiles à estimer, mais rien qu’à Tbilissi, capitale de la Géorgie, les autorités locales avaient relevé début mars l’arrivée de 25 000 Russes. En Arménie, les estimations du gouvernement atteignent 80 000. Cette saignée concerne avant tout la très embryonnaire classe moyenne russe – artistes, scientifiques, journalistes, informaticiens, entrepreneurs, juristes… –, et elle en dit long sur la façon dont celle-ci voit le futur de la Russie.

Helsinki en Finlande, Erevan en Arménie, Istanbul en Turquie, Tachkent en Ouzbékistan ou même Oulan-Bator en Mongolie, la destination importe peu, tant sont forts le sentiment d’urgence, la crainte que les dernières liaisons aériennes ferment, que le rideau de fer soit à nouveau abaissé, comme du temps de la guerre froide. Déjà, le 17 mars, le porte-parole du Kremlin qualifiait *« ceux qui partent »* de *« traîtres »*…

Chaque jour, la liste des nouvelles entreprises occidentales quittant le pays ou les rumeurs renouvelées de l’imposition de la loi martiale achèvent de convaincre les hésitants. À Moscou, Saint-Pétersbourg et dans les grandes capitales régionales, beaucoup de conversations commencent par : *« Tu es encore là ? »* On se compte et, selon les jours, on envie ou on plaint ceux qui ne sont plus là.

**Une échappatoire vitale**

Pour un grand nombre de Russes, la possibilité du départ a toujours été une donnée rassurante, comme un antidote à la catastrophe toujours possible, individuelle ou collective. Même au sein de l’élite loyale au pouvoir, la valise prête dans l’entrée (à laquelle se sont ajoutés, au fil du temps, compte bancaire et appartement à l’étranger) a toujours fait office d’échappatoire vitale, de garantie de sécurité. Le basculement du 24 février a remis en question la facilité d’un départ.

Il y a d’abord eu la fermeture de l’espace aérien européen, puis une question : et si la Russie revenait à la pratique en vigueur en Union soviétique, frontières fermées et visas de sortie délivrés au compte-gouttes ? Pour ceux qui n’avaient pas les moyens de fuir, ne restait, au mieux, que l’« exil intérieur » : une forme de retrait du monde, souvent accompagné d’une plongée dans l’alcool et du mince espoir de se faire oublier de la police politique.

*« Avec ma femme, nous avons fait le compte, dans notre appartement, de ce qui est produit en Russie*, raconte un avocat, qui habite dans une ville de Sibérie. *Bilan : un presse-ail et un tabouret. Les prix vont exploser, même ceux des produits chinois. La crise va être terrible… »* Cet avocat fait partie des malchanceux : comme les deux tiers des Russes qui n’ont jamais quitté le pays, lui n’a pas de passeport international à jour (les Russes possèdent obligatoirement un passeport intérieur, mais le passeport pour l’étranger est facultatif). En temps normal, la procédure prend un mois, et ensuite il faut chercher un visa. L’homme s’inquiète : *« Autour de moi, 90 % des gens sont pour la guerre. Et moi je suis identifié comme antiguerre. Plus le temps va passer, plus la haine et la frustration vont monter. »*

**Une stratégie délibérée du pouvoir ?**

Parmi ceux qui temporisent, volontairement cette fois, il y a aussi ce père de famille, informaticien de 51 ans. Avant d’emmener sa famille à l’étranger, Vladimir attend de voir les derniers signaux se matérialiser, à savoir *« l’isolement russe de l’Internet mondial et le moment où tous ceux qui auront publié des posts contre la guerre seront envoyés dans des camps. »* Si lui ne s’est pas pressé de partir, malgré sa conviction que la crise économique sera pire que celle, terrible, de 1998, c’est qu’il a la *« chance »* d’avoir deux filles, non mobilisables, donc. Pour le reste, Vladimir a déjà étudié les différents plans de sortie, même après une fermeture officielle des frontières, via le Kazakhstan ou l’Azerbaïdjan.

Les départs des trois dernières semaines viennent s’ajouter à ceux, déjà nombreux, des dernières années, qui avaient été freinés seulement par le Covid-19. L’émigration des travailleurs hautement qualifiés a été multipliée par cinq depuis 2012, selon une étude publiée par l’Académie des sciences, en avril 2021. Ce sont bien ces travailleurs qualifiés, ou « créatifs », que l’on peut nommer « classe moyenne », dans une Russie où un enseignant gagne à peine 150 euros (à peine plus de 100 euros, au nouveau cours du rouble post- « opération spéciale »).

En 2019, l’étude « The Putin Exodus, The New Russian Brain Drain » (L’exode sous Poutine, la nouvelle fuite des cerveaux russes), réalisée par le cercle de réflexion américain Atlantic Council, dressait le bilan de l’ère Poutine dans ce domaine : entre 1,6 et 2 millions de Russes qualifiés sont partis du pays, entre 2000 et 2018. Concernant les opposants, il s’agit même d’une stratégie délibérée du pouvoir. Plutôt que de donner de longues peines de prison aux journalistes, défenseurs des droits de l’homme ou détracteurs indésirables, police et justice se sont longtemps contentées d’un harcèlement de moyenne intensité, destiné à les faire partir. Beaucoup l’ont fait, avec une forte accélération au cours de l’année 2021. Dans le même temps, l’électorat de Vladimir Poutine se resserrait sur les retraités et les employés du secteur public.

En décembre, en recevant son prix Nobel de la paix, le rédacteur en chef du quotidien Novaïa Gazeta, Dmitri Mouratov, rappelait que l’année 2022 marquerait le centenaire du départ des « bateaux des philosophes » de Saint-Pétersbourg – des convois organisés par le pouvoir soviétique pour expulser des membres de l’élite intellectuelle, ceux pour lesquels *« il manque un prétexte pour les fusiller »*, notait Trotski. Dmitri Mouratov établissait un lien avec l’exil des nouveaux dissidents. Au soir du 24 février, interrogé sur la chaîne de télévision en ligne Dojd peu avant sa fermeture définitive, le verdict du journaliste était plus sombre, plus radical : «* Le futur est mort. »*"
2022-02-24 12:53:37,[deleted],"on n'attaque pas un pays qui a l'arme nucleaire .... c'est aussi simple que ca

quand aux sanctions, excusez moi mais jusqu'au aujourd'hui on avait pris des sanctions cosmétiques qui n'empechait ni les russes de faire des affaires avec nous ni nous de faire des affaires avec eux.. on faisait semblant (car business is business)

j'attend de voir le niveau de sanction si l'europe decide de ne plus acheter de gaz et petrole russe( ca m'etonnerait) d'interdire tout vol vers et depuis la russie, de fermer les frontieres à l'ensemble des marchandises allant et venant de la russie d'expulser l'ensemble des ambassadeurs russes d'europe...

la russie est un petit pays economiquement (PIB espagne) qu'on pourrait au moins essayer de gener... la russie se retournerait naturellement vers la chine mais nos amis chinois malin en profiterait.... la question c'est jusque quand l'opinion publique sera prete à supporter la soumission à la chine pour un vatenguerre ukrainien?"
2021-09-14 17:08:52,soueuls,"Cela serait absurde, le but c’est de redresser la France pas d’expulser des Africains. Si faut expulser des Turcs, des Albanais, des Polonais, des Chinois ça me va aussi.

Mais oui on va vite se rendre compte que dans le lot y’a pas mal d’Africain qui sauteraient"
