date,author,text
2019-06-07 00:05:25,Chibimao,"Tu veux pas répondre en un seul commentaire ? Ça sera plus simple pour tout le monde. Du coup je réponds du dernier au premier.

Va falloir me montrer à quel moment dans un seul de mes liens y'a marqué ""Algériens et Africains subsahariens dans des logements sociaux"", le statut (immigré ou demandeur/locataire de logement social) y-est, pas l'origine ethnique. [Et je le répète c'est illégal](https://www.legifrance.gouv.fr/affichTexte.do?cidTexte=JORFTEXT000000886460#LEGISCTA000006095885).

&gt; La loi du 6 janvier 1978, dite « loi informatique et libertés » interdit de recueillir et d’enregistrer des informations faisant apparaître, directement ou indirectement, les origines « raciales » ou ethniques, ainsi que les appartenances religieuses des personnes. Outrepasser ces règles peut conduire à une peine de prison de cinq ans et 300 000 euros d’amende, ce à quoi la commission nationale de l’informatique et des libertés (CNIL) peut ajouter une amende.

Va falloir faire mieux que ""non toi t'as tort"" à un moment. Sortir des chiffres et des faits de son cul je sais que c'est un sport national mais sois sérieux 2 secondes stp.

&gt; Les immigrés amenés de force pour bosser dans l'industrie et le btp c'est un mensonge éhonté

Dans [ce livre sur l'histoire de la SONACOTRA](http://www.reseau-terra.eu/article831.html) tu apprendras que la France a:

&gt; la France, à la démographie languissante, fait appel à la « main-d'œuvre étrangère » pour les besoins d'armement de l'armée française. Ainsi, le ministère de l'Armement recrute des Belges, Suisses, Italiens, mais aussi Kabyles, ou plus généralement des Nord-Africains (Colonie d'Afrique du Nord) au Creusot, siège des aciéries Schneider, etc.
Mis à part les Schneider, le ministère de l'Armement recrute la main-d'œuvre venue des colonies : Nord-Africains, des Indochinois (Annamites et Tonkinois) et 35 000 Chinois pour d'autres travaux dangereux, par exemple dans la Société nationale des poudres et explosifs (SNPE).
Le SOTC (Service de l'organisation des travailleurs coloniaux), qui dépend de l'armée, est chargé de fournir des soldats pour le front et des travailleurs à l'arrière.

Mais bon ""mensonge éhonté"" je suppose le travail historique... Et non ils n'ont pas tous été ""rapatriés"" (un mot bien sympa pour bien inclure ceux qui se sont faits expulser après s'être battus pour la France). Et puis putain tu déconnes c'est toi qui donnes un lien vers le musée de l'histoire de l'immigration, [ils ont des dossiers entiers sur l'immigration pendant les guerres mondiales et ""l'appel à l'empire colonial""](http://www.histoire-immigration.fr/dossiers-thematiques/les-etrangers-dans-les-guerres-en-france/1914-l-appel-l-empire) où ils concluent en disant que ""beaucoup ne sont pas rentrés"". Y'a un moment tu m'accuses de pas lire mes liens et tu viens le faire juste derrière t'es gonflé quand même. [Lien bonus sur l'immigration forcée des tirailleurs sénégalais et le foyer SONACOTRA](https://www.francetvinfo.fr/monde/afrique/senegal/tirailleurs-senegalais-l-immigration-obligee_3070095.html) avec l'histoire notamment de ces ""rapatriés"" qui... sont revenus en France.

Le retour au pays n'est pas la meilleure solution pour des immigrés qui ont fait le choix conscient de s'expatrier pour trouver une vie meilleure et ont dû sacrifier de l'argent et du temps, des efforts, pour venir. Mais bon je suppose que quand on est un droitard qui n'aime pas les immigrés on s'en batte royalement les couilles de leur perspective, c'est compréhensible.

Pour le taux de chômage, on enlève les européens ça nous donne toujours 80% des immigrés non Euro qui bossent, si je ne m'abuse c'est toujours une écrasante majorité. J'ai également souligné les raisons des écarts mais tu préfères en tirer d'autres conclusions apparemment, vas-y éclaire nous, les noirs sont fainéants ? Quant au taux d'emploi merci de pas sortir des stats de ton fondement encore une fois: l'OCDE donne pour 2017 [56.6% pour les allochtones](https://data.oecd.org/fr/migration/taux-d-emploi-des-allochtones.htm) et [66% pour les autochtones](https://data.oecd.org/fr/migration/taux-d-emploi-des-autochtones.htm), soit un écart encore plus faible que le taux de chômage qui était doublé entre les deux. Après encore une fois l'écart est expliqué dans mes liens avec des sources et des justifications étudiées, toi l'écart tu dis juste ""j'en connais des bougnoules qui en branlent pas une"". Mais ok tu dois avoir raison.

Alors le premier commentaire au final c'est un peu redondant d'y répondre mais je vais conclure: ce que tu dis sur les algériens et africains subsahariens est bel et bien faux, il n'y a pas de statistique spécifiquement sur ces groupes ethniques parce que c'est bel et bien illégal, tes affirmations sont sorties d'on ne sait où et le premier lien que tu donnes abonde dans le sens de ce que je dis depuis le début (un indice reprends le premier paragraphe du commentaire auquel tu réponds) et ton deuxième lien n'a aucun rapport avec la choucroute. Ah si il souligne une fois de plus l'échec du projet des grands ensembles (parce que durs à entretenir, mal desservis pour les transports, mal placés, pas de commerces, si la zone se désindustrialise y'a aucune raison de rester y-habiter). C'est ce que je dis en fait... Sauf que t'en déduis qu'ils sont détruits... Pour aucune raison ? Et qu'on aurait pu mettre des gens dans ces grands ensembles qui sont détruits pour des raisons très très valables ? Ça n'a aucun sens. Personne ne va habiter à pétaouchnok dans un espace désindustrialisé sans emplois ni transports pour rejoindre les villes. C'est une question d'urbanisme et de politique publique, pas d'immigration.

Et concernant les offres d'emploi non pourvues je ne sais pas si tu as cru que tu parlais à Sarko ou Valls mais [Pole Emploi fait bel et bien état d'au moins 190.000 offres non pourvues en 2012](https://www.lexpress.fr/emploi/offres-d-emploi-non-pourvues-pole-emploi-demonte-les-chiffres-farfelus_1767580.html), c'est pas de la propagande pour dire ""les gens sont juste fainéants, il y a plein de boulot en France"" (ce qui irait à l'encontre de ce que je dis depuis le début en fait, je sais pas ce que tu as cru voir là dedans), c'est juste pour te dire que du boulot il y en a quand même un peu sans forcer, sans réformes. Même si le problème [c'est plutôt les entreprises qui embauchent moins pour faire plus de boulot pour baisser les coûts](http://www.slate.fr/story/86213/pourquoi-chomage-si-eleve-en-france).

Bon par contre si c'est pour continuer à répondre en 5 parties de 3 phrases lapidaires où tu refuses de renifler quand on te met le nez dans ta merde c'est pas la peine hein, t'emmerdes pas. Mais si t'as des sources autres que ton ressenti comme le roybidule là y'a moyen."
2019-05-07 05:04:10,Canemmalum,"C'est censé être choquant qu'un proprio qui n'a que l'embarra du choix préfère louer à des gens qui ont 50 fois le smic et un CDI pour s'éviter des problèmes dans un contexte où il très difficile d’expulser des gens ? C'est choquant qu'un propriétaire dans un pays où, on va arrêter de faire l'autruche deux secondes, les actes délictueux sont majoritairement commis par des gens ayant certaines origines ( bizarrement personne ne mentionne les chinois ou autres communauté, faudrait peut être se poser les bonnes questions au lieu de simplement brandir sa pancarte ""racisme"" ), et ayant l'embarra du choix préfère se trouver une petite famille Dupont pour s'éviter encore une fois des problèmes ? 

Non en faite c'est normal, peu importe que se soit injuste pour les smicard ou ceux qui subissent la réputation d'une minorité de casse burne."
2018-12-31 01:03:56,SensCommun,"&gt;La cause n'est pas la différence de culture ni d'ethnie ni de religion. C'est la concentration dans des ghettos de masses en bas de l'échelle sociale. 

Oui, ça s'appelle le communautarisme et c'est une conséquence du cosmopolitisme et de l'immigration de masse. En général on a tendance à aller vers les gens auxquels on s'identifie, et si ceux-là ne se sont pas assimilés, on risque peu de le faire soi-même.

&gt;A un moment notre économie a eu besoin (et a toujours besoin) d'une main d'oeuvre peu qualifiée et on a pioché allègrement dans nos ex-colonies qui avaient l'avantage justement d'avoir un peu de culture française et pas la barrière de la langue. On a entassé tout ce beau monde dans des banlieues pourries et sous équipées. L'absence de mélange social, c'est ça qui est mauvais.

Non. Il y a très longtemps qu'on a plus besoin de l'immigration pour la main d'oeuvre ""peu qualifiée"", on a 9% de chômage. L'immigration économique ne sert plus à rien, c'est d'ailleurs pour ça que le tocard de Giscard d'Estaing avait voulu expulser des migrants mais il ne l'a pas fait sous la pression et menaces de certains.

&gt;Pour prendre un contrepoint de ton analyse très orientée, des immigrants vietnamiens, taiwanais ou chinois sont généralement bien mieux intégrés et acceptés, car ce sont presque toujours des gens qualifiés qui viennent avec leur entreprise ou créer la leur ici. Et eux ont absolument rien en commun avec notre culture, de près ou de loin. Pourtant, aucun souci, bizarre....

Ah c'est marrant parce que pour ma part j'ai justement rarement vu des communautés aussi sectaires et communautaires que les communautés asiatiques. Par exemple lorsque j'ai eu des étudiants chinois dans ma promotion, il y en a pas mal à l'UTC puisque l'école a des accords avec des universités chinoises : les seules fois où ils n'étaient pas entre eux c'est parce qu'ils y étaient forcés. J'ai même eu l'occasion de manger avec certains d'entre eux et ils parlaient chinois aussi souvent qu'ils le pouvaient pour exclure les autres de la conversation. Une belle preuve d'assimilation, n'est-ce pas ? Il y a une différence entre s'assimiler et ne pas faire de vague. 

&gt;Je répète il ne faut pas mélanger la cause et les effets. On a volontairement procédé à une ségrégation sociale, on en paie les conséquences. Dans d'autres pays comme la Suisse la mixité sociale et imposée par la loi (et fait partie des règles de construction des HCM à Genève par exemple), et a pour conséquence l'absence de ghettos ou de banlieues pourries...

Bien sûr. Sauf que pour faire cela il faut déjà que l'immigration soit limitée et que les premiers soient assimilés avant les nouveaux arrivants, sinon c'est perdu d'avance, comme c'est le cas en France depuis des décennies."
2017-05-29 17:30:04,Apoz2,"Ça c'est rien encore. Il y a aussi ses propos sur Boris Nemtsov, qui sont franchement inexplicables.

Et aussi, c'est un autre sujet, mais [ce qu'il a dit](http://movitcity.blog.lemonde.fr/2013/04/27/pourquoi-melenchon-ment-il-deliberement-et-obstinement-sur-la-question-tibetaine/) sur le Dalaï Lama est très drôle également :
&gt; « Savez-vous« , a-t-il asséné à ses interlocuteurs, « que Le Dalaï Lama a pour objectif de rétablir un régime théocratique, d’y imposer la charia bouddhiste et d’en expulser cent millions (sic) de Chinois qui y vivent et y travaillent ? »"
2017-04-21 21:11:08,Nico2845,"&gt; Fabien Clain est Réunionnais et converti. C'est lui qui a dirigé la filière d'Artigat liée à Mohamed Merat, Sid Ahmed Ghlam et aux deux 
fils de pute qui ont assassiné les dessinateurs de Charlie Hebdo.

J'ai parlé des terroristes, pas des cerveaux. Sinon al-Baghdadi est Irakien. Les cerveaux sont Saoudiens si on part dans ce sens.

&gt; Grave, comme si expulser les immigrés d'aujourd'hui (à 40% des étudiants, les plus nombreux étant des Chinois, des Brésiliens et des Colombiens) allait régler le problème de ces sous-merdes dont ce sont les arrières-grands-parents qui étaient immigrés.

Donc EXACTEMENT ce que j'ai dit, le pire pour résoudre le problème. "
2017-04-21 19:23:15,pink_ego_box,"&gt;Pas un, pas une majorité, pas presque tous, absolument tous.

Fabien Clain est Réunionnais et converti. C'est lui qui a dirigé la filière d'Artigat liée à Mohamed Merat, Sid Ahmed Ghlam et aux deux fils de pute qui ont assassiné les dessinateurs de Charlie Hebdo.

&gt;Et Le Pen est de loin la pire pour résoudre le problème selon moi, ne vous méprenez pas.

Grave, comme si expulser les immigrés d'aujourd'hui (à 40% des étudiants, les plus nombreux étant des Chinois, des Brésiliens et des Colombiens) allait régler le problème de ces sous-merdes dont ce sont les arrières-grands-parents qui étaient immigrés."
2016-08-23 13:52:01,[deleted],"Tu crois que ce sont les chinois à Paris qui sont responsables de la majorité des aggression physiques.

&gt; Tu veux pas créer un parti politique pour expulser tous les parisiens de France ?"
2016-06-05 16:03:33,Broceliande,"Il a aussi dit ça : ""
""Savez-vous"", a-t-il asséné à ses interlocuteurs, ""que Le Dalaï Lama a pour objectif de rétablir un régime théocratique, d’y imposer la charia bouddhiste et d’en expulser cent millions (sic) de Chinois qui y vivent et y travaillent ?"" """
2015-01-04 15:49:56,MauvaisConseil,"&gt;Dans les banlieues, c'est un espace géographique qui est délaissé.

Pas vrai. Tu as tous les travaux de Christophe Guilluy qui montrent qu'au contraire il y a des investissements bien plus massifs en banlieue qu'en campagne.

&gt;Quant aux communautés asiatiques, il ne faut pas occulter le poids important de la diaspora, pour les chinois en particulier. S'ils réussissent, c'est qu'il existe des réseaux de solidarité, de financement, de connaissances. Ce n'est pas cliché de dire que leur implantation n'est pas le fruit hasard.

Je pensais précisément aux boat people. Et l'immigration d'Asie est plus récente que celle du Maghreb par exemple. Pourquoi une diaspora  venant de nulle aurait réussi et pas l'autre qui est là depuis plus longtemps et est arrivée dans une période sans chômage ?

&gt; Si tu as des sources sous la main, ça m'intéresserait d'y jeter un coup d'oeil

Sur la délinquance tu as les bouquins de [Hugues Lagrange](https://fr.wikipedia.org/wiki/Hugues_Lagrange#Le_D.C3.A9ni_des_cultures), tu peux écouter ses interviews aussi. Sur l'éducation tu as la grande enquête de l'Insee [ici](http://www.insee.fr/fr/themes/document.asp?reg_id=0&amp;id=3706). Sur la démographie tu as tout ce qu'a écrit Tribalat depuis une dizaine d'années.

&gt;Je suis d'accord pour dire que l'Islam est tolérant lorsqu'il est dominant, c'est d'ailleurs une différence fondamentale avec le Christianisme. Les exemples ne manquent pas.

Euh, tu veux dire quoi là quand tu parles de différence avec le christianisme ? Les exemples d'intolérance en Arabie Saoudite, au Qatar etc ne manquent pas non plus.

&gt;La religion n'est jamais un facteur isolé. Historiquement, les pouvoirs politiques ont recours à la religion pour renforcer une légitimité en déclin ou menacée.

J'ai comparé les textes des évangiles avec celui du coran, il n'y a pas photo sur la justification religieuse de la violence dans le cas de l'islam. Le coran est un texte politique et législatif qui ne fait pas la distinction entre temporel et spirituel. Mahomet était un chef de guerre qui a créé une religion adaptée à sa politique. Ce n'est absolument pas le cas pour le christianisme dans lequel il faut *rendre à César ce qui est à César, à Dieu ce qui est à Dieu*.

&gt;On ne peut pas stopper les flux migratoires. On a toujours essayé, sans jamais réussir.

Tu veux que je te donne des exemples de mesures à essayer ?

Fin de l'AME, priorité nationale pour l'emploi et le logement, pas de regroupement familial, pas de prestations sociales pour les étrangers, expulsion systématique des clandestins et des délinquants. On est très très loin d'avoir tout essayé et on fait face à une invasion.

&gt;Elles nous font dépenser des millions pour des systèmes de protection

Tu aurais une source stp ?

&gt;qui coûtent davantage d'argent que le supposé coût des migrants sur la société d'ailleurs

Le coût des migrants se chiffre [en milliards, voire en dizaines de milliards par an](http://www.controverses-minesparistech-3.fr/~groupe11/?page_id=162), pas en millions.

&gt;Je ne parle même pas des violations des droits de l'homme aux frontières ou dans les centres de rétention.

Si on commençait par appliquer la loi et à expulser systématiquement les clandestins on n'en serait pas là. C'est l'absence de mesures qui conduit à ces problèmes.

&gt;Par ailleurs, certains pays européens, comme l'Allemagne, ont une démographie déclinante, les contraignant à avoir besoin de cette immigration pour faire tourner leur économie (et s'occuper de leurs vieux).

C'est leur problème, pas celui de la France. Le refrain des immigrés qui viendraient payer nos retraites ne marche pas vu qu'il n'y a pas de travail.

&gt;Avec Shengen, les flux ne peuvent pas être stoppés au sein de l'UE, et supprimer Shengen n'a rien de raisonnable.

Supprimer Schengen est un prérequis pour lutter contre l'invasion.

&gt;Le problème n'est pas tant l'immigration que nos sociétés économiques en elles-mêmes. Je suis d'accord concernant la possibilité d'un débat sur la question migratoire, mais celle-ci doit être secondaire par rapport à la question économique.

Au contraire, la question de la sécurité et de l'identité est bien plus importante que la question économique.

&gt;On doit se sortir de la crise, mais ce n'est pas en se focalisant constamment dans les débats sur les immigrés que les choses avanceront

On ne peut pas sortir de la crise tant qu'on laisse rentrer des dizaines de milliers de nouveaux chômeurs chaque année. Tous les problèmes liés à la crise sont bien plus présents chez les immigrés. Il n'y a aucune chance d'intégration dans les conditions actuelles."
