date,author,text
2017-05-05 09:20:22,lunki,"Nègre recouvre une part de réalité qu'il est stupide de nier, tout comme youpin ou boucaque, ces termes désignent des choses très précises qui existent. Tu auras tout de même remarqué une certaine connotation associée..."
2017-03-11 13:13:25,VilLeSublime,"Ah ok j'avais sincèrement rien compris à ton analogie (maintenant va falloir que tu m'expliques en quoi répondre à côté c'est une preuve évidente de compréhension). 

C'est juste que ça joue dans l'interprétation d'une caricature. Le fait qu'il ne soit pas juif rend encore plus débile l'hypothèse d'une caricature antisémite. Même si ça n'est pas une preuve suffisante. Ton analogie est mauvaise car à aucun moment Macron n'a fait l'objet d'une attaque antisémite explicite. Dessiner quelqu'un avec un nez long (qui est soit dit en passant très différent du nez crochu attribué aux Sémites dans les caricatures d'époque postées dans ce thread) ne revient pas à le traiter de youpin désolé."
2017-03-01 14:27:15,n0ggy,"&gt; Ce n'est pas toi qui décide si le terme est péjoratif ou pas. Ce n'est pas toi qui décide si la personne en face de toi doit être sensible à un mot ou pas.

Le poids d'un mot est à la fois défini par l’interprétation personnelle, et le contexte culturel. 

A moins de connaitre une personne, on ne peut pas prévoir l'interprétation personnelle car elle est liée à pleins de facteurs (légitimes ou non) souvent imprévisibles qui exigent de bien connaitre son interlocuteur. Quand on ne connait pas parfaitement son interlocuteur, un mot complètement innocent peut offenser (à cause d'un événement traumatique par exemple, ou si la personne est un gros susceptible professionnel comme toi). Bref, l’interprétation personnelle est souvent une variable à ignorer quand on accuse quelqu'un d'être indélicat car la responsabilité est surtout dans le camp du récepteur. 

Quant au contexte culturel (défini par pleins de facteurs non personnels), le terme noich' n'a aucun poids raciste et n'est d'ailleurs jamais employé dans un contexte haineux à ma connaissance (contrairement à ""youpin"" ou ""bougnoule""). C'est juste un mot en verlant, et le verlant c'est juste de l'argot. ""Noich'"" aurait d'ailleurs pu (et du) faire partie du slogan ""black, blanc, beur"" antiraciste. On parlerait de niakoué ou chinetoque, j'entendrais ton argument car leur poids culturel est négatif mais là tu dis n'importe quoi. 

En imitant cette poignée d'attardés de ricains qui font de l'offense un fond de commerce, tu dessers complètement la cause que tu penses défendre. L’extrême droite se fait ensuite un plaisir de brandir en exemple les rares zélotes comme toi comme la preuve irréfutable de ""la stupidité et la dérive du politiquement correct"". 

Cela leur permet par la suite de balayer du revers de la main toutes les fois où le politiquement correct est complètement légitime et de se comporter comme des gros connards. Et forcément, les gens qui ont été accusés à tord de racisme par les gros idiots comme toi finissent par avoir plus de rancœur envers les zélotes du politiquement correctes que les vrais racistes, et c'est comme ça qu'on se retrouve avec des gens comme Trump qui vocifèrent des horreurs dans l'espace public et que cela ne dérange plus personne. 

"
2017-03-01 13:52:44,bananastich,"Tu sais tu peux être choqué que je t'appelle keumé, c'est pas pour autant que ça en fera un terme péjoratif. C'est ton ressenti, ça n'engage que toi. 

Bamboula, bridé, youpin, bicot, diable blanc = termes péjoratifs

Noiche, rebeu, renoi, feuj, babtou = termes neutres."
2017-03-01 09:11:38,eeeklesinge,"C'est souvent un réflèxe de se réapproprier des mots souvent utilisés de façon péjorative. Ce n'est pas une raison pour apprécier de se faire traiter de tapette, de plouc, de feuj (ou youpin, le petit classique qui fait toujours plaisir), de bamboula (ou de nègre) par le premier venu."
2017-02-07 18:41:33,UnPoulpe,"Cela fait malheureusement bien longtemps que fleurissent les sujets antisémites, racistes, sexistes, haineux sur les forums de Jeuxvideo.com. En 2007 c'était déjà le cas. 

C'est extrêmement difficile à contrôler. Il y a souvent plus d'une centaine de sujets créés par minutes sur le forum 18-25 ans par exemple, et je ne parle même pas des messages haineux qui peuvent être postés à l'intérieur d'un sujet dont le titre n'a en soi rien de haineux en soi. Ajoutez à cela les messages relativement ambigus mais pas forcément illégaux, les messages privés en groupe dans lesquels des haineux en puissance s'organisent pour mener des actions à l'intérieur de JVC ou à l'extérieur ...

Je n'imagine même pas la taille de l'équipe de modération qu'il faudrait pour réguler tout ça. Les techniques de ""censure"" de mots clés (genre youpin, bougnoules etc..) sont inefficaces car aisément contournables, les pseudos bannis sont remplacés par d'autres via des bots en quelques secondes ... bref que faire ?
 "
2017-01-20 09:22:27,Thouny,"Tu vas sans doute me traiter d'affreux positiviste, mais je vois une différence assez importante entre « un mec affirme un truc en se basant sur son expérience personnelle et un système de compréhension du monde qu'il a bâti lui-même dans son coin » et « des scientifiques, en prenant pour base les travaux précédents de centaines d'autres scientifiques, mènent une expérience pour arriver à une conclusion répétable et falsifiable ».

C'est pas parce qu'un gusse il y a deux cent ans a affirmé quelque chose que celle-ci est vraie ni vérifiable. Et montrer la vérifiabilité de quelque chose est un pas en avant, du moins selon moi.

Et de toute façon, cette publication convaincra des gens que ton youpin d'il y a trois cent ans n'a pas convaincu, et cela aussi c'est un pas en avant."
2017-01-20 09:05:09,NerosTie,"Youpin.  
http://www.larousse.fr/dictionnaires/francais/youpin_youpine/83002
&gt; Terme raciste et injurieux pour désigner un Juif.
"
2017-01-20 09:00:35,lunki,"C'est fantastique, les mecs n'ont que trois siècles de retard sur le youpin qui avait écrit que *la connaissance vraie du bien et du mal ne saurait réprimer aucun affect en tant qu'elle est une connaissance vraie*.

Bienvenue dans le monde des sciences cognitives, qui vous explique ce que vous savez déjà mais sans contexte."
2017-01-19 09:27:29,Frensoaria,"Allez, je vais reprendre cette discussion passionnante.

C'est pas la même chose parce que 100% des Français qui utilisent ""youpin"" le font dans une optique dégradante (ou sur le mode ""mais non allons c'est de l'humoooour"" qui n'est pas beaucoup mieux) alors que 99% des Français qui utilisent ""jap"" le font dans une optique neutre."
2017-01-19 03:21:17,I_MELT_STEEL_BEAMS,"Je suis d'accord que certains poussent le bouchon un peu loin et semblent chercher un prétexte pour s'offenser à tout bout de champ. Les ayatollahs du politiquement correct sont un cancer. Cependant, certains épithètes comme ""jap'"" sont des insultes là où elles sont originaires. Y'a vraiment que les pires rednecks pour encore utiliser le terme, c'est dire à quel point c'est distingué. C'est vraiment l'équivalent de ""youpin"" pour les américains d'origine japonaise. 

C'est peut être drôle pour les bouillonnants adolescents qui se prennent pour des durs derrière leur anonymat, mais c'est vraiment passer pour un rustre que d'employer de tels termes et pire encore que d'essayer de les justifier. Un peu de classe, merde. "
2017-01-18 19:37:09,I_MELT_STEEL_BEAMS,"&gt; Un mot qui a perdu son sens péjoratif en 1945

Ah ouais, comme ""youpin"" a perdu son sens en 1945.

Y'a des baffes qui se perdent..."
2017-01-18 19:23:12,I_MELT_STEEL_BEAMS,"Excuse à 2 balles, je t'ai expliqué la signification de ton ""abréviation"" et tu préfère continuer à t'embourber. ""Jap"" n'est pas qu'une abréviation, au même titre que ""youpin"" n'est pas qu'un mot de 6 lettres. "
2017-01-18 19:14:40,I_MELT_STEEL_BEAMS,"Yankee je m'en fous, c'est plutôt ""Jap"" qui fait tache. Comme je l'ai expliqué maintenant plusieurs fois, c'est l'équivalent de ""youpin"" pour les americano-japonais. Il n'y a, en 2017, aucune justification pour utiliser un tel mot."
2017-01-18 18:36:55,Frensoaria,Non j'utilise pas youpin parce que c'est pas la même chose.
2017-01-18 18:19:30,I_MELT_STEEL_BEAMS,"Donc pourquoi utilises-tu des épithètes datant de 1940, porteurs d'une signification lourde? Utilises-tu aussi des termes comme ""youpin""? C'est la même chose."
2016-11-29 11:19:25,Carlos_Bolos,"&gt; Une connerie de cet acabit serait presque savoureuse si statistiquement ça ne venait pas conforter l'idée que l'islam est une idéologie tellement dangereuse que si c'était un produit il serait interdit de mise sur le marché ou serait livré avec un manuel de sécurité de 3000 pages et assorti d'une obligation de permis.

L'énorme soucis, c'est qu'on s'est trop longtemps bouché les oreilles lorsqu'un cri d'alerte était lancé. 

Lorsqu'au collège, les muslims de la classe sortaient à haute voix devant le prof hilare  ""et bah heureusement qu'il y a pas de youpin dans notre classe !"", lorsque ton collègue refuse de serrer la main de ta collègue femme, lorsqu'au lycée des filles nous distribuaient des tractes sur la dérive de la société et les bienfaits du voile sur les femmes, lorsque des collègues refusent de se rendre à un dîner d'affaire car le resto est pas halal ...

Lorsque, durant tout ceci, la réponse des personnes qui avaient un peu d'autorité a été ""ce n'est que culturel"" ou ""ce n'est pas bien méchant"", c'est à ce moment précis que la machine a démarré. "
2016-11-23 14:30:15,ms_tanuki,"Les commentaires font suite aux articles que le journal a publié sur cette affaire d'affiche, pas de commentaires épars sur des articles divers. C'est bien de faire preuve de critique vis a vis de la presse, mais on peut aussi estimer que s'il se retrouve là c'est bien parce qu'il est utilisé dans ce sens.

Ensuite je suis désolé mais regarde l'étendue des insultes à notre disposition pour dire ""homo"" et qu'on utilise indifféremment et conjointement pour insulter/mentionner les vrais homos et rabaisser celui qu'on veut humilier ou insulter. Le ""pédé"" reste stade le plus bas qu'un homme puisse atteindre (avec une etymologie qui fait confondre avec la pédophilie), une ""tarlouze"" sera toujours ridicule et faible, une ""fiotte"" se met plus bas qu'une femme etc... T'as beau dire que c'est pas un usage homophobe ça fait toujours référence à ça. Parfois j'envie les noirs, les arabes et les juifs qu'on se rende compte pour eux que nègre, bicot et youpin sont des insultes racistes alors que moi je dois fermé ma gueule parce que ""tu comprends, c'est tellement universel de mépriser les pédés que ces mots sont futiles et veulent plus vraiment dire ça, t'es hystérique"". Non, un pédé c'est un homme homosexuel avant tout et ça sert de mesure au niveau de mépris qu'on veut montrer à un homme en le traitant comme ça. "
2016-10-25 11:54:46,Richard____Parker,"Et pendant ce temps, Hillary peut traiter un noir de ""nègre"" et un juif de ""youpin"", tout va bien...
"
2016-08-09 12:48:19,Chiendlacasse,"&gt;T'es un youpin ?

C'est une putain d'insulte ça non ?"
2016-08-09 12:36:59,lunki,"T'es un youpin ?

Non parce que t'es pas islamo-gauchiste, ça c'est sûr."
2016-05-20 14:16:13,FrancoisMcCumhail,"Les anti-concert ont tout de même reproché à Black M d'avoir qualifié la France de ""pays de kouffars"" et de ""conne"", et d'avoir employé le terme de ""youpin"", donc la polémique portait aussi sur les paroles de ses chansons."
2016-05-14 03:29:19,cvuhsfvuihsvw,"Sur l'antisémitisme, dîtes-moi parce que je ne suis pas spécialiste de sa discographie, mais il semble que ce soit le terme ""youpins"" dans une chanson qui pose problème. 


Or :

-C'est une reprise de Doc Gyneco (96 : on n'avait pas bronché à l'époque, c'est lui qui a écrit ça). 

-Dans le contexte de la chanson c'est à relativiser :

&gt;Dans ma rue

&gt;Ma rue est bourrée de vice 
À chacun ses délices, à chacun sa 8.6 
Dans ma rue, les lascars se serrent la main 
*Ce n'est pas comme dans le show-biz 
Où les mecs se font la bise* 
Dans ma rue, les Chinois s'entraident et se tiennent par la main 
**Les Youpins s'éclatent et font des magasins** 
Et tous les lascars fument sur les mêmes joints 
Dans ma rue, **c'est une pub pour Benetton 
Et tout le monde écoute les mêmes sons à fond 
Mangeurs de casher ou de saucisson**

OUI, le ""simple"" emploi du terme ""youpin"" me dérange, c'est raciste en soi. En plus il y a de l'homophobie juste avant avec les hommes du show biz qui se font la bise. OUI c'est antisémite et homophobe. Cependant je pense qu'il est important de placer le terme dans le contexte de la chanson : ça sonne bon le SOS racisme, la France Benetton black-blanc-beur, c'est une ode à la fraternité et au vivre ensemble, même si pour se faire il emploie un terme raciste précédé d'un vers homophobe. (Au passage les paroles sexistes de Gynéco et des nombreux rappeurs actuels on n'en fait pas tout un foin... oh quelle avait été la réaction d'/r/france il y a quelques semaines au sujet du procès d'Orelsan rappelez-moi ???). 

Expliquer n'est pas excuser : Ces paroles sont antisémites et homophobes (en plus la reprise est merdique, comme tout ce qu'il fait) mais quand je lis ça et là comment c'est décrit, j'ai l'impression qu'on noircit le trait. (Oh, rappelez-moi, comment /r/france avait réagit aux propos de Rossignol sur les ""nègres"" ? Ah là, ça allait on pouvait employer un terme raciste, puisque le message complet ne l'était soit-disant pas...). Bizarre ces doubles lectures...



"
2016-04-25 13:27:19,Peysh,"&gt; je ne pense pas que les salafistes soient des ""jihadistes non-violent"".

Ils se définissent pourtant comme ça eux mêmes : ""Nous, à l'inverse des jihadistes, nous ne sommes pas violent car nous pensons que le petit Jihad ne se fera qu'a la fin des temps"".

Tout le reste, c'est identique. (raciste, misogyne, suprémaciste, violent, totalitaire)

Imagine un nazi qui te dit,"" je pense que ce que dit hitler est très bien, tout est de la faute des juifs, mais je pense que nous ne les tuerons que plus tard, pour le moment je suis non violent. Bon, par contre mon cousin Helmut n'a pas pu se retenir, et il est parti tuer du youpin, mais ce n'est pas un probleme d'idéologie, c'est juste qu'il n'a pas compris le timing"".

C'est défendable? Franchement."
2016-04-10 11:03:18,PistilDeLaBourgade,"Si si, j'ai compris. Youpin, c'est raciste. "
2016-04-04 17:05:41,iwillmakeyourgfcum,"&gt; Nègre = bougnoul = youpin = niakoué

= babtou  ?
"
2016-04-04 13:52:30,SabriADoubleTranchan,"Je défends le droit de dire qu'on aime pas le voile. Mais un ministre se doit de représenter tout le monde. La ministre du Droit des Femmes se doit de représenter toutes les femmes. Une Ministre ne peut pas insulter des millions de Français. 

&gt; Je désapprouve

!=

&gt; J'insulte les personnes différentes de moi.

Edit ping /u/roma_schla :

&gt; Une ministre ne représente personne. C'est le boulot du Parlement.

Mouais, tu joues sur les mots. 

&gt; Sinon l'insulte est pas évidente : elle ne vise personne en particulier, elle n'utilise pas de termes explicitement injurieux. Et même si c'est bien une insulte, le racisme n'apparaît pas évident.

Nègre = bougnoul = youpin = niakoué

&gt; Quand un politique dit que les riches volent le peuple français pu quand un ministre de la culture dit que la culture américaine détruit la culture française il n'est pas inquiété. Où est la différence ?

La différence est que les Américains ne subissent pas de discrimination en raison de leur couleur de peau en France et qu'ils ne sont pas citoyens français, aussi. Les riches ne sont pas discriminés non plus.

ping /u/roma_schla

[here](http://4.bp.blogspot.com/-k9TmWq1kRnY/VceDz3kjARI/AAAAAAAABA8/5berDRTDChI/s1600/whiteprivilege.jpg)"
2016-03-31 10:26:25,bananastich,"Je suis tellement d'accord avec toi... Fini l'oppression des cucks boboisants... Faisons une pétition pour revendiquer le droit d'utiliser le mot ""youpin""... "
2015-12-30 09:16:23,Cayou,Bonne journée sale youpin ;-)
2015-11-10 19:50:30,Thouny,"&gt; Quand bien même, il n'est aucunement comparable à ""youpin"".

Ça, je suis bien d'accord. Ne serait-ce que parce qu'en fait, il n'est pas censé désigner les blancs…"
2015-11-10 19:41:53,l_hate_chihuahuas,"...Non. Pas où je vis. Pas comme mon entourage l'utilise.
""Blanbec"" c'est un peu comme ""black"".

Je ne nie pas du tout qu'il peut être légèrement dépréciatif selon la personne qui l'utilise cela dit.
Quand bien même, il n'est aucunement comparable à ""youpin""."
2015-11-10 19:07:27,l_hate_chihuahuas,"Tu es sérieusement en train de comparer ""youpin"" à ""blanbec""?

Blanbec n'est absolument pas insultant...."
2015-11-04 10:18:31,john_84,"Dire que tout un sub est ""raciste"" parce que certains utilisateurs le sont c'est aussi stupide que dire que toute la France est raciste parce qu'un français sur cinq est près à voter le Front National.

On n'est pas chez coontown qui lui est ouvertement raciste contre les noirs ( le terme coon est une insulte raciste ). 

si le sub s'était appelé /r/youpin (ou ça traduction en anglais que je ne connais pas) , la ton argument aurait du sens.

"
2015-09-29 16:42:42,zoheirleet,"&gt;  ne veut pas éditer son livre sur le grand complot youpin

tu as lu le livre ?

&gt;surtout quand c'est illégal

D’après toi.

&gt;L'argument majeur du mec sur son bouquin sur Sarkozy étant que Sarko ayant eu un grand père maternel juif, il a été ""élevé dans un milieu juif"". Comment je réfute ça ? Comment il le prouve ?

L'article évoque la censure dont il fait l'objet, ce n'est pas une critique de ses bouquins. 

&gt;mais le complot juif français qui contrôle les élites, j'abandonne.

le lobby israelien/juif existe comme dans beaucoup d'autres pays ou il est étudié et critiqué sans aucune censure et matraquage médiatique. Faire passer cela pour du ""*protocole des sages de sion*"", c'est assez absurde.

http://www.amazon.com/Israel-Lobby-U-S-Foreign-Policy/dp/0374531501

http://nymag.com/daily/intelligencer/2015/09/iran-deal-and-the-end-of-the-israel-lobby.html
"
2015-09-29 16:19:40,eeeklesinge,"Le fond ? Tu noteras qu'on ne trouve rien sur le fond de ses livres, mais des extrapolations supposées sur le contrôle juif de Grasset, sans se demander pourquoi il veut qu'one boîte qui fait une immense majorité de fiction/poésie ne veut pas éditer son livre sur le grand complot youpin, surtout quand c'est illégal 

&gt; L’article 8 de la loi 78-17 du 6 janvier 1978 relative à l'informatique, aux fichiers et aux libertés interdit la collecte ou le traitement « des données à caractère personnel qui font apparaître, directement ou indirectement, les origines raciales ou ethniques, [...]. 

Aucun point de vue contraire, explication de ses ""ennemis"" au solde des ""maçons juifs"", bref, un travail 'journalistique' bâclé. L'argument majeur du mec sur son bouquin sur Sarkozy étant que Sarko ayant eu un grand père maternel juif, il a été ""élevé dans un milieu juif"". Super. Comment je réfute ça ? Comment il le prouve ? 

Le reste des articles du site pue l'antisémitisme. Evidemment, les liens ne viennent que de sites de bon ton (E&amp;R et al.)

Franchement, je veux bien débattre jusqu'à plus soif sur le FN, l'immigration et autres, mais le complot juif français qui contrôle les élites, j'abandonne. C'est le degré zéro, et ça m'attriste que tant de gens y croient. Vous pensez pas qu'il y a assez du MEDEF, du Siècle et autres groupes d'intérêts industriels sans fantasmer sur le pouvoir des loges, des juifs ou des loges juives ? Faut-il voir un complot quand les gens protègent leurs intérêts ?"
2015-06-14 10:16:43,EHStormcrow,"Les Juifs ne sont pas homogènes en tant que ""race"", t'as des juifs arabes (mizrahis), des juifs indiens (bene israel), des juifs ""aryens"" (ashkénazes), des juifs méditerranéens (séfarades), des juifs africains (beta israel), des juifs chinois, etc...  La définition du groupe ""Juifs"" n'est pas ""racial"" mais un peu héréditaire, un peu culture. 

Du coup, tu dis antisémitisme au lieu de racisme. Ils ont aussi le sionisme à la place du nationalisme puisqu'encore une fois, ils ne sont pas un peuple homogène ethniquement et culturellement.

L'antisionisme et le sionisme sont des termes dangereux parcequ'ils ne veulent pas dire la même chose selon à qui tu parles.
Le sionisme dans sa définition initiale c'est ""la formation d'un état pour le peuple Juif en Terre Sainte"". Maintenant, tu peux considérer que la sionisme a réussi. Toutefois, certains ont mis à jour le mot. Tu peux avoir des ""post-sionistes"" (à mon humble avis, la majorité des israéliens) qui disent ""ok, on a un état, maintenant, il s'agit de s'arranger avec nos voisins"". T'as des néo-sionistes qui veulent rajouter la Cisjordanie (Judée et Samarie, pour eux, des provinces ""historiques"" des royaumes juifs de jadis). T'as également des sionistes religieux qui trouvent que l'état est pas assez Juif (genre y a des femmes ailleurs qu'à la maison à s'occuper de leur 9ième enfant et que y a encore de trucs qui tournent pendant Shabbat). 

Si on accepte la définition de sioniste=qqun qui veut un état pour les Juifs, un antisioniste serait quelqu'un qui leur refuse un état. Les tarés ultraorthodoxes juifs (genre Neturei Karta) sont antisionistes dans ce sens là. Ils n'ont pas encore reçu le message de leur messie pour qu'il les autorise à revenir (où ils ont prévu de prendre tous les habitants non juifs comme esclaves, mais bon, tout le monde l'oublie ça). 
En pratique, à part eux, ""antisionisme"" ça va de ""je refuse qu'il y ait un état Juif et je veux tous les tuer pour rendre la terre aux Palos"" (Hamas) à ""je nie qu'ils existent"" (genre le Qatar qui cache les drapeaux israéliens) à ""je m'oppose à l'existence d'Israel, sans vouloir tuer les gens et de toute façon je les appelle ""entité sioniste"" "" (C'est l'Iran). De plus, on peut trouver l'antisionisme dieudonné (""ouais nique les Ju...les sionistes, Palestine libre toussa, quenelle. Ça fera 40 € mon bon monsieur...pour....la cause!!"") et l'antisionisme de façade (""mort aux juifs... pardon Israel est méchant je voulais dire"").
En plus, étant donné qu'il est hautement improbable qu'Israel disparaisse, il est inutile d'être antisioniste au sens littéral du terme.

En conclusion, stricto sensu l'antisémitisme n'est pas un racisme, mais l'homophobie non plus. On devrait arrêter de faire du verbiage et de couper les cheveux en 4 et juste dire ""**xénophobie**""

L'antisionisme en pratique, c'est la critique des actions d’Israël. Toutefois, étant donné que c'est juste un truc de mode la critique d'Israel (la plupart ne connaissent *rien* à la situation) et qu'il s'agit souvent d'un antisémitisme déguisé, il faut simplement se méfier. Je préfère ceux qui disent simplement ""je condamne les excès d’Israël"". 

Réponse bonus:  Le terme ""antisémitisme"" a été crée, littéralement parlant, pour critiquer les Juifs et eux seulement, par [wilhelm marr](https://en.wikipedia.org/wiki/Wilhelm_Marr). Il ne concerne pas tous les sémites au sens où on l'entend aujourd'hui (tous les peuples du moyen orient). 

Je dis ça parceque j'en ai marre de voir ""ta gueule, sale youpin, je peux pas être antisémite, je suis arabe donc sémite, cqfd yolo""."
2015-03-18 10:47:01,FreeFlood,"QUOI? DU SANG DE PD?

ET POURQUOI PAS BIENTOT DU SANG DE NEGRE OU DE YOUPIN?

...

Plus sérieusement, je crois que c'était une mesure qui date de l'époque ou le sida était encore une maladie mystérieuse et ou les homosexuels étaient bien plus amenés à la contracter que d'autres.
Ca n'est pas pour rien que le sida était appellé ""peste des homosexuels"" à l'époque.

Mais les dépistages de certaines maladies (dont le sida) sont systématiques lors d'un don, et cette mesure est donc la conséquence logique (et tardive) de cette détection automatique.

Mais je sens que on va avoir un paquet de haters qui vont monter au créneau en agitant un danger quelconque ...
"
2014-12-17 13:12:41,Frensoa,"*Pour son pot de départ, Bernadette a réservé la salle ""Youpin"".*"
2014-08-13 14:53:55,eeeklesinge,"Une avancée significative ? Absolument pas. Mais je trouve que c'est un peu mieux que de le laisser. Comme pour les autres exemples mentionnés plus tôt. 

Moi qui ne m'offusque pas souvent, et qui suis le premier à gueuler contre ce mythe de la France où il faut se cacher d'être juif et où les ""islamofascistes"" se baladent dans les rues pour fracasser du youpin, je peine un peu à trouver une raison de garder ce nom. Est-ce une affaire d'Etat ? Non. Mais maintenant qu'on a abordé le sujet, pourquoi ne pas en profiter pour le changer ?

Et on peut se tutoyer :)

edit: petites fautes"
2014-08-13 13:28:52,malpighien,"Je pense que si le lieu-dit s'appelait ""tête de youpin"" il n'y aurait pas de débat pour le changer.
Il est impossible de dire si mort aux juifs se veut vraiment un appel à la mort des juifs. Le lieu n'est pas un haut lieu d'histoire, il n'est pas attaché à un événement bien particulier qui pourrait être un symbole de discrimination. 

Quel est l'argument pour en changer le nom, le fait que ce nom puisse prêter à confusion et inciter à croire qu'il y a une acceptation tacite de ses habitants (de la France entière ou l'état Français?) d'un désir de tuer les juifs? Est ce qu'on peut sérieusement le croire? "
