date,author,text
2018-08-02 08:14:07,basara,"Mais babtou fragile c'est pas babtou aux dernieres nouvelles si ?
Feuj fragile, renoi fragile c'est pas sympa non plus, le debat est pas sur fragile.

T'as vraiment du mal a comprendre que la definition des mots vient aussi de leur utilisation. Youpin et negro sont utilises de facon raciste en France. Babtou non. On a le droit de d'appeler quelqu'un blanc, noir, renoi, babtou....
Negro n'est peut etre pas raciste en espagnol (j'en sais rien je ne parle pas l'espagnol) mais ca l'est en francais."
2018-08-02 08:09:41,sh4rkman,"Autant youpin ouais, autant négro tu l'entends tout le temps entre potes, qu'ils soient renoi ou non.

ça va negro? = ça va gros?"
2018-08-02 08:03:47,basara,"Mec t'as des gros problemes de linguistique.

Negro et youpin sont utilise de facons raciste en france. Ca fait pas un doute c'est meme ecrit dans le dictionnaire (tu sais ce petit bouquin qui permet de connaitre la definition **commune** des mots, pas celle que tu as dans ta tete). Babtou non.


Edit : Et au passage, j'ai grandi avec des aieux qui etaient dans les camps pour des petites raisons religieuses, et qui ont pu decouvrir de leur propre experience que **le mot youpin est raciste**"
2018-08-02 07:59:38,elcapitalismoforaneo,"Quoi renaud ? C'sst quoi ce genre de remarques débiles ?    
  
Bon je ne sais pas ou t'as grandi mais négro (espagnol) et youpin ce ne sont pas des insultes non plus...ah en fait c'est relatif a ce que je vois. C'est pas parce que ce ne sont pas des mots de ton milieu qu'on a pas le droit de les utiliser...bref tu vois que c'est relatif  
    
Et c'est pejoratif car il y a d'autres mots correctes pour parler des blancs de manière normale.   
  
"
2018-08-02 07:58:58,basara,Youpin et negro sont clairement des termes racistes. Babtou ne l'est pas par contre
2018-08-02 07:47:02,1-Sisyphe,"Je n'ai jamais entendu babtou donc je ne peux vraiment juger si c'est péjoratif ou non.   
Par contre negro et youpin sont clairement racistes, c'est quelque chose d'établi dans la langue française."
2018-08-02 07:43:51,electriCT,"Négro et youpin ce sont des mots qui sont assez unanimement considérés comme racistes, notamment à cause de leur utilisation historique.

Pour babtou, ça reste à prouver."
2018-08-02 07:41:53,elcapitalismoforaneo,"Je ne sais las je demande. Si on peut parler de babtou tranquilement on devrait parler de négro, renoi et feuj ou youpin sans problèmes non plus"
2018-08-02 07:40:39,obvious_freud,"J'ai du mal à voir la connotation négative associée au mot babtou, et je ne l'ai quasiment jamais entendu dans un contexte dépréciatif. D'ailleurs, renoi, feuj, je ne vois pas trop où est le souci non plus (contrairement à negro ou youpin). Le souci ne viendrait-il pas que tu amalgames pas mal de mots ?"
2018-08-02 07:38:55,1-Sisyphe,"Je connais pas l'historique de ""youpin"" mais ""negro"" ça me semble hyper raciste, notamment parce que le mot ""nègre"" se traîne un énorme passif raciste..."
2018-08-02 07:35:01,elcapitalismoforaneo,"Pareil pour négro, youpin, etc...    
  
Qui décide quand c'est raciste ou discriminatoire ?  "
2018-07-27 23:02:03,Social_Justice_Monk,"\&gt;Désolé mais là t'es en train de dire que si quelqu'un n'approuve pas de  l'écriture inclusive, c'est forcément parce qu'il n'y connait rien.  


C'est une hypothèse. Je pensais que c'était assez explicite dans mon message qu'il y avait plusieurs possibilités et que, s'il est vrai que j'en suppose une, je reconnais que je puisse me tromper. Donc non si quelqu'un rejette l'écriture inclusive, ce n'est pas forcément que cette personne n'y connait rien. Mais ça ne me parais pas absurde de supposer que c'est une raison probable. Mais en fait, s'il se trouve que c'est en connaissance de cause que tu rejette ça, j'aimerai bien entendre tes arguments contre l'écriture inclusive.  


  
\&gt;Si quelqu'un se met a appeler les gens ""camarade"", ou si un raciste  décide de remplacer Monsieur/Madame par Nègre/Nègresse ou Youpin/Youpine  selon son interlocuteur, quelle que soit l'idéologie c'est pareil pour  moi, ca m'emmerde.  


J'ai du mal à saisir. Pour moi tes deux derniers exemples sont abjectes, alors que le premier est cool. D'ailleurs je sais pas comment ça se passe en belgique, mais en france, à l'école, les enfants entre eux sont souvent appelés des **camarades de classe**. Alors que du reste, l'école publique est pas franchement marxiste. Étonnant, non ?  


  
\&gt;Le langage inclusif est selon moi une grosse connerie, mais ce n'est  pas le sujet.  


Ah bon, c'est pas le sujet ?  


  
\&gt;Tu estimes que ton langage inclusif est neutre au niveau  du genre, mais il ne l'est certainement pas au niveau idéologique.  


  
Là je suis bien d'accord avec toi. Mon utilisation de ce langage est tout à fait motivé par des convictions politiques. C'est d'ailleurs exactement pour ça que j'ai présumé depuis le début que mon ~~camarade~~ co-réditteur au-dessus rejetait mon message précisément our des convictions politiques (opposées aux miennes). Tout cela tourne autour des enjeux de l'utilisation de ces écritures inclusives dans le langage, et pas simplement de grammaire.  


\&gt;Et donc, ta blague? Désolé, ton ""ielles"" c'est une pub chiante au début  d'une vidéo de 10 secondes. Je suis pas resté pour la voir.  


  
Jolie métaphore, très actuelle.  
"
2018-07-27 14:04:35,UK-USAxisofretard,"L'académie francaise, je m'en fiche, je suis belge. 

&gt;Une autre hypothèse, c'est que les personnes font un rejet systématique  de l'écriture inclusive parce que ça leur reviens pas, sans même avoir  de connaissances réelles sur ce que c'est 

Désolé mais là t'es en train de dire que si quelqu'un n'approuve pas de l'écriture inclusive, c'est forcément parce qu'il n'y connait rien.

Si quelqu'un se met a appeler les gens ""camarade"", ou si un raciste décide de remplacer Monsieur/Madame par Nègre/Nègresse ou Youpin/Youpine selon son interlocuteur, quelle que soit l'idéologie c'est pareil pour moi, ca m'emmerde.

Je serai le premier à me revendiquer féministe et à déplorer que ""SJW"" est devenu un épouvantail dont on se sert pour ridiculiser le combat des femmes &amp; minorités. Le langage inclusif est selon moi une grosse connerie, mais ce n'est pas le sujet. Tu estimes que ton langage inclusif est neutre au niveau du genre, mais il ne l'est certainement pas au niveau idéologique.

Et donc, ta blague? Désolé, ton ""ielles"" c'est une pub chiante au début d'une vidéo de 10 secondes. Je suis pas resté pour la voir."
2018-05-26 12:04:39,enjoueur,"La loi de Poe s'applique rudement pour le 1488

Reposte avant que ce soit enlevé

&gt; La Charlemagne 14/88  
&gt; Je suis nationaliste française chrétienne et je soutiens Erdogan ! Le Point est un torchon qui vomit régulièrement sa haine de Poutine, Assad, Maduro, Kim Jong Un et maintenant Erdogan. Ca suffit les litanies haineuses du youpin BHL, le même qui a soutenu les terroristes en Libye et qui soutient les chancres kurdes du PKK et YPG ! Le jour où Le Point arrêtera d'écrire des conneries, les soutiens d'Erdogan n'auront pas à aller faire le ménage !﻿

&gt; Rin Ben    
&gt; un 1488 qui soutient les bicots ? sale traître, tu mérites pas mieux que la corde a piano !﻿

&gt; La Charlemagne 14/88  
&gt; Les turcs sont des bicots maintenant ??? Ah ben c'est nouveau ... Tiens et avant de me jeter la pierre, relis l'Histoire de la noble Wehrmacht et de la division Handschar ! Je ne crois pas que tes propos auraient plu au Führer !﻿

Sachant que 88 c'est un code pour hitler (H 8ème lettre -&gt; heil hitler)"
2018-05-26 12:01:15,Rells_Parker,"Par contre je suis sidéré par certains commentaires... "" je suis nationaliste francaise et je soutiens erdogan, le point est un torchon [...] les litanies haineuses du youpin BHL [...] ""

Et après: ""Relis l'histoire de la noble Wermacht et de la division Handschar! Je ne crois pas que tes propos plairaient au Fuhrer""

Je pensais qu'on avait plus de ça de nos jours mais la ça me navre un peu..."
2018-05-25 14:00:09,imaginary_character,"Parce que les asiatiques ne se désignent pas par ""jaunes"" entre eux. C'est comme youpin. C'est un truc qui vient de l'extérieur. A l'inverse de ""Noir"" par exemple."
2018-05-20 12:14:43,Findeserie,"&gt;Je te donne la définition du terme monstre. Un tueur en série est un monstre. Une sirène est un monstre. 

C'est ton avis personnel.


&gt;Lorsqu'on déshumanise quelqu'un au point de le tuer, on mérite la déshumanisation qui en découle. 

Non. Sinon on se contente de condamner et on refuse de comprendre.


Ton expérience n'a rien à voir avec le schmilblick. C'est pas parce que t'as subi des trucs moches que ça te donne un pass pour dire n'importe quoi. 

&gt; Les mots existent pour quelque chose. 

Oui, mais jamais j'utiliserais les termes ""nègre"" ""youpin"" ou encore ""pédé"". Pourtant ils existent."
2018-02-15 17:41:45,electriCT,"Ba ta question c'est un peu pourquoi une injure est une injure. Pourquoi pute, nègre, youpin c'est une insulte, c'est la même question. C'est pas simple de l'expliquer au fond, même en lisant sur le sujet https://fr.wikipedia.org/wiki/Insulte .

J'imagine que ça devient une insulte à partir du moment où le terme est utilisé de manière dérogatoire et haineuse pour rabaisser des gens."
2017-12-15 18:17:58,Gulliver,"&gt; Ce renouveau est spécial car ce nouvel antisémitisme n'est pas originaire de France.

Tu risques d'être étonné alors. J'ai entendu bien souvent le mot ""youpin"" de triste mémoire et je ne pense pas qu'il soit utilisé par des musulmans. Le plus marrant si j'ose dire de l'histoire, c'est que c'est prononcé devant moi, d'origine arabe, donc forcément antisémite donc forcément complice. Il n'y a pas de renouveau de l'antisémitisme français, il n'a pas disparu, il est simplement ""retenu"" en parole publiquement. 
"
2017-11-03 09:01:10,lunki,On est tous le youpin de quelqu'un d'autre.
2017-10-12 14:35:58,Boulaouane1er,"
Ainsi, le 15 juillet 1943 (il a 23 ans), Audiard donne à « l'Appel » – journal ultra –, dirigé par Pierre Costantini (qui finira par se prendre pour Napoléon et sera interné en HP), une nouvelle intitulée « La fin commence à l'aube », curieuse histoire d'un pêcheur assassin. L'atmosphère est mélodramatique : Audiard n'est pas encore Audiard. Il le devient avec une deuxième nouvelle, « le Rescapé du Santa Maria », récit humoristique d'un trois-mâts conquis à l'abordage. Le propriétaire du bateau est un vieux, qui se définit par « une veulerie suante »et « une odeur de chacal ». Son nom : Jacob Brahm. On lui demande : « Juif, hein ? – Juste un tout petit peu, du côté de mon père. »Un autre bonhomme, Ephraïm, est « une synthèse de fourberie ». C'est donc « la conjuration des synagogues ! », qui s'achèvera « à l'heure prochaine de votre pendaison […] manifestation de l'immanente justice ». On est bien dans l'esprit nauséabond de l'époque. La grande rafle des juifs de Marseille a eu lieu quelques mois auparavant. Celle du Vél'd'Hiv date de l'été précédent. Le 14  octobre 1943, un nouveau texte de Michel Audiard : « la Vérité sur l'affaire Loth », pastiche brindezingue de la Bible, où le patriarche est traité de « fidèle corrompu »… En janvier 1944, changement de crèmerie : c'est dans « l'Union française », journal qui prône la création d'« une nouvelle France dans la nouvelle Europe », qu'Audiard s'exprime, sous forme de « reportages » drolatiques. « Big Billy s'est évadé » invente totalement l'évasion du légendaire Arthur Billy, détenu à Sing Sing. « Numéro 22 » et « Hélène est partie », deux autres « contes », paraissent. Dont « l'Anarchiste derrière la porte », dans laquelle Michel Audiard lui-même écoute le récit d'un pote qui lui raconte avoir été la cible des « terroristes », notamment d'un « anarchiste de l'espèce la plus homicide »… Mais seulement en rêve. Destin qui préfigure celui de Philippe Henriot, éphémère secrétaire d'Etat à l'Information de Vichy, abattu le 28 juin 1944.

CHANGEMENT DE TON À LA LIBÉRATION

Puis Audiard devient critique de théâtre. Le 1er juin 1944, il publie un papier élogieux sur un livre intitulé « Autopsie des spectacles », publié « sous les auspices de l'Institut d'Etudes corporatives et sociales », dont le siège social se trouve au 77, rue de Lille. L'ambassade du Grand Reich est située au 78. L'auteur, Jean-Pierre Liausu, plaide pour l'arrêt des « machinations de la juiverie omniprésente »dans le théâtre et dans le cinéma, vomit sur Léon Blum « chez qui se putréfient toutes les essences ju-déïques »et constate que, dans le monde du spectacle, en France, « le juif a triomphé ». Liausu plaide pour l'élimination des syndicats, la réhabilitation des chants folkloriques, le tout « sous le haut patronage du maréchal Pétain, chef de l'Etat français ». Audiard, en soutien de Liausu, écrit : « Le monde qu'il est convenu d'appeler “artistique” et qui demeure dans sa majorité le plus coquet ramassis de faisans, juifs (pardonnez le pléonasme), métèques, margoulins… »Ce « pardonnez le pléonasme »est impardonnable. De même, consacrant sa rubrique à la littérature, Audiard s'en prend au « petit youpin Joseph Kessel », avant d'étriller Elsa Triolet qui a cette « prédilection pour tout ce qui est veule, fangeux, équivoque ». Et puis… Et puis survient la Libé-ration. Changement de ton, donc. Les grands collabos, Luchaire, Darnand, Brinon, Déat, Laval, Bonnard, Rebatet, ont déjà leur rond de serviette à Sigmaringen. Que fait Audiard ? Il s'engage. Peut-être.

C'est lui qui le dit : il aurait intégré le « 1er Cuir » (régiment de cuirassiers) en août 1944. Pour se faire une virginité ? Franck Lhomeau précise que, malgré ses recherches assidues, il n'a pas retrouvé, dans les archives militaires, trace de cet engagement. En revanche, une « fiche d'identité de solde »du soldat Audiard a été proposée dans une vente aux enchères, en 2016. Authentique ? Allez savoir. Mais il y a plus désagréable : une fiche d'adhésion – numéro 74.208, datée de 1942 – au groupe Collaboration, elle, existe. Fondé en 1940 par Alphonse de Châteaubriant (qui voyait en Hitler un nouveau Christ), comprenant le dessus du fumier collabo (Brinon, Bonnard, Augier, Drieu la Rochelle, Laubreaux), ce groupe milite alors pour une Europe sous bannière allemande. Interrogé, une deuxième fois, au commissariat du Petit-Montrouge par le commissaire Pezet, en mars 1947, Michel Audiard affirme que son adhésion s'est faite « à son insu », et qu'il n'a jamais signé. Le doute lui profite. Il n'y aura pas de suite.

Notre homme s'adapte alors aux temps nouveaux. Il devient critique de cinéma dans « l'Etoile du soir », fondé par un authentique résistant fusillé, et adopte un pseudonyme, Jacques Potier. Il proteste contre la condamnation de Clouzot dans l'affaire du « Corbeau », en compagnie de Marcel Carné et de François Chalais (qui avait travaillé à « Je suis partout » et à « Combats », journal de la Milice). Il publie un reportage bidon sur une cérémonie vaudou au quartier Latin, un autre sur la Chine, et, côté cinéma, se met à dénoncer l'abondance des films sur la Résistance : « Avec quelques accents de clairon, une forte dose de mitraillettes, agrémentées d'une légère teinte de croix de Lorraine, à tous les coups ça marche. »Simultanément il s'attaque à Pierre Blanchar, star de « la Symphonie pastorale », et… président du Comité de Libération du Cinéma français chargé de l'épuration. L'une des marottes d'Audiard se fait jour : étriller les héros de la troisième heure, les résistants tortionnaires, se moquer de la saga d'une France courageuse. « Au fond, pense-t-il, tout le monde est pareil, souligne Franck Lhomeau. Combattants et collabos, épiciers et soldats, tout est nivelé. Le courage et la veulerie sont mis au même niveau… » Curieusement Audiard s'en prend aussi à Jean Gabin, dont il débine la « notoire liquéfaction », alors que Gabin, engagé, se bat contre les Allemands. Ils deviendront copains plus tard… Audiard, aussi, tape sur ce cinéma français qui privilégie « les Don Juan du macadam, les pédérastes intellectuels, les résistants vaudevillesques et les aventurières en panne d'affection ». En revanche, il aime Disney et se souvient d'un « authentique chef-d'œuvre : “les Dieux du stade” de Leni Riefenstahl ».

C'est à cette époque, en 1947, qu'il rencontre le réalisateur André Hunebelle, qui lui commande son premier scénario, « Mission à Tanger », dont certains pensent qu'il s'agit d'un démarquage de « Casablanca ». Une étoile est née… Michel Audiard va devenir, en quelques années, le dialoguiste et le scénariste le plus demandé du cinéma français, alternant les réussites (« Gas-oil », « le Désordre et la nuit », « Cent Mille Dollars au soleil ») et les nanars (« Quai des blondes », « Carambolages », « Sale Temps pour les mouches »), puis en devenant lui-même metteur en scène (« Le drapeau noir flotte sur la marmite »). Pourquoi a-t-il eu l'envie d'écrire (dans les années 1980) ce « Chant du départ », livre décousu, mais où on retrouve son sens de la formule : « Véra poétise sur le clitoris et robinsonne sur le fion avec infiniment d'allant » ? Il y étrille Joanovici, « juif bessarabien » (« marqué du lignage du cloporte »), pose qu'« un régime totalitaire devient tout à fait exécrable lorsqu'il se complique d'un régime alimentaire », se souvient qu'il évitait le métro par peur d'être expédié au STO, et rappelle que « le juif Offenbach »n'était plus au goût du jour, sous Vichy. Un grand moment, quand même : sa description de la collaboration avec Patrick Modiano pour adapter « l'Instinct de mort », de Mesrine, en 1978. On n'imagine pas deux êtres plus mal appariés. Modiano, selon Audiard, aurait « transformé le tueur de maquereaux en Christ aux outrages ». Gabin, au passage, a droit à un portrait sur plusieurs pages, pas toujours tendre : c'est un éternel anxieux, « éparpillé dans le cinéma, l'élevage bovin et l'amélioration de la race chevaline ».

Il y a, chez Audiard, un côté anar de droite tendance Céline, on le savait depuis toujours. Les documents exhumés par Franck Lhomeau, et reproduits dans « Temps noir » le prouvent : il y a, chez Audiard, une part d'ombre. Qu'il ait pu écrire pour un journal qui demandait à ses lecteurs, en titre : « Faut-il exterminer les juifs ? », est odieux. Qu'il ait dépeint, dans ses livres, des résistants barbares, et des FFI qualifiés de « délégation d'escarpes »n'est pas à sa gloire. Qu'il se soit laissé gagner par l'antisémitisme de l'époque est simplement indigne. Qu'il ait manié son humour de titi parisien pour camoufler ses années de guerre est, en revanche, compréhensible… Curieuse vengeance du destin : le fils de Michel, Jacques Audiard, a signé, dix ans après la mort de son père en 1985, un beau film intitulé « Un héros très discret », sur un type qui maquille son passé sous l'Occupation. Très discret : c'est ça, c'est exactement ça.

par François Forestier"
2017-10-12 14:35:37,Boulaouane1er,"La face noire de Michel Audiard
Sous L'OCCUPATION, le dialoguiste culte des « TONTONS FLINGUEURS », dont paraît un roman inédit, écrivait dans la presse COLLABORATIONNISTE et s'en prenait au « petit youpin Joseph Kessel »

Ce jeudi 5 octobre 1944, le temps est maussade. Les troupes soviétiques sont à Riga, les Américains avancent vers Aix-la-Chapelle, « l'Humanité » titre : « Le plus grand des peintres aujourd'hui vivants, Picasso, a apporté son adhésion au parti de la Résistance française. »Deux hommes montent dans les étages du 49, rue Raspail, à Bois-Colombes, un bel immeuble bourgeois. Les inspecteurs Leroux et Defrenet, « en présence de la concierge »qui a signalé que trois jeunes gens étaient venus puis repartis chargés de paquets, quelques jours auparavant, viennent se saisir d'un « ardent collaborateur », Robert Courtine. Celui-ci est un antisémite haineux, chroniqueur dans des journaux abjects comme « l'Appel » ou « Au pilori », sans oublier le « Pariser Zeitung ». Les pandores ne savent pas que Courtine a déjà fui à Sigmaringen, le château de la dernière chance. Quand la porte s'ouvre, les deux inspecteurs se trouvent face à un jeune homme au visage maigre, qui décline son identité : « Michel Audiard, né le 15 mai 1920, célibataire, étudiant. »Que fait-il ici ? Il est de passage. Où habite-t-il ? Chez ses parents adoptifs, 27 bis, avenue du Parc-Montsouris, dans le 14e  arrondissement de Paris. Pourtant, il a les clés de la demeure de Robert Courtine ? Oui, car c'est ce dernier qui lui a permis de « passer quelques contes et nouvelles dans “l'Appel'' ». A tout hasard, on emmène le dénommé Audiard Michel au commissariat. Après un sommaire interrogatoire par le commissaire Thévenin, une enquête de voisinage est menée. Les réponses sont positives, on le relâche. Courtine, lui, sera arrêté en 1946 en Italie, condamné à dix ans de travaux forcés, puis, constatant que la carte de journaliste ne peut être délivrée aux anciens collabos, se consacrera, sous le nom de La Reynière, à l'une des deux activités journalistiques qui ne nécessitent pas cette carte : la gastronomie (l'autre étant la rubrique des mots croisés : Max Favalelli, ex de « Je suis partout », choisira cette voie). Rien n'est retenu contre Michel Audiard, remis en liberté. Il enfourche sa bicyclette et s'en va.

BIO
Né en 1920 à Paris, MICHEL AUDIARD est devenu le plus célèbre des scénaristes-dialoguistes du cinéma français, avec des films comme « les Tontons flingueurs » ou « Ne nous fâchons pas ». Il a signé plusieurs livres dont « la Nuit, le jour et toutes les autres nuits ». Il meurt en 1985, à Dourdan (Essonne).

Audiard, le petit cycliste. Toute sa vie, il entretiendra cette image : celle d'un gamin penché sur son guidon pendant les années noires, uniquement préoccupé de trouver quelques patates, un peu de beurre, et employé, au hasard, à la distribution de journaux. Etudiant ? Pas vraiment. Il raconte des fariboles. Il est vrai qu'on l'aime bien, Audiard : sa gouaille, sa verve, son talent lui valent des biographies chaque année, des bouquins de citations, des « best of » où sont compilées les meilleures répliques de sa centaine de scénarios. Dans les dîners de copains, on cite volontiers « les Tontons flingueurs »(« Les cons, ça ose tout. C'est même à ça qu'on les reconnaît »), ou « les Grandes Familles »(« Dix couples chez toi, c'est une réception… Chez moi, c'est une partouze ! »). Flingué par la Nouvelle Vague qui lui reprochait son goût de la métaphore vacharde et des mots d'auteur (« Vous me haïssez, moi je vous emmerde »), porté aux nues par les cinéphiles amateurs de cinoche français, Audiard est une célébrité populaire, un p'tit gars bien de chez nous, qui, en plus, a signé des livres sympathiques (« le Terminus des prétentieux », « la Nuit, le jour et toutes les autres nuits »).

Les bureaux de « l'Appel » décorés d'affiches antisémites. En 1943, Michel Audiard écrit des nouvelles pour ce journal collabo (ci-dessous).

« LA CONJURATION DES SYNAGOGUES »

Un nouveau roman, visiblement inachevé, paraît aujourd'hui chez Fayard : « le Chant du départ », curieux mélange de souvenirs (un peu faux, un peu vrais) et de considérations sur des personnages pittoresques – Alban de Mérovie, le Kid, Wynn Cabot, Véra Varlope – qui se baladent dans un Montparnasse menacé par les bulldozers. D'où sort ce livre ? Allez savoir. D'un tiroir, sans doute, vu que c'est une succession brinquebalante d'anecdotes et de remarques où passent « un cocu talmudique »et « les images pieuses qui ont bercé vos croyances : Monsieur Résistant, Monsieur Maquisard, Madame Frémissante, Mademoiselle Swing…». Comme l'auteur, les biographes glissent rapidement sur les années de guerre, peu documentées, pour s'attarder sur une carrière de scénariste exceptionnelle. Quelques lignes dans les livres, à peine, par-ci par-là, sur l'Occupation. Or, dans le numéro 20 de « Temps noir », excellente revue des littératures policières, le rédacteur en chef, Franck Lhomeau, livre quelques éléments, soigneusement dénichés dans les archives, avec méticulosité. Et, d'un seul coup, on est loin du vélocipédiste à mégot et casquette.

« Avant d'attaquer le grand lamento des années vertes, j'aimerais que les jeunes gens d'aujourd'hui sachent combien ils ont été blousés. Et pas qu'un peu ! L'Histoire telle qu'on la leur raconte, les films qu'on leur montre, les récits estampillés “vécus”, les témoignages, les “Mémoires”, surtout, tout ça bidon ! », s'exclame Audiard dans « J'étais un gosse sous l'Occupation », interview publiée dans « Paris Match » le 18 août 1978. Franck Lhomeau relève les contradictions : « D'abord, il n'était pas gosse. Et ensuite il publiait dans les journaux les plus collabos de l'époque. »Dans « Chantons sous l'Occupation », d'André Halimi, Audiard en rajoute : « Je faisais du vélo, je portais les journaux, mais si c'est ça la collaboration, tout type qui a touché un salaire a collaboré, si on va au fond des choses…»Allons-y, au fond des choses.

"
2017-05-12 11:13:27,dAdanedhel,"&gt; Ho oui youpin

CCPT "
