date,author,text
2022-08-05 09:23:40,eeeklesinge,"Le père, oui. Il a été collabo, a écrit dans la presse [collabo](https://www.lemonde.fr/idees/article/2017/10/26/michel-audiard-collabo-impenitent_5206005_3232.html) pendant l'occupation, écrivait des personnages de juif caricaturaux ultra abusés, traitait Kessel de [""petit youpin""](https://fr.wikipedia.org/wiki/Michel_Audiard#La_guerre), et à soutenu des oeuvres antisémites avec des textes tels que : 

&gt; « Le monde qu'il est convenu d'appeler ""artistique"" et qui demeure dans sa majorité le plus coquet ramassis de faisans, juifs (pardonnez le pléonasme), métèques, margoulins… »

Ce mec est une énorme merde."
2022-05-27 17:04:25,RoninCanard,"Qu’est ce que ce paragraphe dit de plus que les tags qui sont retranscrits : ""Université raciste, chercheurs bourgeois on vous voit"", ""1 blanc, 1 balle"", ""brûlons le TGI"", ""Charlie l'a mérité"", ""les prisons en feu, les matons au milieu"", ""youpin décolonial"", ""nik les cis"", ""stop les sciences coloniales"".

Leurs « arguments » ça se résume à ça en fait et c’est les premiers mots de l’article donc on avait compris sans les explications d’Arthur que ce sont de gros débiles, c’était pas la peine d’en rajouter."
2022-05-26 19:46:20,ChadRobespierre,"La grande école des sciences sociales est traversée par de violents conflits. En avril, ses nouveaux locaux ont été saccagés par des étudiants.

""Université raciste, chercheurs bourgeois on vous voit"", ""1 blanc, 1 balle"", ""brûlons le TGI"", ""Charlie l'a mérité"", ""les prisons en feu, les matons au milieu"", ""youpin décolonial"", ""nik les cis"", ""stop les sciences coloniales""... Sur les sept étages du bâtiment de l'Ecole des hautes études en sciences sociales (EHESS), installée sur le campus Condorcet à Aubervilliers (Seine-Saint-Denis), des tags en lettres rouges ou noires délivrent des messages souvent rageurs et haineux, parfois contradictoires ou nébuleux. ""Nous sommes en train de les recenser et de les photographier pour en faire un objet d'étude"", expliquait la direction juste après l'occupation des lieux, du 20 au 23 avril dernier. Dans un document interne, on déplore les portes défoncées, les casiers forcés, le matériel informatique volé et un coût financier qui se chiffrerait à plusieurs centaines de milliers d'euros. D'après Christophe Prochasson, le président de l'école, deux cocktails Molotov - ne contenant aucun liquide - ont également été retrouvés sur le toit du bâtiment. Un mois plus tard, au sein de l'établissement, la même question revient, taraudante : comment en est-on arrivé là ? Ces actes de vandalisme interviennent à un moment où l'éminente institution, longtemps considérée comme le saint des saints des sciences sociales, connaît des difficultés sans précédent. Tourmentée par une sourde rivalité entre étudiants en master et doctorants, rongée par une bataille idéologique virulente, l'EHESS est entrée en crise. 

Il y a trois ans, l'inauguration du campus Condorcet, rendue possible par la vente d'une bonne partie des locaux du siège historique du boulevard Raspail, dans le VIe arrondissement de Paris, était censée donner un nouveau souffle à l'école. Cet ensemble de bâtiments tout neuf, récemment sorti de terre dans le cadre du Grand Paris, a été conçu pour regrouper 11 institutions réputées dans le domaine des sciences humaines et sociales. Mais la greffe a du mal à prendre. A côté des revendications du mouvement étudiant de l'entre-deux-tours de la présidentielle - dont la prise en compte des enjeux sociaux et climatiques par Emmanuel Macron et Marine Le Pen -, le nouveau site cristallise les critiques formulées par les ex-occupants de l'EHESS. Dans une lettre ouverte publiée le 26 avril dernier, ces derniers fustigent ""ce grand projet de spéculation immobilière, de gentrification et d'éloignement des classes populaires"". Le texte dénonce aussi des ""caméras à tous les coins, balises, barrières, douves renforcées de barbelés et buissons épineux, vigiles avec chiens, badges limitant l'accès à la plupart des espaces"" sur le campus, et pointe du doigt l'absence de lieux spécifiquement dédiés aux rencontres et aux échanges entre étudiants au sein de l'Ecole.

Romain Huret, directeur d'études à l'EHESS, entend une partie de ces critiques. ""Depuis notre arrivée, bon nombre d'entre nous s'attellent à rendre le bâtiment plus agréable et plus convivial, mais cela ne peut se faire que sur la durée, reconnaît-il. D'autant que l'on s'est heurtés à pas mal de difficultés, entre la grève des transports de 2019, les deux années de Covid qui ont suivi, puis cette occupation dont on mettra sans doute des mois à se remettre."" Le corps enseignant apparaît divisé sur l'analyse de la situation, la manière de réagir et les mesures à adopter. ""Il est heureux que les étudiantes et les étudiants se révoltent et tentent de changer le cours des choses [...]. Comme aurait dit Bertolt Brecht, qu'est-ce qu'une vitrine cassée face à des vies fracassées, qu'est-ce que quelques milliers d'euros de dégâts face à des milliards d'investissement immobilier qu'a coûté ce putain de campus Condorcet ?"", interroge le chercheur Alessandro Stella - un ancien activiste italien d'ultragauche - dans une lettre adressée aux étudiants, à ses collègues et à la présidence. Une enquête a été ouverte, et Christophe Prochasson a porté plainte au titre de l'institution et à titre personnel contre les casseurs. Mais le Syndoc, syndicat des doctorants de l'EHESS, qui condamne les dégradations, de préciser : ""Nous demandons qu'il n'y ait pas de répression disciplinaire individuelle car il paraît difficile d'établir la responsabilité pénale de chacun.""

Le mal-être des étudiants en master

Pour sa part, Jean-Frédéric Schaub, directeur d'études à l'EHESS, éreinte ""ceux qui, pour des raisons politiques et sentimentales, font preuve d'indulgence à l'égard de ce mouvement"", car ""tout cet argent cramé par ces destructions aura des conséquences très concrètes sur nos travaux de recherche et un certain nombre d'autres projets"", poursuit-il. L'historien et chercheur au CNRS Sébastien Fath, lui, n'hésite pas à s'en prendre directement aux auteurs des dégradations. ""Détruire un outil de travail d'étude et d'émancipation intellectuelle n'est pas la meilleure manière de plaider pour l'avenir"", attaque-t-il, avant de se demander si ""une certaine fermentation mêlant gauchisme bourgeois, nihilisme consumériste et illettrisme économique (focalisé sur l'épouvantail néolibéral) n'a pas cristallisé les choses."" Beaucoup s'interrogent sur le nombre réel d'élèves de la maison impliqués dans le blocus et responsables des dégradations. ""Je dirai qu'il y avait un gros tiers d'étudiants venus d'autres universités, un tiers de black blocs ou casseurs, et un petit tiers d'étudiants de chez nous"", avance Christophe Prochasson. Signe d'un vrai malaise."
2021-11-28 05:57:06,Whismirk,"Youpin c'est dans le dictionnaire, ça veut dire qu'on légitime l'antisémitisme ?"
2021-10-04 09:21:45,zabrowski,"Je pense qu'il y a les deux. D'un côté le sale blanc pour moi c'est d'abord parce que y'a pas vraiment d'insulte raciste sur les blancs (contrairement à bougnoule, youpin ou autre) mais le fait est qu'ils s'en prennent aux blancs car ils se font une idée particulière de ce qu'est un blanc (que ca soit en terme de personnalité, fragile, ou de niveau social, bourgeois).
On parle tellement que de racisme systémique aujourd'hui (ce qui est bien) qu'on oublie que le racisme peut être juste individuel.
Ceci dit, le racisme doit bien moins jouer que la masculinité toxique de certains.

Edit: et ouais, Guillotiere ça s'est ultra aggravé depuis quelques années. Y'a 10 ans c'était pas aussi craignos (je dis ça en étant Lyonnais depuis ma naissance et ayant habité la guille pendant 3 ans juste à côté de la place du pont)."
2021-01-21 12:48:54,Cour4ge,"en cherchant le numéro je suis tombé sur ce commentaire lol

&gt; Une Konnasse de première qui me propose de mettre un compteur LINKY à la place de mon ancien compteur.
Je leur ai dit que j'ai pas envie de finir griller comme un youpin.
Alors j'ai dit que leur proposition était nauséabonde et me rappelait les heures les sombres de l'histoire.
Mais que le pognon, les lingots d'or et les tableaux de maîtres devaient tous me revenir en tant qu'héritier légitime.
M'enfin, je vais pas me gêner pour prendre l'argent là ou il est !!"
2020-09-18 00:26:09,I_MELT_STEEL_BEAMS,"Le mot ""nègre"" est tout aussi offensant que ""youpin"", il est temps d'accepter que certains mots ont un poids et qu'on peut les ranger avec le reste du répertoire colonial."
2020-07-06 21:28:16,Ingepierce,"Malheureusement, les trucs racistes étaient pas combinés dans les listes que j'ai trouvé. J'avais du nègre, du youpin, du bougnoule, etc .., mais pas grand chose de composé. 

Après vérification j'avais bien ""sale arabe"", ""sale nègre"", et ""sale noir"", mais puisque ""sale"" n'était pas utilisé dans d'autres injures, ce petit groupe s'est retrouvé déconnecté du reste du graphe, et j'avais la flemme de rapprocher tout ce beau monde manuellement pour que ça apparaisse dans l'image. Dans le même genre il y avait le groupe ""tronche de cake"" et ""tronche en biais"" (?) qui n'ont pas la chance de faire parti de ce graphe. (je ne vais pas tous les citer, mais il y en avait pas mal, d'où la flemme)"
2020-06-16 19:16:44,LeMoineEnSlip,"Mouais. 
Négroïde, ça reprend les théories racialistes passées et c'est censé décrire l'apparence physique d'une personne (d'un noir).
Youpin, ça veut juste dire juif.

Penser que ces deux mots sont équivalents dans leur usage est plutôt malhonnête, intellectuellement. Même si on se doute que c'est pas fait avec les intentions les plus pures.

 /enculagedemouche"
2020-06-16 11:08:04,SuperMoquette,"C'est un synonyme péjoratif.


C'est comme dire qu'un juif est un youpin. C'est le même sens (juif) mais c'est péjoratif. Negroide était utilisé ya des siècles par des racistes."
2020-04-04 20:21:46,WearyVersion,"Les commentaires sont effarants! Ne soyez pas raciste, soyez comme Mario. Un plombier rital, conçu par des niakoués, qui parle rosbeef, ressemble à un chicanos, saute comme un bamboula et attrape des pieces comme un youpin !"
2020-01-24 17:43:28,ethelward,"Ah ouais, aller casser du youpin et/ou du judéo-bolchévique c'est clairement pas un truc de droite ça."
2020-01-15 23:41:59,KafkaDatura,"Perso je suis d'origine juive et le mot ""youpin"" j'en peux plus, alors même que je vis à l'étranger."
2020-01-14 18:18:51,bad_werewolf,"Le mot pédé, c'est comme le mot en ""N"" pour les noirs. Être là référence négative n'est jamais un compliment. C'est comme dire ""Jésus est un Youpin"". C'est vrai sur le principe, mais on utilise le mot Youpin, et pas Juif..."
2019-08-28 13:35:26,LarryBeard,"&gt; J’assume, j’endosse tout. Tout ce que j’ai fait à l’époque avec trois ou quatre cons, on était des types complètement paumés. J’écrivais, je dessinais, je produisais de la merde. Ces textes et ces dessins sont antisémites, mais je ne suis pas antisémite.

J'ai un doute sur le fait qu'il assume. On assume pas en démentant avant d'avouer suite au larguage de preuve qu'il a pris dans la gueule.

Il déclarait hier à l'Express à propos des dessins et des textes :

&gt; ""Je me suis strictement borné à faire les dessins. Je n'ai participé à aucun texte."" 

Il assume beaucoup.

.

J'aime pas BHL mais le Moix il allait loin :

&gt; ""ce youpin dont le crâne n'a hélas pas été rasé par les amis d'Adolf""

Sans oublier qu'il a participé à une pétition contre la loi Gayssot car :

&gt; “Le fait qu’Auchswitz ait besoin d'un tribunal pour avoir une légitimité dans l’histoire m'effraie. Blanrue le savait puisque je venais de participer à des débats sur la question. Un jour, il me contacte et m’affirme qu’il a déjà les signatures de Pierre Nora et Robert Badinter. J'ai donc donné mon accord.”

Avant de se retracter car il voulait pas voir son nom associé à Faurrisson. Cependant, voila ce qu'il disait à une amie :

&gt; ""Chacun sait, ô Marie, que les camps de concentration n'ont jamais existé."" 

Je fini sur ce qu'il disait à propos de [Nabe](https://www.lesinrocks.com/2015/09/29/actualite/actualite/mais-qui-est-yann-moix-le-nouveau-chroniqueur-don-nest-pas-couche).

&gt; “On peut côtoyer des antisémites pendant des années sans savoir qu’ils le sont parce qu’eux-mêmes ne le savent pas. Nabe adore se faire détester par ses amis.”

Assez comique quand on voit l'historique du déchet qu'est Moix."
2019-03-04 13:59:43,aegirs,"«S'ils ont compris tous les clichés Ça f'ra d'la bidoche pour l'armée... Les partouzeurs de miss métro Patrouillent au fond des souterrains Mais ils rêvent d'être en hélico À s'faire de nèg' et du youpin...» :

https://youtu.be/hbdaKpsfZH4

Plus sérieusement, je compatis. Si tu es sont seul contact proche qui ne soit pas dans son état d'esprit, le seul truc que tu puisses faire, à mon avis, c'est de garder au maximum le contact et voir lui faire rencontrer des gens autres. Aller au clash serai pire que tout, mais il ne faut pas lui cacher le fait que tu n'es pas d'accord avec une partie de sa vision des choses."
2019-02-18 10:54:46,televisionus,"&gt; Au lieu d'insulter les homosexuels, on insulte une autre catégorie de la population ou d'animal pour compenser. 

""Ahah sale youpin de merde, je vais te la faire bouffer ta coquille bleue de negro."""
2019-02-13 14:53:34,Meneldyl,"&gt; Sauf que quand tu n'es pas de la bonne couleur ou du bon genre tu en reçois encore plus des communautées en ligne

Je suis à peu près sûr que tu n'as aucune preuve pour affirmer cela, autre qu'un avis pré-construit. J'entends ça régulièrement, sans jamais que quelqu'un se donne la peine de montrer que c'est vrai.

Internet, c'est un putain de défouloir, depuis que c'est devenu grand public. Quels que soient ton origine, ta couleur de peau, ton taf, tu vas potentiellement en prendre plein la gueule, en fonction de ton lectorat. Je vois pas ce qui te permettrait de dire que les femmes, ou les blacks, ou les arabes, en prennent plus dans la gueule que le fameux mâle blanc hétéro. Par contre, ce qui est sûr, c'est qu'il y a moins de tolérance pour les insultes racistes et sexistes. Un ""connard"" passe inaperçu, au contraire d'un ""salope"" ou d'un ""sale youpin"".

Là, en l’occurrence, sur les réseaux sociaux et les forums, je suis à peu prêt persuadé que Chièze en prend largement plus dans la tronche que la nana qui a écrit ce papier. C'est une figure connue et polémique, qui aime se mettre en avant. Sauf que si je le traite de ""petit vendu à la face de rat"", personne ne réagira. Alors que si je traite une twittos de ""salope"", il y aura fort à parier qu'il y aura un drama dans la seconde, avec brigadage et dénonciations à tout va.

Le problème, c'est qu'on assiste maintenant à la confrontation entre la culture geek trash qui a proliféré sur le Net depuis le milieu des années 2000, et qui s'est construite sur les blagues grasses, sexistes et racistes, et des utilisateurs qui non seulement n'adhèrent pas du tout à cet humour, mais sont obsédés par les théories de social studies anglo-saxonnes. Donc le clash violent est inévitable.

Et, attention, je parle que du versant réseaux sociaux. Evidemment que le machisme et le harcèlement touchent beaucoup plus les gonzesses dans le milieu professionnel. Ce qui est arrivé à cette personne est gerbant, même si ça ne m'étonne pas."
2019-02-01 16:28:27,Aspasie,"""Enculé"" c'est *offensive* ou pas comme insulte ?

J'ai banni il y a fort longtemps ""pédé"" et autres saloperies homophobes de mon vocabulaire, si on y réfléchit ça a à peu près la même valeur que ""nègre"" ou ""youpin"". Mais enculé, c'est quand même sympa, et puis est-ce vraiment homophobe ? Les homosexuels n'ont pas le monopole de l'anal. "
2018-11-28 09:20:10,xdadrunkx,"je connaissais pas ce site

un titre pris au hasard pour les curieux :

""L'avocat de Mélenchon dénonce le petit youpin sodomite Gabriel Attal, nommé au gouvernement parce qu'il baise avec le conseiller de Macron.""

C'est quand même chaud d'appeler le président de la république par son nom de famille, faut rien avoir à perdre."
2018-11-25 12:43:18,granddemocrate431,"Je parle Chinois, merci de me donner des leçons. Il y'a plein de combinaisons de caractères qui peuvent se prononcer ""Youpin"" si tu ne mets pas les tons."
2018-11-25 11:39:18,Titibu,"[youpin](https://youpin.mi.com/) etant le nom de l'ensemble des produits electroniques GP sous la marque de Xiaomi, il va falloir s'habituer."
2018-11-25 11:12:48,Demo_Gorgo,"enfait  油品  ça veut dire ""produit pétrolier"" [https://translate.google.fr/?hl=fr#auto/fr/youpin](https://translate.google.fr/?hl=fr#auto/fr/youpin)  "
2018-11-25 10:54:17,Demo_Gorgo,En Anglais Bite veut dire morsure. En Allemand Pute veut dire dinde. Ca veut dire quoi Youpin en chinois ?
2018-11-23 14:42:53,Meneldhil,"Newsflash : il y a plein d'arabes parmi les gilets jaunes.

Ce qui ne veut pas dire que ce sont des arabes qui ont traité la nana de youpin. Parce que, newsflash 2 : l'antisémitisme a le vent en poupe, notamment chez les 15-30 ans fans de Dieudo/Soral et les vieux qui passent leur temps sur les réseaux sociaux à lire de la merde."
2018-11-19 07:34:45,error404brain,Les contre pouvoir c'est surtout là pour empecher les président de se déclarer dictateur ou de mettre les black/bougnoules/youpin/babtous/... dans les fours.
2018-10-19 00:25:45,666millionsofgoats,"Putain les grosses barres quand tu lis les titres des articles sur le site.

&gt;Rendant obsolètes les caricatures antisémites, Macron nomme ministre une youpine d’une laideur proprement infernale

&gt;L’avocat de Mélenchon dénonce le petit youpin sodomite Gabriel Attal, nommé au gouvernement parce qu’il baise avec le conseiller de Macron

&gt;La mulâtresse royale enceinte de la Créature des Îles, le terrible Duc de Sussex dont les lyrics font déjà trembler la scène hip hop

&gt;L’ignoble rappeur nègre IT se met en scène en train de transformer en pute l’Impératrice Aryenne Melania Trump

&gt;La soeur café-au-lait de Varane proclamée nouvelle Miss Nord-Pas-de-Calais malgré sa gueule libano-antillaise difforme

&gt;La grosse pute à nègre narcissique Lucile Joseph annonce qu’elle va bientôt déféquer son négrillon, libérant l’Europe de sa génétique déficiente

C'est horrible mais je vois sincèrement pas comment réagir autrement qu'en éclatant de rire quand tu lis des trucs pareils. "
2018-10-04 23:39:38,Maccullenj,"&gt; On est en plein dans le sujet de qui crée le ghetto : celui qui est dedans ou celui qui est dehors ? (réponse : les deux)

Je reconnais que c'est pertinent comme remarque.

Mais la réponse qui me parait évidente, c'est que le plus facile à bouger, c'est la plus petite masse.

Alors attention : je ne suis pas en train de recommander de supprimer la particularité, hein ?

Je crois par contre que, pour sortir du ghetto, il faut accepter de s'intégrer dans le mainstream. Ca veut dire, entre autre, cesser de se positionner comme différent, quitte à bouffer de la remarque hostile.

Soyons honnêtes : On en est plus à Stonewall. Aujourd'hui, se faire taxer de pédé online n'est guère différent que de se voir appeler nègre ou youpin : ça émane d'une minorité rétrograde sur laquelle la majorité chie (cf toutes les élections françaises depuis WW2), et qui n'a pas pigé que ses enjeux étaient d'avant-hier.

En clair : si ton propos relève du cul, aborde le dans le poteau du Lundi Sexy (cuz of ze children, amirite ?). Sinon, accepte-toi en tant que redditeur de base, et poteauises sur /r/france, comme tout le monde."
2018-08-02 18:08:47,elcapitalismoforaneo,"Re,  
J'ai prit un peu de temps pour refléchire a tout ca et selon mon point de vue on a tous les deux raison mais surtout toi  
  
Toubab n'est pas raciste en tant que tel.  
  
Tout est dans la manière et la situation. Et effectivement je n'ai pas prit en compte cela. Ca peut etre dit de manière totalement normale sans arrière pensée contrairement a negro ou youpin. De meme que renoi ou feuj.  
  
Merci pour la discussion ca m'a fait reflechir et desolé si je me suis enflammé   "
2018-08-02 12:05:25,Rokil,"Je pense qu'il voulait écrire ""youpin"", qui est un terme insultant pour ""juif"""
2018-08-02 09:28:24,JohnConnard,"Certes, mais ça ne change rien au fait que babtou n'est pas un terme particullièrement péjoratif à la base. C'est le verlan de toubab qui est (était ?) utilisé en Afrique principalement pour désigner les blancs. Blancs étrangers certes, mais bon en Afrique les deux vont de pair.  
C'est la même chose que dire renoi/reubeu/feuj, c'est pas la même chose que bicot/négro/youpin, c'est pas parce que tu parles en verlan que d'un coup tu dénigres. Personnellement, à moins qu'on y associe un contexte ou des qualitficatifs péjoratifs, je ne vois pas vraiment de caractère insultant.  
On est d'accord que c'est des termes ""explosifs"", à manier avec une infime précaution.
"
2018-08-02 09:26:06,elcapitalismoforaneo,"Clairement négro et youpin c'était pour faire réagir  
  
C'est un terme inutile en soi. C'est comme dire a un mec: ""t'es un pakpak"" Ca ne se fait pas en vrai    
  
Ca sert a rien a part a être limite condescendant  "
2018-08-02 09:23:10,basara,"[Serious] Quand quelqu'un pousse le debat pour avoir le droit d'utiliser les termes : negre, youpin et negro on a pas le droit des les qualifier de raciste ? 

Une personne utilisant des termes raciste peut être considéré comme raciste, ca ne constitue pas une attaque. 
Ce serait comme dire que c'est une attaque de qualifier quelqu'un de communiste si il veut mettre en commun les moyens de production."
2018-08-02 09:14:01,Iddys,"Mais les Irlandais étaient pas appelés ""babtou"" quand ils étaient esclaves, si ? Alors pourquoi le mot babtou devrait être un mot oppressif ?
Je te parles d'oppression parce que des mots comme youpin ou négro SONT utilisés de façon oppressives à 99% dans des contextes racistes, ce qui n'est pas le cas de babtou."
2018-08-02 08:56:11,basara,"Encore une fois tu melange tout.

JP est un musicien, il est renoi. JP est est un musicien c'est un babtou.
Ces deux phrases sont politiquement correctes. 

JP est un musicien, c'est un negro. JP est un musicien c'est un youpin, JP est musicien c'est un sale babtou.
Ces phrases ne sont pas politiquement correctes.



Les jeunes etaient ignorants et prejudiced. Je vais meme pas me lancer dans le debat du racisme qui doit etre inscrit dans un systeme d'oppression avec toi, I have nor the time nor the crayons to explain that shit to you.

"
2018-08-02 08:46:15,shalli,"Babtou c'est pas péjoratif pour moi, c'est rentré dans le langage courant comme rebeu, renoi ou feuj.

Négro et youpin c'est non, évidemment."
2018-08-02 08:34:28,elcapitalismoforaneo,"TOUBAB EST PEJORATIF A PART DANS TA TETE  
  
Voula je peux faire pareil. C'est relatif et moi je trouve ca pejoratif comme bon nombre de blancs qui ne souhaite pas se faire appeler babtou ou toubab mais blanc. Comme un noir souhaite se faire appeler noir et non pas black/nigga/et j'en passe   
  
Comme tu dis que t'aime bien, moi j'aime pas.   
  
Et oui ca renvoi a l'époque coloniale. ""Ah mais c'est un babtou lui"" ça sous entend quoi? C'est un compliment peut être ?    
  
Ok pour negro et youpin 

  
"
2018-08-02 08:26:46,basara,"Mec faut que t'arrêtes d'inventer des trucs pour accompagner ton discours. 
&gt;Toubab est pejoratif car il renvoi la personne et sa couleur a l'époque coloniale

Wut ??

Alors deja renvoyer a l'epoque coloniale ???? The fuck you're talking about ? Il est ou le rapport avec l'epoque coloniale ??? Et encore une fois, j'ai l'impression qu'il faut le repeter. **TOUBAB N'EST PAS PEJORATIF A PART DANS TA TETE**

&gt;ces termes sont inadaptés et qu'on a des mots adaptés pour parler des coulejrs de peau

Tu trouves ces mots pas adaptes. Perso j'aime bien toubab, feuj et renoi. C'est des mots avec lesquelles j'ai grandi et **QUI NE SONT PAS PEJORATIFS** contrairement a youpin et negro. Donc arretes d'essayer de les mettre au meme niveau.

&gt;C'est juste pour faire une equivalence. En vrai je ne les utilise pas. Mais je demande pourquoi est-ce normal pour tous de ne pas utiliser ces mots mais est-ce normal pour toubab

Parce que toubab n'est pas pejoratif alors que youpin et negro oui. Utilise renoi et feuj si tu le souhaite, aucun probleme.

"
2018-08-02 08:22:47,elcapitalismoforaneo,"La différence pour moi c'est que renoi c'est que du verlan. Et babtou renvoi la personne a l'epoque coloniale et ce que sa couleur impliquait. Sinon on parlerai simplement de blanc tu vois.  
  
C'est pareil la. Je dis noir si je respecte les gens, et je dirai négro si je veux connoter mon terme et les renvoyer au statut de l'epoque    
  
Mais ok pour youpin et négro je comprends bien que c'est pas correct.  
Je trouve babtou non correct egalement "
2018-08-02 08:15:28,basara,"Mec t'ouvres pas un debat. T'essaie de legitimiser ton utilisation de terme raciste.

Depuis le debut de la discussion, tu dis ""Si les gens disent babtou, je peux dire youpin et negro""

Deja j'aimerai bien comprendre ce qui te pousse a vouloir utiliser des termes racistes si tu ne l'es pas ?

Et deuxiemement tout le monde te dit que babtou **n'est pas un terme pejoratif**"
