date,author,text
2021-07-20 09:33:33,Bandolinho2,J'ai pratiqué une forme de scatophilie indirecte :(
2021-06-05 20:34:35,Trashismysecondname,"&gt;J'en ai vue de la scatophilie donc non c'est pas parce que je m'intéresse pas à cette merde que je suis jeune

Two girls one cup est extrêmement connu. C'est un meme internet, et une référence très très connue. généralement les gens qui ne connaissent pas sont les plus de 40 ans ou les moins de 12.

&gt;Peut-être que c'est parce que les gens associent bonheur à argent oui mais en tout cas pas moi on m'a répété 400 fois que le bonheur c'était pas l'argent

L'argent n'est pas du bonheur, mais c'est plus facile d'être heureux quand t'as pas à te soucier de tes factures. 

&gt;Bon on arrête de toute façon avec mon père qui balançait du bullshit quand il été bourré

Hein ? Pourquoi tu parles de ton père ? Je m'en branle.

&gt;mais voilà j'ai juste L'IMPRESSION que penser/croire (ou je sais pas quel verbe) que la vie n'a pas de sens ça peut rendre triste

Mais... La vie n'a pas de sens. Ça n'a pas de but la vie. La vie c'est une courte période d'existence entre 2 éternités d'inexistence. 

&gt;faire voir la vie en plus fade et que ça peut vraiment empirer les choses quand quelque chose de mal arrive dans la vie

Pas vraiment non. La vie n'a pas de but, pas de sens, donc chaque choses peut être considéré comme une chance, comme une occasion. Comme un plaisir. Vu qu'on n'y goûtera qu'une seule fois.

&gt;Et que kurzegstat contribue à ça c'est absurde si tu veut mais j'ai L'IMPRESSION que ça peut-être le cas

Tu me fais vraiment peur là. Tu accuses Kurzegast de donner des faits ? De décrire la réalité ? 

La réalité est absurde. Les gens rationnels le savent. Une vidéo de Kurzegast ne va pas changer le monde. 

Le problème de l'absurde et du sens de la vie c'est vieux. Tu peux lire Camus ou Cioran si tu veux te documenter.

Je comprends vraiment pas ton délire."
2021-06-05 19:59:00,monsieurdusel,"(Si t'en a marre dit le,  j'ai eu une altitude un peu irrationnelle là)
Flemme de continuer peut-être demain

Et ""si t'es doué en argumentation d'argumente pas"" hein???

Bon au fait jvait continuer

Je croyait que one cup two girls c'était un truc de lesbienne un peu dégueulasse et donc sans trop d'intérêt J'en ai vue de la scatophilie donc non c'est pas parce que je m'intéresse pas à cette merde que je suis jeune 

""faut être heureux dans la vie"" c'est sûrement capitaliste Peut-être que c'est parce que les gens associent bonheur à argent oui mais en tout cas pas moi on m'a répété 400 fois que le bonheur c'était pas l'argent

C'est toi qui a demandé pourquoi de base  mais appart ça t'as complètement raison. J'ai hâte de faire pareil sur Twitter

Si j'y vait

Bon on arrête de toute façon avec mon père qui balançait du bullshit quand il été bourré et moi qui pouvait pas dire grand chose (quand je disait quelque chose) pour qu'il arrête de faire des conneries (je me fesait tout le temps rétorquer par des absurdités) je suis vraiment pas fait pour devenir un mec qui fait des débats T'AS VU J'AI DU LORE LOL
 mais voilà j'ai juste L'IMPRESSION que penser/croire (ou je sais pas quel verbe) que la vie n'a pas de sens ça peut rendre triste, faire voir la vie en plus fade et que ça peut vraiment empirer les choses quand quelque chose de mal arrive dans la vie Et que kurzegstat contribue à ça c'est absurde si tu veut mais j'ai L'IMPRESSION que ça peut-être le cas

Je vait voir feldup amuse toi a démonter ce que tu veut et si t'en a marre dit le"
2021-05-23 10:08:17,StupLapinou,"J'ai pas pu m'empêcher de trouver ça sympatique.

Mais en même temps j'ai vomi. 

C'est sympativomi, une drôle de sensation... ça doit se rapprocher de la scatophilie un peu."
2021-04-07 12:13:37,NiqueurDeMachine,"Quand tu vois ce que les saoudiens viennent faire quand ils sont de passage à Dubaï ... Scatophilie, zoophilie, pédophilie, pour un pays ultra religieux c'est le comble, vaudrait mieux nuke tout ceci"
2020-05-05 20:30:16,Analbator,"Slate, Albert Londres de la scatophilie."
2019-07-31 13:27:24,Cizzar,https://fr.wikipedia.org/wiki/Scatophilie
2019-06-18 16:26:06,A_Gnoo_Stick,"en effet ils ont le droit de s´embrasser dans la rue, tout comme moi j´ai le droit de dire que ca ne me plaît pas et que je préférer que ils le fasse dans un environnent plus privé !     
après en effet je ne vois pas ou il y aurais un problème a résoudre !?    
je n´ai jamais dit que c´est sale (ou est ce que toi tu sous entend que la scatophilie est sale ? selon moi ce n´est pas sale non plus, juste une préférences sexuelle dont j´ai pas envie d´etre temoin !)   
et si selon tes propos ca me qualifie d´office d´homophobe la en effet il y a un probleme !     
je n´ai aussi jamais dit que je voulais pas que il existe, si ils sont venu au monde comme ca ce n´est pas de leur faute, si ils ont choisie de le devenir c´est également pas un soucie et leur liberté de choix de vie que je ne critique meme pas !    
par contre le matraquage médiatique sur le sujet LGBT etc ca me fait un peu penser au vegan qui te pollue d´image d´abattoir etc pour te convaincre que c´est mal de manger de la viande...je m´en passerais bien !     
du coup justement des gens comme toi qui commence par mettre en question mon age ou ma maturité avant de commencer a avancer leur arguments et qui interprète mon opinion comme homophobe ne font selon moi pas avancer grand chose.    
et vue que ta l´air d´aimer le whataboutisme...d´ailleures c´est pas toi qui a commencer a me parler de ta peur des araignées !?    
les naturiste ont des endroits qui leur sont reservé car la majorité des gens ne trouve pas ca adéquat de ce promener a poile dans la rue (c´est meme punisable !) pourtant c´est juste un choix de vie et n´implique meme pas de pratique sexuelle, ce n´est pas sale (tes propos) non plus et pour autant ce n´est pas quelque chose qui est souhaiter en publique (et qui perso me dérangerais moins) !"
2019-06-18 15:37:12,A_Gnoo_Stick,"j´ai a aucun moment dit que j´en ai peur , je dit simplement que je n´aime pas voir ca mais que je trouve injuste d´etre qualifié d´homophobe a cause de ca !    
ce n´est ni une peur ni une haine et du coup donc pas une phobie (selon moi en ts cas).    
comme dans une autre réponse que j´ai donner ,on peu sinon parler de scatophilie si tu préfér ,j´aime pas non plus et ca me degoute également de le voir....ca fait de moi un scatophileophobe ?"
2019-05-16 07:39:31,Uncelebreinconnu,"Personnellement, dans ce genre de cas j'évite juste la scatophilie :

- J'évite de me mettre franchement dans la merde

- Je ne dis pas ""merde"" à la vie."
2019-05-10 14:25:52,Uni_Ksyr,"Scatophilie maintenant hein ?


Bon, je vais pas te kink shamer, *whatever floats your boat*."
2019-02-18 01:24:57,Mezziaz,Putain j'ai cliqué un lien et boum scatophilie juste avant de dormir sa race maudite
2019-01-13 20:55:55,Areat,"Non, ce sous-reddit n'est pas un sous-reddit sur la scatophilie."
2018-12-10 15:37:59,Mormuth,"Pourquoi y a-t-il autant de jetteauloin sur reddit ?

Je connais beaucoup de monde sur internet avec ce pseudo, ça contribue à mon existence en ligne avec des différences entre le mormuth des internet et le mormuth IRL mais il y a quand même un lien (au moins niveau mental à savoir intérêts, convictions, ressentis), le distingo se faisant juste sur l'anonymat. Du coup j'ai du mal à comprendre pourquoi utiliser des throw aways pour des choses pas si personnelles : évidemment que si j'ai comme passion secrète la scatophilie je le crierai pas sur tous les toits mais c'est un cas assez exceptionnel quand même."
2018-07-22 18:33:33,Truand2labiffle,"A savoir que les Ougandais ne sont pas de très grands fans de scatophilie non plus


https://youtu.be/yqrH2mYjW0o"
2018-06-28 17:19:57,auloinjet,"&gt; Limites : violence physique, scatophilie **et morve**"
2018-06-18 23:58:33,Galimesh,"Les pérégrinations du héros sont ponctuées de scènes notablement crues, où Apollinaire explore toutes les facettes de la sexualité avec une volonté évidente d'éclectisme : sadisme alterne avec masochisme, zoophilie, ondinisme et scatophilie avec vampirisme, pédophilie avec gérontophilie et nécrophilie, onanisme avec sexualité de groupe, saphismeavec pédérastie, etc. L'écriture est alerte, l'humour — noir au besoin — constamment présent, et l'ensemble du roman dégage une impression de « joie infernale », qui trouve son apothéose dans la scène finale."
2017-08-16 19:33:51,mogismecra,"Je suis allé sur leur site. Marrant le [réglement intérieur](http://www.campinglibertinlaroseraie.com/interdits-obligations.php) : ""Il est strictement interdit de pratiquer la Scatophilie dans « TOUT » le Camping"". C'est sur que ça change du camping des flots bleus !"
2017-08-03 07:26:52,lonezolf,"La sodomie, la scatophilie, l'inceste, ça va, mais les grandes écoles ça c'est VRAIMENT crade."
2016-09-11 09:13:09,Lebutazony,"Je cherchais un subreddit de porno Fr et je suis tombé sur r/France avec un avertissement comme quoi il avait de la scatophilie donc de suis resté \s

En vrai je me suis demandé à quoi ressemblait la commu fr de reddit donc je suis venu voir et je suis resté parce que vous êtes rigolos."
2016-03-05 16:58:24,Luk---,La scatophilie est épargnée. Ouf !
2015-10-28 17:53:38,LeSel,"&gt; On commence par pipi caca, la scatophilie et on continue sur l'homosexualité, on termine par l'euthanasie, en bref tout ce qui permet aux médias d'inverser les valeurs de notre société dont la propreté.  

 Ou bien :

&gt; Ce sont bien des idées d'adultes qui croient savoir ce qui se passe dans la tête des enfants. Donc on déballe tout, même le ""pipi-caca"", sous prétexte de tout, absolument tout expliquer ! Intérêt zéro. J'espère fermement que cette animation sera un bide total. Le rapport avec la pédophilie et l'homosexualité ? Il est pourtant évident : on montre des enfants (en images je pense, dans le cas qui nous occupe) dans une activité intime. Ce qui peut troubler un esprit faible et tenté déjà par la pornographie et pédo-pornographie ambiante. Ne dites pas le contraire : tous les spécialistes déconseillent fortement de poster des photos de ses enfants sur Facebook pour cette raison-là. Ceux qui ont des tendances pédophiles ont également la plupart du temps des tendances homosexuelles. Cela vous choque qu'on puisse dire cela ? C'est pourtant la réalité, et votre histoire de poutre et de paille ne changera rien à l'affaire ! Il faut revenir au respect des enfants. Les respecter, c'est respecter leur intimité, leur pudeur, leur droit de ""zapper"" certaines informations qui heurtent leur jeune intelligence. Les forcer à intégrer des informations inadéquates à contre-temps, c'est considérer qu'un enfant, c'est un adulte de petite taille, ce qui est faux et archi-faux : un enfant, c'est un adulte en devenir. C'est avec des idées comme ça que les adeptes de la pédophilie font passer l'idée, lentement mais sûrement, qu'un enfant a ""droit"" lui aussi au plaisir sexuel, comme un adulte, histoire de dédouaner les pratiques pédophiles. Pour finir, je dirai juste : les enfants, foutons-leur la paix !

"
2013-08-27 19:20:20,Hakim_Bey,"je n'ai pas de papier scientifique qui le prouve, mais je pense que le feeling général est que la pornographie stylisée permet une gradation dans le passage à l'acte. La plupart des gens qui ont des pulsions pédophiles n'ont pas de pulsions violentes, et comprennent bien que le passage à l'acte serait forcément violent d'une manière ou d'une autre. Donc la pornographie permettrait une forme de passage à l'acte ""léger"" qui ""défoule"" la pulsion plutôt que le ""je fais rien jusqu'à craquer et faire quelque chose de grave"". Encore une fois c'est juste ce que j'ai compris de mes lectures, je peux me tromper.

On peut par exemple comparer la proportion de gens qui se paluchent sur de la scatophilie, de la zoophilie et du BDSM hardcore avec la proportion de gens qui pratiquent vraiment ça dans la vraie vie...

edit: des mots"
