date,author,text
2020-01-04 02:23:52,keepthepace,"Y a de tout dans ce thread: du Boche-bashing (du boshing?) de l'apologie de la culture écolo outre-Rhin, des comparaison entre eux et nous, etc...

Oubliez pas de garder en tête [les stats qui comptent et leur évolution](
https://data.worldbank.org/indicator/EN.ATM.CO2E.PC?locations=US-FR-SE-DE-CN-RU).

Perso je trouve ça bien: comme nous, et la pluaprt de l'UE, les Allemands sont dans une pente décroissante en terme de CO2 émis par habitant. Y a pas une seule solution miracle, chaque pourcent gagné sera une bataille.

Ils baissent les prix des billets de train, c'est bien, on devrait faire pareil.

Oui, ils ont des centrales à charbon et ça reste leur plus gros problème.

Nota: si vous voulez ajuster le CO2 par rapport à la balance commerciale (i.e. compter la pollution causée par ce qu'on importe) il faut rajouter +30% à la France et +10% à l'Allemagne, ça diminue l'écart sans le supprimer. Perso je suis de l'opinion que cet ajustement fausse les choses: les pays sont responsables de leurs modes de production.

EDIT: Et, oui, les US sont le GROS problème qu'on a. Tous. Les ricains sont des cancres de ce point de vue là et si on pouvait tous s'unir pour leur dire de faire le minium d'efforts qu'on a tous fait et qui pourraient diviser leurs émissions par deux, ça a bien plus d'importance que les pailles en plastique."
2019-10-11 05:32:52,drpoucevert,"&gt;les ouvriers sont des gauchistes réactionnaire.

si comme l'explique bien Frank Lepage on avait pas cassé la notion de classe sociale au sein des ouvriers, bcp d'entres eux seraient encore des socialistes qui défendent des ideaux ( tu vois un peu la différence de language?) et non des futurs membre du FN

les flics sont devenus a majorités des citoyens qui n'ont plus le respect de la population (repression), avec un salaire de misère. La seule chose qu'il leur reste est une petite forme de pouvoir qu'ils exercent en abusant. 

Combien d'exemples je pourrais te citer? dans mon cas des dizaines. Cette fois ou je faisais refaire ma CI française et je n'avais que mon passeport allemand, je me fais contrôler et embarquer : ""sale nazis, on a loupé ton grand père, sale boche, et vas-y que je donne des coups dans les couilles"""
2019-10-05 22:34:09,Beheska,"On sait déjà qu'OP est boche, mais est-il bien ?"
2019-09-16 14:43:42,Savinien-de-Cyrano,"It has been owned by France for most of the last centuries, 100% of the population speaks French and more than 90% want to remain French.Your country signed a treaty giving it up forever because you (assuming you're german) lost badly in a war you initiated.

Shall I continue, boche?"
2019-09-09 11:34:42,Fdurke,Nan mais c'est l'UE un truc de boche faut pas chercher plus loin :(
2019-09-09 08:10:25,AlphaKevin667,"""Elle est bonne votre bouillabaisse ?""

""Ouaiiiiis""

""Mais vous préférez bouffer du Boche ?""

""OUAIIIIS""

""Très bon choix, tournée générale !"""
2019-09-08 06:38:04,ubomw,"C'est pas une puce, il y a 8 pattes.

^(Sinon Villani a souvent une boche avec une araignée.)"
2019-08-25 18:20:42,parisien75,"j'en profite pour parler de mon pb : quand on utilise le terme ""rosbif"", c'est assez fréquent sur r/france et ce n'est pas moins xénophobe que négro, mararoni ou boche. 

Je pense qu'on pourrait éviter ce genre de termes haineux."
2019-06-25 11:47:41,lost_tardigrade,[AJA que ce mot avait pas exactement l'origine que je pensais.](https://fr.wikipedia.org/wiki/Boche#Origine)
2019-06-25 08:20:16,Solumno,"Je connait un allemand qui vive a Paris. Il m'a dit, la bière francaise n'est pas bon et peu de magasins vendent la bière allemande. Alors il achéte seulement la bière belgique.

(J'suis un boche, pardonnez mon francais)"
2019-01-30 08:27:58,caporaltito,"Le Boche est fourbe et trompeur, je le connais bien !"
2019-01-23 09:33:54,Bitenbois," 

Ainsi le honteux traité d’Aix-la-Chapelle est signé aujourd’hui. La trahison est consommée. C’est un membre de Debout la France qui a démasqué les traîtres, relayé par Marine Le Pen, Nicolas Dupont-Aignan et tout ce que le pays compte de blogs et de pages Facebook tenus par des valeureux souverainistes. Sans ces vigilants patriotes, la forfaiture serait passée inaperçue, soigneusement camouflée par les médias officiels aux mains de l’oligarchie. Nos deux provinces de l’est, l’Alsace et la Lorraine, seront donc à brève échéance vendues à l’Allemagne, qui réalisera ainsi, grâce à la complicité d’une élite cosmopolite coupée du peuple, le rêve du Grand Reich.

Strasbourg sera désormais sous le feu des canons allemands, les provinces de l’est qui ont coûté à la France tant de millions de morts reviennent vers le Boche sans qu’on ait même tiré un coup de fusil, sous la férule de l’empire germano-européen dénoncé avec tant de lucidité par Michel Onfray dans *Marianne*, quand cet hebdomadaire a été tiré des griffes du mondialiste Kahn pour être repris en main par une vraie patriote. Ainsi *la Marseillaise* sera-t-elle bientôt, dans les écoles de l’est, remplacée par *Deutschland Uber Alles* et des menus alternatifs, équivalents germaniques des menus halal déjà imposés dans les territoires perdus de la République, seront proposés aux enfants, avec saucisse de Francfort et choucroute obligatoire.

Cette fois, qui aura l’audace de protester contre cette forme nouvelle de grand remplacement, qui prend en tenailles le vieux pays, entre la montée de l’islam inassimilable si bien anticipé par Houellebecq et la dictature germanique dénoncée par Jean-Luc Mélenchon ? Qui, alors que la propagande mondialiste est omniprésente, braquera son patriotique regard vers la ligne bleue des Vosges – *«n’en parler jamais, y penser toujours»* – et quel nouveau Daudet écrira une version actualisée de *la Dernière Classe*, qui a tiré de justes larmes à tant d’écoliers aux temps où l’école républicaine n’était pas infestée par le pédagogisme courageusement stigmatisé par Alain Finkielkraut ? Il faut dénoncer hautement ces mensonges qui nous ont fait tant de mal. Mais heureusement, comme le rappelait Eric Zemmour avant d’être censuré par les médias du système, la terre, elle, ne ment pas et bientôt les hommes et les femmes enracinées dans nos héroïques provinces perdues, non loin de la colline inspirée, se lèveront pour dire : «Non, vous n’aurez pas l’Alsace et la Lorraine !»

Certains ont déjà émis des doutes sur la réalité de cette menace, arguant fallacieusement que rien de tout cela ne figure dans le texte de l’accord. Plusieurs sites de «fact checking» de la presse officielle – [ainsi le torve et vicieux CheckNews de *Libération*](https://www.liberation.fr/desintox/2019/01/21/alsace-onu-rien-a-voir-avec-la-choucroute_1704474) – veulent endormir l’opinion en se contentant d’une lecture littérale. La réalité du complot est ainsi confirmée, puisque les plumitifs de la pensée unique cherchent à le dissimuler. Tout est clair : c’est l’habituelle complicité des médias tenus en laisse par l’oligarchie cosmopolite des Drahi, des Dassault et des Niel, justement dénoncée jusque dans les rangs de La France insoumise ou encore par Natacha Polony, qui a échappé à l’emprise des forces de l’argent sans feu ni lieu en recevant le soutien d’un vrai slave de souche.

Si Marine Le Pen a dénoncé l’imposture, d’ailleurs, c’est bien que sa réalité est irréfutable, tant la cheffe du Rassemblement national s’appuie sur une connaissance intime des mécanismes de l’Union européenne, comme l’a montré son débat de la présidentielle contre Emmanuel Macron, le candidat de la banque Rothschild. Si quelqu’un en doute, il lui suffit de se reporter au site «Fasciste de souche», une association apolitique elle aussi vouée à la vérité nue. Vérité confirmée par les impeccables démonstrations de la page Facebook «Antisémitisme et Réconciliation», elle aussi animée par des patriotes. Marcel Dugenou, son fondateur, réfugié en Russie pour échapper à la police de Macron, a d’ailleurs suivi une formation auprès d’Etienne Chouard, cet autre patriote qui a dénoncé d’un seul mouvement les diaboliques implications du traité constitutionnel européen de 2005 et les balivernes officielles qui entourent l’attentat du 11 Septembre. Quel meilleur brevet de crédibilité face aux mensonges de la presse mainstream, qui prend ce traité à la légère et soutient vicieusement qu’il n’a d’autre objet que [de resserrer les liens avec la démocratie allemande](https://www.liberation.fr/planete/2019/01/21/traite-franco-allemand-un-pacte-d-amitie-pour-dirigeants-en-detresse_1704473), sans remettre quoi que ce soit en cause de la souveraineté des deux Etats ?"
2019-01-22 20:14:04,JonathanAlexander,"&gt; Warum würdest du überhaupt Franzose werden wollen? 

Qu'est-ce qu'il a dit sur ma mère, le boche ? "
2019-01-22 08:27:27,DasFranck,"Y'a pas l'accent donc je pense pas.  
Par contre c'est peut être des nobles allemands et ce serait du coup :
&gt; de De Boche "
2019-01-17 16:43:39,henrirosace,*Rigole en boche*
2019-01-13 12:35:34,Orthopedux,"Le pot de fleurs, c'est quand même mieux avec le crâne de boche."
2018-12-05 20:38:28,pipoons,Casser du Boche quand il est aux portes de Paris c'est un acte xénophobe ? Ahah. Mauvaise foi puissance ∞
2018-11-15 17:46:52,Frensoaria,"Soit je suis très idiot, soit tu expliques mal, mais même après plusieurs jours de réflexion je me demande toujours la différence de raisonnement entre « le français est râleur » et « le boche est belliqueux »."
2018-11-15 13:13:10,Mormuth,Ah mais pour le coup on peut parler de la propagande d'état qu'il y a eu pour préparer la population à prendre sa revanche sur le boche qui n'était même pas humanisé entre 70 et 14.
2018-11-12 13:20:42,Zventibold,"Mais n'importe quoi... tu fais une fixette sur l'Allemagne, ma parole. Tu ne prends en compte qu'un aspect de l'Histoire et tu mets volontairement tout le reste de côté. La crise économique, la xénophobie généralisée, la géopolitique en dehors de l'Allemagne et des pays riverains, c'est pas des trucs qu'on peut écarter facilement pour garder une lecture ""Le bôche est un con"" !"
2018-11-11 22:34:08,M4d_Martigan,"T'as de ces questions à st'heure toi... Bon c'est vrai c'est tout aussi horrible. Mais j'imagine qu'il y a une différence entre un soldat qui croit dur comme fer que buter ce sale boche / viet / bronzé / infidèle  (insérer diabolisation de l’ennemi de votre choix) est nécessaire à la sauvegarde de son pays et de sa famille, et un psychopathe fini que seul la violence excite encore. Quoique le premier deviens parfois le second..."
2018-11-06 23:18:58,gimnru,"Oui, je comprends qu'on veuille analyser les conflits humains, leurs causes, leurs conséquences politiques, sociales et économiques, avec le recul un peu froid d'un chercheur, d'un historien, mais il faut parfois se pencher sur les horribles détails des petites histoires de soldats.

Une anecdote comme celle qu'à vécu mon grand-père, qu'on avait ""éduqué"" dans la haine du ""boche"" découvrit ce qu'il aurait dû savoir plus tôt : ce ""boche""-là était un homme comme lui. Il emportait avec lui la photo de ses enfants, qu'il chérissait sans doute comme mon grand-père adorait les siens. Tuer un homme est horrible, mais tuer un père, c'est meurtrir un enfant qui, en plus, concevra peut-être de la rancœur vis-à-vis de ces salauds de français qui lui ont pris son père. Il sera alors plus prompt à aller en découdre avec l'ennemi quand l'homme à la moustache et à la mèche folle l'y encouragera. Les guerres d'hier justifient celles de demain ; c'est bien connu. "
2018-11-06 10:11:22,gimnru,"Merci à toi. Écrire ce petit texte m'a tiré les larmes. Ces hommes étaient conditionnés à haïr un ennemi qu'ils croyaient monstrueux. Ce n'est qu'au contact de leurs cadavres que certains d'entre-eux, comme mon grand-père, comprirent qu'ils avaient affaire à des hommes comme eux.
C'est difficile aujourd'hui de comprendre l'effet d'une propagande telle que celle qui les avaient formatés à détester ""le boche""."
2018-10-19 11:29:29,JoLeRigolo,Boche un jour Boche toujours tu sais
2018-10-14 12:00:55,Renard4,Ca prendra 30 ans mais ils feront des gamins qui seront éduqués et parleront le boche.
2018-10-01 13:20:57,TheDarkitect,"Est-ce que si un juif et un allemand se réconcilient, on dit qu'ils se rabbi-boche ?"
2018-09-19 09:43:53,Delotox,I never thought I would discuter de comment économiser mes RTT side by side with un boche !
2018-08-21 11:58:17,electriCT,« Boche » c’est un peu xenophobe hein
2018-08-21 08:18:57,_elFred_,Boche venant de alboche pas bosh ni bosch
2018-08-21 08:08:00,saintsulpice,"À Leroy-Merlin ou Castorama oui, sinon dans ce contexte on dit plutôt ""boche"". "
2018-07-28 13:01:25,Orthopedux,"Le FN fait des gros scores partout, dans nos villes, dans nos campagnes /s

Plus sérieusement, les petits bleds de cul terreux bas du front qui jouent les durs, ca n'a rien d'exceptionnel, ni en Alsace, ni ailleurs en France. Et les scores ne sont pas les plus gros. C'est plus gros encore dans le Nord, en PACA, et même en Lorraine.


C'est juste que le boche nazi d'Alsace, c'est vendeur. Et notre accent local donne un petit ""charme"" à ce genre de propos..."
2018-07-09 08:54:49,JoLeRigolo,"Vu que tous les fêtards parisiens du FL se sont casés et nous partagent plus leurs aventures, une petite brève berlinoise en ce lundi matin.

Le problème à l'étranger, c'est que les étrangers ils parlent étrangers.

 Et moi bah quand je suis en boîte, qu'il y a du bruit, que j'ai bu et que la première prise commence à faire effet, bah je comprends plus trop le boche en fait. Du coup pour moi 'tiens, voilà ta moitié' et 'coupe le en deux pour nous' et bah c'était la même chose. Les grands yeux de la polonaise (encore elle ouais) qui me sort 'mais naaan t'as tout pris' et moi qui comprend pas ce que je viens de faire, je pense que c'est un moment qui restera gravé dans ma mémoire.


Au final une bonne manière de fêter la victoire de la France, mais un très mauvais Samedi. Not sure if would do it again soon, even with rice.
"
2018-07-03 21:02:53,Sabrovitch,"""Boche"" is a word used to say ""Germans"" in a mean/offensive way, mostly used at the start of the 20th century.

""Bochie"" is therefore ""Germany."""
2018-05-23 19:46:08,DontMentionWombats,"Désolé, la prochaine fois je posterai en boche."
2018-05-20 12:33:41,Leaz31,"Uh ?? Du coup, vu que la discussion sur ce sujet te gêne il faudrait l'enlever des faits historiques ? C'est pas comme ça que ça marche l'histoire hein, on choisit pas les thèmes qui étaient centraux dans le passé. 

Les querelles de clocher étaient ultra fréquentes, le sudiste était un fainéant et le bretons un plouc. Je te parle pas du boche, ce mangeur d'enfant, violeur en puissance. Qu'est ce que tu veux que je te dise, je vais pas réécrire l'histoire..

Et sinon c'est dommage, c'est tout le temps le même type de personne et au même moment du débat qui sortent ""ce débat est terminé"" ... C'est l'erreur 404 du réac' ?

"
2018-05-07 15:38:24,Tihar90,"Tres bon point sur les armes et l'otan j'avait oublié de prendre ca en compte ! Mais je reste persuadé que le.manque de fiabilité de Trump et les pressions russes peuvent pousser les europeens a s'unir, je l'espère en tout cas. Apres culturellement c'est peut etre subjectif mais culturellement entre europeens on est quand meme proches, c'est un des aspects de la mondialisation. Assez pour etre un seul etat ? Peut etre pas, mais y a 60 les allemands c'etait encore les boche y a du progres. Ca prendra peut etre encore 50 ans mais regrouper les Européens sous une meme bannière c'est pas impossible. Apres de nombreux etats post coloniaux sont nes avant d'avoir une identité nationale pour certains ca a marché (Singapour, Indonésie, Malaisie) d'autres ont plus de mal ... "
2018-02-07 09:52:41,Frensoaria,^(y parait que /u/hycanlox elle parle boche.)
2018-01-24 13:44:05,Tryphon59200,Ne serait-ce pas vous le pauvre Boche.. enfin je voulais dire Schleu ?? Ahh ces Fritz !
2018-01-24 12:44:30,bluenovascoz,"Chez nous les Alsaciens (dans ma famille en tout cas), on aura tendance a' se vexer pour le ""boche"", mais on utilise volontiers ""casque a' pointe"" pour se charrier les uns les autres."
2018-01-24 10:57:26,DaLoutre,"Pas vraiment offensant effectivement. C'est plutôt une blague qu'un truc vraiment méchant je pense. Dans le doute je continuerais d'utiliser ""boche"" plutôt que ""gros bronzé à claquette"". "
2018-01-24 09:42:15,Le_Gritche,"&gt; **allemand**, **pauvres** bosch

Ça va, en terme de respect à mon sens, ya allemand en premier juste avant.
En tant que Franco allemand, j'ai entendu sale boche dans les récré française et Scheiß Franzose dans les récré allemandes quand j'allais en vacances chez mes cousins. 

Aujourd'hui, à titre personnel, je ne tique pas sur le mot boche contrairement à bougnoule ou rital, etc.. 
Mais j'entends qu'on puisse le ressentir autrement."
2018-01-24 09:35:45,nrsaul,"parce que je trouve qu'au 21e, utiliser le terme «boche» pour parler des allemands c'est franchement irrespectueux et déplacé. De même qu'on ne parle pas des «bougnoules» ou des «niakoués». À moins de faire dans le 2nd degré comme les sketchs des guignols, mais ce n'est pas vraiment le contexte du commentaire ci desssus. "
2017-12-02 16:51:46,Hawne,Tu leur proposes un *schokobrötchen*. Si tu lis la gourmandise dans le regard de l'intéressé c'est un boche.
2017-11-22 19:14:45,wurnthebitch,"* Amerloques, ricains =&gt; américains
* Rostbifs =&gt; anglais
* Schleuh, boche =&gt; allemands
* Ritals =&gt; italiens
* Russkofs =&gt; russes
* Polaks =&gt; polonais
* Tos =&gt; portugais
* Espingouins =&gt; espagnols
...

Si vous en connaissez d'autres..."
2017-11-11 11:58:11,TheyHateWhenYouThink,"Bien l'incitation à la haine !

Remplaçons ""boche"" par ""personne d’Afrique du nord ou d’Asie de l'ouest"" et voyons comment ca se passe."
2017-11-11 10:49:59,Code_44,"Joyeux 11 novembre, et n'oubliez qu'aujourd'hui, c'est légal de tuer un boche !"
2017-11-08 09:51:41,Frensoaria,"Je suis d'accord sur les bas-votes, en revanche j'ai fait une blague sur les camps de concentration en modmail et l'ami boche l'a bien prise..."
2017-10-30 16:01:03,shalli,"C'est bien, c'est beau, c'est boche"
2017-09-30 09:17:57,NerosTie,C'est bien un truc de boche ça !
2017-09-19 16:32:02,_elFred_,"&gt; J'ai déjà été appelée bougnoule

Tu auras toujours des cons , j'ai été traité de souchien et de boche ,ce qui me fait rire plus ou moins jaune d'ailleurs"
2017-09-19 13:34:33,jaguass,"Je compte pas le nombre de fois ou quelqu'un laisse échapper une allusion ""allemand = nazi"", ou alors boche. Sans vraiment vouloir à mal.  
  
Je pense qu'il y a deux phénomènes ici:  
  

- les français nous abondons d'autant plus dans l'amalgame allemand=nazi que nous-même nous n'avons jamais complètement fait l'inventaire de notre comportement sous l'occupation. Du coup c'est plus commode de rejeter toute la faute sur eux (et par extension sur leurs descendants).  
  
- t'as aussi un phénomène de politiquement correct qui fait que parmi tout le catalogue de blagues sur les ""padchénous"", la plupart sont aujourd'hui interdites sous peine d'être taxé de raciste: africains, arabes, chinois, je pense que y'a 20-30 ans ça dégainait bien plus facilement qu'aujourd'hui sa petite allusion raciste ou taquine. Par contre il reste des nationalités où la remarque naze est encore permise sans être taxé de quoi que ce soit, dont on continue à se lâcher sur anglais=ceci, belges=cela, allemands=nazis ou boches parce que c'est toujours hors-taxe sous le régime du politiquement correct, et avec une ardeur d'autant plus forte que les origines pré-citées sont aujourd'hui proscrites.  
(par ailleurs mon deuxième point, je pense qu'il sert aussi à expliquer le retour en force du french-bashing)   
  
edit: syntaxe"
2017-08-22 05:57:23,draxredd,"C'est clairement la cause des attaques. Rien à voir avec les pays du moyen orient ravagés par les incursions occidentales. 
Expliquer c'est déjà excuser ? Expliquer c'est surtout montrer les responsabilités. Il vaut bien mieux comme le font chaque ""camp"" essentialiser l'adversaire.
On se croirai revenu à la propagande anti-boche de 1914.

Rien ne change, des gens pauvres qui ne se connaissent pas continuent de s'entretuer pour des gens riches qui se connaissent très bien."
2017-08-13 13:11:20,rafy77,"Non mais ca j'ai bien compris merci, mon tout premier message avait rien a voir avec ca d'ailleurs.

Hugo Boss a travaillé avec les NAZI, pas avec l'Allemagne, ma question c'etait pourquoi employer boche (équivalent de rosbif, de frogs etc ...) au lieu de nazi"
2017-08-13 08:33:37,Hawne,"Effectivement il y a un problème de compréhension. J'ai illustré le fait **d'insulter** un jeune allemand en raison de l'appartenance de son aïeul aux troupes nazies, toi tu cherches à me ""corriger"" sur la non-correspondance boche / nazi.

Ce qui me fait énormément penser à l'adage ""Lorsque le sage désigne la lune, l'imbécile regarde le doigt""."
2017-08-13 08:24:31,rafy77,"Sale boche = sale allemand

Un boche n'est pas un nazi, soit tu fais l'amalgame tout seul, soit tu l'utilisais pas comme je l'entend et c'est moi qui ai rien compris."
2017-08-13 08:07:55,Hawne,"C'était ""sale boche"". Et je ne comprends pas tout mais je mesure ton arrogance."
2017-08-13 08:05:52,rafy77,"Un allemand = un boche

T'a pas tout compris toi non ?"
2017-08-12 23:12:32,Hawne,"Bof, à l'époque oui j'aurais sans doute peu aimé Hugo Ferdinand, mais vouloir maintenant répercuter le passé sur l'entreprise serait aussi peu judicieux que de traiter un jeune allemand de sale boche parce que son arrière-grand-père était dans la Wehrmacht.

Ceci dit je suis effectivement plus Torrente que Boss."
2017-08-09 12:21:15,Code_44,"Par respect des traditions, j'ai toujours été pour que dans la zone de Verdun, la chasse au boche soit dépénalisée"
2017-08-09 08:33:32,_elFred_,"En fait c'est juste que ton camouflage est mauvais /s

Je dis ça car je suis plus métèque que pas mal de gents ayant plus de mélanine que moi mais je passe inaperçu globalement sauf quand le ""con"" se rend compte que je fais vachement ""boche"" quand même.
Chose qui me fait partir dans les tours vu mes origines.


Mais bon revenons sur le point l'insistance de l'individu c'est un gentil con IMO il ne faut pas te formaliser plus que ça,au moins il à pour lui une certaine curiosité/ouverture d'esprit c'est ce qu'il faut retenir."
2017-07-19 12:46:29,ScalSaver,"Je t'aime copain. Que tu sois black, blanc, beur, bolshevik ou boche, j'm en beurre la raie.

Tu dis ce que je me tue à faire passer depuis trois ans ici, alors des bisous."
2017-07-04 11:05:36,Th4m00,"&gt; Hugo Boss

Hugo Boche

Cçpt"
2017-05-27 04:38:07,amorpisseur,[Le cauchemar du Boche](http://i.imgur.com/89vA8VO.jpg)
2017-05-15 15:40:20,FancyColonel,"&gt; Toi tu n'a pas croisé les comme moi les 2 FI qui tractaient au marché du bled et qui dés que je les ais titillé un peu m'ont traité de nazi ""car tu ressemble à un boche"" (c'est clair que le demi-polac que je suis est vachement aryen)

Non, mais ils méritent des claques.

&gt; aryen

Déclenché puissance 10000"
2017-05-15 15:36:35,_elFred_,"&gt; Ah oui, je me retrouve tout à fait là dedans, suivant aveuglement, sans esprit critique, beuglant comme un pauvre scélérat derrière mon écran.. 

Toi tu n'a pas croisé les comme moi les 2 FI qui tractaient au marché du bled et qui dés que je les ais titillé un peu m'ont traité de nazi ""car tu ressemble à un boche"" (c'est clair que le demi-polac que je suis est vachement aryen)

Le con ça ose tout et la connerie ce n'est pas d'un seul parti.

3615 my Life (oui je suis vieux)"
2017-04-30 15:14:05,backtolurk,"Oh pas grand chose à dire, juste que j'aimerais le traiter de sale boche après lui avoir déversé son coca dans ses cheveux couleur paille en rigolant à la cantine, et lui rappeler que les excuses de Schumacher n'ont servi à rien du tout, parce que c'est vraiment un gros FDP."
2017-04-27 09:21:27,DeGaulle2017,"&gt;les mecs qui votent FN c'est les même qui aurait fait des bisous aux envahisseurs

Pour l'anecdote, les groupes d'extrême-droite les plus radicaux ont rapidement fait partie de la Résistance (ou ont en tous cas résisté) : la haine du boche l'emportait sur celle du juif Français. Par exemple tu as l'anecdote de mecs de l'Action Française qui cachaient des juifs, ou de membres de la Cagoule au CNR (si je dis pas de bêtises).

Les premiers à faire des bisous aux envahisseurs justement c'était les centristes bureaucrates et opportunistes (suivez mon regard). Ceux qui ont résisté sont d'abord les extrêmes (PCF après 1942 par ex). "
2017-04-21 09:57:13,Lukior,Avec un peu de chance elle est un peu boche.
2017-04-16 20:19:22,_friert_,"j'suis boche, mais quand même: publié en 1997. probab' pas trop d'influence sur un traîté conclu en 1963."
2017-04-05 09:38:04,Digmo,"&gt; Oui, mais bon, un des trucs qui m'a le plus surpris quand j'ai lu des textes communards c'est de voir à quel point ils avaient envie de «bouffer du boche». 

A leur charge, ça se retrouve aussi chez les maquisards en 40 et je pense qu'on peut extrapoler à un certain nombre de peuples auxquels on a imposé la reddition (et potentiellement l'occupation)."
