date,author,text
2020-08-21 11:07:00,Chunt_Of_Hogsface,"Bon, j'ai enfin fini *Les Décombres* de Lucien Rebatet, le fameux best-seller de l'occupation sorti en 1942. Rebatet y raconte son cheminement de journaliste militant à l'Action Francaise à fasciste et collabo intégral.  

Il décrit l'état d'esprit de son camps avant-guerre, le délabrement de l'armée, la débacle, et enfin le milieu Vichyssois. Rebatet a une plume violente et corrosive qui rappelle celle de Nabe, mais la lecture est rendue très pénible par des bouffées régulières d'antisémitisme maladif (pourtant mon édition est expurgée d'une centaine de pages particulièment violentes).  

Bref au final c'est un témoignage intéressant, mais j'ai du le lire par petites doses. Etant petit-fils de résistants, j'ai eu du mal à plus d'un titre. Je laisse le deuxième tome tranquille pour l'instant.  

Ensuite j'ai enchainé avec *Alias Caracalla* de Daniel Cordier, qui est le miroir de *Les Décombres* à plus d'un titre. Daniel Cordier fut lui aussi militant à Action Francaise et antisémite, mais au lieu de se complaire dans la défaite il est parti rejoindre De Gaulle à Londres.  

Après une formation commando etc., il est parachuté en France et devient le secrétaire d'un certain Rex, alias Jean Moulin. Au lieu de ""tuer du boche"" et de faire péter des voies ferrées, Cordier se retrouve au milieu des intrigues des dirigeants des mouvements de résistance. Au contact de ses camarades et de ses rencontres il évolue aussi politiquement et intérieurement. A un moment il parle justement de Rebatet dont il achète le livre à Lyon en 42...  

Sinon, pour celles et ceux qui ont vécu sous une pierre ces trois dernières semaines, Gojira a sorti le single [Another World](https://youtu.be/iqrMFNMgVS0), et Mastodon [Fallen Torches](https://youtu.be/LiXTJvnWA_4) en attendant la sortie de leur album en Septembre."
2020-07-28 15:41:53,TotoLaMoto29,"Version très longue ( avec beaucoup de blabla) :

Tout d'abord, je pense que ton principal problème c'est peu-être un manque d'estime de toi. Tu dis ne pas avoir d'ami d'enfance avec qui tu peux parler de tout et que cela te fait souffrir. Mais il est important de savoir si tu apprécie ta propre compagnie j'entends par là, si tu t'aimes (bon c'est un peu cliché) mais il faut que tu sois fier de qui tu es et que tu trouve ce qui te fait vibrer dans la vie, ça peut être la musique, la nature (randonné etc), la littérature, le sport etc etc (perso moi c'est l'histoire, le cinéma, et la musique). Ne cherche pas désespérément d'avoir des amis avant de te connaître réellement toi même. Comme en amour, il faut savoir s'aimer soi-même avant de prétendre aimé quelqu'un d'autre. Si tu te trouve une passion, tu pourra facilement trouver des clubs ou des forums où les gens partagent partage les mêmes passions que toi, c'est là où tu pourra au fil du temps trouver des gens avec qui tu pourra tisser des liens d'amitiés sincère. (un exemple très simple, un jour j'ai parlé avec une personne sur une forum sur l'histoire de la Perse, au fur et à mesure de nos discutions sur l'histoire, on a commencé à parlé d'autre chose de nos vies, de nos études, de nos déception amoureuse etc etc... Et maintenant je le considère comme un de mes plus proche amis. Il est russe et à déjà fait deux fois un voyage en France et est passé me voire). Donc le conseil le plus importent trouve, les passions qui te font vibrer, si tu es timides aborde les gens sur les forum et ensuite dans des clubs dans ta ville etc. Mais le plus importants ne cherche pas désespérément des amis très proche mais apprend à t'en passé et aime toi.

En ce qui concerne le faite que tu ne te sens pas Français alors que tu habite en France, avec ton histoire personnelle, il est tout à fait normal que tu te sente dépassé par tout ça et que tu es un peu perdu. Sache qu'on n'a le même âge tout les deux, je suis né en France et est grandi en France, mais je n'ai pas un nom de famille français mais très allemand, de plus n'ai un peu le physique de l'allemand cliché (blond, grand, yeux claire) et quand j'étais au collège certain de mes camarades me fessaient des petites réflexions régulière du genre ""ton papi était un nazi, t'es un peu un boche etc"" alors que ma famille est en  France depuis plus d'un siècle. À force, ça m'a énervé à telle point que je me sentait limite plus allemand que français et j'aimais pas mon pays, ça été une erreur monumental, je me suis laissé faire par les remarques débiles de certain de mes camarades et je les ai laissé en sorte décidé qui j'étais et comment je me voyais. Cette vision que j'avais à duré 3-4 ans et a'en première et terminal tout à changé parce que j'ai commencé à m'intéresser sérieusement à la culture française, j'ai lu Zola mais surtout Maupasant et Hugo (je te conseille d'ailleurs de lire les lettres d'amour de Victor Hugo si jamais tu voudrais en écrire une toi même, elles sont vraiment fabuleuse). La culture française regorge de chef-d'œuvres. Et j'ai commencé à tombé amoureux de la France de sa culture de son histoire et tout ce qui la fait. 

Tu peux faire de même avec tout les pays où tu a habité et qui ton marqué. (tu dis avoir aimé l'Angleterre, elle n'a casiment rien à nous envier avec sa formidable culture). 

Le pense que si tu ne sens pas Français et que tu a du mal à te sentir intégré, c'est que peut-être tu connais mal ou trop peu ce pays. Apprend à le connaître et lisant et écoutant sa musique et en regardant ses films et je te fais le pari que tu aimera la France et tu sentira Français. Et n'écoute pas: ni les idiots qui te font croire que seul la couleur de peau et l'origine compte, ni les débiles qui te dise que la France est un pays racistes qui ne t'aimera jamais. 
Sache que aujourd'hui même certain de mes amis qui ont un nom Français qui sont blanc, me disent qu'il n'aime pas la France et préféraient être d'une autre origine, je pense que c'est uniquement parce qu'ils n'ont vraiment pris la peine d'apprendre à connaître leur propre pays.

Apprend à te connaître et apprend à connaître le pays où tu vis et le pays d'où tu viens et je pense que tu ne te posera plus de question et que tu découvrira un nouveau visage de l'endroit où tu vis.





Version courte:

 Je pense que ton principal problème et que tu manque de confiance en toi, d'amour propre, tu te sens perdu mais c'est tout à fait normal avec ton expérience atypique. Apprend à te connaître toi même, à découvrir tes passions et alors tu pourra rencontrer dans des clubs des amis avec qui tu pourra avoir des relations sincères. Pour ce qui est de sentiment d'être perdu et ne pas te sentir intégré, tous d'abords ne te laisse pas envahir par la rencoeur que certain idiots peuvent tenir et surtout apprend à connaitre le pays où tu vis, en lisant/écoutent/regardant sa culture et son histoire. Fait la même chose avec les pays où tu a vécu et ton pays d'origine et alors je suis persuadé que tu arrivera à trouvé des réponses à tes question sur toi-même."
2020-06-30 16:38:21,RoyTellier,"Laissez encore quelques années au capitaine évidence qui a écrit ce torchon, le temps que ca mettra pour qu'il médiate les différends irréconciliables entre ses deux seuls neurones, pour ait une illumination et qu'il nous sorte des images de feuilles de papiers empilées et d'une gonzesse avec un voile et une croix autour du cou a droite et a gauche de sa chocolatine puisque ca semble être le max de son humour et de sa réflexion. Putain de boche.

On dit pain au chocolat bordel."
2020-06-18 16:49:39,pitoasto,"Ça dépend si tu la situes relativement à la Laponie ou à l'Andalousie.

Pour un Lapon, la France ça commence à sentir le ~~métèque~~ méditerranéen qui met de l'huile d'olive partout.
Pour un Andalou, la France ça commence à sentir le ~~boche~~ teuton qui porte des chaussettes sur sandales. 

Position bâtarde, ni au Sud ni au Nord, trop septentrional relativement aux pays de l'Europe du Sud et trop méridional relativement aux pays de l'Europe du Nord."
2020-06-01 14:56:44,Sartopia,Il dit quoi le BOCHE ???? Wollen sie schlaffen mit mir ???
2020-05-27 12:29:18,AnarchyinGroland,"*""Quand t'aimerais bien draguer au boulot la stagiaire, mais que ton nouveau client est un véritable boche et que c'est la guerre au bureau"".*"
2020-05-19 15:38:10,C6H12O7,Racisme anti-boche? En pleine invasion c'est pas normal d'avoir un petit peu de distance critique par rapport à l'envahisseur ?
2020-05-19 15:20:55,Peysh,"Si on était taquin on pourrait dire que ce sont les gauches et droites souverainistes qui sont à l'origine de l'appel du 18 juin et du début de la resistance pourtant.

L'histoire en a fait des héros, ils étaient juste très motivés par leur racisme anti-boche."
2020-05-09 12:54:25,m8r-1975wk,"&gt; Vous avez remarqué que les foyers de contamination se situent dans des abattoirs ou des lieux de transformation de viande ?

&gt; Bon courage à ceux qui achètent de la viande Européenne à l'Aldi ou Lidl.

&gt; Alors que la viande FRANCAISE elle est PAS malade elle, c'est un truc de boche la viande malade.
&gt; J'ai bon ?

Visiblement c'est trop dur à comprendre pour plusieurs personnes ici."
2020-05-09 11:31:28,-aRn-,"&gt; Alors que la viande FRANCAISE elle est PAS malade elle, c'est un truc de boche la viande malade.

En l’occurrence, en Allemagne les très gros élevages de porcs ou de boeufs sont plus la norme qu'en France. Et plus on concentre de bêtes au même endroit, plus on doit utiliser d'antibios &amp; et produits sanitaires. 

Donc oui, de part son mode de production la viande made in Germany pose plus de problèmes sanitaires, et donne une viande moins bonne (le animaux produits dans ces usines d'élevage sont enfermés toute leur vie et sont nourris au tourteau de soja / maïs... Rien à voir avec une vache qui peut paitre dans un près et qui se nourrit simplement d'herbe.


https://reporterre.net/En-Allemagne-les-ferme-usines-deviennent-la-regle-malgre-une-rentabilite

Edit : et ta  remarque genre ""ouais mais c'est partout pareil, on n'est pas meilleur que les autres"" me fatigue. Parce que non, ce n'est du tout pas partout pareil. Et que les efforts de nos éleveurs sont réduits à néant par ce genre de discours, produit par des gens qui ne connaissent pas le sujet et racontent n'importe quoi."
2020-05-09 10:45:19,m8r-1975wk,"Alors que la viande FRANCAISE elle est PAS malade elle, c'est un truc de boche la viande malade.

J'ai bon ?"
2020-05-04 03:40:39,keepthepace,"Intéressante cette histoire, à replacer dans le contexte de l'époque. Aujourd'hui on voit ça, on pense nationalisme, vieille France conservatrice, etc...

Or c'est un ancien communard qui propose ça. La république est toute jeune (10 ans!), l'éducation publique encore plus, et le combat commence pour disputer au clergé et aux aristocrates le privilège de l'éducation.

Bien sur aujourd'hui on voit ça avec l’œil de quelqu'un qui sait que ça annonce la première guerre mondiale. On voit du nationalisme et de l'éducation rétrograde. On oublie que Louise Michel appelait à bouffer du boche! (à moins bien sur qu'ils renversent leur tyran avant).

L'idée que le peuple soit formé à la chose militaire au lieu de laisser ce «privilège» à une classe dirigeante a été une revendication des radicaux depuis la révolution. Il faut dire qu'avec des spécimens comme [Guillaume II](https://fr.wikipedia.org/wiki/Guillaume_II_(empereur_allemand\)) outre-Rhin, la préparation militaire semblait une évidence."
2020-05-03 10:55:39,Ahnkhaen,"Regarder la vidéo d'Histony sur la question de la responsabilité de la Première Guerre mondiale est nécessaire. 

Le revanchardisme français a joué, c'est indéniable. Mais je ne dirais jamais que seule la France est responsable.

 Boulanger, montée du nationalisme, Schnaebelé, conflits d'influence au Maroc, propagande d'Etat notamment à l'école, stigmatisation du ""Boche"", etc."
2020-04-29 21:08:10,AnarchyinGroland,"Les magistrats peuvent réfléchir à l'envie de ne pas s'humilier et payer des amendes par la suite. *Se faire rappeler l'Etat de droit par un mangeur de Rollmop Finlandais ou un boche, c'est vexant.*

Mais je suis con, je postule que la justice a des comptes à rendre à ses victime.... Blakany est libre, le Juge Burgeaux a eu une promotion à la cour de cas' (sociaux) et le juge qui se branlaient en pleine audition de victimes de viol est partit à la retraite à taux pleins des années avant.

Putain comme j'aime pas les flics et la justice."
2020-04-22 19:11:03,MonsieurFred,"Ou parce qu’ils sont tous boche, la."
2020-04-13 09:48:05,Nico_Oni,"""Le Boche est vaincu, mais la grippe ne l'est pas""

Y'a pas à dire, on savait faire des slogans en 1918."
2020-04-02 09:00:56,jeyreymii,"Alors déjà ont dit pas boche, c'est pas beau. Seuls les modo d'r/france peuvent être assimilé à des nazi. Va te laver la bouche au savon noir.

Après, y'a une fonction *reply* sue reddit"
2020-03-09 22:36:08,FallenWalkerCult,"Le film est beau comme une pub pour les vacances sur la Côte d'Opale. Il manque un char à voile et les terrains de Volley Ball. 

Dk s'en est prise plein du début à la fin. Brest, le Havre, même combat pour ces villes portuaires stratégiques. Et même reconstruction qui font la légende de ces villes aujourd'hui. 

Pour le corsaire, orientation volontaire. Il volait les navires britanniques pour le compte de Louis XIV. On a jamais pu piffrer les rosbeef à Dunkerque, c'est génétique, haha. 

Je ne me permettrais pas juger ta famille et de t'attribuer leurs (des) idées. Mon GP était un gros raston qui a fait l'Algérie donc des infamies pires que nazies, j'en ai bouffé toute mon enfance... Ma GM, sa femme, qui était pied noire me disait toujours: à l'école, un jour c'était vive Petain, le lendemain vive de Gaulle. Mon autre grand mère a été déplacée de Dunkerque à Lille suite à l'opération dynamo. Je ne l'ai jamais entendu dire allemand, toujours schleu ou boche. Ce sont des gens ordinaires qui se retrouvent imbriqués dans la grande histoire qu'on nous apprendra plus tard à l'école dans une version officielle où les humains deviennent des chiffres en kilos ou des flèches sur une carte."
2020-02-12 21:29:55,wazoox,"Moi je suis définitivement devenu favorable au Lao-gai, au goulag pour l'ensemble des députés LREM. Une bonne paire d'années en camp de travail, je suis sûr que ça leur ferait le plus grand bien. 

Notez que je suis drôlement de bonne humeur; quand je suis de mauvaise humeur, je suis plutôt favorable au Tribunal révolutionnaire, avec le Rasoir National place de la Concorde, et hop.

Je ne voudrais pas décevoir ces gens-là en me montrant trop à cheval sur la démocratie. Ou bien si elle veut voir la violence politique, qu'elle vienne un peu en manif avec nous rencontrer les sbires de Didier ~~le boche~~ Lallemand."
2020-02-11 12:32:05,_JCVD_,u/A_french_boche_man  ?
2020-01-31 23:06:35,TonyCoolos,"&gt;Quand tu envoies tes gamins en Erasmus chez les allemands, ils ont tendance, en revenant, à ne plus appeler les allemands ""boche""

Ne dis pas de bêtises. J'ai fait une erasmus et ça m'a convaincu que l'UE était un attrape pigeon. Un marché unique fin win  n'est pas possible avec des pays qui ont des intérêts opposés.  Tu en as toujours qui se font niquer. Et dans le cas de l'UE il est démontré que la France y perd alors que l'Allemagne y gagne.

Au final en erasmus t'apprends que tu as plus de points communs avec les Estoniens qu'avec les Antillais, mais que jamais un estonien ni un allemand ne sera prêt à te détendre quand tu seras en danger."
2020-01-31 14:13:14,Zventibold,"Quand c'est plus facile d'aller chez le voisin et de commercer avec lui, bah tu fais des accords commerciaux plus souvent et plus avantageux pour les deux parties.   

Quand tu envoies tes gamins en Erasmus chez les allemands, ils ont tendance, en revenant, à ne plus appeler les allemands ""boche"", à ne plus vouloir leur crever les yeux à coup de baïonnette, et à vouloir garder contact avec leurs potes sur place. C'est bon pour le commerce ça aussi.  

Quand tu as une seule assemblée qui décide pour toute l'Europe que la peinture au plomb c'est pas l'idée du siècle pour les jouets, c'est plus facile de commercer avec tes voisins européens (parce que les exigences sont communes)  


Je continue ?  

Je suis loin d'être un zombie europhile qui ne voit que les bons côtés de l'Europe, mais si on ne prend que les aspects économiques en compte, je viens de te citer trois moteurs indéniables de l'intérêt de l'Europe au niveau économique. Séparés, nous ne valons rien, et nous nous ferrons bouffer par les gros poissons."
2020-01-22 15:15:31,Poglosaurus,"The bes thing the academie has given us : 

Réquisitoire contre Jean d'Ormesson

16 septembre 1982

Françaises, Français,
Belges, Belges,
Monsieur le comte,
Monsieur le président de pacotille,
Monsieur l'avocat le plus bas d'Inter,
Ma chère petite follette,
Mesdames et messieurs les jurés,
Public chéri, mon amour.

Quand il a fini d'écrire des conneries dans le dictionnaire, à quoi sert un académicien français ? A rien. A rien du tout. Non mais, regardez-le, mesdames et messieurs les jurés ! Voyez ce triste spécimen de parasite de la société, qui trémousse sans vergogne son arrogance de nanti sur le banc vermoulu de l'infamie populaire. Voyez-le glandouiller sans honte dans ce minable tribunal de pitres grotesques à l'heure même où des millions de travailleurs de ce pays suent sang et eau dans nos usines, dans nos bureaux et même dans nos jardins, où d'humbles femmes de la terre arrachent sans gémir à la glèbe hostile les glorieuses feuilles de scarole destinées à décorer les habits verts des quarante plésiosaures grabataires qui souillent le quai Conti du chevrotement comateux de leurs pensées séniles.


N'avez-vous pas honte, monsieur d'Ormesson, de vous commettre ainsi avec ces trente-neuf vieilles tiges creuses, rien dans la cafetière, tout dans la coupole !

N'avez-vous point honte de vous exhiber dans cet affligeant gérontodrome, vous qui êtes encore jeune et fringant, malgré les rides affreuses qui commencent à défigurer de façon dramatique votre visage naguère aristocratique ?

N'avez-vous point honte à votre âge, un grand garçon comme vous, de vous déguiser périodiquement en guignol vert pomme avec un chapeau à plumes à la con et une épée de panoplie de Zorro ? Est-il Dieu possible qu'un écrivain aussi sérieux que vous fasse partie des quarante papy-la-tremblote tout juste encore bons à réchauffer leurs os cliquetants au soleil du front de Seine en se demandant s'il y a un N ou deux à zigounette ?


N'avez-vous point honte, Jean d'Ormesson, de fricoter dans les belles lettres en compagnie de Jean Mistler, d'Henry Bordeaux, d'André Maurois ou de Jean Dutourd, autant d'écrivaillons tellement inexistants que je me demande s'il n'y en a pas déjà la moitié de morts ?

Est-il Dieu possible qu'il existe une précocité du gâtisme ? Peut-on être gâteux précoce comme on est éjaculateur mondain ? Si cela était, cette question en amènerait une autre, encore plus terrible. Et c'est à vous que je la pose, monsieur d'Ormesson : serait-il Dieu possible que des gâteux écrivent dans Le Figaro ? Je ne puis le croire !

C'est en 1635 que Richelieu-Drouot créa l'Académie française. Pourquoi ce nom d'« Académie française » ? C'est la question que tout le monde se pose, sauf maître Rego qui s'en fout du moment qu'il a pas froid aux genoux, et qu'il peut brouter tranquillement sous son pupitre la morue séchée que sa tata Rodriguez lui envoie de Lisbonne en paquet fado.


Pourquoi « Académie française » ? Eh bien, justement, pour éviter que les bougnoules étrangers ne vinssent poser leur cul basané sur les bancs des Français. Pourquoi « Académie » ? Là, c'est plus compliqué. Je vous demande à tous un effort d'attention. Vous n'allez pas être déçus.

Avant que Richelieu-Drouot ne le réquisitionnât, le magnifique bâtiment surmonté de la célèbre coupole et flanqué de deux très belles bâtisses que tout le monde connaît, ce magnifique bâtiment abritait une boulangerie. La boulangerie du maître boulanger Jean-Baptiste Quaiconti où Henri IV lui-même venait acheter ses fameuses baguettes bien cuites que son amant, Sully, lui découpait en mouillettes pour les tremper dans le bouillon de poule au pot tous les dimanches.


A cette époque, on ne faisait pas le pain comme aujourd'hui : on fabriquait la croûte d'un côté et la mie un peu plus loin. C'est pourquoi il y avait ces deux bâtisses. Les clients fortunés comme Henri IV ou Marguerite de Valois achetaient évidemment la croûte et la mie. Mais les pauvres qui, depuis le début de l'humanité, ont toujours eu des goûts simples (j'en connais qui n'ont même pas de magnétoscope !), les pauvres, dis-je, n'achetaient que la croûte. Et quand un pauvre arrivait devant la double boutique de maître Jean-Baptiste Quaiconti, il demandait : « Pardon, notre bon maître, où c'est qu'y a des croûtes ? »

Et notre brave boulanger répondait invariablement en montrant les deux portes : « C'est là qu'y a des croûtes, et c'est là qu'y a des mies », précisait-il.


Or, par un beau soir de printemps 1635, le cardinal de Richelieu, qui était de fort belle humeur (il venait de se faire amidonner la soutane par une jolie repasseuse de la rue Dauphine). Le cardinal, dis-je... (cette blanchisserie existe aujourd'hui encore, 14, rue Dauphine, vous pouvez vérifier. Elle a seulement changé de nom : elle s'appelait jadis « A la calotte qui luit » (en hommage à Richelieu, évidemment). Maintenant ça s'appelle, beaucoup plus prosaïquement, « Pressing du Sahel. Nettoyage à sec ».

Donc, Richelieu se promenait, un peu raide, au bord de la Seine lorsque son regard fut attiré par le trottoir souillé de miettes de pain à la hauteur de la boulangerie de maître Quaiconti. « Degueulassum est », dit-il en latin et en lui-même. Il fit mander dès le lendemain le boulanger et le tança d'importance pour cette dégradation de la chaussée.


« Vous pourriez faire votre pain plus loin, dit le cardinal.

Oh, ben, vous savez, moi, je fais où on me dit de faire », rétorqua cet homme.

Outré par tant d'impertinence, Richelieu ordonna qu'on lui coupât la tête (ce qui fut fait dans l'heure), puis, pris de remords, il donna au bord de Seine, à cet endroit, le nom de quai Conti.

« Monsieur le cardinal, j'aime beaucoup ce que vous faites, dit Louis XIII, qui était con comme un Bourbon, mais que va devenir cette immense boulangerie dont vous étêtâtes le chef?

Que Sa Majesté besogne en paix son Autrichienne, j'y ai songé, répondit Richelieu. Je vais tout simplement remplacer toutes ces vieilles croûtes par des vieux croûtons. »


L'Académie française était née. Puis s'avisant soudain qu'on était déjà en 1635, Richelieu et Louis XIII décidèrent qu'il était grand temps d'aller bouffer du boche s'ils ne voulaient pas que la guerre de Trente Ans se terminât sans eux.

Donc, Jean d'Ormesson, mon petit bonhomme, vous êtes coupable. La peine capitale ayant été abolie contre la volonté du peuple, par un caprice des hordes roses hystériques qui font régner leur loi laxiste dans ce pays, je demande néanmoins aux jurés un maximum de fermeté. Étant donné que l'accusé n'écrit pas avec ses pieds, je suggère qu'on lui coupe les mains.

Jean d'Ormesson : Cet écrivain Immortel et manifestement très nain a l'habitude de donner ses rendez- vous dans les escaliers de façon à surplomber ses interlocuteurs en se plaçant deux marches au-dessus d'eux.

Pierre Desproges"
2020-01-16 08:11:07,[deleted],Ca vient aussi beaucoup du fait que l’histoire dans leurs pays est écrite par des anglo saxons. Pour beaucoup la première guerre mondiale c’est encore Tommy qui bat le méchant Boche tout seul et sauve l’Europe. Y a qu’a lire des classiques comme Keegan pour s’en rendre compte.
2020-01-10 19:41:15,Beheska,Pourquoi tu causes boche ?
2020-01-06 22:37:14,pipoons,Y' pas de quoi être fier... On forme des ingénieurs suffisamment formés je pense pour qu'on ne dépende pas des autres. Je déteste l'idée de me faire trouer la peau par une arme rital ou boche.
