date,author,text
2017-04-05 08:07:04,keepthepace,"Oui, mais bon, un des trucs qui m'a le plus surpris quand j'ai lu des textes communards c'est de voir à quel point ils avaient envie de «bouffer du boche». 

Les références historiques, ça se manie avec précaution. Perso je suis plus pour construire un futur en partant de nos désirs présent plutôt que d'un passé idéalisé."
2017-04-02 18:36:15,air8orne,The french Megaman is a nice touch! grüße from le Boche.
2017-04-01 17:15:31,fernguts,Canadian here.  We'll help you put the Boche back in his place again!
2017-03-28 15:35:21,jeyreymii,"Si tu préfère que je justifie : je parle de soldat allemand lambda qui n'a rien demandé à personne (un Boche de base quoi) et de Waffen SS. Ça va mieux?

Bon, alors maintenant, les soldats allemands étaient-ils tous des pourris?"
2017-03-15 14:22:13,ConnardDechaine,"*Mes idées politiques* est immensément supérieur au torchon du boche Hitler. Du reste, si la caste politique avait écouté Maurras au lieu de le mettre en taule, on lui aurait réglé son sort vite fait au peintre raté.

Mais non, la priorité en 1934, c'était pas Hitler, c'était d'interdire les ligues pour sauver la bande de dégénérés au pouvoir et carrément filer le pouvoir aux traîtres socialo-communistes du Front Populaire plutôt que de sauver la France du péril chleu."
2017-01-18 14:13:02,PsyX99,"Mon opinion sur ces histoires de ""faut pas dire c'est pas beau c'est raciste gnagna"" c'est que *l'intention est importante*. Je refuse qu'on soit coupable de racisme alors qu'on avait pas l'intention de l'être (c'est l'opposé d'un facteur aggravant si préjudice il y a de la part de personnes concernés). Je ne pense pas que /u/Kikujiroo a voulu dire implicitement dans son message que les Français seraient supérieur au autre. Ni qu'il souhaitait les insulter. Donc ça me pose aucun problème.

Qui plus est vu les exemples et compte tenu des affinités entre pays le seul qui puissent être vu péjorativement c'est ruskov. Jap c'est la contraction de Japonais et ce n'est pas péjoratif, Yankee c'est un mot familier lui non plus pas péjoratif. Boche (ou Fritz, Schleu, Frisé, etc,) c'est péjoratif mais on a une certaine proximité avec notre voisin Allemand pour s'autoriser l'usage de ces mots et olala ils sont nombreux; et une proximité encore plus grande avec nos meilleurs ennemies les Anglais pour les appeler Rosbeefs. 

Bienvenu chez les franchouillard.

"
2017-01-18 13:43:12,I_MELT_STEEL_BEAMS,"J'adore l'argot mais ces mots n'en sont pas. ""Jap"" c'est comme ""Boche"" ou ""Schleu"", des termes utilisés en temps de guerre pour insulter l'ennemi quand on le mentionne. Va ouvrir un dictionnaire de l'argot (Larousse en avait un) et tu ne trouveras pas ces mots."
2017-01-15 19:20:38,elvadia28,"Me semble avoir entendu la réplique ""Le coup est parti tout seul"" dans quelques vieux films de comédie mais jamais avec une explication style ""nettoyais mon arme"" pour expliquer les circonstances du tir (généralement t'entends un coup de feu, tout le monde accourt, voit un bandit/boche à terre et le meurtrier qui hausse les épaules genre c'est pas ma faute s'il s'est mis sur la trajectoire de la balle)"
2016-12-24 16:44:57,Aesahaetr,"Joyeux Noël à toi aussi, ~~sale boche~~ cher voisin !"
2016-11-28 10:14:16,Thoumas,"Oh putain, t'as fait une typo sur le pseudo de /u/lunki et tu vas nous ramener un boche. J'en ai vu des cons, mais tu remportes la palme"
2016-11-07 09:27:19,lonezolf,"Tout dépend de ce qu'on entend par l'église.

L'église globale, le pape et la curie ? Elle a justement pas mal changé avec le nouveau pape. Pas assez vite pour mon goût, beaucoup trop vite au goût d'autres, mais certainement bien plus vite que sous le pontificat précédent du boche. Et l'église globale a des tas d'autres soucis de part le monde que le mariage homo, entre la lutte contre les violences envers les chrétiens d'orient, la lutte contre les animismes et autres en Afrique, la lutte d'influence contre l'Islam et l'évangelisme...

Au niveau plus national, c'est aussi compliqué. Le paradigme a changé depuis que l'archevêque de Paris a été remplacé par son homologue marseillais. Et de toute façon l'(arch)evêque a au final une influence moins importante au niveau local que le pape, je trouve.

Et au niveau local enfin, chaque paroisse est différente, entre les ~~connards~~ intégristes de St nicolas du Chardonnay à Paris et les paroisses d'inspiration ignatiennes ou jésuites, il y a un monde.

Ces trois niveaux sont l'église, et elles sont chacunes représentatives et non représentatives du catholicisme français... parce que ce dernier couvre un spectre assez large (comme les autres religions d'ailleurs)

Pour finir avec la MPT, elle a surtout réussi à noyauter et monopoliser le terrain mé(r)diatique, et notamment à s'adjuger le soutien visible d'une partie (non négligeable, mais pas la totalité) des archevêques."
2016-10-08 17:50:22,DeRobespierre,"Bon ok Momo puisque tu m'a cité. Je vais te rentré dedans comme la lame dans le cou du condamné.

Alors 1905 pas vieux ? Et alors ? Contrairement aux PS qui pense que c'est la panacée, pour nous c'est la moitié du chemin parcourus. Un compromis. Parce que je te rappelle qu'on a buté un paquet de catholique avant, on les a éparpillé façon puzzle.

Ho et pour l’Alsace, ou whatever the fuck on l’appelle maintenant, c'est à cause des allemands qu'on a pu les faire rentré dans le rang : elle était boche quand on a fait la loi mange-merde. Et en 1945 on avait la France à reconstruire, on pouvait pas se permettre de se lancé dans ce chantier bordélique.

Quant au subventions direct indirect et déguisé aux ""organisme culturel religieux"", ça faudra s'en occupé au plus vite, en effet. Mais c'est pas l'UMPS qui s'en chargera pour sur.

Quant au poisson du vendredi, bah c'est pas obligatoire, une école risque pas de donné 10 coup fouet au à l'intendant qui mettra de la barbaque. On te mettra du ralouf si ca te fait plaiz. 

Et enfin le sapin de Noël... pas c'est pas catholique mais protestant germanique. Car en Palestine, y'en a pas (opps,spoiler). Et encore mieux, ces abruties de catho ne savent même pas le vrai jour de sa naissance (ni l'année, mais bon on est plus à cela prêt.)

Bref, va fanculo stronzzo.

"
2016-10-05 07:11:47,DeRobespierre,"Les ""balles"" c'est le franc, pas cette monnaie boche, espèce de traitre à ton histoire."
2016-08-28 18:03:42,DeRobespierre,Cette célébration de Clovis le boche envahisseur de la terre ancestral Celtes me fait toujours marrer.
2016-08-26 14:53:42,GantZu,Je me suis acheté In Stahlgewittern (c'est Orage d'acier le titre en français) d'Ernst Jünger pour pouvoir bosser un peu mon boche et franchement j'aime bien. Je suis dans mon trip 1ère GM en ce moment et c'est super bien écrit et super intéressant.
2016-08-24 11:01:07,Baboeuf,"&gt;Il défendait aussi la déferlante anti-bosch en 45 ?

Mais oui, bien sûr!

D'abord, ça s'écrit ""boche"", comme alboche et pas comme une perceuse...
Ensuite, justement, en 1945, il s'agissait d'une déferlante anti-nazie et non anti-allemande. Sachant que par surcroit, la proportion d'allemands ayant soutenu Hitler était infiniment plus importante que ne l'est aujourd'hui celle de musulmans soutenant Daesh..."
2016-08-17 18:04:01,SowetoNecklace,"J'ai voulu en savoir plus après être tombé sur l'histoire de [Claude Mamba Sy](http://www.liberation.fr/photographie/2014/08/20/paris-libere-uniquement-par-des-soldats-blancs_1083150), le seul Noir de la 2^e DB a être entré dans Paris avec Leclerc. Pour l'histoire : La 2^e DB était pleine de troupes coloniales, puisque fondée en exil par Leclerc. Mais quand Leclerc est arrivé vers Paris avec ses troupes, les Américains lui ont ordonné de ""blanchir"" ses colonnes, pour éviter que les images de propagandes à destination des Etats-Unis ne transmette l'idée dangereuse et subversive que les noirs sont aussi des humains. Tout le personnel ""indigène"" a donc été muté dans des divisions d'infanterie sur les ordres des américains, sauf Claude Mamba Sy, orphelin et pupille de l'Etat, qui était par conséquent citoyen français de plein droit et a été maintenu à son poste.

Mais le statut d'Indigène, de citoyen de seconde zone, c'est quoi ? 

- C'est un régime avec un droit de vote limité (à des élections locales, et encore uniquement sur un nombre de sièges réservés et minoritaires).  
- Un système d'infractions qui n'existent que pour les indigènes. L'appel à la grève par exemple est illégal pour un indigène, et avec ses propres punitions, généralement déclarées par le gouverneur sans procès ni appel.  
- Ce sont des taxes spécifiques et un ""impôt en travail"", la *prestation*, d'un montant de 12 jours de travail en A.O.F. et 15 jours en A.E.F. ainsi qu'une ""taxe de sang"", la conscription forcée dans les troupes coloniales.  
- C'est la responsabilité collective : Un indigène commet un crime, la punition peut être légalement appliquée à toute sa famille ou sa tribu.

Déjà à l'époque, le statut était contesté en France... Ca clashait trop avec l'idéal des Lumières. Un officier français qui suivait les négociations entre colons européens et indigènes en Algérie a dit : 

&gt; Je crois la situation incurable. Les colons agricoles français ont une mentalité de pur Boche, avec les mêmes théories sur les races inférieures destinées à être exploitées sans merci. Il n'y a chez eux ni humanité, ni intelligence.

L'indigénat a été qualifié de ""monstre juridique"" par Olivier Le Cour-Grandmaison, en 2010.

En plus de l'article dans mon OP, [l'article Wikipedia en anglais sur le même sujet](https://en.wikipedia.org/wiki/Indig%C3%A9nat) présente quelques infos qui sont pas dans le francophone et inversement."
2016-08-13 08:26:15,-Malky-,"&gt; Ah donc sous prétexte des JO on oublie tout ce qui se passe pendant ce temps?

C'est plus ou moins le but des JO depuis le départ :

&gt; Il faut que tous les quatre ans les Jeux Olympiques restaurés donnent à la jeunesse universelle, l’occasion d’une rencontre heureuse et fraternelle dans laquelle s’effacera peu à peu cette ignorance où vivent les peuples de ce qui les concerne les uns les autres

Pierre de Coubertin, Conférence du 16 Novembre 1894 à Athènes, Société du Parnasse

Lorsque les premiers JO ont eu lieu en 1896 à Athènes, l'Allemagne occupait l'Alsace et la Moselle depuis ~25 ans. Le sentiment revanchard était très présent en France - c'est même à cette époque là que le mot 'boche' est né - et pourtant les athlètes des deux pays se respectaient un minimum."
2016-08-04 09:19:31,Quorton,Frapper un boche sur le casque.
2016-07-29 11:20:20,the-hadob,Bah ouai mais la Bavière voulait pas faire partie de l'allemagne a la base donc bon forcément ils vont être différent des autres boche. 
2016-07-14 14:26:35,Fandechichoune,"Quand je dis ""préparés"", je dis ""conditionnés"", conditionnés à l'idée qu'un jour ou l'autre ils allaient tuer du boche, et ça seriné dès ta plus tendre enfance et par les maitres d'école. "
2016-06-28 07:43:50,shalli,"&gt;comment tu fais accepter aux Allemands qu'ils devront payer jusqu'à la fin des temps pour les Grecs ?

Il me semble que malgrès quelques ratés, UE leur est profitable au final.

&gt;Comment tu fais accepter à des Français qu'un général boche pourra leur demander d'aller mourir et qu'ils devront obéir ?

Je n'ai jamais parlé d'armée européenne. Sans l'Angleterre, il n'y plus que la France qui puisse jouer le rôle du bras armé de l'UE, avec tous les avantages que cela implique. (ton général allemand il sera chargé de la logistique).

&gt;Il n'y a pas de peuple européen... ennemi commun...

Tout à fait d'accord. Il ne s'agit pas ici de forcer les peuples à fusionner, c'est impossible. Le principe c'est l'alliance face à un ennemi commun comme tu dis. Les souverainistes ont tendance à oublier que face à la Chine ou aux US on ne fait pas le poids. 

C'est triste à dire mais on a besoin des boches. La bonne nouvelle c'est qu'ils ont eux aussi besoin de nous."
2016-06-27 14:53:40,m4uv415c0n531l,"&gt;D'où l’intérêt d'une Europe plus resserrée avec un centre de décision plus fort incarné par le couple franco-allemand. 

Ça ne change rien au problème fondamental : comment tu fais accepter aux Allemands qu'ils devront payer jusqu'à la fin des temps pour les Grecs ? Comment tu fais accepter à des Français qu'un général boche pourra leur demander d'aller mourir et qu'ils devront obéir ? 

Il n'y a pas de peuple européen alors que même avant l'unification il y avait un peuple allemand ou un peuple italien. Là c'est trop tard, trop gros, trop mitigé. La seule manière d'unifier les Européens serait de trouver un ennemi commun. Vu que la Russie ça n'a pas marché. Il reste l'islam ou les États-Unis d'Amérique. 

&gt;J'aime à croire que L'UE débarrassée de l'influence anglo-saxone ne sera plus la même, la France y gagnera en leadership à mesure que notre démographie se raproche de celle des allemands. Le discours anti-UE va perdre de sa popularité.

Lol. Le leadership c'est du blabla. 22 millions de chômeurs c'est du concret. "
2016-03-29 21:25:44,FroggerThrw,"Yeeaaaah. Enfin un peu de sens commun. Le crime de guerre est réservé aux hommes, pas aux sauvages, voyons. 'foirés d'occidentaux, toujours à chouiner, les droits de l'homme par ci, les arabes sont des gens par là, pis quoi encore.

Non mais non, la guerre, c'est comme nous à l'époque, la bonne odeur de cochon des baraques de civils cramées, le viol en self-service, le carpet bombing à la munition à fragmentation, pis oui, forcément, des exécutions sommaires d'un des petits-fumiers-à-mi-homme-mi-démon-d'en-face de temps en temps, histoire de ressouder le groupe autour d'une bonne vieille histoire de ~~boche~~ terroriste arabe qui fait moins son malin avec deux nouveaux trous de balle . 

Sérieux, les français ont pillé et violé et fumé du villageois pendant des siècles, et maintenant on interdit le plaisir aux autres ? En plus les feujs en ont plutôt chié quand même par le passé, et maintenant qu'ils ont enfin récupéré leur crèche ils auraient pas le droit de se marrer ?

Même pas juste.

"
2016-03-11 09:41:38,DeRobespierre,"Marié à une boche lui aussi, belle tignasse, je lui aurai fait la même coupe que son petit fils."
2016-02-15 21:00:38,Endarys,C'est quoi c'te déterrage de vieux topic. Tout le monde avait oublié pour moi cette histoire. Traitre. Sale boche. Putain de nordique. ^^^/s
2016-02-01 12:57:13,JoLeRigolo,"Bon j'ai demandé à un boche de passage et tu as raison, c'est hier."
2016-01-21 17:04:49,ubomw,"&gt; bosche 

Et puis c'est boche en français."
2015-11-13 02:45:19,Chelecossais,"Nan, j'ai peut-etre tort. J'admets.

Tu peux peut-etre métenoquement nous appeller des ""anglais"".

We still will not fucking like it.

We will fight that.

So don't fucking do it. Got it ?

Espece de Boche."
2015-10-31 13:46:38,Autobot248,"C'est faux. Nous on dit ""maternelle"" ou ""jardin d'enfants"", pas cet affreux mot boche."
2015-10-02 09:00:56,JoLeRigolo,"Seulement ? C'est triste.

Je dois être le boche.

J'suis allé voir sur wikipedia, on dit 'Béninois' et je trouve que c'est mignon comme nom :)"
2015-06-01 11:34:19,NMO,"LyaBoche, feminazi."
2015-05-05 14:16:00,MartelFirst,"Je n'ai pas reproduit toute la conversation ici, mais elle pensait que j'étais polonais en vrai.

Mais en effet, c'est un peu étrange, je ne suis pas la seul blond à Paris. Mais je suppose que j'ai des traits suffisamment notables pour que ça relève l'attention. Des amis m'appelaient le boche. Il m'est également arrivé qu'un touriste russe dans le rue me demande si je suis russe. 

On me demande vraiment souvent mes origines. Je ne le prends pas mal, par contre. Je prends ça plutôt pour un compliment. Il n'y a pas de mal à ce que des gens soient curieux."
2015-03-21 18:33:03,Theirn,"""Boche"", c'est de l'argot pour allemand..."
2015-01-06 17:30:39,Neredev,A mon grand regret je ne parle pas boche.
2014-12-17 09:48:46,MauvaisConseil,"Je relis l'article après coup et c'est à se pisser dessus de rire l'ironie quand Jean Luc affirme :

*Poirette sur RTL, sans aucun rapport avec le sujet du débat avec Zemmour, me demande à l’impromptu si je « regrette d’avoir insulté » madame Merkel. Je lui réponds que je ne l’ai pas insultée mais que je me demande pourquoi je regretterai des propos réfléchis même si j’ai cru que « Maul zu » voulait dire « shut up ! ». Réplique du journaliste « ça aurait pu vous échapper ! » Inouï ! Mais c’est bon pour le buzz ça coco ! Aussitôt « le Lab » titre que « Mélenchon ne regrette pas d’avoir insulté » la madame. Ce qui est une façon de suggérer que je suis d’accord avec l’idée que je l’ai insultée.*

**« Tu verras coco, le mot Mélenchon plus le mot “insulte” va produire des clics supplémentaires ! »**

*Et ainsi de suite. Le régal, ce fut de crucifier ma mauvaise manière pour avoir prétendument utilisé le terme « boche ». La manipulation odieuse qui fut faite alors me révulsa d’abord, moi qui en aie pourtant déjà tant subi.*

---

Tu verras coco (muniste ?), le mot Zemmour plus le mot déportation va produire des clics supplémentaires... "
2014-12-11 19:43:37,SaucissonFurtif,"Rolande  et Francis d'un coté.

Georgette et Helmut de l'autre. Oui ma grand mère à fauté avec un boche."
2014-11-10 14:47:24,Rc72,"&gt; la France doit supprimer l'Elysée, selon un rapport ~~de Washington~~ *d'une fondation privée basée à Washington dont les opinions n'engagent qu'elle même*

Encore plus drôle, en fait: selon le [wiki](http://fr.wikipedia.org/wiki/Peterson_Institute_for_International_Economics)

&gt; Il est dirigé depuis sa création par C. Fred Bergsten, anciennement Secrétaire adjoint aux affaires internationales du Département du Trésor américain, qui en fut le créateur en 1981 avec le soutien du **German Marshall Fund**.

C'est une conspiration boche! "
2014-07-17 12:38:27,Luk---,"L'un n'empêche pas l'autre. Obtenir l'assentiment des foules avant de partir à la guerre est une nécessité si on veut que ses soldats se laissent effectivement embarquer dans un truc qui leur est aussi nuisible que la guerre. 

Des années de violence verbale et de message de haine ont précédé  le génocide rwandais. La haine du boche, le développement d'un racisme scientifique (j'ai souvenir d'un article scientifique du début du XXème siècle qui démontrait la supériorité de la race française sur la race allemande) ont rendus la première guerre mondiale possible. Ne parlons même pas des régimes totalitaires du XXème. 

Ce n'est pas tant la liberté qui est en jeu mais la construction d'un ennemi objectif et de la dynamique collective qui peut se construire au point où sa destruction devient légitime. 

Bien entendu ce genre de parole a été contrôlé et privatisé par les états totalitaires au travers de la propagande, mais que ce soit sous la tutelle d'un état autoritaire ou la libre parole d'une communauté radicale, le problème que cela me pose est la violence qui en découle. 

Donc oui, ce n'est pas une question de liberté vs  contrainte mais une question de Politique.
  "
2012-04-24 09:01:32,groumpf,"Je ne mets pas toute la Province dans le meme sac: la carte le fait tres bien sans moi. Je sais tres bien, en tant que provincial itinérant (et maintenant expatrié, et voyant une facette de la population Française qui n'est pas, soit dit en passant, représentée sur la carte), que la province est variée. Je sais aussi lire une carte et voir que tout ce qui n'est pas Ile-de-France sur la carte est a au moins 10% des voix pour le FN alors que l'Ile de France (sauf si je deviens daltonien) est en dessous.

""Et avec Marine on sait vers qui pointer du doigt."" Non, non, et non. On ne sait pas vers qui pointer du doigt. Sarkozy/Hortefeux/Guéant ont restreint la politique d'immigration Francaise de facon radicale, ont expulsé des Roms, ont mis en place (ou renforcé) des lois qui ont pour objectif non-avoué (ou pour effet secondaire) de décourager l'immigration des populations étrangères les plus fondamentalistes. La France est-elle dans une meilleure situation qu'avant ces mesures? Le sentiment que les étrangers sont a la source de tous les problemes ne vient pas de la partie rationelle du cerveau: il y a suffisamment de données qui pointent vers au moins l'existence d'autres facteurs, non seulement en France, mais plus ou moins partout en Europe. L'idée que l'étranger est un danger n'est pas rationelle, et meme si on la repousse un peu plus loin (du ""Boche"" au ""Beur"") elle reste injustifiable de maniere rationelle et raisonnée.

Personnellement, je préfere détester les Parisiens."
