date,author,text
2021-07-30 07:05:16,zelynettr,"Comme en 1940, la résistance était encore quasi inexistante, il ne reste que deux possibilités : boche ou collabo. Choix Cornélien..."
2021-06-27 16:59:17,Etaris,"&gt;Y'a le boss qu'est vénère comme un boche

&gt;Il te crache dessus, tu stress c'est l'angoisse

&gt;Mais tu continues
Parce qu'il t'faut d'la caillasse

&gt;C'est le biz' qui prime
Et ça t fout la déprime

&gt;Tu veux en parler mais jamais tu t'exprime

&gt;Se faire prendre pour un con par des gens qu'on déteste

&gt;Payé au lance pierre t'as plus qu'à bouffer les restes

&gt;Harcèlement moral, ambiance carcérale

Les gars je vais pleurer il y a les gens qui nous servent du poulet congelé à 18€ qui vont devoir fermer leurs boîtes à fric et à exploitation :(((((("
2021-06-22 07:39:30,Aidenwill,"Enlever ""boche"" ça se dit, mais pour mettre ""Allemand"", pas ""nazi"". Faut pas commencer à oublier ce qu'on fait les allemands au dernier siècle. Dédouaner les allemands est une erreur."
2021-06-21 20:55:56,Landriaz,"Ça me fait penser qu'il y a un an, par curiosité, j'ai lu ""Oradour-sur-Glane Vision d'épouvante"" et j'avais été étonné de voir le terme Boche dans un livre. Bon sorti en 1970, c'était pas si surprenant en soi, mais ça l'était pour moi. Je connaissais le terme par toutes les expressions encore orale mais le voir écrit ça m'a fait ""bizarre"" sur le coup puis j'ai lu le bouquin...J'irai jamais reproché aux gens qui ont témoigné, qui ont écrit ce livre d'avoir utilisé le terme, faut arrêter de faire la vierge effarouchée."
2021-06-21 19:40:23,Kookanoodles,"L'occupant *allemand*. Je comprends que boche soit insultant, mais occupant *allemand*."
2021-06-21 16:55:43,chameau_pelon,"C'est si péjoratif que ça boche ? Moi je mets ça au même niveau que rosbif ou rital, un peu limite mais avec un ton blagueur ça passe."
2021-06-21 15:23:55,Sabba_Malouki,"&gt;Oui c'est important, un vestige d'un temps degueu

Bah oui c'est important. C'est le principe de l'Histoire de se souvenir.

&gt;C'est pas du tout la même chose d'avoir un nom de PEUPLE péjoratif

Boche dans ce cadre était utilisé pour l'envahisseur."
2021-06-21 15:22:34,RyanBLKST,"&gt; boche désigne très clairement l'ennemi plutôt que n'importe quel allemand.  
  
De même personne ne va penser que c'est un un civil allemand qui est venu faire la tuerie....  
Je trouve que garder le terme Boche est puéril, mettre ""Allemand"" est plus formel est ne change pas la mémoire."
2021-06-21 15:12:55,Sabba_Malouki,"Non, il veut changer un monument historique. Le fait que ce soit marqué Boche et non Allemand ou Nazi ou l'Ennemi est particulier et c'est important.

Qu'on soit d'accord avec l'expression ou non importe peu, ça fait partie de la culture quand même. Ça ne veut pas dire qu'on doit utiliser ce terme aujourd'hui.

À ce moment là, les allemands doivent changer leur mot pour désigner la France parce qu'on n'est plus un royaume et que c'est dévalorisant pour la République ?"
2021-06-21 15:09:22,Sabba_Malouki,"La plaque date de l'époque, c'est un monument. On va pas changer tous les monuments de France à chaque fois que quelqu'un est choqué par une inscription et ne sait pas se remettre dans le contexte.

Puis mettre Allemand à la place de Boche, c'est pas mieux, ça veut dire que le type a été assassiné par un type qui représentait les allemands, alors que boche désigne très clairement l'ennemi plutôt que n'importe quel allemand.

Le touriste sensible se tire une balle dans le pied."
2021-06-21 14:55:59,SweeneyisMad,"J'ai fait une petite recherche, le monsieur offusqué est franco-allemand, et il préférerait ""[fusillé par l'occupant nazi](https://www.sudouest.fr/france/plaque-commemorative-de-ruch-l-ambassade-d-allemagne-a-ete-saisie-par-celui-qui-n-est-pas-un-touriste-de-passage-3818489.php)"" que ""assassiné par les Boches"". Il a tout de même contacté l'ambassade.

Personnellement, je trouve que la plaque est très claire et elle explicite la colère que les gens ressentaient, ça la rend plus vivante.

L'idée d'y ajouter une note pour contextualiser le meurtre de l'instituteur me rend perplexe. Quel genre de message peut-être apposé à coté d'une plaque commémorative:

*Plaque commémorative faite en 19\*\* ou était toléré le mot boche.* *Théo était un résistant, il fut donc fusillé par l'occupant nazi.*

Je m'emporte, cette mode de toujours détricoter le passé pour que les consciences actuelles ne soient plus choquées...

Bref, un village de 600 âmes, perdu dans le trou du cul de la France se voit contester sa vision du passé pour respecter les convenances."
2021-06-20 06:51:54,Redisdead_BELG,Boche ? Du travail de Praud !
2021-05-26 21:56:58,Muzle84,"Trop rigolo ce poteau avec tous ces commentaires :)

Je m'appelle Adolf Boche, je suis moche et je décoche :

Tu as oublié de dire que le barreur est le chef d'orchestre, qui compte ~~Ein, Zvei~~, erm... Un, Deux!

Tu es donc atteint d'amnésie, ce qui prouve que tu es ami des nazis. Echec et mat, sale facho. A la tonte !

^(Je pars sur la pointe des pieds.)"
2021-05-23 19:21:23,Niquarl,Bleu blanc boche ?
2021-05-02 08:05:35,OrbisAlius,Et comme par hasard ça sort d'un institut ~~allemand~~ boche
2021-04-12 21:07:52,AlexDonteneau,"&gt;Que demander de plus ‽

Devenir boche  ? /s"
2021-03-30 16:20:24,Rc72,"&gt; Ca ne va pas faciliter les relations Américano-germaniques, tout ça.. 

Pourquoi? L'Allemagne, elle, a officiellement reconnu le génocide arménien (et sa propre co-responsabilité) [depuis 2016](https://www.liberation.fr/planete/2016/06/02/le-genocide-armenien-ravive-les-tensions-entre-l-allemagne-et-la-turquie_1456849/).

Franchement, les bouffeurs de Boche de ce sous êtes d'un fatigant..."
2021-03-16 00:19:42,Johannes_P,"Et il arrivait que certains officiers coloniaux se plaignent du racisme des colons, comme le Maréchal Lyautey le fit en 1918:

&gt;Je crois la situation incurable. Les colons français ont une mentalité de pur Boche, avec les mêmes théories sur les races inférieures destinées à être exploitées sans merci."
2021-02-09 12:07:40,wazoox,"J'ai lu un bouquin là-dessus, ""on killing"" (c'est le titre). Il raconte pas mal de choses intéressantes là-dessus. Frédéric II de Prusse avait fait des évaluations de l'efficacité d'une mousquetade lors d'une bataille en ligne classique (avec des corps d'armées avançant l'un vers l'autre sur un champ dégagé, façon guerres napoléoniennes) et logiquement la ligne adverse devrait être massacrée, or ce n'était en pratique jamais le cas. La très grande majorité des coups étaient tirés en visant soigneusement au-dessus des têtes ou en-dessous des pieds des adversaires.

Sur le site archéologique de la bataille de Gettysburg, on a retrouvé un fusil avec des dizaines de cartouches enfoncées, le canon était presque plein (cartouches en papier chargées par la bouche); le soldat chargeait quand on lui en donnait l'ordre, mais n'appuyait jamais sur la détente.

Jusqu'en 1945 inclus, les études menées ont bien montré que la grande majorité des fantassins ne tirent pas sur l'adversaire. Ils tirent à côté, au-dessus, font semblant de tirer, ne chargent pas leur arme, etc.

D'ailleurs mon pépé m'a dit que quand il était artilleur de DCA en 40, il visait soigneusement à côté des avions allemands. Ce n'est pas bien, mais tuer même un boche ça le gênait.

Ceci a été largement étudié après-guerre, et à partir de la guerre de Corée l'armée américaine a commencé à modifier l'entraînement en fonction de ces informations. Au moment du Vietnam, les hommes avaient subi un conditionnement au ""tir réflexe"" (ce sont les séquences d'entraînement sur cibles mobile sur le terrain qu'on voit souvent dans les films de guerre ou certains films policiers comme Magnum Force), ce qui fait qu'ils tiraient effectivement sur l'adversaire. Du coup la létalité des combats rapprochés a explosé, mais l'effet secondaire induit est que les fantassins devenaient fous. Parce que tuer des gens, à moins d'être déjà un psychopathe, ça rend fou."
2021-01-30 17:57:58,wazoox,"Je vais faire de la psychanalyse de bazar, mais il faut vraiment être des pervers sadiques  pour faire un truc pareil. Venant des sbires ~~du Boche~~ de Lallemant, ça n'étonnera évidemment personne. Lallemant est _manifestement_ un  pervers frustré impuissant avec un tout petit zizi et des problèmes avec sa maman.

Quant aux vichystes et macronistes qui applaudissent : vous êtes aussi des petits flics aigris et je vous embrenne avec toute la puissance d'un troupeau d'éléphants chiasseux."
2021-01-23 09:35:46,unmalepourunbien,"*Le malheur des uns fait le bonheur des autres*

*Se réjouir aux dépends de quelqu'un* 

Il n'y a certes pas de traduction littérale en un mot mais en tout cas ça reste moins moche que ce mot boche."
2021-01-15 10:52:44,chohw,Sale Boche !
2021-01-07 14:04:29,BojackPonyman,"Perso avec ma gueule de boche et mon amour des parkas militaires, je suis obligé de porter un keffieh pour ne pas être considéré comme un facho."
2020-12-15 16:31:15,Pklnt,"&gt; Gwer aussi, ils descendent juste de deux langues différentes (arabe et persan). D'ailleurs, les deux seuls dicos un minimum sourcé le présentent comme péjoratif.

Le premier lien ne source rien du tout.

Concernant le deuxième, les seules parties sourcées qui traitent de son carractère péjoratif sont divisés à son sujet.


&gt; Ah oui, alors que quand tu t'apprêtes à tabasser quelqu'un en meute, c'est bien sûr avec le respect et l'amour du prochain en tête, en utilisant des qualitatifs mélioratifs, on se souviendra par exemples de l'armée US se plaignant de l'utilisation du terme chink pendant la guerre de Corée, ou Joffre préoccupé de voir boche se répandre dans l'argot militaire. Mais ce qu'il ne faut pas lire...


Le soucis c'est que vous avancez l'utilisation de ce mot comme forcément péjorative, sauf qu'il ne l'est pas forcément.

Est-ce que ""regarde le blanc il est vieux"" aurait autant choqué que ""regarde le gwer il est vieux"" ? 

Pourquoi ""il est vieux"" ne choque pas ? 


Parce-que sur ce sub on aime créer ce branlerond du méchant arabe raciste en réaction aux discours ""insupportables"" où on avance que l'arabe pourrait être victime de racisme."
2020-12-15 16:21:08,ethelward,"&gt; C'est ""kouffar"" qui désigne les mécréants.

_Gwer_ aussi, ils descendent juste de deux langues différentes (arabe et persan). D'ailleurs, les deux seuls dicos un minimum sourcés le présentent comme péjoratif.

https://dictionnaire.orthodidacte.com/article/definition-gwer

https://fr.wiktionary.org/wiki/gwer

&gt; On est dans un contexte péjoratif.

Ah oui, alors que quand tu t'apprêtes à tabasser quelqu'un en meute, c'est bien sûr avec le respect et l'amour du prochain en tête, en utilisant des qualitatifs mélioratifs. On se souviendra par exemples de l'armée US se plaignant de l'utilisation du terme _chink_ pendant la guerre de Corée, ou Joffre préoccupé de voir _boche_ se répandre dans l'argot militaire, puis, en son temps, Salan et _niakoué_. Mais ce qu'il ne faut pas lire..."
2020-11-17 09:22:07,Gomunis-Prime,Mon arrière grand-père à participé à 11 batailles sur le front de l'est notamment en Bielo-Russie (d'après son livret de soldat boche). Après il a disparu en 1917 et on ne l'a revu au pays que plusieurs années après la fin de la guerre. C'est vraiment dommage qu'il n'ait jamais raconté à personne ce qu'il a vécu pendant toute cette période.
2020-11-11 18:14:16,adnateorrounded,"J'objecterais que ceux qui pensaient à une guerre rapide étaient ceux qui sonnaient le grand rassemblement pour préparer la grande boucherie et  les pauvres gars qui ont ont gobé la propagande. 

Il faut bien reconnaître que les moyens d'information étaient bien différents à l'époque et la presse libre s'est bien mise au pas dans un grand élan patriotique.

Il fallait bien reprendre l'Alsace et la Lorraine. N'oublions pas les générations, depuis 1870, gravées de haine anti boche. 

Dernière chose, n'oublions pas comment Jean Jaurès et sa généreuse théorie des crosses en l'air ont fini."
2020-11-07 07:11:36,paofidjzo,"Ça a été fait au nom de la république, pas du peuple. Puisque comme j'ai dit, une partie de l'opinion publique aurait préféré qu'on s'occupe de nos affaires en Europe (notamment aller taper du boche) plutôt que d'aller en Afrique ou en Asie."
2020-10-22 21:16:54,EnvironmentalBobcat2,Ya 100 ans personne faisait sa petite chatte laicarde quand il fallait dresser du colonisé musulman à aller hacher du Boche pour récupérer un carré de boue nationale en Artois...mais bon
2020-09-25 09:03:17,Aidenwill,Si tu supportes pas le Sud en fait n'y viens pas petit boche.
2020-09-15 16:55:17,freeblowjobiffound,C'est bien c'est boche.
2020-08-28 14:41:31,princeps_astra,"Écoute, si tu ne veux pas me répondre libre à toi. Je ne te force à rien. Tu pré-supposes que je vais me transformer en un espèce de militant violent qui va s'attaquer aux gens dans la rue, à te lire. Si tu penses que je projetes tes paroles, dans ce cas je pourrais te dire que tu fais la même chose des miennes.

Je te conseille de ne pas mettre nos situations sur un pied d'égalité car, je le dis une troisième fois, en ce moment même ce n'est pas toi qui court le risque d'être la cible de la violence haineuse qui est de plus en plus visible, et de plus en plus assumée. Et ce partout en occident. Ce ne sont pas les restaurateurs allemands qui voient leurs vitres se faire tagger, ce ne sont pas les grands hommes blonds qui se font agresser. Parmi toutes mes paroles que tu cites, tu choisis de n'avoir cure de celles où je dis clairement que mon apparence, contrairement à la tienne, fait de moi et de mes compères racisés une cible. Tu dis toi-même avoir dû cacher tes origines, et crois-moi j'en suis navré. La différence, c'est que malgré les tentatives des mes compères de faire de même, et les miennes, cette option n'est pas disponible dans nos cas. Certes, ""une bonne petite tête de Nazi"" est un préjugé basé sur l'apparence, mais pré-suppose-t-il des capacités intellectuelles réduites comme il en existe encore pour les noirs, ou des capacités physiques manquantes pour les asiatiques ? Non. Je doute que ta tête ai fait de toi quelqu'un qui a été déshumanisé au point où l'on pourrait se satisfaire, chez certains, que c'est tant mieux qu'il y en ait plus qui ""coulent en Méditerranée"". Alors certes il y a eu des préjugés hérités de conflits et de guerres sanglantes qui ont fait de ""l'autre"" un ennemi à abattre, mais ces préjugés se sont évanoui dans le temps. Mon arrière-grand-oncle, partisan, parlait à mon grand père encore enfant de ""bouffer du boche"", mais ça ne se retrouve plus aujourd'hui. Les préjugés racistes, par contre, ceux créés, disséminés, et marqués au fer dans la culture occidentale, persistent. Il est encore acceptable de parler de chintoque, de niakoué, et de bamboula sous le vernis de l'humour. Même parmi les adultes. Il est encore acceptable pour Kev Adams et Gad Elmaleh de dédier un sketch entier à des clichés racistes, sans que jamais ils ne s'en excusent. Ces deux mecs ont même pris la position de victimes dans le débat, comme si ils n'avaient rien fait de mal. 

Et sache que je te considérais comme une personne avant que tu ne décides de te présenter en victime, comme tu dis. Si ce n'était pas le cas, je n'aurais pas lu ce que tu as à dire et je n'aurais jamais pris le temps de te répondre. En ce qui me concerne, je veux bien continuer à débattre avec toi autant de temps que possible, je suis plutôt satisfait de t'avoir fait parler à chaud pendant un petit moment, car maintenant j'ai l'impression qu'on avance. 

Je persiste aussi, c'est une fausse équivalence. Je t'ai donné cet essai infâme écrit par un aristocrate français à l'aube de la domination occidentale sur le reste du monde. Ce qui est écrit, et tout l'assemblage théorique du racisme a été fait pour justifier une domination tout à fait nouvelle dans l'Histoire. Une qui permettait à tout pied noir européen de bénéficier de plus de droits et d'un régime légal différent de celui des indigènes. Tu aurais pu être allemand, espagnol ou italien dans l'Algérie française, et tu aurais tout de même été supérieur aux yeux de la loi et des mœurs à un arabe, un kabyle, un musulman. Les conventions de Genève ont acquis des clauses ayant banni l'utilisation d'armes chimiques après la Première Guerre mondiale, mais cela n'a pas empêché la France de bombarder les rebelles du Rif au phosphate. Fait d'arme pour lequel Philippe Pétain et Franco ont reçu la légion d'honneur. Et même à cette époque, des européens en métropole s'en insurgeaient. Mais leurs voix étaient étouffées par des sociétés qui étaient, sans équivoque, racistes. 

Tu parles de ce qu'il se passe aujourd'hui en Chine, c'est un autre débat mais j'aimerais pointer du doigt le fait que l'indignation actuelle n'a été causée que parce que la BBC et CNN ont décidé d'en faire un sujet ces derniers mois-ci. Si l'occident était réellement déterminé à prendre position, il l'aurait fait il y a des années. Cela fait au moins cinq ans que des journalistes d'investigation occidentaux ont reporté les faits sur les camps de rééducation et le traitement atroce que les ouïghours musulmans doivent subir. Et cela fait des décennies qu'ils se font martyriser par le parti communiste chinois sous couvert de l'athéisme. Nous, occidentaux, décidons d'en faire un sujet au même moment où la Chine devient la superpuissance qu'elle a toujours été. C'est hypocrite de la part de nos gouvernements et de nos États.

Les Han avaient besoin d'un casus belli pour envahir les provinces occidentales chinoises. Les francs sont parti en croisade après l'appel à l'aide d'Alexis Komnène face aux turcs seljoukides. Les Mongols ont envahi l'empire des Shahs après qu'ils aient exécuté ses émissaires. Les romains allaient certes conquérir le monde en ayant un sentiment de puissance, mais les conquis furent ensuite accueilli dans le monde romain. Dès César, et certes pour des raisons politiques, les chefs des tribus loyales pendant sa conquête ont été invité à siéger au Sénat. 

L'Europe et l'Amérique anglo-saxonne, dans le cas du monde de la conférence de Berlin, ont simplement déclaré qu'ils devraient civiliser le reste du monde. Avant cela, il s'agissait de convertir les autres. Tu peux me dire que les musulmans ont fait de même, sauf que dans les cas des invasions qui ont commencé au VIIè siècle, la conversion n'était pas forcée. Ils laissaient les conquis payer la jizyah si ils voulaient garder leur religion. Ils les accueillaient dans le monde musulman si ils décidaient de se convertir. Il n'y avait pas de tolérance similaire dans le monde chrétien, mais une conversion au Moyen-âge suffisait pour échapper à la persécution religieuse. Même pendant les invasions des amériques par les Espagnols, Charles Quint a écrit à Cortes qu'il était tenu de traiter les amérindiens comme des sujets de la couronne espagnole avec les mêmes droits que ceux de la péninsule ibérique. Évidemment, les conquistadors ont ignoré ces ordres. Mais dans la colonisation post-Berlin, jamais un seul gouvernement d'empire colonial n'a eu la même empathie et la même vertu. Parce qu'entre temps, il y a eu ce racisme théorique qui a été développé, dans lequel l'homme blanc était absolument convaincu d'incarner l'être supérieur. Il y a eu des hommes vertueux, des britanniques outrés par les guerres de l'opium. Mais jamais ces sentiments n'ont été traduit dans les prises de position de leurs gouvernements et leurs États. La raison pour laquelle l'union française a été immédiatement contestée dans les colonies, c'est parce que les indigènes n'ont pas eu droit à la représentation dans l'assemblée nationale. Même après la Seconde guerre mondiale et son paroxysme de la discrimination raciale, les citoyens de métropole dans leur majorité refusaient catégoriquement l'idée que des non-blancs aient accès aux mêmes droits dont ils bénéficiaient. Tous les leaders de la décolonisation avaient commencé leurs revendications en demandant cette représentation. C'est en essuyant le refus qu'ils ont su que le seul chemin de leur libération était l'indépendance. 

J'admets que mes paroles sont aisément lues comme si je mettais tous les blancs dans le même sac. Sache que ce n'est pas le cas, tu peux vérifier sur mon historique de commentaire que j'ai récemment contesté une accusation de la part d'asiatiques (sur /r/aznidentity) que Bernie Sanders serait raciste envers les asiatiques. Leur argument se basait sur une seule phrase dans laquelle il citait la Chine et le Vietnam comme des pays desquels des hordes d'immigrés débarqueraient si les frontières étaient ouvertes. Mon but, comme le tiens, est de tackler les gens pour leur faire sentir l'indignation qui se ressent lorsqu'on se fait catégoriser. Ce que d'aucun appelleraient le ""privilège blanc"", c'est que ce sentiment ne se fait connaître de la part desdits ""blancs"" seulement lorsqu'une personne de couleur leur fait subir cette catégorisation. Ce n'est pas du tout agréable, n'est-ce pas ? Pour nous, personnes de couleur, c'est tous les jours. Ça commence à l'école, tout comme toi tu as pu le vivre à onze ans. Mais pour nous, à l'âge adulte, ça continue. Ce n'est pas juste les conneries et les railleries qui s'accompagnent du cadre scolaire dans lequel les enfants peuvent être cruels les uns envers les autres, ce sont des préjugés qui s'éternisent et continuent tout. Le. Temps. Dans la vie de tous les jours, dans les médias... Mon but, c'est que peut-être une personne me lise ou m'entende, s'énerve et ressente l'indignation, et se rende compte que pour cette personne ce fut une anecdote, et qu'elle a la chance de ne pas avoir à vivre cette indignation de façon permanente."
2020-08-27 21:09:07,Bravemount,"C'est bien aimable de ne pas me viser, mais je partage son avis, tant qu'il est formulé comme je l'ai fait.

Et pourtant, je fais partie des personnes ayant été discriminées en raison de mes origines (allemandes, avec le ""boche"" et les croix gammées et ""collabo"" sur la porte de ma prof de français au collège... les réflexions sur les nazis dès que les gens apprennent que je suis allemand, très désagréable, j'en conviens). Edit: c'est vrai que ce n'est pas ""marqué sur ma gueule"", c'est ""l'avantage"".

De ce que j'ai compris à la France, il faut, pour citer Emmanuel Todd, ""savoir s'asseoir sur les questions identitaires avec optimisme. Si on ne le peut pas, alors c'est fini, il n'y a plus de France, et ça ne sert à rien de se battre."" Que ce soient les Zemmours ou les Indigénistes, tous les deux ont la même obsession identitaire toxique qui ruine la cohésion sociale.

J'ai bien lu tout ton coup de gueule, et je comprends très bien que c'est frustrant (le mot est faible) d'être ramené à ses origines, peu importe à quel point on est intégré (d'autant plus quand on est né en France) et peu importe qu'on ait toute sa famille maternelle qui soit française ""de souche"" et qu'on ait la nationalité française (ce qui n'est pas mon cas, je suis de nationalité allemande, né en Allemagne, de parents allemands). Seulement, je trouve dommage de rentrer dans ""leur"" jeu et de se laisser déborder par la rage.

J'estime qui si l'on croît en ce que représente la France, il faut savoir être au-dessus de ça. Dénoncer et culpabiliser les agressions graves et ne pas se soucier des moins graves. Tu sais que t'es français, tu sais qu'ils sont cons, ne les laisse pas t'affecter. Ces gens-là, je les vois comme des gamins qui ne savent pas ce qu'ils disent."
